Date,Conf Time,Entry Time,Instrument,Conf Type,Direction,Session,Entry Method,Status,Entry,Stop,Target,Exit,entry_dt,narrative,confluences,prior_session,probabilities,session_status,sequence_notes,daycycle_notes,m7_metrics,level_breaks
03/16/2018,,9:35,ES,No Conf,Long,RDR,M7 Candle,W,2757.75,2756.0,2771.0,2760.25,2018-03-16 09:35:00-04:00,"IF prior TR session, prior session closed down AND weekly rejection support, perfect rejection near entry; recent sessions: AR true=True break_dir= box=down, OR true=False break_dir= box=down, RR true=True break_dir= box=down; level breaks: AS high broken 05:10; low broken 03:55; first=low, OS high broken 08:35; first=high, AR high broken 08:35; low broken 20:30; first=low, OR high broken 04:30; first=high, RR high broken 11:00; low broken 13:45; first=high; probs: confirm_long=0.50, seq_intraday_high_holds=0.62, seq_asia_high_holds=0.50, first_break_true=0.82; seq_asia top: asia_high_holds=0.50, asia_low_holds=0.50; seq_intraday top: day_high_in_RS=0.74, day_low_in_OS=0.51; seq_intraday holds: high_holds=0.62, low_holds=0.64, hi_pct_pctile=0.48, lo_pct_pctile=0.72; daycycle: daycycle hi_hold_24h=0.28, lo_hold_24h=0.27, cycle_pair_24h=0.02, pair_hi_hold=0.28, pair_lo_hold=0.27, hi_pct_pctile=0.88, lo_pct_pctile=0.85; m7/max: m7_ret_sd=0.50, m7_time=0.50, max_ext_sd=0.50, max_ext_time=0.50, max_ret_sd=0.50, max_ret_time=0.50; THEN LONG via M7 Candle at 2757.75, stop 2756.0, target 2771.0.",weekly rejection support; perfect rejection near entry,prior TR session; prior session closed down,confirm_long=0.50; seq_intraday_high_holds=0.62; seq_asia_high_holds=0.50; first_break_true=0.82,AR true=True break_dir= box=down; OR true=False break_dir= box=down; RR true=True break_dir= box=down,"seq_asia top: asia_high_holds=0.50, asia_low_holds=0.50; seq_intraday top: day_high_in_RS=0.74, day_low_in_OS=0.51; seq_intraday holds: high_holds=0.62, low_holds=0.64, hi_pct_pctile=0.48, lo_pct_pctile=0.72",daycycle hi_hold_24h=0.28; lo_hold_24h=0.27; cycle_pair_24h=0.02; pair_hi_hold=0.28; pair_lo_hold=0.27; hi_pct_pctile=0.88; lo_pct_pctile=0.85,m7_ret_sd=0.50; m7_time=0.50; max_ext_sd=0.50; max_ext_time=0.50; max_ret_sd=0.50; max_ret_time=0.50,AS high broken 05:10; low broken 03:55; first=low; OS high broken 08:35; first=high; AR high broken 08:35; low broken 20:30; first=low; OR high broken 04:30; first=high; RR high broken 11:00; low broken 13:45; first=high
03/15/2018,11:00,12:20,ES,Confirmed,Long,RDR,Mode,EX,2758.0,2755.75,2768.75,2755.75,2018-03-15 12:20:00-04:00,"IF prior RR session, prior session closed down, prior session high printed early AND near range high, perfect rejection near entry; recent sessions: AR true=True break_dir= box=down, OR true=False break_dir= box=up, RR true=True break_dir= box=down; level breaks: AS high broken 03:45; first=high, OS high broken 11:00; low broken 09:45; first=low, AR high broken 22:40; low broken 20:35; first=low, OR high broken 11:00; low broken 04:05; first=low, RR high broken 11:00; first=high; probs: confirm_long=0.83, seq_intraday_high_holds=0.39, seq_asia_high_holds=0.50, first_break_true=0.89; seq_asia top: asia_high_holds=0.50, asia_low_holds=0.50; seq_intraday top: day_high_in_RS=1.00, day_low_in_RR=0.82; seq_intraday holds: high_holds=0.39, low_holds=0.73, hi_pct_pctile=1.00, lo_pct_pctile=0.83; daycycle: daycycle hi_hold_24h=0.52, lo_hold_24h=0.84, cycle_pair_24h=0.03, pair_hi_hold=0.52, pair_lo_hold=0.84, hi_pct_pctile=0.54, lo_pct_pctile=0.86; m7/max: m7_ret_sd=0.26, m7_time=0.96, max_ext_sd=0.48, max_ext_time=0.17, max_ret_sd=0.52, max_ret_time=0.65; THEN LONG via Mode at 2758.0, stop 2755.75, target 2768.75.",near range high; perfect rejection near entry,prior RR session; prior session closed down; prior session high printed early,confirm_long=0.83; seq_intraday_high_holds=0.39; seq_asia_high_holds=0.50; first_break_true=0.89,AR true=True break_dir= box=down; OR true=False break_dir= box=up; RR true=True break_dir= box=down,"seq_asia top: asia_high_holds=0.50, asia_low_holds=0.50; seq_intraday top: day_high_in_RS=1.00, day_low_in_RR=0.82; seq_intraday holds: high_holds=0.39, low_holds=0.73, hi_pct_pctile=1.00, lo_pct_pctile=0.83",daycycle hi_hold_24h=0.52; lo_hold_24h=0.84; cycle_pair_24h=0.03; pair_hi_hold=0.52; pair_lo_hold=0.84; hi_pct_pctile=0.54; lo_pct_pctile=0.86,m7_ret_sd=0.26; m7_time=0.96; max_ext_sd=0.48; max_ext_time=0.17; max_ret_sd=0.52; max_ret_time=0.65,AS high broken 03:45; first=high; OS high broken 11:00; low broken 09:45; first=low; AR high broken 22:40; low broken 20:35; first=low; OR high broken 11:00; low broken 04:05; first=low; RR high broken 11:00; first=high
03/15/2018,,9:35,ES,No Conf,Short,RDR,M7 Candle,EX,2756.75,2759.75,2743.75,2759.75,2018-03-15 09:35:00-04:00,"IF prior TR session, prior session closed up, prior session low printed early AND confluence light; recent sessions: AR true=True break_dir= box=down, OR true=False break_dir= box=up, RR true=True break_dir= box=down; level breaks: AS high broken 03:45; first=high, OS high/low held, AR high broken 22:40; low broken 20:35; first=low, OR low broken 04:05; first=low, RR low broken 11:00; first=low; probs: confirm_short=0.50, seq_intraday_low_holds=0.73, seq_asia_low_holds=0.50, first_break_true=0.89; seq_asia top: asia_high_holds=0.50, asia_low_holds=0.50; seq_intraday top: day_low_in_RS=0.54, day_high_in_RS=0.45; seq_intraday holds: high_holds=0.65, low_holds=0.73, hi_pct_pctile=0.94, lo_pct_pctile=1.00; daycycle: daycycle hi_hold_24h=0.22, lo_hold_24h=0.35, cycle_pair_24h=0.02, pair_hi_hold=0.22, pair_lo_hold=0.35, hi_pct_pctile=0.84, lo_pct_pctile=0.86; m7/max: m7_ret_sd=0.50, m7_time=0.50, max_ext_sd=0.50, max_ext_time=0.50, max_ret_sd=0.50, max_ret_time=0.50; THEN SHORT via M7 Candle at 2756.75, stop 2759.75, target 2743.75.",confluence light,prior TR session; prior session closed up; prior session low printed early,confirm_short=0.50; seq_intraday_low_holds=0.73; seq_asia_low_holds=0.50; first_break_true=0.89,AR true=True break_dir= box=down; OR true=False break_dir= box=up; RR true=True break_dir= box=down,"seq_asia top: asia_high_holds=0.50, asia_low_holds=0.50; seq_intraday top: day_low_in_RS=0.54, day_high_in_RS=0.45; seq_intraday holds: high_holds=0.65, low_holds=0.73, hi_pct_pctile=0.94, lo_pct_pctile=1.00",daycycle hi_hold_24h=0.22; lo_hold_24h=0.35; cycle_pair_24h=0.02; pair_hi_hold=0.22; pair_lo_hold=0.35; hi_pct_pctile=0.84; lo_pct_pctile=0.86,m7_ret_sd=0.50; m7_time=0.50; max_ext_sd=0.50; max_ext_time=0.50; max_ret_sd=0.50; max_ret_time=0.50,AS high broken 03:45; first=high; OS high/low held; AR high broken 22:40; low broken 20:35; first=low; OR low broken 04:05; first=low; RR low broken 11:00; first=low
03/14/2018,,10:30,ES,No Conf,Short,RDR,Frontrun,W,2767.0,2769.25,2752.25,2752.25,2018-03-14 10:30:00-04:00,"IF prior RR session, prior session closed down, prior session high printed early AND near range low, near range low, weekly rejection resistance; recent sessions: AR true=True break_dir= box=up, OR true=False break_dir= box=up, RR true=True break_dir= box=down; level breaks: AS high broken 02:10; first=high, OS low broken 09:30; first=low, AR high broken 00:00; low broken 21:10; first=low, OR high broken 04:00; low broken 10:10; first=high, RR high/low held; probs: confirm_short=1.00, seq_intraday_low_holds=0.49, seq_asia_low_holds=0.50, first_break_true=0.76; seq_asia top: asia_high_holds=0.50, asia_low_holds=0.50; seq_intraday top: day_high_in_OS=0.80, day_low_in_RS=0.73; seq_intraday holds: high_holds=0.60, low_holds=0.49, hi_pct_pctile=0.69, lo_pct_pctile=0.50; daycycle: daycycle hi_hold_24h=0.45, lo_hold_24h=0.71, cycle_pair_24h=0.03, pair_hi_hold=0.45, pair_lo_hold=0.71, hi_pct_pctile=0.60, lo_pct_pctile=0.77; m7/max: m7_ret_sd=0.50, m7_time=0.00, max_ext_sd=0.00, max_ext_time=0.00, max_ret_sd=0.50, max_ret_time=0.00; THEN SHORT via Frontrun at 2767.0, stop 2769.25, target 2752.25.",near range low; near range low; weekly rejection resistance,prior RR session; prior session closed down; prior session high printed early,confirm_short=1.00; seq_intraday_low_holds=0.49; seq_asia_low_holds=0.50; first_break_true=0.76,AR true=True break_dir= box=up; OR true=False break_dir= box=up; RR true=True break_dir= box=down,"seq_asia top: asia_high_holds=0.50, asia_low_holds=0.50; seq_intraday top: day_high_in_OS=0.80, day_low_in_RS=0.73; seq_intraday holds: high_holds=0.60, low_holds=0.49, hi_pct_pctile=0.69, lo_pct_pctile=0.50",daycycle hi_hold_24h=0.45; lo_hold_24h=0.71; cycle_pair_24h=0.03; pair_hi_hold=0.45; pair_lo_hold=0.71; hi_pct_pctile=0.60; lo_pct_pctile=0.77,m7_ret_sd=0.50; m7_time=0.00; max_ext_sd=0.00; max_ext_time=0.00; max_ret_sd=0.50; max_ret_time=0.00,AS high broken 02:10; first=high; OS low broken 09:30; first=low; AR high broken 00:00; low broken 21:10; first=low; OR high broken 04:00; low broken 10:10; first=high; RR high/low held
03/07/2018,10:30,13:20,ES,Confirmed,Long,RDR,Missed,W,2705.75,2702.25,2727.5,2727.5,2018-03-07 13:20:00-05:00,"IF prior RR session, prior session closed up, prior session low printed early AND weekly rejection support; recent sessions: AR true=True break_dir= box=up, OR true=False break_dir= box=down, RR true=True break_dir= box=up; level breaks: AS high broken 07:15; first=high, OS high broken 09:30; first=high, AR high broken 20:35; first=high, OR high broken 05:15; low broken 04:10; first=low, RR high broken 10:30; first=high; probs: confirm_long=0.69, seq_intraday_high_holds=0.50, seq_asia_high_holds=0.50, first_break_true=0.90; seq_asia top: asia_high_holds=0.50, asia_low_holds=0.50; seq_intraday top: day_high_in_RS=1.00, day_low_in_OS=0.80; seq_intraday holds: high_holds=0.50, low_holds=0.56, hi_pct_pctile=0.96, lo_pct_pctile=0.67; daycycle: daycycle hi_hold_24h=0.79, lo_hold_24h=0.94, cycle_pair_24h=0.02, pair_hi_hold=0.79, pair_lo_hold=0.94, hi_pct_pctile=0.76, lo_pct_pctile=0.36; m7/max: m7_ret_sd=0.00, m7_time=0.85, max_ext_sd=0.35, max_ext_time=0.49, max_ret_sd=0.14, max_ret_time=0.46; THEN LONG via Missed at 2705.75, stop 2702.25, target 2727.5.",weekly rejection support,prior RR session; prior session closed up; prior session low printed early,confirm_long=0.69; seq_intraday_high_holds=0.50; seq_asia_high_holds=0.50; first_break_true=0.90,AR true=True break_dir= box=up; OR true=False break_dir= box=down; RR true=True break_dir= box=up,"seq_asia top: asia_high_holds=0.50, asia_low_holds=0.50; seq_intraday top: day_high_in_RS=1.00, day_low_in_OS=0.80; seq_intraday holds: high_holds=0.50, low_holds=0.56, hi_pct_pctile=0.96, lo_pct_pctile=0.67",daycycle hi_hold_24h=0.79; lo_hold_24h=0.94; cycle_pair_24h=0.02; pair_hi_hold=0.79; pair_lo_hold=0.94; hi_pct_pctile=0.76; lo_pct_pctile=0.36,m7_ret_sd=0.00; m7_time=0.85; max_ext_sd=0.35; max_ext_time=0.49; max_ret_sd=0.14; max_ret_time=0.46,AS high broken 07:15; first=high; OS high broken 09:30; first=high; AR high broken 20:35; first=high; OR high broken 05:15; low broken 04:10; first=low; RR high broken 10:30; first=high
03/06/2018,,10:25,ES,No Conf,Short,RDR,Mode,W,2726.5,2729.75,2707.75,2722.0,2018-03-06 10:25:00-05:00,"IF prior TR session, prior session closed up AND weekly rejection resistance; recent sessions: AR true=True break_dir= box=up, OR true=False break_dir= box=down, RR true=True break_dir= box=down; level breaks: AS high broken 02:00; first=high, OS low broken 09:40; first=low, AR high broken 20:35; low broken 21:00; first=high, OR high broken 06:05; low broken 09:40; first=high, RR high/low held; probs: confirm_short=0.75, seq_intraday_low_holds=0.49, seq_asia_low_holds=0.50, first_break_true=0.75; seq_asia top: asia_high_holds=0.50, asia_low_holds=0.50; seq_intraday top: day_high_in_RS=0.59, day_low_in_RS=0.53; seq_intraday holds: high_holds=0.47, low_holds=0.49, hi_pct_pctile=0.51, lo_pct_pctile=0.84; daycycle: daycycle hi_hold_24h=0.45, lo_hold_24h=0.63, cycle_pair_24h=0.03, pair_hi_hold=0.45, pair_lo_hold=0.63, hi_pct_pctile=0.64, lo_pct_pctile=0.73; m7/max: m7_ret_sd=0.50, m7_time=0.50, max_ext_sd=0.50, max_ext_time=0.50, max_ret_sd=0.50, max_ret_time=0.50; THEN SHORT via Mode at 2726.5, stop 2729.75, target 2707.75.",weekly rejection resistance,prior TR session; prior session closed up,confirm_short=0.75; seq_intraday_low_holds=0.49; seq_asia_low_holds=0.50; first_break_true=0.75,AR true=True break_dir= box=up; OR true=False break_dir= box=down; RR true=True break_dir= box=down,"seq_asia top: asia_high_holds=0.50, asia_low_holds=0.50; seq_intraday top: day_high_in_RS=0.59, day_low_in_RS=0.53; seq_intraday holds: high_holds=0.47, low_holds=0.49, hi_pct_pctile=0.51, lo_pct_pctile=0.84",daycycle hi_hold_24h=0.45; lo_hold_24h=0.63; cycle_pair_24h=0.03; pair_hi_hold=0.45; pair_lo_hold=0.63; hi_pct_pctile=0.64; lo_pct_pctile=0.73,m7_ret_sd=0.50; m7_time=0.50; max_ext_sd=0.50; max_ext_time=0.50; max_ret_sd=0.50; max_ret_time=0.50,AS high broken 02:00; first=high; OS low broken 09:40; first=low; AR high broken 20:35; low broken 21:00; first=high; OR high broken 06:05; low broken 09:40; first=high; RR high/low held
03/02/2018,10:40,11:20,ES,Confirmed,Long,RDR,Mode,W,2654.0,2650.5,2684.5,2684.5,2018-03-02 11:20:00-05:00,"IF prior RR session, prior session closed down, prior session low printed early, prior session high printed early AND weekly rejection support, perfect rejection near entry; recent sessions: AR true=True break_dir= box=down, OR true=False break_dir= box=up, RR true=True break_dir= box=down; level breaks: AS high broken 03:20; low broken 04:30; first=high, OS low broken 09:35; first=low, AR low broken 20:35; first=low, OR low broken 04:10; first=low, RR high broken 10:40; first=high; probs: confirm_long=0.76, seq_intraday_high_holds=0.56, seq_asia_high_holds=0.50, first_break_true=0.89; seq_asia top: asia_high_holds=0.50, asia_low_holds=0.50; seq_intraday top: day_high_in_OS=0.88, day_low_in_RS=0.75; seq_intraday holds: high_holds=0.56, low_holds=0.46, hi_pct_pctile=0.04, lo_pct_pctile=0.16; daycycle: daycycle hi_hold_24h=0.78, lo_hold_24h=0.54, cycle_pair_24h=0.04, pair_hi_hold=0.78, pair_lo_hold=0.54, hi_pct_pctile=0.33, lo_pct_pctile=0.73; m7/max: m7_ret_sd=0.15, m7_time=0.71, max_ext_sd=0.15, max_ext_time=0.21, max_ret_sd=0.50, max_ret_time=0.29; THEN LONG via Mode at 2654.0, stop 2650.5, target 2684.5.",weekly rejection support; perfect rejection near entry,prior RR session; prior session closed down; prior session low printed early; prior session high printed early,confirm_long=0.76; seq_intraday_high_holds=0.56; seq_asia_high_holds=0.50; first_break_true=0.89,AR true=True break_dir= box=down; OR true=False break_dir= box=up; RR true=True break_dir= box=down,"seq_asia top: asia_high_holds=0.50, asia_low_holds=0.50; seq_intraday top: day_high_in_OS=0.88, day_low_in_RS=0.75; seq_intraday holds: high_holds=0.56, low_holds=0.46, hi_pct_pctile=0.04, lo_pct_pctile=0.16",daycycle hi_hold_24h=0.78; lo_hold_24h=0.54; cycle_pair_24h=0.04; pair_hi_hold=0.78; pair_lo_hold=0.54; hi_pct_pctile=0.33; lo_pct_pctile=0.73,m7_ret_sd=0.15; m7_time=0.71; max_ext_sd=0.15; max_ext_time=0.21; max_ret_sd=0.50; max_ret_time=0.29,AS high broken 03:20; low broken 04:30; first=high; OS low broken 09:35; first=low; AR low broken 20:35; first=low; OR low broken 04:10; first=low; RR high broken 10:40; first=high
03/01/2018,,10:30,ES,No Conf,Long,RDR,Frontrun,BE,2718.25,2715.25,2737.75,2718.25,2018-03-01 10:30:00-05:00,"IF prior RR session, prior session closed up, prior session high printed early AND near range high; recent sessions: AR true=True break_dir= box=down, OR true=False break_dir= box=up, RR true=True break_dir= box=up; level breaks: AS high broken 02:00; low broken 06:50; first=high, OS high broken 09:30; first=high, AR high broken 03:40; low broken 20:30; first=low, OR high broken 10:30; low broken 04:00; first=low, RR high broken 10:30; first=high; probs: confirm_long=0.77, seq_intraday_high_holds=0.48, seq_asia_high_holds=0.50, first_break_true=0.85; seq_asia top: asia_high_holds=0.50, asia_low_holds=0.50; seq_intraday top: day_high_in_RS=1.00, day_low_in_RS=0.60; seq_intraday holds: high_holds=0.48, low_holds=0.51, hi_pct_pctile=0.93, lo_pct_pctile=0.56; daycycle: daycycle hi_hold_24h=0.50, lo_hold_24h=0.71, cycle_pair_24h=0.03, pair_hi_hold=0.50, pair_lo_hold=0.71, hi_pct_pctile=0.41, lo_pct_pctile=0.41; m7/max: m7_ret_sd=0.50, m7_time=0.00, max_ext_sd=0.00, max_ext_time=0.00, max_ret_sd=0.50, max_ret_time=0.00; THEN LONG via Frontrun at 2718.25, stop 2715.25, target 2737.75.",near range high,prior RR session; prior session closed up; prior session high printed early,confirm_long=0.77; seq_intraday_high_holds=0.48; seq_asia_high_holds=0.50; first_break_true=0.85,AR true=True break_dir= box=down; OR true=False break_dir= box=up; RR true=True break_dir= box=up,"seq_asia top: asia_high_holds=0.50, asia_low_holds=0.50; seq_intraday top: day_high_in_RS=1.00, day_low_in_RS=0.60; seq_intraday holds: high_holds=0.48, low_holds=0.51, hi_pct_pctile=0.93, lo_pct_pctile=0.56",daycycle hi_hold_24h=0.50; lo_hold_24h=0.71; cycle_pair_24h=0.03; pair_hi_hold=0.50; pair_lo_hold=0.71; hi_pct_pctile=0.41; lo_pct_pctile=0.41,m7_ret_sd=0.50; m7_time=0.00; max_ext_sd=0.00; max_ext_time=0.00; max_ret_sd=0.50; max_ret_time=0.00,AS high broken 02:00; low broken 06:50; first=high; OS high broken 09:30; first=high; AR high broken 03:40; low broken 20:30; first=low; OR high broken 10:30; low broken 04:00; first=low; RR high broken 10:30; first=high
02/28/2018,,10:40,ES,No Conf,Short,RDR,Frontrun,W,2755.25,2757.75,2738.5,2738.5,2018-02-28 10:40:00-05:00,"IF prior RR session, prior session closed up, prior session low printed early AND weekly rejection resistance; recent sessions: AR true=True break_dir= box=down, OR true=False break_dir= box=up, RR true=True break_dir= box=up; level breaks: AS high broken 03:05; first=high, OS high broken 08:35; first=high, AR high broken 03:40; low broken 20:30; first=low, OR high broken 04:15; low broken 06:40; first=high, RR high/low held; probs: confirm_short=0.40, seq_intraday_low_holds=0.49, seq_asia_low_holds=0.50, first_break_true=0.62; seq_asia top: asia_high_holds=0.50, asia_low_holds=0.50; seq_intraday top: day_high_in_RS=0.56, day_low_in_RS=0.56; seq_intraday holds: high_holds=0.49, low_holds=0.49, hi_pct_pctile=0.96, lo_pct_pctile=0.93; daycycle: daycycle hi_hold_24h=0.54, lo_hold_24h=0.74, cycle_pair_24h=0.03, pair_hi_hold=0.54, pair_lo_hold=0.74, hi_pct_pctile=0.88, lo_pct_pctile=0.46; m7/max: m7_ret_sd=0.50, m7_time=0.06, max_ext_sd=0.00, max_ext_time=0.03, max_ret_sd=0.50, max_ret_time=0.02; THEN SHORT via Frontrun at 2755.25, stop 2757.75, target 2738.5.",weekly rejection resistance,prior RR session; prior session closed up; prior session low printed early,confirm_short=0.40; seq_intraday_low_holds=0.49; seq_asia_low_holds=0.50; first_break_true=0.62,AR true=True break_dir= box=down; OR true=False break_dir= box=up; RR true=True break_dir= box=up,"seq_asia top: asia_high_holds=0.50, asia_low_holds=0.50; seq_intraday top: day_high_in_RS=0.56, day_low_in_RS=0.56; seq_intraday holds: high_holds=0.49, low_holds=0.49, hi_pct_pctile=0.96, lo_pct_pctile=0.93",daycycle hi_hold_24h=0.54; lo_hold_24h=0.74; cycle_pair_24h=0.03; pair_hi_hold=0.54; pair_lo_hold=0.74; hi_pct_pctile=0.88; lo_pct_pctile=0.46,m7_ret_sd=0.50; m7_time=0.06; max_ext_sd=0.00; max_ext_time=0.03; max_ret_sd=0.50; max_ret_time=0.02,AS high broken 03:05; first=high; OS high broken 08:35; first=high; AR high broken 03:40; low broken 20:30; first=low; OR high broken 04:15; low broken 06:40; first=high; RR high/low held
02/27/2018,10:45,11:15,ES,Confirmed,Short,RDR,Missed,W,2776.25,2779.25,2747.75,2747.75,2018-02-27 11:15:00-05:00,"IF prior RR session, prior session closed up AND near range low, near weekly cluster; recent sessions: AR true=True break_dir= box=up, OR true=False break_dir= box=up, RR true=True break_dir= box=up; level breaks: AS high broken 10:10; low broken 04:35; first=low, OS high broken 09:35; low broken 10:40; first=high, AR high broken 20:30; low broken 22:10; first=high, OR high broken 09:35; low broken 04:10; first=low, RR low broken 10:40; first=low; probs: confirm_short=0.77, seq_intraday_low_holds=0.44, seq_asia_low_holds=0.50, first_break_true=0.63; seq_asia top: asia_high_holds=0.50, asia_low_holds=0.50; seq_intraday top: day_low_in_RS=1.00, day_high_in_RR=0.60; seq_intraday holds: high_holds=0.54, low_holds=0.44, hi_pct_pctile=0.38, lo_pct_pctile=0.25; daycycle: daycycle hi_hold_24h=0.65, lo_hold_24h=0.68, cycle_pair_24h=0.03, pair_hi_hold=0.65, pair_lo_hold=0.68, hi_pct_pctile=0.83, lo_pct_pctile=0.26; m7/max: m7_ret_sd=0.30, m7_time=0.90, max_ext_sd=0.43, max_ext_time=0.37, max_ret_sd=0.83, max_ret_time=0.27; THEN SHORT via Missed at 2776.25, stop 2779.25, target 2747.75.",near range low; near weekly cluster,prior RR session; prior session closed up,confirm_short=0.77; seq_intraday_low_holds=0.44; seq_asia_low_holds=0.50; first_break_true=0.63,AR true=True break_dir= box=up; OR true=False break_dir= box=up; RR true=True break_dir= box=up,"seq_asia top: asia_high_holds=0.50, asia_low_holds=0.50; seq_intraday top: day_low_in_RS=1.00, day_high_in_RR=0.60; seq_intraday holds: high_holds=0.54, low_holds=0.44, hi_pct_pctile=0.38, lo_pct_pctile=0.25",daycycle hi_hold_24h=0.65; lo_hold_24h=0.68; cycle_pair_24h=0.03; pair_hi_hold=0.65; pair_lo_hold=0.68; hi_pct_pctile=0.83; lo_pct_pctile=0.26,m7_ret_sd=0.30; m7_time=0.90; max_ext_sd=0.43; max_ext_time=0.37; max_ret_sd=0.83; max_ret_time=0.27,AS high broken 10:10; low broken 04:35; first=low; OS high broken 09:35; low broken 10:40; first=high; AR high broken 20:30; low broken 22:10; first=high; OR high broken 09:35; low broken 04:10; first=low; RR low broken 10:40; first=low
02/26/2018,,9:35,ES,No Conf,Long,RDR,M7 Candle,BE,2760.0,2758.25,2774.25,2760.0,2018-02-26 09:35:00-05:00,"IF prior TR session, prior session closed up, prior session low printed early, prior session high printed early AND confluence light; recent sessions: AR true=True break_dir= box=down, OR true=False break_dir= box=up, RR true=True break_dir= box=down; level breaks: AS high broken 02:35; first=high, OS high broken 09:35; first=high, AR high broken 22:10; first=high, OR high broken 04:00; first=high, RR high broken 11:00; low broken 10:30; first=low; probs: confirm_long=0.69, seq_intraday_high_holds=0.63, seq_asia_high_holds=0.50, first_break_true=0.90, wddrb_model=UG(0.69); seq_asia top: asia_high_holds=0.50, asia_low_holds=0.50; seq_intraday top: day_high_in_RS=0.76, day_low_in_OS=0.52; seq_intraday holds: high_holds=0.63, low_holds=0.62, hi_pct_pctile=0.38, lo_pct_pctile=0.61; daycycle: daycycle hi_hold_24h=0.22, lo_hold_24h=0.35, cycle_pair_24h=0.02, pair_hi_hold=0.22, pair_lo_hold=0.35, hi_pct_pctile=0.89, lo_pct_pctile=0.67; m7/max: m7_ret_sd=0.50, m7_time=0.50, max_ext_sd=0.50, max_ext_time=0.50, max_ret_sd=0.50, max_ret_time=0.50; THEN LONG via M7 Candle at 2760.0, stop 2758.25, target 2774.25.",confluence light,prior TR session; prior session closed up; prior session low printed early; prior session high printed early,confirm_long=0.69; seq_intraday_high_holds=0.63; seq_asia_high_holds=0.50; first_break_true=0.90; wddrb_model=UG(0.69),AR true=True break_dir= box=down; OR true=False break_dir= box=up; RR true=True break_dir= box=down,"seq_asia top: asia_high_holds=0.50, asia_low_holds=0.50; seq_intraday top: day_high_in_RS=0.76, day_low_in_OS=0.52; seq_intraday holds: high_holds=0.63, low_holds=0.62, hi_pct_pctile=0.38, lo_pct_pctile=0.61",daycycle hi_hold_24h=0.22; lo_hold_24h=0.35; cycle_pair_24h=0.02; pair_hi_hold=0.22; pair_lo_hold=0.35; hi_pct_pctile=0.89; lo_pct_pctile=0.67,m7_ret_sd=0.50; m7_time=0.50; max_ext_sd=0.50; max_ext_time=0.50; max_ret_sd=0.50; max_ret_time=0.50,AS high broken 02:35; first=high; OS high broken 09:35; first=high; AR high broken 22:10; first=high; OR high broken 04:00; first=high; RR high broken 11:00; low broken 10:30; first=low
02/23/2018,11:00,11:15,ES,Confirmed,Long,RDR,Missed,W,2719.75,2717.75,2743.5,2743.5,2018-02-23 11:15:00-05:00,"IF prior RR session, prior session closed down, prior session high printed early AND near weekly cluster, weekly rejection support, perfect rejection near entry; recent sessions: AR true=True break_dir= box=up, OR true=False break_dir= box=down, RR true=True break_dir= box=down; level breaks: AS low broken 05:25; first=low, OS high broken 11:00; low broken 10:15; first=low, AR high broken 21:25; first=high, OR high broken 07:10; low broken 05:25; first=low, RR high broken 11:00; low broken 10:30; first=low; probs: confirm_long=0.78, seq_intraday_high_holds=0.51, seq_asia_high_holds=0.50, first_break_true=0.75; seq_asia top: asia_high_holds=0.50, asia_low_holds=0.50; seq_intraday top: day_high_in_RS=1.00, day_low_in_RS=1.00; seq_intraday holds: high_holds=0.51, low_holds=0.49, hi_pct_pctile=0.80, lo_pct_pctile=0.93; daycycle: daycycle hi_hold_24h=0.55, lo_hold_24h=0.72, cycle_pair_24h=0.04, pair_hi_hold=0.55, pair_lo_hold=0.72, hi_pct_pctile=0.56, lo_pct_pctile=0.85; m7/max: m7_ret_sd=0.30, m7_time=0.44, max_ext_sd=0.07, max_ext_time=0.11, max_ret_sd=0.63, max_ret_time=0.19; THEN LONG via Missed at 2719.75, stop 2717.75, target 2743.5.",near weekly cluster; weekly rejection support; perfect rejection near entry,prior RR session; prior session closed down; prior session high printed early,confirm_long=0.78; seq_intraday_high_holds=0.51; seq_asia_high_holds=0.50; first_break_true=0.75,AR true=True break_dir= box=up; OR true=False break_dir= box=down; RR true=True break_dir= box=down,"seq_asia top: asia_high_holds=0.50, asia_low_holds=0.50; seq_intraday top: day_high_in_RS=1.00, day_low_in_RS=1.00; seq_intraday holds: high_holds=0.51, low_holds=0.49, hi_pct_pctile=0.80, lo_pct_pctile=0.93",daycycle hi_hold_24h=0.55; lo_hold_24h=0.72; cycle_pair_24h=0.04; pair_hi_hold=0.55; pair_lo_hold=0.72; hi_pct_pctile=0.56; lo_pct_pctile=0.85,m7_ret_sd=0.30; m7_time=0.44; max_ext_sd=0.07; max_ext_time=0.11; max_ret_sd=0.63; max_ret_time=0.19,AS low broken 05:25; first=low; OS high broken 11:00; low broken 10:15; first=low; AR high broken 21:25; first=high; OR high broken 07:10; low broken 05:25; first=low; RR high broken 11:00; low broken 10:30; first=low
02/22/2018,,9:45,ES,No Conf,Short,RDR,Advanced,BE,2717.75,2721.75,2682.25,2717.75,2018-02-22 09:45:00-05:00,"IF prior TR session, prior session closed up, prior session low printed early AND weekly rejection resistance, perfect rejection near entry; recent sessions: AR true=True break_dir= box=down, OR true=False break_dir= box=down, RR true=True break_dir= box=up; level breaks: AS high broken 02:00; first=high, OS high broken 08:50; first=high, AR high broken 03:30; first=high, OR high broken 05:00; low broken 04:00; first=low, RR high broken 10:35; low broken 15:10; first=high; probs: confirm_short=0.41, seq_intraday_low_holds=0.63, seq_asia_low_holds=0.50, first_break_true=0.90; seq_asia top: asia_high_holds=0.50, asia_low_holds=0.50; seq_intraday top: day_high_in_RS=0.78, day_low_in_OS=0.68; seq_intraday holds: high_holds=0.28, low_holds=0.63, hi_pct_pctile=1.00, lo_pct_pctile=0.77; daycycle: daycycle hi_hold_24h=0.36, lo_hold_24h=0.38, cycle_pair_24h=0.03, pair_hi_hold=0.36, pair_lo_hold=0.38, hi_pct_pctile=0.73, lo_pct_pctile=0.66; m7/max: m7_ret_sd=0.50, m7_time=0.50, max_ext_sd=0.50, max_ext_time=0.50, max_ret_sd=0.50, max_ret_time=0.50; THEN SHORT via Advanced at 2717.75, stop 2721.75, target 2682.25.",weekly rejection resistance; perfect rejection near entry,prior TR session; prior session closed up; prior session low printed early,confirm_short=0.41; seq_intraday_low_holds=0.63; seq_asia_low_holds=0.50; first_break_true=0.90,AR true=True break_dir= box=down; OR true=False break_dir= box=down; RR true=True break_dir= box=up,"seq_asia top: asia_high_holds=0.50, asia_low_holds=0.50; seq_intraday top: day_high_in_RS=0.78, day_low_in_OS=0.68; seq_intraday holds: high_holds=0.28, low_holds=0.63, hi_pct_pctile=1.00, lo_pct_pctile=0.77",daycycle hi_hold_24h=0.36; lo_hold_24h=0.38; cycle_pair_24h=0.03; pair_hi_hold=0.36; pair_lo_hold=0.38; hi_pct_pctile=0.73; lo_pct_pctile=0.66,m7_ret_sd=0.50; m7_time=0.50; max_ext_sd=0.50; max_ext_time=0.50; max_ret_sd=0.50; max_ret_time=0.50,AS high broken 02:00; first=high; OS high broken 08:50; first=high; AR high broken 03:30; first=high; OR high broken 05:00; low broken 04:00; first=low; RR high broken 10:35; low broken 15:10; first=high
02/20/2018,,10:10,ES,No Conf,Short,RDR,Advanced,EX,2724.75,2727.75,2709.0,2727.75,2018-02-20 10:10:00-05:00,"IF prior TR session, prior session closed up, prior session high printed early AND confluence light; recent sessions: AR true=True break_dir= box=down, OR true=False break_dir= box=up, RR true=True break_dir= box=down; level breaks: AS low broken 03:15; first=low, OS high broken 09:30; first=high, AR low broken 20:45; first=low, OR high broken 09:35; low broken 04:15; first=low, RR low broken 10:35; first=low; probs: confirm_short=0.31, seq_intraday_low_holds=0.54, seq_asia_low_holds=0.50, first_break_true=0.79; seq_asia top: asia_high_holds=0.50, asia_low_holds=0.50; seq_intraday top: day_high_in_RS=0.79, day_low_in_RS=0.44; seq_intraday holds: high_holds=0.28, low_holds=0.54, hi_pct_pctile=0.15, lo_pct_pctile=0.93; daycycle: daycycle hi_hold_24h=0.48, lo_hold_24h=0.40, cycle_pair_24h=0.02, pair_hi_hold=0.48, pair_lo_hold=0.40, hi_pct_pctile=0.77, lo_pct_pctile=0.72; m7/max: m7_ret_sd=0.50, m7_time=0.50, max_ext_sd=0.50, max_ext_time=0.50, max_ret_sd=0.50, max_ret_time=0.50; THEN SHORT via Advanced at 2724.75, stop 2727.75, target 2709.0.",confluence light,prior TR session; prior session closed up; prior session high printed early,confirm_short=0.31; seq_intraday_low_holds=0.54; seq_asia_low_holds=0.50; first_break_true=0.79,AR true=True break_dir= box=down; OR true=False break_dir= box=up; RR true=True break_dir= box=down,"seq_asia top: asia_high_holds=0.50, asia_low_holds=0.50; seq_intraday top: day_high_in_RS=0.79, day_low_in_RS=0.44; seq_intraday holds: high_holds=0.28, low_holds=0.54, hi_pct_pctile=0.15, lo_pct_pctile=0.93",daycycle hi_hold_24h=0.48; lo_hold_24h=0.40; cycle_pair_24h=0.02; pair_hi_hold=0.48; pair_lo_hold=0.40; hi_pct_pctile=0.77; lo_pct_pctile=0.72,m7_ret_sd=0.50; m7_time=0.50; max_ext_sd=0.50; max_ext_time=0.50; max_ret_sd=0.50; max_ret_time=0.50,AS low broken 03:15; first=low; OS high broken 09:30; first=high; AR low broken 20:45; first=low; OR high broken 09:35; low broken 04:15; first=low; RR low broken 10:35; first=low
02/16/2018,,10:25,ES,No Conf,Long,RDR,Frontrun,W,2736.25,2733.75,2751.0,2751.0,2018-02-16 10:25:00-05:00,"IF prior TR session, prior session closed down, prior session high printed early AND near range high, near range high, perfect rejection near entry; recent sessions: AR true=True break_dir= box=down, OR true=False break_dir= box=up, RR true=True break_dir= box=up; level breaks: AS high broken 02:55; low broken 08:25; first=high, OS low broken 08:40; first=low, AR high broken 00:15; low broken 20:30; first=low, OR high broken 04:30; low broken 05:45; first=high, RR high/low held; probs: confirm_long=0.80, seq_intraday_high_holds=0.61, seq_asia_high_holds=0.50, first_break_true=0.61; seq_asia top: asia_high_holds=0.50, asia_low_holds=0.50; seq_intraday top: day_high_in_OS=0.86, day_low_in_RS=0.86; seq_intraday holds: high_holds=0.61, low_holds=0.39, hi_pct_pctile=0.45, lo_pct_pctile=0.62; daycycle: daycycle hi_hold_24h=0.29, lo_hold_24h=0.75, cycle_pair_24h=0.02, pair_hi_hold=0.29, pair_lo_hold=0.75, hi_pct_pctile=0.92, lo_pct_pctile=0.46; m7/max: m7_ret_sd=0.50, m7_time=0.50, max_ext_sd=0.50, max_ext_time=0.50, max_ret_sd=0.50, max_ret_time=0.50; THEN LONG via Frontrun at 2736.25, stop 2733.75, target 2751.0.",near range high; near range high; perfect rejection near entry,prior TR session; prior session closed down; prior session high printed early,confirm_long=0.80; seq_intraday_high_holds=0.61; seq_asia_high_holds=0.50; first_break_true=0.61,AR true=True break_dir= box=down; OR true=False break_dir= box=up; RR true=True break_dir= box=up,"seq_asia top: asia_high_holds=0.50, asia_low_holds=0.50; seq_intraday top: day_high_in_OS=0.86, day_low_in_RS=0.86; seq_intraday holds: high_holds=0.61, low_holds=0.39, hi_pct_pctile=0.45, lo_pct_pctile=0.62",daycycle hi_hold_24h=0.29; lo_hold_24h=0.75; cycle_pair_24h=0.02; pair_hi_hold=0.29; pair_lo_hold=0.75; hi_pct_pctile=0.92; lo_pct_pctile=0.46,m7_ret_sd=0.50; m7_time=0.50; max_ext_sd=0.50; max_ext_time=0.50; max_ret_sd=0.50; max_ret_time=0.50,AS high broken 02:55; low broken 08:25; first=high; OS low broken 08:40; first=low; AR high broken 00:15; low broken 20:30; first=low; OR high broken 04:30; low broken 05:45; first=high; RR high/low held
02/16/2018,,9:35,ES,No Conf,Long,RDR,M7 Candle,BE,2728.25,2726.0,2746.75,2728.25,2018-02-16 09:35:00-05:00,"IF prior TR session, prior session closed down, prior session high printed early AND perfect rejection near entry; recent sessions: AR true=True break_dir= box=down, OR true=False break_dir= box=up, RR true=True break_dir= box=down; level breaks: AS high broken 02:55; low broken 08:25; first=high, OS low broken 08:40; first=low, AR high broken 00:15; low broken 20:30; first=low, OR high broken 04:30; low broken 05:45; first=high, RR high broken 13:05; low broken 10:40; first=low; probs: confirm_long=0.50, seq_intraday_high_holds=0.63, seq_asia_high_holds=0.50, first_break_true=0.61; seq_asia top: asia_high_holds=0.50, asia_low_holds=0.50; seq_intraday top: day_low_in_RS=0.67, day_high_in_OS=0.63; seq_intraday holds: high_holds=0.63, low_holds=0.33, hi_pct_pctile=0.69, lo_pct_pctile=0.50; daycycle: daycycle hi_hold_24h=0.22, lo_hold_24h=0.35, cycle_pair_24h=0.02, pair_hi_hold=0.22, pair_lo_hold=0.35, hi_pct_pctile=0.88, lo_pct_pctile=0.59; m7/max: m7_ret_sd=0.50, m7_time=0.50, max_ext_sd=0.50, max_ext_time=0.50, max_ret_sd=0.50, max_ret_time=0.50; THEN LONG via M7 Candle at 2728.25, stop 2726.0, target 2746.75.",perfect rejection near entry,prior TR session; prior session closed down; prior session high printed early,confirm_long=0.50; seq_intraday_high_holds=0.63; seq_asia_high_holds=0.50; first_break_true=0.61,AR true=True break_dir= box=down; OR true=False break_dir= box=up; RR true=True break_dir= box=down,"seq_asia top: asia_high_holds=0.50, asia_low_holds=0.50; seq_intraday top: day_low_in_RS=0.67, day_high_in_OS=0.63; seq_intraday holds: high_holds=0.63, low_holds=0.33, hi_pct_pctile=0.69, lo_pct_pctile=0.50",daycycle hi_hold_24h=0.22; lo_hold_24h=0.35; cycle_pair_24h=0.02; pair_hi_hold=0.22; pair_lo_hold=0.35; hi_pct_pctile=0.88; lo_pct_pctile=0.59,m7_ret_sd=0.50; m7_time=0.50; max_ext_sd=0.50; max_ext_time=0.50; max_ret_sd=0.50; max_ret_time=0.50,AS high broken 02:55; low broken 08:25; first=high; OS low broken 08:40; first=low; AR high broken 00:15; low broken 20:30; first=low; OR high broken 04:30; low broken 05:45; first=high; RR high broken 13:05; low broken 10:40; first=low
02/15/2018,,10:10,ES,Confirmed,Short,RDR,Frontrun,W,2710.25,2713.0,2693.25,2693.25,2018-02-15 10:10:00-05:00,"IF prior TR session, prior session closed up, prior session low printed early AND confluence light; recent sessions: AR true=True break_dir= box=up, OR true=False break_dir= box=up, RR true=True break_dir= box=up; level breaks: AS high broken 02:15; first=high, OS low broken 08:30; first=low, AR high broken 22:05; first=high, OR high broken 04:20; low broken 07:35; first=high, RR high broken 10:35; first=high; probs: confirm_short=0.75, seq_intraday_low_holds=0.37, seq_asia_low_holds=0.50, first_break_true=0.75; seq_asia top: asia_high_holds=0.50, asia_low_holds=0.50; seq_intraday top: day_low_in_RS=0.67, day_high_in_OS=0.63; seq_intraday holds: high_holds=0.65, low_holds=0.37, hi_pct_pctile=0.78, lo_pct_pctile=0.61; daycycle: daycycle hi_hold_24h=0.33, lo_hold_24h=0.59, cycle_pair_24h=0.02, pair_hi_hold=0.33, pair_lo_hold=0.59, hi_pct_pctile=0.80, lo_pct_pctile=0.72; m7/max: m7_ret_sd=0.50, m7_time=0.50, max_ext_sd=0.50, max_ext_time=0.50, max_ret_sd=0.50, max_ret_time=0.50; THEN SHORT via Frontrun at 2710.25, stop 2713.0, target 2693.25.",confluence light,prior TR session; prior session closed up; prior session low printed early,confirm_short=0.75; seq_intraday_low_holds=0.37; seq_asia_low_holds=0.50; first_break_true=0.75,AR true=True break_dir= box=up; OR true=False break_dir= box=up; RR true=True break_dir= box=up,"seq_asia top: asia_high_holds=0.50, asia_low_holds=0.50; seq_intraday top: day_low_in_RS=0.67, day_high_in_OS=0.63; seq_intraday holds: high_holds=0.65, low_holds=0.37, hi_pct_pctile=0.78, lo_pct_pctile=0.61",daycycle hi_hold_24h=0.33; lo_hold_24h=0.59; cycle_pair_24h=0.02; pair_hi_hold=0.33; pair_lo_hold=0.59; hi_pct_pctile=0.80; lo_pct_pctile=0.72,m7_ret_sd=0.50; m7_time=0.50; max_ext_sd=0.50; max_ext_time=0.50; max_ret_sd=0.50; max_ret_time=0.50,AS high broken 02:15; first=high; OS low broken 08:30; first=low; AR high broken 22:05; first=high; OR high broken 04:20; low broken 07:35; first=high; RR high broken 10:35; first=high
02/12/2018,,10:35,ES,No Conf,Long,RDR,Advanced,W,2631.0,2626.0,2680.75,2662.5,2018-02-12 10:35:00-05:00,"IF prior RR session, prior session closed down, prior session high printed early AND near darkpool cluster, weekly rejection support; recent sessions: AR true=True break_dir= box=down, OR true=False break_dir= box=up, RR true=True break_dir= box=down; level breaks: AS high broken 03:40; low broken 03:00; first=low, OS low broken 08:50; first=low, AR high broken 03:40; low broken 20:35; first=low, OR high broken 04:00; low broken 09:15; first=high, RR high/low held; probs: confirm_long=0.20, seq_intraday_high_holds=0.51, seq_asia_high_holds=0.50, first_break_true=0.63, wddrb_model=UX(0.48); seq_asia top: asia_high_holds=0.50, asia_low_holds=0.50; seq_intraday top: day_high_in_RS=0.71, day_low_in_RS=0.57; seq_intraday holds: high_holds=0.51, low_holds=0.49, hi_pct_pctile=0.23, lo_pct_pctile=0.33; daycycle: daycycle hi_hold_24h=0.61, lo_hold_24h=0.72, cycle_pair_24h=0.04, pair_hi_hold=0.61, pair_lo_hold=0.72, hi_pct_pctile=0.41, lo_pct_pctile=0.41; m7/max: m7_ret_sd=0.50, m7_time=0.00, max_ext_sd=0.00, max_ext_time=0.00, max_ret_sd=0.50, max_ret_time=0.00; THEN LONG via Advanced at 2631.0, stop 2626.0, target 2680.75.",near darkpool cluster; weekly rejection support,prior RR session; prior session closed down; prior session high printed early,confirm_long=0.20; seq_intraday_high_holds=0.51; seq_asia_high_holds=0.50; first_break_true=0.63; wddrb_model=UX(0.48),AR true=True break_dir= box=down; OR true=False break_dir= box=up; RR true=True break_dir= box=down,"seq_asia top: asia_high_holds=0.50, asia_low_holds=0.50; seq_intraday top: day_high_in_RS=0.71, day_low_in_RS=0.57; seq_intraday holds: high_holds=0.51, low_holds=0.49, hi_pct_pctile=0.23, lo_pct_pctile=0.33",daycycle hi_hold_24h=0.61; lo_hold_24h=0.72; cycle_pair_24h=0.04; pair_hi_hold=0.61; pair_lo_hold=0.72; hi_pct_pctile=0.41; lo_pct_pctile=0.41,m7_ret_sd=0.50; m7_time=0.00; max_ext_sd=0.00; max_ext_time=0.00; max_ret_sd=0.50; max_ret_time=0.00,AS high broken 03:40; low broken 03:00; first=low; OS low broken 08:50; first=low; AR high broken 03:40; low broken 20:35; first=low; OR high broken 04:00; low broken 09:15; first=high; RR high/low held
02/12/2018,,9:35,ES,No Conf,Long,RDR,Advanced,EX,2648.0,2643.25,2680.75,2643.25,2018-02-12 09:35:00-05:00,"IF prior TR session, prior session closed down, prior session high printed early AND weekly rejection support; recent sessions: AR true=True break_dir= box=down, OR true=False break_dir= box=up, RR true=True break_dir= box=down; level breaks: AS high broken 03:40; low broken 03:00; first=low, OS low broken 08:50; first=low, AR high broken 03:40; low broken 20:35; first=low, OR high broken 04:00; low broken 09:15; first=high, RR high broken 15:45; low broken 10:35; first=low; probs: confirm_long=0.52, seq_intraday_high_holds=0.39, seq_asia_high_holds=0.50, first_break_true=0.79, wddrb_model=UX(0.49); seq_asia top: asia_high_holds=0.50, asia_low_holds=0.50; seq_intraday top: day_high_in_RS=0.58, day_low_in_RS=0.53; seq_intraday holds: high_holds=0.39, low_holds=0.43, hi_pct_pctile=0.04, lo_pct_pctile=0.16; daycycle: daycycle hi_hold_24h=0.22, lo_hold_24h=0.32, cycle_pair_24h=0.03, pair_hi_hold=0.22, pair_lo_hold=0.32, hi_pct_pctile=0.88, lo_pct_pctile=0.60; m7/max: m7_ret_sd=0.50, m7_time=0.50, max_ext_sd=0.50, max_ext_time=0.50, max_ret_sd=0.50, max_ret_time=0.50; THEN LONG via Advanced at 2648.0, stop 2643.25, target 2680.75.",weekly rejection support,prior TR session; prior session closed down; prior session high printed early,confirm_long=0.52; seq_intraday_high_holds=0.39; seq_asia_high_holds=0.50; first_break_true=0.79; wddrb_model=UX(0.49),AR true=True break_dir= box=down; OR true=False break_dir= box=up; RR true=True break_dir= box=down,"seq_asia top: asia_high_holds=0.50, asia_low_holds=0.50; seq_intraday top: day_high_in_RS=0.58, day_low_in_RS=0.53; seq_intraday holds: high_holds=0.39, low_holds=0.43, hi_pct_pctile=0.04, lo_pct_pctile=0.16",daycycle hi_hold_24h=0.22; lo_hold_24h=0.32; cycle_pair_24h=0.03; pair_hi_hold=0.22; pair_lo_hold=0.32; hi_pct_pctile=0.88; lo_pct_pctile=0.60,m7_ret_sd=0.50; m7_time=0.50; max_ext_sd=0.50; max_ext_time=0.50; max_ret_sd=0.50; max_ret_time=0.50,AS high broken 03:40; low broken 03:00; first=low; OS low broken 08:50; first=low; AR high broken 03:40; low broken 20:35; first=low; OR high broken 04:00; low broken 09:15; first=high; RR high broken 15:45; low broken 10:35; first=low
02/08/2018,,8:55,ES,No Conf,Long,In Between,Advanced,EX,2683.0,2679.25,2727.0,2679.25,2018-02-08 08:55:00-05:00,"IF prior OS session, prior session closed up AND weekly rejection support, perfect rejection near entry; recent sessions: AR true=True break_dir= box=up, OR true=False break_dir= box=down, RR true=True break_dir= box=up; level breaks: AS high broken 02:05; first=high, OS high broken 08:30; first=high, AR high broken 00:05; low broken 20:30; first=low, OR high broken 08:20; low broken 04:00; first=low, RR high broken 11:00; low broken 15:55; first=high; probs: confirm_long=0.50, seq_intraday_high_holds=0.28, seq_asia_high_holds=0.50, first_break_true=0.77; seq_asia top: asia_high_holds=0.50, asia_low_holds=0.50; seq_intraday top: day_low_in_OS=0.60, day_high_in_RS=0.58; seq_intraday holds: high_holds=0.28, low_holds=0.58, hi_pct_pctile=0.74, lo_pct_pctile=0.45; daycycle: daycycle hi_hold_24h=0.95, lo_hold_24h=0.95, cycle_pair_24h=0.17, pair_hi_hold=0.95, pair_lo_hold=0.95, hi_pct_pctile=0.00, lo_pct_pctile=0.17; m7/max: m7_ret_sd=0.50, m7_time=0.50, max_ext_sd=0.50, max_ext_time=0.50, max_ret_sd=0.50, max_ret_time=0.50; THEN LONG via Advanced at 2683.0, stop 2679.25, target 2727.0.",weekly rejection support; perfect rejection near entry,prior OS session; prior session closed up,confirm_long=0.50; seq_intraday_high_holds=0.28; seq_asia_high_holds=0.50; first_break_true=0.77,AR true=True break_dir= box=up; OR true=False break_dir= box=down; RR true=True break_dir= box=up,"seq_asia top: asia_high_holds=0.50, asia_low_holds=0.50; seq_intraday top: day_low_in_OS=0.60, day_high_in_RS=0.58; seq_intraday holds: high_holds=0.28, low_holds=0.58, hi_pct_pctile=0.74, lo_pct_pctile=0.45",daycycle hi_hold_24h=0.95; lo_hold_24h=0.95; cycle_pair_24h=0.17; pair_hi_hold=0.95; pair_lo_hold=0.95; hi_pct_pctile=0.00; lo_pct_pctile=0.17,m7_ret_sd=0.50; m7_time=0.50; max_ext_sd=0.50; max_ext_time=0.50; max_ret_sd=0.50; max_ret_time=0.50,AS high broken 02:05; first=high; OS high broken 08:30; first=high; AR high broken 00:05; low broken 20:30; first=low; OR high broken 08:20; low broken 04:00; first=low; RR high broken 11:00; low broken 15:55; first=high
02/07/2018,,9:35,ES,No Conf,Long,RDR,M7 Candle,W,2689.75,2685.0,2725.25,2725.25,2018-02-07 09:35:00-05:00,"IF prior TR session, prior session closed up AND weekly rejection support; recent sessions: AR true=True break_dir= box=up, OR true=False break_dir= box=up, RR true=True break_dir= box=up; level breaks: AS high broken 09:35; low broken 03:10; first=low, OS high broken 09:25; first=high, AR high broken 21:10; low broken 21:30; first=high, OR high broken 04:35; first=high, RR high broken 15:05; first=high; probs: confirm_long=0.86, seq_intraday_high_holds=0.20, seq_asia_high_holds=0.50, first_break_true=0.90; seq_asia top: asia_high_holds=0.50, asia_low_holds=0.50; seq_intraday top: day_high_in_RS=0.71, day_low_in_OS=0.52; seq_intraday holds: high_holds=0.20, low_holds=0.58, hi_pct_pctile=0.70, lo_pct_pctile=0.47; daycycle: daycycle hi_hold_24h=0.28, lo_hold_24h=0.27, cycle_pair_24h=0.02, pair_hi_hold=0.28, pair_lo_hold=0.27, hi_pct_pctile=0.68, lo_pct_pctile=0.58; m7/max: m7_ret_sd=0.50, m7_time=0.50, max_ext_sd=0.50, max_ext_time=0.50, max_ret_sd=0.50, max_ret_time=0.50; THEN LONG via M7 Candle at 2689.75, stop 2685.0, target 2725.25.",weekly rejection support,prior TR session; prior session closed up,confirm_long=0.86; seq_intraday_high_holds=0.20; seq_asia_high_holds=0.50; first_break_true=0.90,AR true=True break_dir= box=up; OR true=False break_dir= box=up; RR true=True break_dir= box=up,"seq_asia top: asia_high_holds=0.50, asia_low_holds=0.50; seq_intraday top: day_high_in_RS=0.71, day_low_in_OS=0.52; seq_intraday holds: high_holds=0.20, low_holds=0.58, hi_pct_pctile=0.70, lo_pct_pctile=0.47",daycycle hi_hold_24h=0.28; lo_hold_24h=0.27; cycle_pair_24h=0.02; pair_hi_hold=0.28; pair_lo_hold=0.27; hi_pct_pctile=0.68; lo_pct_pctile=0.58,m7_ret_sd=0.50; m7_time=0.50; max_ext_sd=0.50; max_ext_time=0.50; max_ret_sd=0.50; max_ret_time=0.50,AS high broken 09:35; low broken 03:10; first=low; OS high broken 09:25; first=high; AR high broken 21:10; low broken 21:30; first=high; OR high broken 04:35; first=high; RR high broken 15:05; first=high
02/05/2018,,12:00,ES,No Conf,Short,RDR,Advanced,W,2749.25,2754.0,2712.75,2712.75,2018-02-05 12:00:00-05:00,"IF prior RR session, prior session closed up, prior session low printed early AND weekly rejection resistance; recent sessions: AR true=True break_dir= box=down, OR true=False break_dir= box=down, RR true=True break_dir= box=up; level breaks: AS high broken 02:00; low broken 07:00; first=high, OS high broken 10:20; low broken 09:30; first=low, AR high broken 20:40; low broken 07:05; first=high, OR high broken 04:10; low broken 06:40; first=high, RR high/low held; probs: confirm_short=0.27, seq_intraday_low_holds=0.52, seq_asia_low_holds=0.50, first_break_true=0.63, wddrb_model=DX(0.40); seq_asia top: asia_high_holds=0.50, asia_low_holds=0.50; seq_intraday top: day_high_in_RS=0.83, day_low_in_RR=0.67; seq_intraday holds: high_holds=0.48, low_holds=0.52, hi_pct_pctile=0.89, lo_pct_pctile=0.45; daycycle: daycycle hi_hold_24h=0.54, lo_hold_24h=0.85, cycle_pair_24h=0.03, pair_hi_hold=0.54, pair_lo_hold=0.85, hi_pct_pctile=0.55, lo_pct_pctile=0.30; m7/max: m7_ret_sd=0.50, m7_time=0.53, max_ext_sd=0.00, max_ext_time=0.21, max_ret_sd=0.50, max_ret_time=0.24; THEN SHORT via Advanced at 2749.25, stop 2754.0, target 2712.75.",weekly rejection resistance,prior RR session; prior session closed up; prior session low printed early,confirm_short=0.27; seq_intraday_low_holds=0.52; seq_asia_low_holds=0.50; first_break_true=0.63; wddrb_model=DX(0.40),AR true=True break_dir= box=down; OR true=False break_dir= box=down; RR true=True break_dir= box=up,"seq_asia top: asia_high_holds=0.50, asia_low_holds=0.50; seq_intraday top: day_high_in_RS=0.83, day_low_in_RR=0.67; seq_intraday holds: high_holds=0.48, low_holds=0.52, hi_pct_pctile=0.89, lo_pct_pctile=0.45",daycycle hi_hold_24h=0.54; lo_hold_24h=0.85; cycle_pair_24h=0.03; pair_hi_hold=0.54; pair_lo_hold=0.85; hi_pct_pctile=0.55; lo_pct_pctile=0.30,m7_ret_sd=0.50; m7_time=0.53; max_ext_sd=0.00; max_ext_time=0.21; max_ret_sd=0.50; max_ret_time=0.24,AS high broken 02:00; low broken 07:00; first=high; OS high broken 10:20; low broken 09:30; first=low; AR high broken 20:40; low broken 07:05; first=high; OR high broken 04:10; low broken 06:40; first=high; RR high/low held
02/05/2018,,10:35,ES,No Conf,Long,RDR,Frontrun,BE,2753.5,2749.75,2780.5,2753.5,2018-02-05 10:35:00-05:00,"IF prior RR session, prior session closed up, prior session low printed early AND weekly rejection support; recent sessions: AR true=True break_dir= box=down, OR true=False break_dir= box=down, RR true=True break_dir= box=up; level breaks: AS high broken 02:00; low broken 07:00; first=high, OS high broken 10:20; low broken 09:30; first=low, AR high broken 20:40; low broken 07:05; first=high, OR high broken 04:10; low broken 06:40; first=high, RR high/low held; probs: confirm_long=0.73, seq_intraday_high_holds=0.47, seq_asia_high_holds=0.50, first_break_true=0.63, wddrb_model=DX(0.40); seq_asia top: asia_high_holds=0.50, asia_low_holds=0.50; seq_intraday top: day_high_in_RS=0.83, day_low_in_RR=0.67; seq_intraday holds: high_holds=0.47, low_holds=0.52, hi_pct_pctile=0.89, lo_pct_pctile=0.45; daycycle: daycycle hi_hold_24h=0.51, lo_hold_24h=0.75, cycle_pair_24h=0.03, pair_hi_hold=0.51, pair_lo_hold=0.75, hi_pct_pctile=0.55, lo_pct_pctile=0.30; m7/max: m7_ret_sd=0.50, m7_time=0.00, max_ext_sd=0.00, max_ext_time=0.00, max_ret_sd=0.50, max_ret_time=0.00; THEN LONG via Frontrun at 2753.5, stop 2749.75, target 2780.5.",weekly rejection support,prior RR session; prior session closed up; prior session low printed early,confirm_long=0.73; seq_intraday_high_holds=0.47; seq_asia_high_holds=0.50; first_break_true=0.63; wddrb_model=DX(0.40),AR true=True break_dir= box=down; OR true=False break_dir= box=down; RR true=True break_dir= box=up,"seq_asia top: asia_high_holds=0.50, asia_low_holds=0.50; seq_intraday top: day_high_in_RS=0.83, day_low_in_RR=0.67; seq_intraday holds: high_holds=0.47, low_holds=0.52, hi_pct_pctile=0.89, lo_pct_pctile=0.45",daycycle hi_hold_24h=0.51; lo_hold_24h=0.75; cycle_pair_24h=0.03; pair_hi_hold=0.51; pair_lo_hold=0.75; hi_pct_pctile=0.55; lo_pct_pctile=0.30,m7_ret_sd=0.50; m7_time=0.00; max_ext_sd=0.00; max_ext_time=0.00; max_ret_sd=0.50; max_ret_time=0.00,AS high broken 02:00; low broken 07:00; first=high; OS high broken 10:20; low broken 09:30; first=low; AR high broken 20:40; low broken 07:05; first=high; OR high broken 04:10; low broken 06:40; first=high; RR high/low held
02/01/2018,11:25,11:30,ES,Confirmed,Long,RDR,Mode,W,2826.25,2824.0,2839.5,2831.5,2018-02-01 11:30:00-05:00,"IF prior RR session, prior session closed up, prior session low printed early AND near range high, weekly rejection support; recent sessions: AR true=True break_dir= box=up, OR true=False break_dir= box=down, RR true=True break_dir= box=up; level breaks: AS low broken 02:30; first=low, OS low broken 08:30; first=low, AR high broken 20:30; low broken 04:15; first=high, OR low broken 04:00; first=low, RR high broken 11:30; first=high; probs: confirm_long=0.94, seq_intraday_high_holds=0.54, seq_asia_high_holds=0.50, first_break_true=0.61; seq_asia top: asia_high_holds=0.50, asia_low_holds=0.50; seq_intraday top: day_low_in_RS=0.83, day_high_in_OS=0.67; seq_intraday holds: high_holds=0.54, low_holds=0.48, hi_pct_pctile=1.00, lo_pct_pctile=0.78; daycycle: daycycle hi_hold_24h=0.58, lo_hold_24h=0.74, cycle_pair_24h=0.04, pair_hi_hold=0.58, pair_lo_hold=0.74, hi_pct_pctile=0.90, lo_pct_pctile=0.63; m7/max: m7_ret_sd=0.50, m7_time=0.00, max_ext_sd=0.00, max_ext_time=0.00, max_ret_sd=0.50, max_ret_time=0.00; THEN LONG via Mode at 2826.25, stop 2824.0, target 2839.5.",near range high; weekly rejection support,prior RR session; prior session closed up; prior session low printed early,confirm_long=0.94; seq_intraday_high_holds=0.54; seq_asia_high_holds=0.50; first_break_true=0.61,AR true=True break_dir= box=up; OR true=False break_dir= box=down; RR true=True break_dir= box=up,"seq_asia top: asia_high_holds=0.50, asia_low_holds=0.50; seq_intraday top: day_low_in_RS=0.83, day_high_in_OS=0.67; seq_intraday holds: high_holds=0.54, low_holds=0.48, hi_pct_pctile=1.00, lo_pct_pctile=0.78",daycycle hi_hold_24h=0.58; lo_hold_24h=0.74; cycle_pair_24h=0.04; pair_hi_hold=0.58; pair_lo_hold=0.74; hi_pct_pctile=0.90; lo_pct_pctile=0.63,m7_ret_sd=0.50; m7_time=0.00; max_ext_sd=0.00; max_ext_time=0.00; max_ret_sd=0.50; max_ret_time=0.00,AS low broken 02:30; first=low; OS low broken 08:30; first=low; AR high broken 20:30; low broken 04:15; first=high; OR low broken 04:00; first=low; RR high broken 11:30; first=high
02/01/2018,,9:55,ES,No Conf,Long,RDR,Advanced,EX,2821.5,2818.0,2839.5,2818.0,2018-02-01 09:55:00-05:00,"IF prior TR session, prior session closed down, prior session high printed early, prior session high rejected weekly cluster AND near weekly cluster, weekly rejection support; recent sessions: AR true=True break_dir= box=up, OR true=False break_dir= box=down, RR true=True break_dir= box=up; level breaks: AS low broken 02:30; first=low, OS low broken 08:30; first=low, AR high broken 20:30; low broken 04:15; first=high, OR low broken 04:00; first=low, RR low broken 10:40; first=low; probs: confirm_long=0.83, seq_intraday_high_holds=0.44, seq_asia_high_holds=0.50, first_break_true=0.61; seq_asia top: asia_high_holds=0.50, asia_low_holds=0.50; seq_intraday top: day_low_in_RS=0.67, day_high_in_RS=0.58; seq_intraday holds: high_holds=0.44, low_holds=0.37, hi_pct_pctile=0.97, lo_pct_pctile=0.73; daycycle: daycycle hi_hold_24h=0.34, lo_hold_24h=0.50, cycle_pair_24h=0.03, pair_hi_hold=0.34, pair_lo_hold=0.50, hi_pct_pctile=0.86, lo_pct_pctile=0.73; m7/max: m7_ret_sd=0.50, m7_time=0.50, max_ext_sd=0.50, max_ext_time=0.50, max_ret_sd=0.50, max_ret_time=0.50; THEN LONG via Advanced at 2821.5, stop 2818.0, target 2839.5.",near weekly cluster; weekly rejection support,prior TR session; prior session closed down; prior session high printed early; prior session high rejected weekly cluster,confirm_long=0.83; seq_intraday_high_holds=0.44; seq_asia_high_holds=0.50; first_break_true=0.61,AR true=True break_dir= box=up; OR true=False break_dir= box=down; RR true=True break_dir= box=up,"seq_asia top: asia_high_holds=0.50, asia_low_holds=0.50; seq_intraday top: day_low_in_RS=0.67, day_high_in_RS=0.58; seq_intraday holds: high_holds=0.44, low_holds=0.37, hi_pct_pctile=0.97, lo_pct_pctile=0.73",daycycle hi_hold_24h=0.34; lo_hold_24h=0.50; cycle_pair_24h=0.03; pair_hi_hold=0.34; pair_lo_hold=0.50; hi_pct_pctile=0.86; lo_pct_pctile=0.73,m7_ret_sd=0.50; m7_time=0.50; max_ext_sd=0.50; max_ext_time=0.50; max_ret_sd=0.50; max_ret_time=0.50,AS low broken 02:30; first=low; OS low broken 08:30; first=low; AR high broken 20:30; low broken 04:15; first=high; OR low broken 04:00; first=low; RR low broken 10:40; first=low
01/30/2018,,9:45,ES,No Conf,Long,RDR,Advanced,EX,2832.25,2829.25,2856.75,2829.25,2018-01-30 09:45:00-05:00,"IF prior TR session, prior session closed down, prior session high printed early AND weekly rejection support; recent sessions: AR true=True break_dir= box=down, OR true=False break_dir= box=up, RR true=True break_dir= box=down; level breaks: AS low broken 09:15; first=low, OS low broken 08:50; first=low, AR low broken 22:20; first=low, OR high broken 04:55; low broken 07:35; first=high, RR low broken 10:35; first=low; probs: confirm_long=0.40, seq_intraday_high_holds=0.51, seq_asia_high_holds=0.50, first_break_true=0.88; seq_asia top: asia_high_holds=0.50, asia_low_holds=0.50; seq_intraday top: day_low_in_RS=0.54, day_low_in_RR=0.46; seq_intraday holds: high_holds=0.51, low_holds=0.45, hi_pct_pctile=0.66, lo_pct_pctile=0.74; daycycle: daycycle hi_hold_24h=0.37, lo_hold_24h=0.35, cycle_pair_24h=0.02, pair_hi_hold=0.37, pair_lo_hold=0.35, hi_pct_pctile=0.69, lo_pct_pctile=0.80; m7/max: m7_ret_sd=0.50, m7_time=0.50, max_ext_sd=0.50, max_ext_time=0.50, max_ret_sd=0.50, max_ret_time=0.50; THEN LONG via Advanced at 2832.25, stop 2829.25, target 2856.75.",weekly rejection support,prior TR session; prior session closed down; prior session high printed early,confirm_long=0.40; seq_intraday_high_holds=0.51; seq_asia_high_holds=0.50; first_break_true=0.88,AR true=True break_dir= box=down; OR true=False break_dir= box=up; RR true=True break_dir= box=down,"seq_asia top: asia_high_holds=0.50, asia_low_holds=0.50; seq_intraday top: day_low_in_RS=0.54, day_low_in_RR=0.46; seq_intraday holds: high_holds=0.51, low_holds=0.45, hi_pct_pctile=0.66, lo_pct_pctile=0.74",daycycle hi_hold_24h=0.37; lo_hold_24h=0.35; cycle_pair_24h=0.02; pair_hi_hold=0.37; pair_lo_hold=0.35; hi_pct_pctile=0.69; lo_pct_pctile=0.80,m7_ret_sd=0.50; m7_time=0.50; max_ext_sd=0.50; max_ext_time=0.50; max_ret_sd=0.50; max_ret_time=0.50,AS low broken 09:15; first=low; OS low broken 08:50; first=low; AR low broken 22:20; first=low; OR high broken 04:55; low broken 07:35; first=high; RR low broken 10:35; first=low
01/29/2018,,9:40,ES,No Conf,Long,RDR,Advanced,EX,2869.5,2867.75,2878.75,2867.75,2018-01-29 09:40:00-05:00,"IF prior TR session, prior session closed down, prior session high printed early AND confluence light; recent sessions: AR true=True break_dir= box=up, OR true=False break_dir= box=down, RR true=True break_dir= box=flat; level breaks: AS low broken 03:00; first=low, OS low broken 09:05; first=low, AR high broken 20:30; low broken 22:05; first=high, OR low broken 04:00; first=low, RR high broken 10:35; first=high; probs: confirm_long=0.75, seq_intraday_high_holds=0.43, seq_asia_high_holds=0.50, first_break_true=0.70, wddrb_model=U(0.38); seq_asia top: asia_high_holds=0.50, asia_low_holds=0.50; seq_intraday top: day_low_in_RS=0.62, day_high_in_RS=0.53; seq_intraday holds: high_holds=0.43, low_holds=0.64, hi_pct_pctile=0.70, lo_pct_pctile=0.31; daycycle: daycycle hi_hold_24h=0.33, lo_hold_24h=0.32, cycle_pair_24h=0.02, pair_hi_hold=0.33, pair_lo_hold=0.32, hi_pct_pctile=0.85, lo_pct_pctile=0.82; m7/max: m7_ret_sd=0.50, m7_time=0.50, max_ext_sd=0.50, max_ext_time=0.50, max_ret_sd=0.50, max_ret_time=0.50; THEN LONG via Advanced at 2869.5, stop 2867.75, target 2878.75.",confluence light,prior TR session; prior session closed down; prior session high printed early,confirm_long=0.75; seq_intraday_high_holds=0.43; seq_asia_high_holds=0.50; first_break_true=0.70; wddrb_model=U(0.38),AR true=True break_dir= box=up; OR true=False break_dir= box=down; RR true=True break_dir= box=flat,"seq_asia top: asia_high_holds=0.50, asia_low_holds=0.50; seq_intraday top: day_low_in_RS=0.62, day_high_in_RS=0.53; seq_intraday holds: high_holds=0.43, low_holds=0.64, hi_pct_pctile=0.70, lo_pct_pctile=0.31",daycycle hi_hold_24h=0.33; lo_hold_24h=0.32; cycle_pair_24h=0.02; pair_hi_hold=0.33; pair_lo_hold=0.32; hi_pct_pctile=0.85; lo_pct_pctile=0.82,m7_ret_sd=0.50; m7_time=0.50; max_ext_sd=0.50; max_ext_time=0.50; max_ret_sd=0.50; max_ret_time=0.50,AS low broken 03:00; first=low; OS low broken 09:05; first=low; AR high broken 20:30; low broken 22:05; first=high; OR low broken 04:00; first=low; RR high broken 10:35; first=high
01/26/2018,10:35,11:05,ES,Confirmed,Long,RDR,Mode,W,2852.75,2851.5,2862.75,2862.75,2018-01-26 11:05:00-05:00,"IF prior RR session, prior session low printed early AND near range high, near range high; recent sessions: AR true=True break_dir= box=up, OR true=False break_dir= box=flat, RR true=True break_dir= box=flat; level breaks: AS high broken 04:45; first=high, OS high broken 09:55; first=high, AR high broken 20:30; first=high, OR high broken 04:35; low broken 04:05; first=low, RR high broken 10:35; first=high; probs: confirm_long=0.80, seq_intraday_high_holds=0.16, seq_asia_high_holds=0.50, first_break_true=0.90; seq_asia top: asia_high_holds=0.50, asia_low_holds=0.50; seq_intraday top: day_high_in_RS=1.00, day_low_in_OS=0.85; seq_intraday holds: high_holds=0.16, low_holds=0.84, hi_pct_pctile=0.97, lo_pct_pctile=0.38; daycycle: daycycle hi_hold_24h=0.52, lo_hold_24h=0.74, cycle_pair_24h=0.03, pair_hi_hold=0.52, pair_lo_hold=0.74, hi_pct_pctile=0.72, lo_pct_pctile=0.78; m7/max: m7_ret_sd=0.43, m7_time=0.51, max_ext_sd=0.29, max_ext_time=0.11, max_ret_sd=0.57, max_ret_time=0.29; THEN LONG via Mode at 2852.75, stop 2851.5, target 2862.75.",near range high; near range high,prior RR session; prior session low printed early,confirm_long=0.80; seq_intraday_high_holds=0.16; seq_asia_high_holds=0.50; first_break_true=0.90,AR true=True break_dir= box=up; OR true=False break_dir= box=flat; RR true=True break_dir= box=flat,"seq_asia top: asia_high_holds=0.50, asia_low_holds=0.50; seq_intraday top: day_high_in_RS=1.00, day_low_in_OS=0.85; seq_intraday holds: high_holds=0.16, low_holds=0.84, hi_pct_pctile=0.97, lo_pct_pctile=0.38",daycycle hi_hold_24h=0.52; lo_hold_24h=0.74; cycle_pair_24h=0.03; pair_hi_hold=0.52; pair_lo_hold=0.74; hi_pct_pctile=0.72; lo_pct_pctile=0.78,m7_ret_sd=0.43; m7_time=0.51; max_ext_sd=0.29; max_ext_time=0.11; max_ret_sd=0.57; max_ret_time=0.29,AS high broken 04:45; first=high; OS high broken 09:55; first=high; AR high broken 20:30; first=high; OR high broken 04:35; low broken 04:05; first=low; RR high broken 10:35; first=high
01/24/2018,,10:50,ES,No Conf,Long,RDR,Frontrun,EX,2852.25,2850.5,2862.0,2850.5,2018-01-24 10:50:00-05:00,"IF prior RR session, prior session closed up, prior session low printed early AND confluence light; recent sessions: AR true=True break_dir= box=up, OR true=False break_dir= box=up, RR true=True break_dir= box=up; level breaks: AS high broken 02:10; first=high, OS high broken 08:30; first=high, AR high broken 01:45; low broken 20:30; first=low, OR high broken 05:30; first=high, RR high broken 10:35; first=high; probs: confirm_long=0.71, seq_intraday_high_holds=0.20, seq_asia_high_holds=0.50, first_break_true=0.61; seq_asia top: asia_high_holds=0.50, asia_low_holds=0.50; seq_intraday top: day_high_in_RS=1.00, day_low_in_OS=0.89; seq_intraday holds: high_holds=0.20, low_holds=0.89, hi_pct_pctile=0.81, lo_pct_pctile=0.69; daycycle: daycycle hi_hold_24h=0.31, lo_hold_24h=0.80, cycle_pair_24h=0.02, pair_hi_hold=0.31, pair_lo_hold=0.80, hi_pct_pctile=0.92, lo_pct_pctile=0.64; m7/max: m7_ret_sd=0.50, m7_time=0.16, max_ext_sd=0.00, max_ext_time=0.06, max_ret_sd=0.50, max_ret_time=0.06; THEN LONG via Frontrun at 2852.25, stop 2850.5, target 2862.0.",confluence light,prior RR session; prior session closed up; prior session low printed early,confirm_long=0.71; seq_intraday_high_holds=0.20; seq_asia_high_holds=0.50; first_break_true=0.61,AR true=True break_dir= box=up; OR true=False break_dir= box=up; RR true=True break_dir= box=up,"seq_asia top: asia_high_holds=0.50, asia_low_holds=0.50; seq_intraday top: day_high_in_RS=1.00, day_low_in_OS=0.89; seq_intraday holds: high_holds=0.20, low_holds=0.89, hi_pct_pctile=0.81, lo_pct_pctile=0.69",daycycle hi_hold_24h=0.31; lo_hold_24h=0.80; cycle_pair_24h=0.02; pair_hi_hold=0.31; pair_lo_hold=0.80; hi_pct_pctile=0.92; lo_pct_pctile=0.64,m7_ret_sd=0.50; m7_time=0.16; max_ext_sd=0.00; max_ext_time=0.06; max_ret_sd=0.50; max_ret_time=0.06,AS high broken 02:10; first=high; OS high broken 08:30; first=high; AR high broken 01:45; low broken 20:30; first=low; OR high broken 05:30; first=high; RR high broken 10:35; first=high
01/24/2018,,10:10,ES,No Conf,Long,RDR,Frontrun,EX,2854.0,2852.25,2862.0,2852.25,2018-01-24 10:10:00-05:00,"IF prior TR session, prior session closed up AND confluence light; recent sessions: AR true=True break_dir= box=up, OR true=False break_dir= box=up, RR true=True break_dir= box=up; level breaks: AS high broken 02:10; first=high, OS high broken 08:30; first=high, AR high broken 01:45; low broken 20:30; first=low, OR high broken 05:30; first=high, RR high broken 10:55; first=high; probs: confirm_long=0.88, seq_intraday_high_holds=0.63, seq_asia_high_holds=0.50, first_break_true=0.61; seq_asia top: asia_high_holds=0.50, asia_low_holds=0.50; seq_intraday top: day_high_in_RS=0.76, day_low_in_OS=0.52; seq_intraday holds: high_holds=0.63, low_holds=0.64, hi_pct_pctile=0.45, lo_pct_pctile=0.62; daycycle: daycycle hi_hold_24h=0.33, lo_hold_24h=0.59, cycle_pair_24h=0.02, pair_hi_hold=0.33, pair_lo_hold=0.59, hi_pct_pctile=0.86, lo_pct_pctile=0.74; m7/max: m7_ret_sd=0.50, m7_time=0.50, max_ext_sd=0.50, max_ext_time=0.50, max_ret_sd=0.50, max_ret_time=0.50; THEN LONG via Frontrun at 2854.0, stop 2852.25, target 2862.0.",confluence light,prior TR session; prior session closed up,confirm_long=0.88; seq_intraday_high_holds=0.63; seq_asia_high_holds=0.50; first_break_true=0.61,AR true=True break_dir= box=up; OR true=False break_dir= box=up; RR true=True break_dir= box=up,"seq_asia top: asia_high_holds=0.50, asia_low_holds=0.50; seq_intraday top: day_high_in_RS=0.76, day_low_in_OS=0.52; seq_intraday holds: high_holds=0.63, low_holds=0.64, hi_pct_pctile=0.45, lo_pct_pctile=0.62",daycycle hi_hold_24h=0.33; lo_hold_24h=0.59; cycle_pair_24h=0.02; pair_hi_hold=0.33; pair_lo_hold=0.59; hi_pct_pctile=0.86; lo_pct_pctile=0.74,m7_ret_sd=0.50; m7_time=0.50; max_ext_sd=0.50; max_ext_time=0.50; max_ret_sd=0.50; max_ret_time=0.50,AS high broken 02:10; first=high; OS high broken 08:30; first=high; AR high broken 01:45; low broken 20:30; first=low; OR high broken 05:30; first=high; RR high broken 10:55; first=high
01/23/2018,,10:30,ES,No Conf,Long,RDR,Frontrun,BE,2838.5,2836.75,2848.0,2838.5,2018-01-23 10:30:00-05:00,"IF prior RR session, prior session closed up, prior session high printed early AND confluence light; recent sessions: AR true=True break_dir= box=up, OR true=False break_dir= box=flat, RR true=True break_dir= box=up; level breaks: AS high broken 02:50; low broken 06:05; first=high, OS high broken 09:45; first=high, AR high broken 20:30; low broken 06:05; first=high, OR high broken 04:05; low broken 04:30; first=high, RR high/low held; probs: confirm_long=0.70, seq_intraday_high_holds=0.46, seq_asia_high_holds=0.50, first_break_true=0.63; seq_asia top: asia_high_holds=0.50, asia_low_holds=0.50; seq_intraday top: day_low_in_RS=0.69, day_high_in_RS=0.63; seq_intraday holds: high_holds=0.46, low_holds=0.37, hi_pct_pctile=0.90, lo_pct_pctile=0.50; daycycle: daycycle hi_hold_24h=0.30, lo_hold_24h=0.78, cycle_pair_24h=0.02, pair_hi_hold=0.30, pair_lo_hold=0.78, hi_pct_pctile=0.92, lo_pct_pctile=0.60; m7/max: m7_ret_sd=0.50, m7_time=0.00, max_ext_sd=0.00, max_ext_time=0.00, max_ret_sd=0.50, max_ret_time=0.00; THEN LONG via Frontrun at 2838.5, stop 2836.75, target 2848.0.",confluence light,prior RR session; prior session closed up; prior session high printed early,confirm_long=0.70; seq_intraday_high_holds=0.46; seq_asia_high_holds=0.50; first_break_true=0.63,AR true=True break_dir= box=up; OR true=False break_dir= box=flat; RR true=True break_dir= box=up,"seq_asia top: asia_high_holds=0.50, asia_low_holds=0.50; seq_intraday top: day_low_in_RS=0.69, day_high_in_RS=0.63; seq_intraday holds: high_holds=0.46, low_holds=0.37, hi_pct_pctile=0.90, lo_pct_pctile=0.50",daycycle hi_hold_24h=0.30; lo_hold_24h=0.78; cycle_pair_24h=0.02; pair_hi_hold=0.30; pair_lo_hold=0.78; hi_pct_pctile=0.92; lo_pct_pctile=0.60,m7_ret_sd=0.50; m7_time=0.00; max_ext_sd=0.00; max_ext_time=0.00; max_ret_sd=0.50; max_ret_time=0.00,AS high broken 02:50; low broken 06:05; first=high; OS high broken 09:45; first=high; AR high broken 20:30; low broken 06:05; first=high; OR high broken 04:05; low broken 04:30; first=high; RR high/low held
01/23/2018,,10:15,ES,No Conf,Long,RDR,Frontrun,EX,2837.25,2835.25,2848.0,2835.25,2018-01-23 10:15:00-05:00,"IF prior TR session, prior session closed up AND confluence light; recent sessions: AR true=True break_dir= box=up, OR true=False break_dir= box=flat, RR true=True break_dir= box=up; level breaks: AS high broken 02:50; low broken 06:05; first=high, OS high broken 09:45; first=high, AR high broken 20:30; low broken 06:05; first=high, OR high broken 04:05; low broken 04:30; first=high, RR high broken 11:55; first=high; probs: confirm_long=0.60, seq_intraday_high_holds=0.46, seq_asia_high_holds=0.50, first_break_true=0.63; seq_asia top: asia_high_holds=0.50, asia_low_holds=0.50; seq_intraday top: day_high_in_RS=0.75, day_low_in_OS=0.44; seq_intraday holds: high_holds=0.46, low_holds=0.54, hi_pct_pctile=0.95, lo_pct_pctile=0.56; daycycle: daycycle hi_hold_24h=0.34, lo_hold_24h=0.62, cycle_pair_24h=0.02, pair_hi_hold=0.34, pair_lo_hold=0.62, hi_pct_pctile=0.86, lo_pct_pctile=0.71; m7/max: m7_ret_sd=0.50, m7_time=0.50, max_ext_sd=0.50, max_ext_time=0.50, max_ret_sd=0.50, max_ret_time=0.50; THEN LONG via Frontrun at 2837.25, stop 2835.25, target 2848.0.",confluence light,prior TR session; prior session closed up,confirm_long=0.60; seq_intraday_high_holds=0.46; seq_asia_high_holds=0.50; first_break_true=0.63,AR true=True break_dir= box=up; OR true=False break_dir= box=flat; RR true=True break_dir= box=up,"seq_asia top: asia_high_holds=0.50, asia_low_holds=0.50; seq_intraday top: day_high_in_RS=0.75, day_low_in_OS=0.44; seq_intraday holds: high_holds=0.46, low_holds=0.54, hi_pct_pctile=0.95, lo_pct_pctile=0.56",daycycle hi_hold_24h=0.34; lo_hold_24h=0.62; cycle_pair_24h=0.02; pair_hi_hold=0.34; pair_lo_hold=0.62; hi_pct_pctile=0.86; lo_pct_pctile=0.71,m7_ret_sd=0.50; m7_time=0.50; max_ext_sd=0.50; max_ext_time=0.50; max_ret_sd=0.50; max_ret_time=0.50,AS high broken 02:50; low broken 06:05; first=high; OS high broken 09:45; first=high; AR high broken 20:30; low broken 06:05; first=high; OR high broken 04:05; low broken 04:30; first=high; RR high broken 11:55; first=high
01/22/2018,,11:00,ES,No Conf,Long,RDR,Frontrun,W,2818.75,2815.75,2834.25,2834.25,2018-01-22 11:00:00-05:00,"IF prior RR session, prior session closed up, prior session low printed early, prior session low rejected weekly cluster AND weekly rejection support; recent sessions: AR true=True break_dir= box=up, OR true=False break_dir= box=up, RR true=True break_dir= box=up; level breaks: AS high broken 07:55; low broken 02:35; first=low, OS high broken 09:35; first=high, AR high broken 20:50; low broken 02:50; first=high, OR high broken 06:10; low broken 04:05; first=low, RR high/low held; probs: confirm_long=0.71, seq_intraday_high_holds=0.52, seq_asia_high_holds=0.50, first_break_true=0.90, wddrb_model=UX(0.72); seq_asia top: asia_high_holds=0.50, asia_low_holds=0.50; seq_intraday top: day_high_in_RS=0.67, day_low_in_OS=0.58; seq_intraday holds: high_holds=0.52, low_holds=0.52, hi_pct_pctile=0.81, lo_pct_pctile=0.38; daycycle: daycycle hi_hold_24h=0.56, lo_hold_24h=0.70, cycle_pair_24h=0.04, pair_hi_hold=0.56, pair_lo_hold=0.70, hi_pct_pctile=0.93, lo_pct_pctile=0.63; m7/max: m7_ret_sd=0.50, m7_time=0.25, max_ext_sd=0.00, max_ext_time=0.09, max_ret_sd=0.50, max_ret_time=0.08; THEN LONG via Frontrun at 2818.75, stop 2815.75, target 2834.25.",weekly rejection support,prior RR session; prior session closed up; prior session low printed early; prior session low rejected weekly cluster,confirm_long=0.71; seq_intraday_high_holds=0.52; seq_asia_high_holds=0.50; first_break_true=0.90; wddrb_model=UX(0.72),AR true=True break_dir= box=up; OR true=False break_dir= box=up; RR true=True break_dir= box=up,"seq_asia top: asia_high_holds=0.50, asia_low_holds=0.50; seq_intraday top: day_high_in_RS=0.67, day_low_in_OS=0.58; seq_intraday holds: high_holds=0.52, low_holds=0.52, hi_pct_pctile=0.81, lo_pct_pctile=0.38",daycycle hi_hold_24h=0.56; lo_hold_24h=0.70; cycle_pair_24h=0.04; pair_hi_hold=0.56; pair_lo_hold=0.70; hi_pct_pctile=0.93; lo_pct_pctile=0.63,m7_ret_sd=0.50; m7_time=0.25; max_ext_sd=0.00; max_ext_time=0.09; max_ret_sd=0.50; max_ret_time=0.08,AS high broken 07:55; low broken 02:35; first=low; OS high broken 09:35; first=high; AR high broken 20:50; low broken 02:50; first=high; OR high broken 06:10; low broken 04:05; first=low; RR high/low held
01/22/2018,,10:35,ES,No Conf,Long,RDR,Frontrun,EX,2821.0,2819.0,2833.25,2819.0,2018-01-22 10:35:00-05:00,"IF prior RR session, prior session closed up, prior session low printed early, prior session low rejected weekly cluster AND near range high, weekly rejection support; recent sessions: AR true=True break_dir= box=up, OR true=False break_dir= box=up, RR true=True break_dir= box=up; level breaks: AS high broken 07:55; low broken 02:35; first=low, OS high broken 09:35; first=high, AR high broken 20:50; low broken 02:50; first=high, OR high broken 06:10; low broken 04:05; first=low, RR high/low held; probs: confirm_long=0.71, seq_intraday_high_holds=0.46, seq_asia_high_holds=0.50, first_break_true=0.90, wddrb_model=UX(0.72); seq_asia top: asia_high_holds=0.50, asia_low_holds=0.50; seq_intraday top: day_high_in_RS=0.67, day_low_in_OS=0.58; seq_intraday holds: high_holds=0.46, low_holds=0.52, hi_pct_pctile=0.81, lo_pct_pctile=0.38; daycycle: daycycle hi_hold_24h=0.54, lo_hold_24h=0.70, cycle_pair_24h=0.04, pair_hi_hold=0.54, pair_lo_hold=0.70, hi_pct_pctile=0.93, lo_pct_pctile=0.63; m7/max: m7_ret_sd=0.50, m7_time=0.00, max_ext_sd=0.00, max_ext_time=0.00, max_ret_sd=0.50, max_ret_time=0.00; THEN LONG via Frontrun at 2821.0, stop 2819.0, target 2833.25.",near range high; weekly rejection support,prior RR session; prior session closed up; prior session low printed early; prior session low rejected weekly cluster,confirm_long=0.71; seq_intraday_high_holds=0.46; seq_asia_high_holds=0.50; first_break_true=0.90; wddrb_model=UX(0.72),AR true=True break_dir= box=up; OR true=False break_dir= box=up; RR true=True break_dir= box=up,"seq_asia top: asia_high_holds=0.50, asia_low_holds=0.50; seq_intraday top: day_high_in_RS=0.67, day_low_in_OS=0.58; seq_intraday holds: high_holds=0.46, low_holds=0.52, hi_pct_pctile=0.81, lo_pct_pctile=0.38",daycycle hi_hold_24h=0.54; lo_hold_24h=0.70; cycle_pair_24h=0.04; pair_hi_hold=0.54; pair_lo_hold=0.70; hi_pct_pctile=0.93; lo_pct_pctile=0.63,m7_ret_sd=0.50; m7_time=0.00; max_ext_sd=0.00; max_ext_time=0.00; max_ret_sd=0.50; max_ret_time=0.00,AS high broken 07:55; low broken 02:35; first=low; OS high broken 09:35; first=high; AR high broken 20:50; low broken 02:50; first=high; OR high broken 06:10; low broken 04:05; first=low; RR high/low held
01/22/2018,,9:30,ES,No Conf,Long,RDR,Missed,W,2809.5,2808.25,2827.5,2827.5,2018-01-22 09:30:00-05:00,"IF prior TR session, prior session closed down, prior session high printed early, prior session low rejected weekly cluster AND near weekly cluster, near darkpool cluster, weekly rejection support; recent sessions: AR true=True break_dir= box=up, OR true=False break_dir= box=up, RR true=True break_dir= box=up; level breaks: AS high broken 07:55; low broken 02:35; first=low, OS high/low held, AR high broken 20:50; low broken 02:50; first=high, OR high broken 06:10; low broken 04:05; first=low, RR high broken 14:15; low broken 11:05; first=low; probs: confirm_long=0.52, seq_intraday_high_holds=0.45, seq_asia_high_holds=0.50, first_break_true=0.82, wddrb_model=UX(0.72); seq_asia top: asia_high_holds=0.50, asia_low_holds=0.50; seq_intraday top: day_high_in_RS=0.52, day_low_in_RS=0.52; seq_intraday holds: high_holds=0.45, low_holds=0.36, hi_pct_pctile=0.91, lo_pct_pctile=0.29; daycycle: daycycle hi_hold_24h=0.16, lo_hold_24h=0.21, cycle_pair_24h=0.03, pair_hi_hold=0.16, pair_lo_hold=0.21, hi_pct_pctile=0.94, lo_pct_pctile=0.83; m7/max: m7_ret_sd=0.50, m7_time=0.50, max_ext_sd=0.50, max_ext_time=0.50, max_ret_sd=0.50, max_ret_time=0.50; THEN LONG via Missed at 2809.5, stop 2808.25, target 2827.5.",near weekly cluster; near darkpool cluster; weekly rejection support,prior TR session; prior session closed down; prior session high printed early; prior session low rejected weekly cluster,confirm_long=0.52; seq_intraday_high_holds=0.45; seq_asia_high_holds=0.50; first_break_true=0.82; wddrb_model=UX(0.72),AR true=True break_dir= box=up; OR true=False break_dir= box=up; RR true=True break_dir= box=up,"seq_asia top: asia_high_holds=0.50, asia_low_holds=0.50; seq_intraday top: day_high_in_RS=0.52, day_low_in_RS=0.52; seq_intraday holds: high_holds=0.45, low_holds=0.36, hi_pct_pctile=0.91, lo_pct_pctile=0.29",daycycle hi_hold_24h=0.16; lo_hold_24h=0.21; cycle_pair_24h=0.03; pair_hi_hold=0.16; pair_lo_hold=0.21; hi_pct_pctile=0.94; lo_pct_pctile=0.83,m7_ret_sd=0.50; m7_time=0.50; max_ext_sd=0.50; max_ext_time=0.50; max_ret_sd=0.50; max_ret_time=0.50,AS high broken 07:55; low broken 02:35; first=low; OS high/low held; AR high broken 20:50; low broken 02:50; first=high; OR high broken 06:10; low broken 04:05; first=low; RR high broken 14:15; low broken 11:05; first=low
01/19/2018,11:05,11:55,ES,Wick,Short,RDR,Mode,EX,2802.25,2804.0,2791.75,2804.0,2018-01-19 11:55:00-05:00,"IF prior RR session, prior session closed up, prior session high printed early, prior session low rejected weekly cluster AND near weekly cluster, weekly rejection resistance, perfect rejection near entry; recent sessions: AR true=True break_dir= box=up, OR true=False break_dir= box=up, RR true=True break_dir= box=up; level breaks: AS high broken 04:00; first=high, OS high broken 09:25; low broken 08:30; first=low, AR high broken 20:30; low broken 21:35; first=high, OR high broken 04:00; first=high, RR low broken 11:05; first=low; probs: confirm_short=0.43, seq_intraday_low_holds=0.50, seq_asia_low_holds=0.50, first_break_true=0.61; seq_asia top: asia_high_holds=0.50, asia_low_holds=0.50; seq_intraday top: day_high_in_RS=0.67, day_low_in_RS=0.67; seq_intraday holds: high_holds=0.50, low_holds=0.50, hi_pct_pctile=0.75, lo_pct_pctile=0.55; daycycle: daycycle hi_hold_24h=0.69, lo_hold_24h=0.70, cycle_pair_24h=0.04, pair_hi_hold=0.69, pair_lo_hold=0.70, hi_pct_pctile=0.93, lo_pct_pctile=0.68; m7/max: m7_ret_sd=0.50, m7_time=0.52, max_ext_sd=0.00, max_ext_time=0.20, max_ret_sd=0.50, max_ret_time=0.24; THEN SHORT via Mode at 2802.25, stop 2804.0, target 2791.75.",near weekly cluster; weekly rejection resistance; perfect rejection near entry,prior RR session; prior session closed up; prior session high printed early; prior session low rejected weekly cluster,confirm_short=0.43; seq_intraday_low_holds=0.50; seq_asia_low_holds=0.50; first_break_true=0.61,AR true=True break_dir= box=up; OR true=False break_dir= box=up; RR true=True break_dir= box=up,"seq_asia top: asia_high_holds=0.50, asia_low_holds=0.50; seq_intraday top: day_high_in_RS=0.67, day_low_in_RS=0.67; seq_intraday holds: high_holds=0.50, low_holds=0.50, hi_pct_pctile=0.75, lo_pct_pctile=0.55",daycycle hi_hold_24h=0.69; lo_hold_24h=0.70; cycle_pair_24h=0.04; pair_hi_hold=0.69; pair_lo_hold=0.70; hi_pct_pctile=0.93; lo_pct_pctile=0.68,m7_ret_sd=0.50; m7_time=0.52; max_ext_sd=0.00; max_ext_time=0.20; max_ret_sd=0.50; max_ret_time=0.24,AS high broken 04:00; first=high; OS high broken 09:25; low broken 08:30; first=low; AR high broken 20:30; low broken 21:35; first=high; OR high broken 04:00; first=high; RR low broken 11:05; first=low
01/19/2018,,11:00,ES,No Conf,Short,RDR,Mode,BE,2803.25,2804.75,2791.75,2803.25,2018-01-19 11:00:00-05:00,"IF prior RR session, prior session closed up, prior session high printed early, prior session low rejected weekly cluster AND near weekly cluster, weekly rejection resistance, perfect rejection near entry; recent sessions: AR true=True break_dir= box=up, OR true=False break_dir= box=up, RR true=True break_dir= box=up; level breaks: AS high broken 04:00; first=high, OS high broken 09:25; low broken 08:30; first=low, AR high broken 20:30; low broken 21:35; first=high, OR high broken 04:00; first=high, RR high/low held; probs: confirm_short=0.43, seq_intraday_low_holds=0.50, seq_asia_low_holds=0.50, first_break_true=0.61; seq_asia top: asia_high_holds=0.50, asia_low_holds=0.50; seq_intraday top: day_high_in_RS=0.67, day_low_in_RS=0.67; seq_intraday holds: high_holds=0.50, low_holds=0.50, hi_pct_pctile=0.75, lo_pct_pctile=0.55; daycycle: daycycle hi_hold_24h=0.64, lo_hold_24h=0.66, cycle_pair_24h=0.04, pair_hi_hold=0.64, pair_lo_hold=0.66, hi_pct_pctile=0.93, lo_pct_pctile=0.69; m7/max: m7_ret_sd=0.50, m7_time=0.20, max_ext_sd=0.00, max_ext_time=0.05, max_ret_sd=0.50, max_ret_time=0.09; THEN SHORT via Mode at 2803.25, stop 2804.75, target 2791.75.",near weekly cluster; weekly rejection resistance; perfect rejection near entry,prior RR session; prior session closed up; prior session high printed early; prior session low rejected weekly cluster,confirm_short=0.43; seq_intraday_low_holds=0.50; seq_asia_low_holds=0.50; first_break_true=0.61,AR true=True break_dir= box=up; OR true=False break_dir= box=up; RR true=True break_dir= box=up,"seq_asia top: asia_high_holds=0.50, asia_low_holds=0.50; seq_intraday top: day_high_in_RS=0.67, day_low_in_RS=0.67; seq_intraday holds: high_holds=0.50, low_holds=0.50, hi_pct_pctile=0.75, lo_pct_pctile=0.55",daycycle hi_hold_24h=0.64; lo_hold_24h=0.66; cycle_pair_24h=0.04; pair_hi_hold=0.64; pair_lo_hold=0.66; hi_pct_pctile=0.93; lo_pct_pctile=0.69,m7_ret_sd=0.50; m7_time=0.20; max_ext_sd=0.00; max_ext_time=0.05; max_ret_sd=0.50; max_ret_time=0.09,AS high broken 04:00; first=high; OS high broken 09:25; low broken 08:30; first=low; AR high broken 20:30; low broken 21:35; first=high; OR high broken 04:00; first=high; RR high/low held
01/19/2018,,9:45,ES,No Conf,Short,RDR,Mode,BE,2807.0,2809.0,2791.75,2807.0,2018-01-19 09:45:00-05:00,"IF prior TR session, prior session closed up, prior session low printed early, prior session high rejected weekly cluster AND near weekly cluster, near darkpool cluster, weekly rejection resistance; recent sessions: AR true=True break_dir= box=up, OR true=False break_dir= box=up, RR true=True break_dir= box=down; level breaks: AS high broken 04:00; first=high, OS high broken 09:25; low broken 08:30; first=low, AR high broken 20:30; low broken 21:35; first=high, OR high broken 04:00; first=high, RR high broken 14:30; low broken 11:40; first=low; probs: confirm_short=0.35, seq_intraday_low_holds=0.45, seq_asia_low_holds=0.50, first_break_true=0.73; seq_asia top: asia_high_holds=0.50, asia_low_holds=0.50; seq_intraday top: day_low_in_RS=0.60, day_high_in_RS=0.56; seq_intraday holds: high_holds=0.47, low_holds=0.45, hi_pct_pctile=0.76, lo_pct_pctile=0.36; daycycle: daycycle hi_hold_24h=0.36, lo_hold_24h=0.46, cycle_pair_24h=0.03, pair_hi_hold=0.36, pair_lo_hold=0.46, hi_pct_pctile=0.87, lo_pct_pctile=0.83; m7/max: m7_ret_sd=0.50, m7_time=0.50, max_ext_sd=0.50, max_ext_time=0.50, max_ret_sd=0.50, max_ret_time=0.50; THEN SHORT via Mode at 2807.0, stop 2809.0, target 2791.75.",near weekly cluster; near darkpool cluster; weekly rejection resistance,prior TR session; prior session closed up; prior session low printed early; prior session high rejected weekly cluster,confirm_short=0.35; seq_intraday_low_holds=0.45; seq_asia_low_holds=0.50; first_break_true=0.73,AR true=True break_dir= box=up; OR true=False break_dir= box=up; RR true=True break_dir= box=down,"seq_asia top: asia_high_holds=0.50, asia_low_holds=0.50; seq_intraday top: day_low_in_RS=0.60, day_high_in_RS=0.56; seq_intraday holds: high_holds=0.47, low_holds=0.45, hi_pct_pctile=0.76, lo_pct_pctile=0.36",daycycle hi_hold_24h=0.36; lo_hold_24h=0.46; cycle_pair_24h=0.03; pair_hi_hold=0.36; pair_lo_hold=0.46; hi_pct_pctile=0.87; lo_pct_pctile=0.83,m7_ret_sd=0.50; m7_time=0.50; max_ext_sd=0.50; max_ext_time=0.50; max_ret_sd=0.50; max_ret_time=0.50,AS high broken 04:00; first=high; OS high broken 09:25; low broken 08:30; first=low; AR high broken 20:30; low broken 21:35; first=high; OR high broken 04:00; first=high; RR high broken 14:30; low broken 11:40; first=low
01/18/2018,,10:30,ES,No Conf,Short,RDR,Frontrun,EX,2799.75,2801.0,2791.5,2801.0,2018-01-18 10:30:00-05:00,"IF prior RR session, prior session closed down, prior session high printed early AND near weekly cluster, weekly rejection resistance; recent sessions: AR true=True break_dir= box=flat, OR true=False break_dir= box=down, RR true=True break_dir= box=down; level breaks: AS low broken 04:25; first=low, OS low broken 08:50; first=low, AR high broken 22:40; low broken 20:30; first=low, OR high broken 06:50; low broken 04:00; first=low, RR high/low held; probs: confirm_short=0.57, seq_intraday_low_holds=0.48, seq_asia_low_holds=0.50, first_break_true=0.63; seq_asia top: asia_high_holds=0.50, asia_low_holds=0.50; seq_intraday top: day_low_in_RS=0.62, day_high_in_OS=0.50; seq_intraday holds: high_holds=0.52, low_holds=0.48, hi_pct_pctile=0.07, lo_pct_pctile=0.87; daycycle: daycycle hi_hold_24h=0.71, lo_hold_24h=0.38, cycle_pair_24h=0.03, pair_hi_hold=0.71, pair_lo_hold=0.38, hi_pct_pctile=0.64, lo_pct_pctile=0.90; m7/max: m7_ret_sd=0.50, m7_time=0.00, max_ext_sd=0.00, max_ext_time=0.00, max_ret_sd=0.50, max_ret_time=0.00; THEN SHORT via Frontrun at 2799.75, stop 2801.0, target 2791.5.",near weekly cluster; weekly rejection resistance,prior RR session; prior session closed down; prior session high printed early,confirm_short=0.57; seq_intraday_low_holds=0.48; seq_asia_low_holds=0.50; first_break_true=0.63,AR true=True break_dir= box=flat; OR true=False break_dir= box=down; RR true=True break_dir= box=down,"seq_asia top: asia_high_holds=0.50, asia_low_holds=0.50; seq_intraday top: day_low_in_RS=0.62, day_high_in_OS=0.50; seq_intraday holds: high_holds=0.52, low_holds=0.48, hi_pct_pctile=0.07, lo_pct_pctile=0.87",daycycle hi_hold_24h=0.71; lo_hold_24h=0.38; cycle_pair_24h=0.03; pair_hi_hold=0.71; pair_lo_hold=0.38; hi_pct_pctile=0.64; lo_pct_pctile=0.90,m7_ret_sd=0.50; m7_time=0.00; max_ext_sd=0.00; max_ext_time=0.00; max_ret_sd=0.50; max_ret_time=0.00,AS low broken 04:25; first=low; OS low broken 08:50; first=low; AR high broken 22:40; low broken 20:30; first=low; OR high broken 06:50; low broken 04:00; first=low; RR high/low held
01/18/2018,,8:05,ES,No Conf,Short,ODR,Advanced,EX,2801.75,2803.25,2793.75,2803.25,2018-01-18 08:05:00-05:00,"IF prior OR session, prior session closed down, prior session high printed early AND near weekly cluster, weekly rejection resistance, perfect rejection near entry; recent sessions: AR true=True break_dir= box=flat, OR true=False break_dir= box=down, RR true=True break_dir= box=down; level breaks: AS low broken 04:25; first=low, OS high broken 08:45; low broken 09:30; first=high, AR high broken 22:40; low broken 20:30; first=low, OR high broken 06:50; low broken 04:00; first=low, RR high broken 11:05; first=high; probs: confirm_short=0.65, seq_intraday_low_holds=0.42, seq_asia_low_holds=1.00, first_break_true=0.89; seq_asia top: asia_high_holds=1.00, asia_low_holds=1.00; seq_intraday top: day_high_in_RS=0.54, day_low_in_OS=0.40; seq_intraday holds: high_holds=0.18, low_holds=0.42, hi_pct_pctile=0.05, lo_pct_pctile=0.89; daycycle: daycycle hi_hold_24h=0.98, lo_hold_24h=0.98, cycle_pair_24h=0.09, pair_hi_hold=0.98, pair_lo_hold=0.98, hi_pct_pctile=0.64, lo_pct_pctile=0.39; m7/max: m7_ret_sd=0.00, m7_time=0.00, max_ext_sd=0.00, max_ext_time=0.00, max_ret_sd=0.26, max_ret_time=0.00; THEN SHORT via Advanced at 2801.75, stop 2803.25, target 2793.75.",near weekly cluster; weekly rejection resistance; perfect rejection near entry,prior OR session; prior session closed down; prior session high printed early,confirm_short=0.65; seq_intraday_low_holds=0.42; seq_asia_low_holds=1.00; first_break_true=0.89,AR true=True break_dir= box=flat; OR true=False break_dir= box=down; RR true=True break_dir= box=down,"seq_asia top: asia_high_holds=1.00, asia_low_holds=1.00; seq_intraday top: day_high_in_RS=0.54, day_low_in_OS=0.40; seq_intraday holds: high_holds=0.18, low_holds=0.42, hi_pct_pctile=0.05, lo_pct_pctile=0.89",daycycle hi_hold_24h=0.98; lo_hold_24h=0.98; cycle_pair_24h=0.09; pair_hi_hold=0.98; pair_lo_hold=0.98; hi_pct_pctile=0.64; lo_pct_pctile=0.39,m7_ret_sd=0.00; m7_time=0.00; max_ext_sd=0.00; max_ext_time=0.00; max_ret_sd=0.26; max_ret_time=0.00,AS low broken 04:25; first=low; OS high broken 08:45; low broken 09:30; first=high; AR high broken 22:40; low broken 20:30; first=low; OR high broken 06:50; low broken 04:00; first=low; RR high broken 11:05; first=high
01/17/2018,,9:45,ES,No Conf,Long,RDR,Advanced,EX,2783.75,2781.75,2794.25,2781.75,2018-01-17 09:45:00-05:00,"IF prior TR session, prior session closed down AND perfect rejection near entry; recent sessions: AR true=True break_dir= box=up, OR true=False break_dir= box=up, RR true=True break_dir= box=up; level breaks: AS high broken 03:05; low broken 09:45; first=high, OS high broken 08:45; low broken 09:30; first=high, AR high broken 20:30; low broken 09:45; first=high, OR high broken 05:00; low broken 09:40; first=high, RR low broken 10:35; first=low; probs: confirm_long=0.50, seq_intraday_high_holds=0.33, seq_asia_high_holds=0.50, first_break_true=0.85; seq_asia top: asia_high_holds=0.50, asia_low_holds=0.50; seq_intraday top: day_low_in_RS=0.74, day_high_in_RS=0.56; seq_intraday holds: high_holds=0.33, low_holds=0.60, hi_pct_pctile=0.97, lo_pct_pctile=0.93; daycycle: daycycle hi_hold_24h=0.27, lo_hold_24h=0.45, cycle_pair_24h=0.02, pair_hi_hold=0.27, pair_lo_hold=0.45, hi_pct_pctile=0.85, lo_pct_pctile=0.76; m7/max: m7_ret_sd=0.50, m7_time=0.50, max_ext_sd=0.50, max_ext_time=0.50, max_ret_sd=0.50, max_ret_time=0.50; THEN LONG via Advanced at 2783.75, stop 2781.75, target 2794.25.",perfect rejection near entry,prior TR session; prior session closed down,confirm_long=0.50; seq_intraday_high_holds=0.33; seq_asia_high_holds=0.50; first_break_true=0.85,AR true=True break_dir= box=up; OR true=False break_dir= box=up; RR true=True break_dir= box=up,"seq_asia top: asia_high_holds=0.50, asia_low_holds=0.50; seq_intraday top: day_low_in_RS=0.74, day_high_in_RS=0.56; seq_intraday holds: high_holds=0.33, low_holds=0.60, hi_pct_pctile=0.97, lo_pct_pctile=0.93",daycycle hi_hold_24h=0.27; lo_hold_24h=0.45; cycle_pair_24h=0.02; pair_hi_hold=0.27; pair_lo_hold=0.45; hi_pct_pctile=0.85; lo_pct_pctile=0.76,m7_ret_sd=0.50; m7_time=0.50; max_ext_sd=0.50; max_ext_time=0.50; max_ret_sd=0.50; max_ret_time=0.50,AS high broken 03:05; low broken 09:45; first=high; OS high broken 08:45; low broken 09:30; first=high; AR high broken 20:30; low broken 09:45; first=high; OR high broken 05:00; low broken 09:40; first=high; RR low broken 10:35; first=low
01/17/2018,,9:45,ES,No Conf,Long,RDR,Advanced,EX,2783.0,2780.75,2794.25,2780.75,2018-01-17 09:45:00-05:00,"IF prior TR session, prior session closed down AND perfect rejection near entry; recent sessions: AR true=True break_dir= box=up, OR true=False break_dir= box=up, RR true=True break_dir= box=up; level breaks: AS high broken 03:05; low broken 09:45; first=high, OS high broken 08:45; low broken 09:30; first=high, AR high broken 20:30; low broken 09:45; first=high, OR high broken 05:00; low broken 09:40; first=high, RR low broken 10:35; first=low; probs: confirm_long=0.50, seq_intraday_high_holds=0.33, seq_asia_high_holds=0.50, first_break_true=0.85; seq_asia top: asia_high_holds=0.50, asia_low_holds=0.50; seq_intraday top: day_low_in_RS=0.74, day_high_in_RS=0.56; seq_intraday holds: high_holds=0.33, low_holds=0.60, hi_pct_pctile=0.97, lo_pct_pctile=0.93; daycycle: daycycle hi_hold_24h=0.27, lo_hold_24h=0.45, cycle_pair_24h=0.02, pair_hi_hold=0.27, pair_lo_hold=0.45, hi_pct_pctile=0.85, lo_pct_pctile=0.76; m7/max: m7_ret_sd=0.50, m7_time=0.50, max_ext_sd=0.50, max_ext_time=0.50, max_ret_sd=0.50, max_ret_time=0.50; THEN LONG via Advanced at 2783.0, stop 2780.75, target 2794.25.",perfect rejection near entry,prior TR session; prior session closed down,confirm_long=0.50; seq_intraday_high_holds=0.33; seq_asia_high_holds=0.50; first_break_true=0.85,AR true=True break_dir= box=up; OR true=False break_dir= box=up; RR true=True break_dir= box=up,"seq_asia top: asia_high_holds=0.50, asia_low_holds=0.50; seq_intraday top: day_low_in_RS=0.74, day_high_in_RS=0.56; seq_intraday holds: high_holds=0.33, low_holds=0.60, hi_pct_pctile=0.97, lo_pct_pctile=0.93",daycycle hi_hold_24h=0.27; lo_hold_24h=0.45; cycle_pair_24h=0.02; pair_hi_hold=0.27; pair_lo_hold=0.45; hi_pct_pctile=0.85; lo_pct_pctile=0.76,m7_ret_sd=0.50; m7_time=0.50; max_ext_sd=0.50; max_ext_time=0.50; max_ret_sd=0.50; max_ret_time=0.50,AS high broken 03:05; low broken 09:45; first=high; OS high broken 08:45; low broken 09:30; first=high; AR high broken 20:30; low broken 09:45; first=high; OR high broken 05:00; low broken 09:40; first=high; RR low broken 10:35; first=low
01/12/2018,10:35,11:15,ES,Confirmed,Long,RDR,Mode,W,2779.25,2778.0,2787.75,2787.75,2018-01-12 11:15:00-05:00,"IF prior RR session, prior session closed up, prior session low printed early AND near range high, near range high, perfect rejection near entry; recent sessions: AR true=True break_dir= box=down, OR true=False break_dir= box=up, RR true=True break_dir= box=up; level breaks: AS high broken 02:15; low broken 08:35; first=high, OS high broken 09:45; low broken 08:30; first=low, AR high broken 20:30; low broken 08:35; first=high, OR high broken 04:10; low broken 08:35; first=high, RR high broken 10:30; first=high; probs: confirm_long=0.80, seq_intraday_high_holds=0.43, seq_asia_high_holds=0.50, first_break_true=0.78; seq_asia top: asia_high_holds=0.50, asia_low_holds=0.50; seq_intraday top: day_high_in_RS=1.00, day_low_in_TR=0.56; seq_intraday holds: high_holds=0.43, low_holds=0.55, hi_pct_pctile=0.20, lo_pct_pctile=0.47; daycycle: daycycle hi_hold_24h=0.31, lo_hold_24h=0.85, cycle_pair_24h=0.03, pair_hi_hold=0.31, pair_lo_hold=0.85, hi_pct_pctile=0.78, lo_pct_pctile=0.59; m7/max: m7_ret_sd=0.57, m7_time=0.63, max_ext_sd=0.51, max_ext_time=0.11, max_ret_sd=0.71, max_ret_time=0.34; THEN LONG via Mode at 2779.25, stop 2778.0, target 2787.75.",near range high; near range high; perfect rejection near entry,prior RR session; prior session closed up; prior session low printed early,confirm_long=0.80; seq_intraday_high_holds=0.43; seq_asia_high_holds=0.50; first_break_true=0.78,AR true=True break_dir= box=down; OR true=False break_dir= box=up; RR true=True break_dir= box=up,"seq_asia top: asia_high_holds=0.50, asia_low_holds=0.50; seq_intraday top: day_high_in_RS=1.00, day_low_in_TR=0.56; seq_intraday holds: high_holds=0.43, low_holds=0.55, hi_pct_pctile=0.20, lo_pct_pctile=0.47",daycycle hi_hold_24h=0.31; lo_hold_24h=0.85; cycle_pair_24h=0.03; pair_hi_hold=0.31; pair_lo_hold=0.85; hi_pct_pctile=0.78; lo_pct_pctile=0.59,m7_ret_sd=0.57; m7_time=0.63; max_ext_sd=0.51; max_ext_time=0.11; max_ret_sd=0.71; max_ret_time=0.34,AS high broken 02:15; low broken 08:35; first=high; OS high broken 09:45; low broken 08:30; first=low; AR high broken 20:30; low broken 08:35; first=high; OR high broken 04:10; low broken 08:35; first=high; RR high broken 10:30; first=high
01/12/2018,,10:30,ES,No Conf,Long,RDR,Advanced,W,2778.75,2777.5,2784.75,2784.75,2018-01-12 10:30:00-05:00,"IF prior RR session, prior session closed up, prior session low printed early AND near range high, near range high, perfect rejection near entry; recent sessions: AR true=True break_dir= box=down, OR true=False break_dir= box=up, RR true=True break_dir= box=up; level breaks: AS high broken 02:15; low broken 08:35; first=high, OS high broken 09:45; low broken 08:30; first=low, AR high broken 20:30; low broken 08:35; first=high, OR high broken 04:10; low broken 08:35; first=high, RR high broken 10:30; first=high; probs: confirm_long=0.60, seq_intraday_high_holds=0.43, seq_asia_high_holds=0.50, first_break_true=0.78; seq_asia top: asia_high_holds=0.50, asia_low_holds=0.50; seq_intraday top: day_high_in_RS=1.00, day_low_in_TR=0.56; seq_intraday holds: high_holds=0.43, low_holds=0.53, hi_pct_pctile=0.20, lo_pct_pctile=0.47; daycycle: daycycle hi_hold_24h=0.30, lo_hold_24h=0.78, cycle_pair_24h=0.03, pair_hi_hold=0.30, pair_lo_hold=0.78, hi_pct_pctile=0.92, lo_pct_pctile=0.59; m7/max: m7_ret_sd=0.50, m7_time=0.00, max_ext_sd=0.00, max_ext_time=0.00, max_ret_sd=0.50, max_ret_time=0.00; THEN LONG via Advanced at 2778.75, stop 2777.5, target 2784.75.",near range high; near range high; perfect rejection near entry,prior RR session; prior session closed up; prior session low printed early,confirm_long=0.60; seq_intraday_high_holds=0.43; seq_asia_high_holds=0.50; first_break_true=0.78,AR true=True break_dir= box=down; OR true=False break_dir= box=up; RR true=True break_dir= box=up,"seq_asia top: asia_high_holds=0.50, asia_low_holds=0.50; seq_intraday top: day_high_in_RS=1.00, day_low_in_TR=0.56; seq_intraday holds: high_holds=0.43, low_holds=0.53, hi_pct_pctile=0.20, lo_pct_pctile=0.47",daycycle hi_hold_24h=0.30; lo_hold_24h=0.78; cycle_pair_24h=0.03; pair_hi_hold=0.30; pair_lo_hold=0.78; hi_pct_pctile=0.92; lo_pct_pctile=0.59,m7_ret_sd=0.50; m7_time=0.00; max_ext_sd=0.00; max_ext_time=0.00; max_ret_sd=0.50; max_ret_time=0.00,AS high broken 02:15; low broken 08:35; first=high; OS high broken 09:45; low broken 08:30; first=low; AR high broken 20:30; low broken 08:35; first=high; OR high broken 04:10; low broken 08:35; first=high; RR high broken 10:30; first=high
01/11/2018,,10:40,ES,No Conf,Long,RDR,Frontrun,W,2754.5,2753.25,2766.75,2766.75,2018-01-11 10:40:00-05:00,"IF prior RR session, prior session closed up, prior session low printed early, prior session low rejected weekly cluster AND near weekly cluster, weekly rejection support; recent sessions: AR true=True break_dir= box=up, OR true=False break_dir= box=down, RR true=True break_dir= box=up; level breaks: AS high broken 02:40; first=high, OS high broken 09:50; first=high, AR high broken 03:05; low broken 21:05; first=low, OR high broken 04:00; low broken 04:10; first=high, RR high/low held; probs: confirm_long=0.52, seq_intraday_high_holds=0.50, seq_asia_high_holds=0.50, first_break_true=0.63; seq_asia top: asia_high_holds=0.50, asia_low_holds=0.50; seq_intraday top: day_high_in_RS=0.70, day_low_in_RS=0.70; seq_intraday holds: high_holds=0.50, low_holds=0.46, hi_pct_pctile=1.00, lo_pct_pctile=0.77; daycycle: daycycle hi_hold_24h=0.52, lo_hold_24h=0.78, cycle_pair_24h=0.03, pair_hi_hold=0.52, pair_lo_hold=0.78, hi_pct_pctile=0.91, lo_pct_pctile=0.67; m7/max: m7_ret_sd=0.50, m7_time=0.05, max_ext_sd=0.00, max_ext_time=0.01, max_ret_sd=0.50, max_ret_time=0.01; THEN LONG via Frontrun at 2754.5, stop 2753.25, target 2766.75.",near weekly cluster; weekly rejection support,prior RR session; prior session closed up; prior session low printed early; prior session low rejected weekly cluster,confirm_long=0.52; seq_intraday_high_holds=0.50; seq_asia_high_holds=0.50; first_break_true=0.63,AR true=True break_dir= box=up; OR true=False break_dir= box=down; RR true=True break_dir= box=up,"seq_asia top: asia_high_holds=0.50, asia_low_holds=0.50; seq_intraday top: day_high_in_RS=0.70, day_low_in_RS=0.70; seq_intraday holds: high_holds=0.50, low_holds=0.46, hi_pct_pctile=1.00, lo_pct_pctile=0.77",daycycle hi_hold_24h=0.52; lo_hold_24h=0.78; cycle_pair_24h=0.03; pair_hi_hold=0.52; pair_lo_hold=0.78; hi_pct_pctile=0.91; lo_pct_pctile=0.67,m7_ret_sd=0.50; m7_time=0.05; max_ext_sd=0.00; max_ext_time=0.01; max_ret_sd=0.50; max_ret_time=0.01,AS high broken 02:40; first=high; OS high broken 09:50; first=high; AR high broken 03:05; low broken 21:05; first=low; OR high broken 04:00; low broken 04:10; first=high; RR high/low held
