Date,conf,entry,instrument,conf type,exit time,Unnamed: 6,stopped out,Unnamed: 8,Unnamed: 9,entry.1,stop ,take profit,exit,source,date,entry_time,stop,target,direction,entry_method,conf_type,conf_time,status,entry_ts,entry_date,Conf Time,Entry Time,Instrument,Conf Type,Direction,Session,Entry Method,Status,Entry,Stop,Target,Exit,session_label,Entry Price,Stop Price,Target Price,Exit Price,ts_x,bar_session,bar_session_start,high,low,range_session,session_x,range_session_start,mins_from_range_start,session_y,breakout_ts,ts_y,session,range_p_confirm_long,range_p_confirm_short,range_p_false_session,range_p_m7_ret_sd,range_p_m7_time,range_p_max_ext_sd,range_p_max_ret_sd,first_range_candle_p_session_box_dir_up,first_range_candle_p_session_box_dir_down,first_range_candle_p_first_break_true_range_only,seq_intraday_p_high_holds,seq_intraday_p_low_holds,seq_intraday_hi_pct_percentile,seq_intraday_lo_pct_percentile,seq_asia_p_high_holds,seq_asia_p_low_holds,seq_asia_hi_pct_percentile,seq_asia_lo_pct_percentile,seq_daycycle_p_hi_hold_24h,seq_daycycle_p_lo_hold_24h,modeldb_p_box_up,modeldb_p_box_down,range_p_confirm_dir,seq_intraday_p_hold_dir,seq_asia_p_hold_dir,entry_cluster,target_cluster,stop_cluster,rej_30m_count,rej_30m_perfect,rej_6h_support,rej_6h_resist,rej_24h_support,rej_24h_resist,rej_move_away,rej_retest_count,rej_quality,rej_6h_bias,rej_24h_bias,rej_30m_perfect_any,frontrun_class,risk_pts,target_r_multiple,realized_r_multiple,is_win
2011-01-02,0:00,1256.25,ES,Confirmation,22:30,,No,,,1256.25,1255.5,1261.0,1261.0,2011-2016,2011-01-02,19:35,1255.5,1261.0,Long,Confirmation,Confirmation,0:00,No,2011-01-02 19:35:00-05:00,2011-01-02,,,,,,,,,,,,,,,,,,2011-01-02 19:35:00-05:00,AR,2011-01-02 19:30:00-05:00,1256.5,1256.25,AR,AR,2011-01-02 19:30:00-05:00,5.0,AR,2011-01-02 20:25:00-05:00,2011-01-02 19:35:00-05:00,AR,0.52,0.48,0.5,0.5,0.5,0.5,0.5,0.3971,0.5037,0.7227,0.5,0.5,,,0.5,0.5,,,0.902,0.921,1.0,0.0,0.52,0.5,0.5,1.0,0.0,1.0,0.0,0.0,0.0,0.0,0.0,0.0,1.25,6.0,dirty,0.0,0.0,False,m7_first_two,0.75,6.333333333333333,6.333333333333333,True
2011-01-03,0:00,1260.0,ES,Confirmation,11:35,,No,,,1260.0,1258.75,1271.5,1271.5,2011-2016,2011-01-03,7:15,1258.75,1271.5,Long,Confirmation,Confirmation,0:00,No,2011-01-03 07:15:00-05:00,2011-01-03,,,,,,,,,,,,,,,,,,2011-01-03 07:15:00-05:00,OS,2011-01-03 04:00:00-05:00,1260.25,1260.0,OS,OS,2011-01-03 04:00:00-05:00,195.0,OS,2011-01-03 07:30:00-05:00,2011-01-03 07:15:00-05:00,OS,0.78,0.22,0.16,0.5,0.0,0.0,0.5,0.7972,0.1748,0.8321,0.3061224489795918,0.2244897959183673,,,0.9782608695652174,0.981132075471698,0.391,0.438,0.983,0.983,1.0,0.0,0.78,0.3061224489795918,0.9782608695652174,0.0,0.0,0.0,2.0,2.0,14.0,18.0,22.0,22.0,4.25,3.0,dirty,-4.0,0.0,True,frontrun,1.25,9.2,9.2,True
2011-01-03,0:00,1266.75,ES,Confirmation,4:35,,Yes,,,1266.75,1267.75,1261.0,1267.75,2011-2016,2011-01-03,21:50,1267.75,1261.0,Short,Confirmation,Confirmation,0:00,Yes,2011-01-03 21:50:00-05:00,2011-01-03,,,,,,,,,,,,,,,,,,2011-01-03 21:50:00-05:00,AS,2011-01-03 20:30:00-05:00,1267.0,1266.5,AS,AS,2011-01-02 20:30:00-05:00,1520.0,AS,2011-01-03 00:00:00-05:00,2011-01-03 21:50:00-05:00,AS,0.72,0.28,0.26,0.39,0.78,0.39,0.89,0.6575,0.2329,0.7391,0.5,0.5,,,0.9833333333333332,0.981132075471698,,,0.926,0.963,1.0,0.0,0.28,0.5,0.981132075471698,0.0,0.0,0.0,12.0,12.0,14.0,27.0,14.0,27.0,0.5,6.0,dirty,-13.0,-13.0,True,post_breakout,1.0,5.75,-1.0,False
2011-01-04,0:00,1268.25,ES,Confirmation,12:25,,No,,,1268.25,1270.25,1260.0,1260.0,2011-2016,2011-01-04,9:35,1270.25,1260.0,Short,Confirmation,Confirmation,0:00,No,2011-01-04 09:35:00-05:00,2011-01-04,,,,,,,,,,,,,,,,,,2011-01-04 09:35:00-05:00,RR,2011-01-04 09:30:00-05:00,1269.0,1267.75,RR,RR,2011-01-04 09:30:00-05:00,5.0,RR,2011-01-04 10:25:00-05:00,2011-01-04 09:35:00-05:00,RR,0.5,0.5,0.5,0.5,0.5,0.5,0.5,0.5263,0.4561,0.7368,0.1818181818181818,0.6285714285714286,,,0.5,0.5,0.69,0.966,0.253,0.386,0.0,1.0,0.5,0.6285714285714286,0.5,1.0,0.0,1.0,16.0,8.0,38.0,47.0,38.0,47.0,4.0,1.0,clean,-9.0,-9.0,True,m7_first_two,2.0,4.125,4.125,True
2011-01-04,0:00,1264.75,ES,Confirmation,3:40,,No,,,1264.75,1265.25,1258.25,1258.25,2011-2016,2011-01-04,19:45,1265.25,1258.25,Short,Confirmation,Confirmation,0:00,No,2011-01-04 19:45:00-05:00,2011-01-04,,,,,,,,,,,,,,,,,,2011-01-04 19:45:00-05:00,AR,2011-01-04 19:30:00-05:00,1265.0,1264.5,AR,AR,2011-01-04 19:30:00-05:00,15.0,AR,2011-01-04 20:25:00-05:00,2011-01-04 19:45:00-05:00,AR,0.58,0.42,0.5,0.5,0.5,0.5,0.5,0.465,0.4568,0.7186,0.5,0.5,,,0.5,0.5,0.667,0.667,0.921,0.895,0.0,0.0,0.42,0.5,0.5,1.0,1.0,1.0,0.0,0.0,36.0,54.0,143.0,133.0,0.5,6.0,dirty,-18.0,10.0,False,frontrun,0.5,13.0,13.0,True
2011-01-05,0:00,1264.25,ES,Confirmation,11:25,,No,,,1264.25,1263.25,1270.0,1270.0,2011-2016,2011-01-05,10:35,1263.25,1270.0,Long,Confirmation,Confirmation,0:00,No,2011-01-05 10:35:00-05:00,2011-01-05,,,,,,,,,,,,,,,,,,2011-01-05 10:35:00-05:00,RS,2011-01-05 10:30:00-05:00,1265.0,1264.0,RS,RS,2011-01-05 10:30:00-05:00,5.0,RS,2011-01-05 10:50:00-05:00,2011-01-05 10:35:00-05:00,RS,0.89,0.11,0.3,0.5,0.0,0.0,0.5,0.8362,0.1638,0.8276,0.265625,0.7109375,,,0.5,0.5,0.606,0.152,0.62,0.58,1.0,0.0,0.89,0.265625,0.5,1.0,1.0,1.0,52.0,26.0,52.0,48.0,110.0,121.0,3.25,3.0,dirty,4.0,-11.0,True,m7_first_two,1.0,5.75,5.75,True
2011-01-06,0:00,1271.25,ES,Confirmation,7:30,,No,,,1271.25,1270.25,1276.75,1271.25,2011-2016,2011-01-06,3:00,1270.25,1276.75,Long,Confirmation,Confirmation,0:00,No,2011-01-06 03:00:00-05:00,2011-01-06,,,,,,,,,,,,,,,,,,2011-01-06 03:00:00-05:00,OR,2011-01-06 03:00:00-05:00,1272.0,1271.0,OR,OR,2011-01-06 03:00:00-05:00,0.0,,,2011-01-06 03:00:00-05:00,OR,0.52,0.48,0.5,0.5,0.5,0.5,0.5,0.3077,0.5385,0.8182,0.5,0.5,,,0.95125,0.9906542056074766,0.024,1.0,0.981,0.981,1.0,0.0,0.52,0.5,0.95125,1.0,0.0,1.0,33.0,27.0,138.0,122.0,153.0,124.0,2.25,4.0,dirty,16.0,29.0,True,m7_first_two,1.0,5.5,0.0,False
2011-01-06,0:00,1274.25,ES,Confirmation,11:05,,No,,,1274.25,1275.25,1267.75,1274.25,2011-2016,2011-01-06,10:40,1275.25,1267.75,Short,Confirmation,Confirmation,0:00,No,2011-01-06 10:40:00-05:00,2011-01-06,,,,,,,,,,,,,,,,,,2011-01-06 10:40:00-05:00,RS,2011-01-06 10:30:00-05:00,1274.5,1273.25,RS,RS,2011-01-06 10:30:00-05:00,10.0,RS,2011-01-06 10:35:00-05:00,2011-01-06 10:40:00-05:00,RS,0.72,0.28,0.29,0.58,0.0,0.18,0.87,0.2308,0.7692,0.7692,0.4444444444444444,0.5111111111111111,,,0.5,0.5,0.523,0.923,0.556,0.741,1.0,0.0,0.28,0.5111111111111111,0.5,1.0,1.0,0.0,3.0,2.0,17.0,13.0,17.0,16.0,8.0,1.0,clean,4.0,1.0,True,post_breakout,1.0,6.5,-0.0,False
2011-01-07,0:00,1270.25,ES,Confirmation,6:50,,BE,,,1270.25,1271.5,1264.25,1270.25,2011-2016,2011-01-07,3:05,1271.5,1264.25,Short,Confirmation,Confirmation,0:00,BE,2011-01-07 03:05:00-05:00,2011-01-07,,,,,,,,,,,,,,,,,,2011-01-07 03:05:00-05:00,OR,2011-01-07 03:00:00-05:00,1271.0,1270.25,OR,OR,2011-01-07 03:00:00-05:00,5.0,,,2011-01-07 03:05:00-05:00,OR,0.5,0.5,0.5,0.5,0.5,0.5,0.5,0.7852,0.2074,0.8125,0.5,0.5,,,0.9910714285714286,0.9906542056074766,0.569,0.969,0.963,0.963,1.0,0.0,0.5,0.5,0.9906542056074766,1.0,1.0,1.0,35.0,26.0,116.0,164.0,163.0,237.0,3.5,3.0,dirty,-48.0,-74.0,True,m7_first_two,1.25,4.8,-0.0,False
2011-01-07,0:00,1272.25,ES,Confirmation,11:20,,No,,,1272.25,1273.5,1264.5,1272.25,2011-2016,2011-01-07,10:35,1273.5,1264.5,Short,Confirmation,Confirmation,0:00,No,2011-01-07 10:35:00-05:00,2011-01-07,,,,,,,,,,,,,,,,,,2011-01-07 10:35:00-05:00,RS,2011-01-07 10:30:00-05:00,1272.5,1271.0,RS,RS,2011-01-07 10:30:00-05:00,5.0,RS,2011-01-07 10:50:00-05:00,2011-01-07 10:35:00-05:00,RS,0.86,0.14,0.17,0.5,0.0,0.0,0.5,0.7368,0.2632,0.4211,0.4429347826086957,0.4201086956521739,,,0.5,0.5,0.462,0.538,0.645,0.553,0.0,1.0,0.14,0.4201086956521739,0.5,1.0,1.0,1.0,20.0,11.0,20.0,46.0,27.0,78.0,7.0,1.0,clean,-26.0,-51.0,True,m7_first_two,1.25,6.2,-0.0,False
2011-01-10,0:00,1263.5,ES,Confirmation,8:25,,No,,,1263.5,1264.75,1257.75,1262.25,2011-2016,2011-01-10,3:15,1264.75,1257.75,Short,Confirmation,Confirmation,0:00,No,2011-01-10 03:15:00-05:00,2011-01-10,,,,,,,,,,,,,,,,,,2011-01-10 03:15:00-05:00,OR,2011-01-10 03:00:00-05:00,1264.0,1263.25,OR,OR,2011-01-10 03:00:00-05:00,15.0,,,2011-01-10 03:15:00-05:00,OR,0.57,0.43,0.5,0.5,0.5,0.5,0.5,0.5,0.4556,0.6932,0.5,0.5,0.863,0.438,0.9836065573770492,0.9908256880733946,0.917,0.833,0.996,0.996,0.0,0.0,0.43,0.5,0.9908256880733946,1.0,0.0,1.0,14.0,10.0,9.0,17.0,11.0,17.0,3.5,3.0,dirty,-8.0,-6.0,True,no_breakout,1.25,4.6,1.0,True
2011-01-10,0:00,1260.75,ES,Confirmation,9:55,,Yes,,,1260.75,1258.75,1274.0,1258.75,2011-2016,2011-01-10,9:30,1258.75,1274.0,Long,Confirmation,Confirmation,0:00,Yes,2011-01-10 09:30:00-05:00,2011-01-10,,,,,,,,,,,,,,,,,,2011-01-10 09:30:00-05:00,RR,2011-01-10 09:30:00-05:00,1263.25,1260.0,RR,RR,2011-01-10 09:30:00-05:00,0.0,RR,2011-01-10 10:25:00-05:00,2011-01-10 09:30:00-05:00,RR,0.52,0.48,0.5,0.5,0.5,0.5,0.5,0.4,0.6,1.0,0.3505,0.5345,0.6,0.4,0.5,0.5,0.829,0.805,0.214,0.199,0.0,1.0,0.52,0.3505,0.5,0.0,1.0,0.0,2.0,2.0,19.0,16.0,19.0,16.0,3.5,5.0,dirty,3.0,3.0,True,m7_first_two,2.0,6.625,-1.0,False
2011-01-10,0:00,1264.25,ES,Confirmation,7:05,,No,,,1264.25,1263.25,1272.0,1272.0,2011-2016,2011-01-10,20:40,1263.25,1272.0,Long,Confirmation,Confirmation,0:00,No,2011-01-10 20:40:00-05:00,2011-01-10,,,,,,,,,,,,,,,,,,2011-01-10 20:40:00-05:00,AS,2011-01-10 20:30:00-05:00,1264.75,1264.25,AS,AS,2011-01-09 20:30:00-05:00,1450.0,AS,2011-01-10 00:00:00-05:00,2011-01-10 20:40:00-05:00,AS,0.5,0.5,0.26,0.5,0.04,0.0,0.5,0.2583,0.6424,0.7676,0.5,0.5,,,0.9973474801061007,0.9947368421052633,0.911,1.0,0.889,0.963,0.0,1.0,0.5,0.5,0.9973474801061007,1.0,1.0,1.0,20.0,13.0,28.0,9.0,149.0,143.0,3.0,3.0,dirty,19.0,6.0,True,post_breakout,1.0,7.75,7.75,True
2011-01-11,0:00,1266.0,ES,Confirmation,7:05,,No,,,1266.0,1265.0,1272.0,1272.0,2011-2016,2011-01-11,5:05,1265.0,1272.0,Long,Confirmation,Confirmation,0:00,No,2011-01-11 05:05:00-05:00,2011-01-11,,,,,,,,,,,,,,,,,,2011-01-11 05:05:00-05:00,OS,2011-01-11 04:00:00-05:00,1266.75,1265.5,OS,OS,2011-01-11 04:00:00-05:00,65.0,OS,2011-01-11 04:30:00-05:00,2011-01-11 05:05:00-05:00,OS,0.29,0.71,0.31,0.75,0.0,0.62,0.96,0.7972,0.1748,0.8321,0.2539682539682539,0.0952380952380952,0.762,0.667,0.9787234042553192,0.8391129032258065,1.0,0.857,0.929,0.929,1.0,0.0,0.29,0.2539682539682539,0.9787234042553192,1.0,1.0,1.0,30.0,18.0,79.0,35.0,225.0,221.0,2.0,6.0,dirty,44.0,4.0,True,post_breakout,1.0,6.0,6.0,True
2011-01-12,0:00,1279.0,ES,Confirmation,11:15,,No,,,1279.0,1278.0,1282.75,1282.75,2011-2016,2011-01-12,10:40,1278.0,1282.75,Long,Confirmation,Confirmation,0:00,No,2011-01-12 10:40:00-05:00,2011-01-12,,,,,,,,,,,,,,,,,,2011-01-12 10:40:00-05:00,RS,2011-01-12 10:30:00-05:00,1279.75,1278.5,RS,RS,2011-01-12 10:30:00-05:00,10.0,RS,2011-01-12 10:55:00-05:00,2011-01-12 10:40:00-05:00,RS,0.67,0.33,0.25,0.5,0.06,0.0,0.5,0.5556,0.4444,0.4074,0.4902777777777777,0.4708333333333333,0.016,0.429,0.5,0.5,0.222,0.714,0.354,0.788,1.0,0.0,0.67,0.4902777777777777,0.5,0.0,0.0,0.0,0.0,0.0,0.0,0.0,0.0,0.0,3.75,4.0,dirty,0.0,0.0,False,frontrun,1.0,3.75,3.75,True
2011-01-12,0:00,1282.0,ES,Confirmation,21:55,,Yes,,,1282.0,1281.25,1286.5,1281.25,2011-2016,2011-01-12,21:25,1281.25,1286.5,Long,Confirmation,Confirmation,0:00,Yes,2011-01-12 21:25:00-05:00,2011-01-12,,,,,,,,,,,,,,,,,,2011-01-12 21:25:00-05:00,AS,2011-01-12 20:30:00-05:00,1282.5,1282.0,AS,AS,2011-01-11 20:30:00-05:00,1495.0,AS,2011-01-12 00:00:00-05:00,2011-01-12 21:25:00-05:00,AS,0.26,0.74,0.28,0.3,0.61,0.17,0.83,0.2583,0.6424,0.7676,0.5,0.5,,,0.9888888888888888,0.7645,1.0,0.794,0.703,0.973,0.0,1.0,0.26,0.5,0.9888888888888888,0.0,0.0,0.0,25.0,25.0,13.0,41.0,13.0,41.0,0.75,6.0,dirty,-28.0,-28.0,True,post_breakout,0.75,6.0,-1.0,False
2011-01-13,0:00,1280.5,ES,Confirmation,4:15,,BE,,,1280.5,1279.5,1286.25,1280.5,2011-2016,2011-01-13,1:40,1279.5,1286.25,Long,Confirmation,Confirmation,0:00,BE,2011-01-13 01:40:00-05:00,2011-01-13,,,,,,,,,,,,,,,,,,2011-01-13 01:40:00-05:00,AS,2011-01-12 20:30:00-05:00,1282.25,1282.0,AS,AS,2011-01-12 20:30:00-05:00,310.0,AS,2011-01-13 00:00:00-05:00,2011-01-13 01:40:00-05:00,AS,0.26,0.74,0.28,0.13,1.0,0.48,0.61,0.2566,0.6447,0.7692,0.5,0.5,,,0.6408333333333334,0.7396739130434783,1.0,0.714,0.968,0.968,0.0,1.0,0.26,0.5,0.6408333333333334,0.0,0.0,0.0,0.0,0.0,14.0,5.0,14.0,5.0,2.0,0.0,mixed,9.0,9.0,False,post_breakout,1.0,5.75,0.0,False
2011-01-13,0:00,1281.75,ES,Confirmation,5:20,,Yes,,,1281.75,1281.0,1286.5,1281.0,2011-2016,2011-01-13,4:15,1281.0,1286.5,Long,Confirmation,Confirmation,0:00,Yes,2011-01-13 04:15:00-05:00,2011-01-13,,,,,,,,,,,,,,,,,,2011-01-13 04:15:00-05:00,OS,2011-01-13 04:00:00-05:00,1282.25,1281.5,OS,OS,2011-01-13 04:00:00-05:00,15.0,OS,2011-01-13 07:35:00-05:00,2011-01-13 04:15:00-05:00,OS,0.27,0.73,0.24,0.5,0.0,0.0,0.5,0.2674,0.6977,0.7326,0.1333333333333333,0.1666666666666666,0.647,0.294,0.6285714285714286,0.8764705882352941,0.905,0.619,0.968,0.968,0.0,1.0,0.27,0.1333333333333333,0.6285714285714286,0.0,0.0,0.0,17.0,15.0,85.0,134.0,114.0,181.0,1.75,6.0,dirty,-49.0,-67.0,True,frontrun,0.75,6.333333333333333,-1.0,False
2011-01-13,0:00,1280.75,ES,Confirmation,10:00,,Yes,,,1280.75,1279.5,1287.25,1279.5,2011-2016,2011-01-13,9:50,1279.5,1287.25,Long,Confirmation,Confirmation,0:00,Yes,2011-01-13 09:50:00-05:00,2011-01-13,,,,,,,,,,,,,,,,,,2011-01-13 09:50:00-05:00,RR,2011-01-13 09:30:00-05:00,1282.0,1280.5,RR,RR,2011-01-13 09:30:00-05:00,20.0,RR,2011-01-13 10:25:00-05:00,2011-01-13 09:50:00-05:00,RR,0.14,0.86,0.5,0.5,0.5,0.5,0.5,0.2182,0.7636,0.7818,0.43125,0.3166666666666666,0.647,0.294,0.5,0.5,0.889,0.413,0.362,0.481,0.0,1.0,0.14,0.43125,0.5,0.0,0.0,0.0,9.0,4.0,24.0,12.0,42.0,19.0,1.0,3.0,dirty,12.0,23.0,True,frontrun,1.25,5.2,-1.0,False
2011-01-13,0:00,1282.75,ES,Confirmation,14:50,,No,,,1282.75,1283.75,1277.25,1282.75,2011-2016,2011-01-13,11:35,1283.75,1277.25,Short,Confirmation,Confirmation,0:00,No,2011-01-13 11:35:00-05:00,2011-01-13,,,,,,,,,,,,,,,,,,2011-01-13 11:35:00-05:00,RS,2011-01-13 10:30:00-05:00,1283.0,1282.25,RS,RS,2011-01-13 10:30:00-05:00,65.0,RS,2011-01-13 15:30:00-05:00,2011-01-13 11:35:00-05:00,RS,0.14,0.86,0.19,0.5,0.45,0.0,0.5,0.2182,0.7636,0.7818,0.4571428571428571,0.5428571428571429,0.52,0.24,0.5,0.5,0.64,0.52,0.658,0.566,0.0,1.0,0.86,0.5428571428571429,0.5,0.0,0.0,0.0,27.0,21.0,88.0,117.0,223.0,378.0,1.5,6.0,dirty,-29.0,-155.0,True,frontrun,1.0,5.5,-0.0,False
2011-01-14,0:00,1275.75,ES,Confirmation,14:05,,No,,,1275.75,1274.0,1288.5,1288.5,2011-2016,2011-01-14,8:35,1274.0,1288.5,Long,Confirmation,Confirmation,0:00,No,2011-01-14 08:35:00-05:00,2011-01-14,,,,,,,,,,,,,,,,,,2011-01-14 08:35:00-05:00,TR,2011-01-14 08:30:00-05:00,1276.75,1275.0,TR,TR,2011-01-14 08:30:00-05:00,5.0,,,2011-01-14 08:35:00-05:00,TR,0.5,0.5,0.5,0.5,0.5,0.5,0.5,0.4663,0.4838,0.7437,0.3735,0.4195,0.52,0.32,0.5,0.5,0.84,0.28,0.994,0.994,0.0,0.0,0.5,0.3735,0.5,0.0,1.0,1.0,6.0,2.0,11.0,2.0,20.0,2.0,2.25,4.0,dirty,9.0,18.0,True,m7_first_two,1.75,7.285714285714286,7.285714285714286,True
2011-01-14,0:00,1282.5,ES,Confirmation,14:05,,No,,,1282.5,1281.5,1288.5,1288.5,2011-2016,2011-01-14,11:00,1281.5,1288.5,Long,Confirmation,Confirmation,0:00,No,2011-01-14 11:00:00-05:00,2011-01-14,,,,,,,,,,,,,,,,,,2011-01-14 11:00:00-05:00,RS,2011-01-14 10:30:00-05:00,1283.5,1282.25,RS,RS,2011-01-14 10:30:00-05:00,30.0,RS,2011-01-14 10:40:00-05:00,2011-01-14 11:00:00-05:00,RS,0.76,0.24,0.25,0.56,0.53,0.26,0.79,0.6129,0.3226,0.6452,0.4875,0.4875,0.52,0.32,0.5,0.5,0.72,0.28,0.519,0.716,1.0,0.0,0.76,0.4875,0.5,0.0,1.0,0.0,69.0,31.0,45.0,57.0,296.0,484.0,2.25,6.0,dirty,-12.0,-188.0,True,post_breakout,1.0,6.0,6.0,True
2011-01-18,0:00,1285.75,ES,Confirmation,6:45,,No,,,1285.75,1284.5,1292.5,1292.5,2011-2016,2011-01-18,2:15,1284.5,1292.5,Long,Confirmation,Confirmation,0:00,No,2011-01-18 02:15:00-05:00,2011-01-18,,,,,,,,,,,,,,,,,,2011-01-18 02:15:00-05:00,TO,2011-01-18 02:00:00-05:00,1286.75,1285.75,TO,TO,2011-01-18 02:00:00-05:00,15.0,,,2011-01-18 02:15:00-05:00,TO,0.5,0.5,0.5,0.5,0.5,0.5,0.5,0.4662,0.4832,0.7446,0.5,0.5,,,0.9824561403508772,0.9925373134328358,0.775,0.966,0.964,0.898,0.0,0.0,0.5,0.5,0.9824561403508772,1.0,0.0,0.0,42.0,33.0,100.0,119.0,130.0,152.0,2.0,4.0,dirty,-19.0,-22.0,True,no_breakout,1.25,5.4,5.4,True
2011-01-18,0:00,1286.75,ES,Confirmation,15:55,,No,,,1286.75,1285.25,1293.0,1291.5,2011-2016,2011-01-18,9:55,1285.25,1293.0,Long,Confirmation,Confirmation,0:00,No,2011-01-18 09:55:00-05:00,2011-01-18,,,,,,,,,,,,,,,,,,2011-01-18 09:55:00-05:00,RR,2011-01-18 09:30:00-05:00,1288.0,1286.5,RR,RR,2011-01-18 09:30:00-05:00,25.0,RR,2011-01-18 10:25:00-05:00,2011-01-18 09:55:00-05:00,RR,0.57,0.43,0.5,0.5,0.5,0.5,0.5,0.6237,0.3548,0.5806,0.545,0.3425,1.0,0.81,0.5,0.5,0.76,0.88,0.354,0.451,0.0,0.0,0.57,0.545,0.5,1.0,0.0,0.0,18.0,8.0,25.0,3.0,153.0,146.0,4.25,2.0,mixed,22.0,7.0,True,frontrun,1.5,4.166666666666667,3.1666666666666665,True
2011-01-19,0:00,1292.25,ES,Confirmation,8:00,,BE,,,1292.25,1291.25,1297.25,1292.25,2011-2016,2011-01-19,4:20,1291.25,1297.25,Long,Confirmation,Confirmation,0:00,BE,2011-01-19 04:20:00-05:00,2011-01-19,,,,,,,,,,,,,,,,,,2011-01-19 04:20:00-05:00,OS,2011-01-19 04:00:00-05:00,1292.75,1292.0,OS,OS,2011-01-19 04:00:00-05:00,20.0,OS,2011-01-19 04:00:00-05:00,2011-01-19 04:20:00-05:00,OS,0.16,0.84,0.17,0.4,0.0,0.4,0.72,0.2222,0.6667,0.7778,0.3836538461538461,0.4259615384615384,0.658,0.745,0.8640151515151515,0.9772727272727272,0.875,0.897,0.968,0.968,0.0,1.0,0.16,0.3836538461538461,0.8640151515151515,0.0,0.0,1.0,19.0,12.0,16.0,13.0,32.0,32.0,1.5,6.0,dirty,3.0,0.0,True,post_breakout,1.0,5.0,0.0,False
2011-01-19,0:00,1290.25,ES,Confirmation,11:10,,No,,,1290.25,1291.5,1281.25,1281.25,2011-2016,2011-01-19,9:35,1291.5,1281.25,Short,Confirmation,Confirmation,0:00,No,2011-01-19 09:35:00-05:00,2011-01-19,,,,,,,,,,,,,,,,,,2011-01-19 09:35:00-05:00,RR,2011-01-19 09:30:00-05:00,1290.5,1289.0,RR,RR,2011-01-19 09:30:00-05:00,5.0,RR,2011-01-19 10:25:00-05:00,2011-01-19 09:35:00-05:00,RR,0.0,1.0,0.5,0.5,0.5,0.5,0.5,0.1468,0.8257,0.8807,0.4599999999999999,0.44,0.658,0.745,0.5,0.5,0.875,0.685,0.2,0.4,0.0,1.0,1.0,0.44,0.5,1.0,0.0,1.0,49.0,19.0,46.0,29.0,46.0,29.0,4.25,1.0,clean,17.0,17.0,True,m7_first_two,1.25,7.2,7.2,True
2011-01-19,0:00,1283.5,ES,Confirmation,14:40,,No,,,1283.5,1284.5,1278.0,1278.0,2011-2016,2011-01-19,11:45,1284.5,1278.0,Short,Confirmation,Confirmation,0:00,No,2011-01-19 11:45:00-05:00,2011-01-19,,,,,,,,,,,,,,,,,,2011-01-19 11:45:00-05:00,RS,2011-01-19 10:30:00-05:00,1284.0,1282.5,RS,RS,2011-01-19 10:30:00-05:00,75.0,RS,2011-01-19 10:35:00-05:00,2011-01-19 11:45:00-05:00,RS,0.34,0.66,0.35,0.7,0.7,0.13,0.91,0.1468,0.8257,0.8807,0.8490566037735849,0.2452830188679245,0.59,0.878,0.5,0.5,0.558,0.59,0.333,0.667,0.0,1.0,0.66,0.2452830188679245,0.5,0.0,0.0,0.0,4.0,2.0,6.0,6.0,6.0,6.0,1.25,6.0,dirty,0.0,0.0,True,post_breakout,1.0,5.5,5.5,True
2011-01-19,0:00,1280.75,ES,Confirmation,7:20,,No,,,1280.75,1281.75,1275.0,1280.75,2011-2016,2011-01-19,21:10,1281.75,1275.0,Short,Confirmation,Confirmation,0:00,No,2011-01-19 21:10:00-05:00,2011-01-19,,,,,,,,,,,,,,,,,,2011-01-19 21:10:00-05:00,AS,2011-01-19 20:30:00-05:00,1281.5,1280.75,AS,AS,2011-01-18 20:30:00-05:00,1480.0,AS,2011-01-19 00:00:00-05:00,2011-01-19 21:10:00-05:00,AS,0.62,0.38,0.29,0.5,0.36,0.0,0.5,0.687,0.2261,0.7778,0.5,0.5,,,0.9887640449438202,0.9838709677419356,0.795,1.0,0.867,0.867,1.0,0.0,0.38,0.5,0.9838709677419356,0.0,0.0,0.0,9.0,7.0,2.0,7.0,2.0,7.0,1.5,6.0,dirty,-5.0,-5.0,True,post_breakout,1.0,5.75,-0.0,False
2011-01-20,0:00,1278.5,ES,Confirmation,10:55,,No,,,1278.5,1280.25,1268.25,1278.5,2011-2016,2011-01-20,8:55,1280.25,1268.25,Short,Confirmation,Confirmation,0:00,No,2011-01-20 08:55:00-05:00,2011-01-20,,,,,,,,,,,,,,,,,,2011-01-20 08:55:00-05:00,TR,2011-01-20 08:30:00-05:00,1278.5,1277.75,TR,TR,2011-01-20 08:30:00-05:00,25.0,,,2011-01-20 08:55:00-05:00,TR,0.5,0.5,0.5,0.5,0.5,0.5,0.5,0.4665,0.483,0.7449,0.4791666666666667,0.4791666666666667,0.056,0.917,0.5,0.5,0.306,1.0,0.933,0.933,0.0,0.0,0.5,0.4791666666666667,0.5,0.0,0.0,0.0,17.0,9.0,20.0,65.0,52.0,105.0,3.25,1.0,clean,-45.0,-53.0,True,no_breakout,1.75,5.857142857142857,-0.0,False
2011-01-20,0:00,1269.0,ES,Confirmation,14:40,,No,,,1269.0,1267.0,1280.0,1269.0,2011-2016,2011-01-20,11:00,1267.0,1280.0,Long,Confirmation,Confirmation,0:00,No,2011-01-20 11:00:00-05:00,2011-01-20,,,,,,,,,,,,,,,,,,2011-01-20 11:00:00-05:00,RS,2011-01-20 10:30:00-05:00,1270.0,1268.25,RS,RS,2011-01-20 10:30:00-05:00,30.0,RS,2011-01-20 10:50:00-05:00,2011-01-20 11:00:00-05:00,RS,0.25,0.75,0.27,1.0,0.38,0.29,1.0,0.7308,0.2692,0.7308,0.51875,0.4625,0.848,0.5,0.5,0.5,0.939,0.561,0.745,0.383,0.0,1.0,0.25,0.51875,0.5,0.0,0.0,0.0,11.0,7.0,7.0,4.0,7.0,4.0,2.25,6.0,dirty,3.0,3.0,True,post_breakout,2.0,5.5,0.0,False
2011-01-20,0:00,1274.0,ES,Confirmation,0:40,,BE,,,1274.0,1273.0,1280.25,1274.0,2011-2016,2011-01-20,21:10,1273.0,1280.25,Long,Confirmation,Confirmation,0:00,BE,2011-01-20 21:10:00-05:00,2011-01-20,,,,,,,,,,,,,,,,,,2011-01-20 21:10:00-05:00,AS,2011-01-20 20:30:00-05:00,1274.5,1273.75,AS,AS,2011-01-19 20:30:00-05:00,1480.0,AS,2011-01-20 01:35:00-05:00,2011-01-20 21:10:00-05:00,AS,0.33,0.67,0.33,0.39,0.65,0.2,0.78,0.2949,0.6026,0.7532,0.5,0.5,,,0.9888888888888888,0.9915254237288136,1.0,0.909,0.923,0.923,0.0,1.0,0.33,0.5,0.9888888888888888,1.0,0.0,1.0,35.0,27.0,28.0,19.0,80.0,72.0,1.5,6.0,dirty,9.0,8.0,True,post_breakout,1.0,6.25,0.0,False
2011-01-21,0:00,1274.0,ES,Confirmation,7:40,,No,,,1274.0,1273.0,1283.25,1283.25,2011-2016,2011-01-21,3:25,1273.0,1283.25,Long,Confirmation,Confirmation,0:00,No,2011-01-21 03:25:00-05:00,2011-01-21,,,,,,,,,,,,,,,,,,2011-01-21 03:25:00-05:00,OR,2011-01-21 03:00:00-05:00,1274.25,1273.5,OR,OR,2011-01-21 03:00:00-05:00,25.0,,,2011-01-21 03:25:00-05:00,OR,0.5,0.5,0.5,0.5,0.5,0.5,0.5,0.8462,0.1538,1.0,0.5,0.5,0.773,0.53,0.9910714285714286,0.9906542056074766,0.788,0.909,0.955,0.955,1.0,0.0,0.5,0.5,0.9910714285714286,1.0,0.0,1.0,42.0,30.0,110.0,103.0,193.0,179.0,1.75,6.0,dirty,7.0,14.0,True,no_breakout,1.0,9.25,9.25,True
2011-01-21,0:00,1286.25,ES,Confirmation,11:45,,No,,,1286.25,1287.5,1280.25,1280.25,2011-2016,2011-01-21,10:10,1287.5,1280.25,Short,Confirmation,Confirmation,0:00,No,2011-01-21 10:10:00-05:00,2011-01-21,,,,,,,,,,,,,,,,,,2011-01-21 10:10:00-05:00,RR,2011-01-21 09:30:00-05:00,1286.75,1285.75,RR,RR,2011-01-21 09:30:00-05:00,40.0,RR,2011-01-21 10:25:00-05:00,2011-01-21 10:10:00-05:00,RR,0.75,0.25,0.5,0.5,0.5,0.5,0.5,0.839,0.161,0.8305,0.4259615384615384,0.5317307692307692,0.697,0.53,0.5,0.5,0.106,0.909,0.457,0.543,1.0,0.0,0.25,0.5317307692307692,0.5,1.0,1.0,1.0,13.0,3.0,6.0,8.0,6.0,8.0,4.0,2.0,mixed,-2.0,-2.0,True,frontrun,1.25,4.8,4.8,True
2011-01-21,0:00,1283.75,ES,Confirmation,11:40,,No,,,1283.75,1284.75,1279.75,1279.75,2011-2016,2011-01-21,10:45,1284.75,1279.75,Short,Confirmation,Confirmation,0:00,No,2011-01-21 10:45:00-05:00,2011-01-21,,,,,,,,,,,,,,,,,,2011-01-21 10:45:00-05:00,RS,2011-01-21 10:30:00-05:00,1284.5,1282.5,RS,RS,2011-01-21 10:30:00-05:00,15.0,RS,2011-01-21 10:30:00-05:00,2011-01-21 10:45:00-05:00,RS,0.25,0.75,0.26,0.17,0.39,0.05,0.63,0.839,0.161,0.8305,0.6163461538461539,0.7702702702702703,0.572,0.723,0.5,0.5,0.44,0.729,0.6,0.533,0.0,1.0,0.75,0.7702702702702703,0.5,0.0,1.0,0.0,0.0,0.0,0.0,0.0,0.0,0.0,3.25,4.0,dirty,0.0,0.0,False,post_breakout,1.0,4.0,4.0,True
2011-01-24,0:00,1279.0,ES,Confirmation,14:15,,No,,,1279.0,1278.0,1288.0,1288.0,2011-2016,2011-01-24,9:30,1278.0,1288.0,Long,Confirmation,Confirmation,0:00,No,2011-01-24 09:30:00-05:00,2011-01-24,,,,,,,,,,,,,,,,,,2011-01-24 09:30:00-05:00,RR,2011-01-24 09:30:00-05:00,1281.0,1278.75,RR,RR,2011-01-24 09:30:00-05:00,0.0,RR,2011-01-24 10:25:00-05:00,2011-01-24 09:30:00-05:00,RR,0.52,0.48,0.5,0.5,0.5,0.5,0.5,0.4,0.6,1.0,0.4227941176470588,0.5330882352941176,0.469,0.312,0.5,0.5,0.938,0.781,0.27,0.19,1.0,0.0,0.52,0.4227941176470588,0.5,1.0,1.0,1.0,14.0,3.0,88.0,49.0,88.0,49.0,3.75,2.0,mixed,39.0,39.0,True,m7_first_two,1.0,9.0,9.0,True
2011-01-25,0:00,1291.0,ES,Confirmation,4:35,,No,,,1291.0,1292.0,1285.25,1291.0,2011-2016,2011-01-25,2:40,1292.0,1285.25,Short,Confirmation,Confirmation,0:00,No,2011-01-25 02:40:00-05:00,2011-01-25,,,,,,,,,,,,,,,,,,2011-01-25 02:40:00-05:00,TO,2011-01-25 02:00:00-05:00,1291.25,1290.75,TO,TO,2011-01-25 02:00:00-05:00,40.0,,,2011-01-25 02:40:00-05:00,TO,0.5,0.5,0.5,0.5,0.5,0.5,0.5,0.4662,0.4831,0.7453,0.5,0.5,,,0.9263157894736842,0.9887640449438202,0.322,0.956,0.933,0.933,0.0,0.0,0.5,0.5,0.9887640449438202,0.0,0.0,0.0,11.0,9.0,9.0,19.0,9.0,19.0,2.5,5.0,dirty,-10.0,-10.0,True,no_breakout,1.0,5.75,-0.0,False
2011-01-25,0:00,1286.0,ES,Confirmation,11:20,,No,,,1286.0,1287.0,1279.75,1286.0,2011-2016,2011-01-25,11:00,1287.0,1279.75,Short,Confirmation,Confirmation,0:00,No,2011-01-25 11:00:00-05:00,2011-01-25,,,,,,,,,,,,,,,,,,2011-01-25 11:00:00-05:00,RS,2011-01-25 10:30:00-05:00,1286.25,1284.25,RS,RS,2011-01-25 10:30:00-05:00,30.0,RS,2011-01-25 11:10:00-05:00,2011-01-25 11:00:00-05:00,RS,0.57,0.43,0.21,0.5,0.27,0.0,0.5,0.625,0.3125,0.6562,0.4785714285714285,0.5,0.185,0.185,0.5,0.5,0.222,0.481,0.58,0.636,0.0,0.0,0.43,0.5,0.5,1.0,1.0,1.0,6.0,5.0,0.0,14.0,90.0,118.0,7.75,1.0,clean,-14.0,-28.0,True,frontrun,1.0,6.25,-0.0,False
2011-01-25,0:00,1288.75,ES,Confirmation,0:30,,No,,,1288.75,1288.0,1292.25,1292.25,2011-2016,2011-01-25,22:35,1288.0,1292.25,Long,Confirmation,Confirmation,0:00,No,2011-01-25 22:35:00-05:00,2011-01-25,,,,,,,,,,,,,,,,,,2011-01-25 22:35:00-05:00,AS,2011-01-25 20:30:00-05:00,1289.0,1288.5,AS,AS,2011-01-24 20:30:00-05:00,1565.0,AS,2011-01-25 00:00:00-05:00,2011-01-25 22:35:00-05:00,AS,0.68,0.32,0.33,0.27,0.91,0.64,0.73,0.5726,0.3306,0.6752,0.5,0.5,,,0.8764705882352941,0.99009900990099,0.741,1.0,0.986,0.986,1.0,0.0,0.68,0.5,0.8764705882352941,1.0,0.0,1.0,24.0,24.0,70.0,46.0,211.0,215.0,1.5,6.0,dirty,24.0,-4.0,True,post_breakout,0.75,4.666666666666667,4.666666666666667,True
2011-01-26,0:00,1289.0,ES,Confirmation,10:45,,No,,,1289.0,1287.75,1296.0,1296.0,2011-2016,2011-01-26,9:50,1287.75,1296.0,Long,Confirmation,Confirmation,0:00,No,2011-01-26 09:50:00-05:00,2011-01-26,,,,,,,,,,,,,,,,,,2011-01-26 09:50:00-05:00,RR,2011-01-26 09:30:00-05:00,1290.0,1288.25,RR,RR,2011-01-26 09:30:00-05:00,20.0,RR,2011-01-26 10:25:00-05:00,2011-01-26 09:50:00-05:00,RR,0.5,0.5,0.5,0.5,0.5,0.5,0.5,0.2143,0.7679,0.7857,0.545,0.3425,0.524,0.667,0.5,0.5,0.56,0.84,0.348,0.427,0.0,1.0,0.5,0.545,0.5,1.0,0.0,1.0,36.0,18.0,31.0,11.0,128.0,89.0,6.0,3.0,dirty,20.0,39.0,True,frontrun,1.25,5.6,5.6,True
2011-01-27,0:00,1293.0,ES,Confirmation,11:05,,BE,,,1293.0,1291.5,1298.5,1293.0,2011-2016,2011-01-27,9:35,1291.5,1298.5,Long,Confirmation,Confirmation,0:00,BE,2011-01-27 09:35:00-05:00,2011-01-27,,,,,,,,,,,,,,,,,,2011-01-27 09:35:00-05:00,RR,2011-01-27 09:30:00-05:00,1293.5,1292.0,RR,RR,2011-01-27 09:30:00-05:00,5.0,RR,2011-01-27 10:25:00-05:00,2011-01-27 09:35:00-05:00,RR,0.12,0.88,0.5,0.5,0.5,0.5,0.5,0.7006,0.2874,0.7605,0.2553191489361702,0.574468085106383,0.355,0.484,0.5,0.5,0.613,0.903,0.253,0.293,0.0,1.0,0.12,0.2553191489361702,0.5,0.0,0.0,0.0,39.0,13.0,96.0,114.0,176.0,248.0,5.0,3.0,dirty,-18.0,-72.0,True,m7_first_two,1.5,3.6666666666666665,0.0,False
2011-01-27,0:00,1291.0,ES,Confirmation,15:45,,No,,,1291.0,1289.75,1298.0,1298.0,2011-2016,2011-01-27,11:35,1289.75,1298.0,Long,Confirmation,Confirmation,0:00,No,2011-01-27 11:35:00-05:00,2011-01-27,,,,,,,,,,,,,,,,,,2011-01-27 11:35:00-05:00,RS,2011-01-27 10:30:00-05:00,1292.75,1290.75,RS,RS,2011-01-27 10:30:00-05:00,65.0,RS,2011-01-27 11:25:00-05:00,2011-01-27 11:35:00-05:00,RS,0.12,0.88,0.21,0.25,0.5,0.12,0.75,0.8319,0.1681,0.8319,0.3972826086956522,0.6711956521739131,0.5,0.353,0.5,0.5,0.676,0.647,0.733,0.594,1.0,0.0,0.12,0.3972826086956522,0.5,0.0,0.0,0.0,16.0,7.0,43.0,8.0,100.0,46.0,2.75,3.0,dirty,35.0,54.0,True,post_breakout,1.25,5.6,5.6,True
2011-01-28,0:00,1293.25,ES,Confirmation,10:15,,Yes,,,1293.25,1291.5,1301.5,1291.5,2011-2016,2011-01-28,10:05,1291.5,1301.5,Long,Confirmation,Confirmation,0:00,Yes,2011-01-28 10:05:00-05:00,2011-01-28,,,,,,,,,,,,,,,,,,2011-01-28 10:05:00-05:00,RR,2011-01-28 09:30:00-05:00,1293.75,1292.25,RR,RR,2011-01-28 09:30:00-05:00,35.0,RR,2011-01-28 10:25:00-05:00,2011-01-28 10:05:00-05:00,RR,0.17,0.83,0.5,0.5,0.5,0.5,0.5,0.375,0.5833,0.5833,0.4217105263157895,0.5782894736842106,0.176,0.824,0.5,0.5,0.676,0.912,0.414,0.439,0.0,1.0,0.17,0.4217105263157895,0.5,0.0,0.0,0.0,13.0,8.0,44.0,53.0,232.0,264.0,1.0,3.0,dirty,-9.0,-32.0,True,frontrun,1.75,4.714285714285714,-1.0,False
2011-01-28,0:00,1288.25,ES,Confirmation,11:40,,No,,,1288.25,1289.5,1279.75,1289.5,2011-2016,2011-01-28,10:45,1289.5,1279.75,Short,Confirmation,Confirmation,0:00,No,2011-01-28 10:45:00-05:00,2011-01-28,,,,,,,,,,,,,,,,,,2011-01-28 10:45:00-05:00,RS,2011-01-28 10:30:00-05:00,1288.5,1285.5,RS,RS,2011-01-28 10:30:00-05:00,15.0,RS,2011-01-28 10:30:00-05:00,2011-01-28 10:45:00-05:00,RS,0.25,0.75,0.26,0.59,0.39,0.05,0.85,0.2747,0.7253,0.7363,0.51875,0.44375,0.194,0.903,0.5,0.5,0.484,0.839,0.747,0.379,0.0,1.0,0.75,0.44375,0.5,1.0,0.0,1.0,32.0,10.0,13.0,19.0,13.0,19.0,5.0,1.0,clean,-6.0,-6.0,True,post_breakout,1.25,6.8,-1.0,False
2011-01-28,0:00,1293.5,ES,Confirmation,0:35,,No,,,1293.5,1294.25,1289.25,1293.5,2011-2016,2011-01-28,21:00,1294.25,1289.25,Short,Confirmation,Confirmation,0:00,No,2011-01-28 21:00:00-05:00,2011-01-28,,,,,,,,,,,,,,,,,,,,,,,,,,,,,2011-01-28 16:10:00-05:00,TOUT,0.5,0.5,0.5,0.5,0.5,0.5,0.5,0.4667,0.4823,0.746,0.5,0.5,0.194,0.903,0.5,0.5,0.484,0.258,0.916,0.853,0.0,0.0,0.5,0.5,0.5,0.0,1.0,0.0,0.0,0.0,0.0,0.0,162.0,241.0,0.0,0.0,unknown,0.0,-79.0,False,unknown,0.75,5.666666666666667,-0.0,False
2011-01-31,0:00,1274.0,ES,Confirmation,5:20,,BE,,,1274.0,1275.25,1262.25,1274.0,2011-2016,2011-01-31,3:05,1275.25,1262.25,Short,Confirmation,Confirmation,0:00,BE,2011-01-31 03:05:00-05:00,2011-01-31,,,,,,,,,,,,,,,,,,2011-01-31 03:05:00-05:00,OR,2011-01-31 03:00:00-05:00,1274.5,1272.75,OR,OR,2011-01-31 03:00:00-05:00,5.0,,,2011-01-31 03:05:00-05:00,OR,0.25,0.75,0.5,0.5,0.5,0.5,0.5,0.2821,0.641,0.7746,0.5,0.5,0.26,0.527,0.9903846153846154,0.6777777777777778,0.693,1.0,0.996,0.996,0.0,1.0,0.75,0.5,0.6777777777777778,1.0,0.0,0.0,22.0,6.0,89.0,76.0,89.0,76.0,5.5,2.0,mixed,13.0,13.0,True,m7_first_two,1.25,9.4,-0.0,False
2011-01-31,0:00,1274.5,ES,Confirmation,12:10,,No,,,1274.5,1272.75,1282.0,1282.0,2011-2016,2011-01-31,9:50,1272.75,1282.0,Long,Confirmation,Confirmation,0:00,No,2011-01-31 09:50:00-05:00,2011-01-31,,,,,,,,,,,,,,,,,,2011-01-31 09:50:00-05:00,RR,2011-01-31 09:30:00-05:00,1275.75,1274.0,RR,RR,2011-01-31 09:30:00-05:00,20.0,RR,2011-01-31 10:25:00-05:00,2011-01-31 09:50:00-05:00,RR,0.0,1.0,0.5,0.5,0.5,0.5,0.5,0.5714,0.4286,0.4286,0.4693181818181818,0.4897727272727272,0.478,0.826,0.5,0.5,0.725,0.975,0.419,0.372,0.0,1.0,0.0,0.4693181818181818,0.5,1.0,1.0,1.0,2.0,2.0,14.0,23.0,41.0,67.0,2.75,6.0,dirty,-9.0,-26.0,True,frontrun,1.75,4.285714285714286,4.285714285714286,True
2011-02-01,0:00,1284.75,ES,Confirmation,8:25,,No,,,1284.75,1284.0,1290.75,1290.75,2011-2016,2011-02-01,4:10,1284.0,1290.75,Long,Confirmation,Confirmation,0:00,No,2011-02-01 04:10:00-05:00,2011-02-01,,,,,,,,,,,,,,,,,,2011-02-01 04:10:00-05:00,OS,2011-02-01 04:00:00-05:00,1285.25,1284.5,OS,OS,2011-02-01 04:00:00-05:00,10.0,OS,2011-02-01 05:05:00-05:00,2011-02-01 04:10:00-05:00,OS,0.33,0.67,0.19,0.5,0.0,0.0,0.5,0.4375,0.5312,0.6129,0.2954545454545454,0.3636363636363636,0.262,0.954,0.9861111111111112,0.9824561403508772,0.785,0.785,0.923,0.923,0.0,1.0,0.33,0.2954545454545454,0.9861111111111112,0.0,1.0,0.0,24.0,16.0,40.0,26.0,66.0,46.0,2.25,5.0,dirty,14.0,20.0,True,frontrun,0.75,8.0,8.0,True
2011-02-01,0:00,1292.25,ES,Confirmation,12:50,,No,,,1292.25,1290.5,1303.5,1303.5,2011-2016,2011-02-01,9:35,1290.5,1303.5,Long,Confirmation,Confirmation,0:00,No,2011-02-01 09:35:00-05:00,2011-02-01,,,,,,,,,,,,,,,,,,2011-02-01 09:35:00-05:00,RR,2011-02-01 09:30:00-05:00,1293.75,1292.25,RR,RR,2011-02-01 09:30:00-05:00,5.0,RR,2011-02-01 10:25:00-05:00,2011-02-01 09:35:00-05:00,RR,0.5,0.5,0.5,0.5,0.5,0.5,0.5,0.8333,0.1667,0.8333,0.4599999999999999,0.54,0.262,0.954,0.5,0.5,0.415,0.785,0.349,0.238,1.0,0.0,0.5,0.4599999999999999,0.5,1.0,0.0,1.0,0.0,0.0,0.0,0.0,0.0,0.0,4.0,6.0,dirty,0.0,0.0,False,m7_first_two,1.75,6.428571428571429,6.428571428571429,True
2011-02-01,0:00,1295.75,ES,Confirmation,12:50,,No,,,1295.75,1294.25,1303.5,1303.5,2011-2016,2011-02-01,10:35,1294.25,1303.5,Long,Confirmation,Confirmation,0:00,No,2011-02-01 10:35:00-05:00,2011-02-01,,,,,,,,,,,,,,,,,,2011-02-01 10:35:00-05:00,RS,2011-02-01 10:30:00-05:00,1297.25,1295.75,RS,RS,2011-02-01 10:30:00-05:00,5.0,RS,2011-02-01 10:40:00-05:00,2011-02-01 10:35:00-05:00,RS,1.0,0.0,0.21,0.5,0.0,0.0,0.5,0.8333,0.1667,0.8333,0.4785714285714285,0.5428571428571429,0.28,0.935,0.5,0.5,0.417,0.756,0.536,0.714,1.0,0.0,1.0,0.4785714285714285,0.5,1.0,0.0,0.0,3.0,1.0,1.0,4.0,1.0,4.0,3.75,1.0,clean,-3.0,-3.0,True,m7_first_two,1.5,5.166666666666667,5.166666666666667,True
2011-02-02,0:00,1302.5,ES,Confirmation,4:10,,BE,,,1302.5,1301.5,1309.0,1302.5,2011-2016,2011-02-02,3:05,1301.5,1309.0,Long,Confirmation,Confirmation,0:00,BE,2011-02-02 03:05:00-05:00,2011-02-02,,,,,,,,,,,,,,,,,,2011-02-02 03:05:00-05:00,OR,2011-02-02 03:00:00-05:00,1303.0,1302.25,OR,OR,2011-02-02 03:00:00-05:00,5.0,,,2011-02-02 03:05:00-05:00,OR,0.25,0.75,0.5,0.5,0.5,0.5,0.5,0.4,0.4,0.8,0.5,0.5,0.577,0.976,0.9910714285714286,0.6777777777777778,0.982,0.929,0.933,0.933,0.0,0.0,0.25,0.5,0.9910714285714286,0.0,0.0,0.0,24.0,18.0,89.0,118.0,95.0,137.0,2.25,3.0,dirty,-29.0,-42.0,True,m7_first_two,1.0,6.5,0.0,False
2011-02-03,0:00,1300.75,ES,Confirmation,4:20,,BE,,,1300.75,1301.75,1295.25,1300.75,2011-2016,2011-02-03,3:15,1301.75,1295.25,Short,Confirmation,Confirmation,0:00,BE,2011-02-03 03:15:00-05:00,2011-02-03,,,,,,,,,,,,,,,,,,2011-02-03 03:15:00-05:00,OR,2011-02-03 03:00:00-05:00,1301.0,1299.75,OR,OR,2011-02-03 03:00:00-05:00,15.0,,,2011-02-03 03:15:00-05:00,OR,0.67,0.33,0.5,0.5,0.5,0.5,0.5,0.557,0.3544,0.7468,0.5,0.5,0.549,0.67,0.9905660377358492,0.9885057471264368,0.747,0.626,0.984,0.984,0.0,1.0,0.33,0.5,0.9885057471264368,1.0,1.0,1.0,60.0,39.0,62.0,85.0,214.0,187.0,3.5,3.0,dirty,-23.0,27.0,True,no_breakout,1.0,5.5,-0.0,False
2011-02-03,0:00,1293.75,ES,Confirmation,14:55,,No,,,1293.75,1292.0,1302.5,1302.5,2011-2016,2011-02-03,10:20,1292.0,1302.5,Long,Confirmation,Confirmation,0:00,No,2011-02-03 10:20:00-05:00,2011-02-03,,,,,,,,,,,,,,,,,,2011-02-03 10:20:00-05:00,RR,2011-02-03 09:30:00-05:00,1294.5,1293.25,RR,RR,2011-02-03 09:30:00-05:00,50.0,RR,2011-02-03 10:25:00-05:00,2011-02-03 10:20:00-05:00,RR,0.33,0.67,0.5,0.5,0.5,0.5,0.5,0.7037,0.2963,0.7407,0.48,0.4599999999999999,0.571,0.0,0.5,0.5,0.857,0.179,0.454,0.589,0.0,1.0,0.33,0.48,0.5,1.0,0.0,1.0,4.0,2.0,1.0,3.0,1.0,3.0,3.25,4.0,dirty,-2.0,-2.0,True,frontrun,1.75,5.0,5.0,True
2011-02-04,0:00,1302.25,ES,Confirmation,8:10,,No,,,1302.25,1301.5,1305.75,1305.75,2011-2016,2011-02-04,3:25,1301.5,1305.75,Long,Confirmation,Confirmation,0:00,No,2011-02-04 03:25:00-05:00,2011-02-04,,,,,,,,,,,,,,,,,,2011-02-04 03:25:00-05:00,OR,2011-02-04 03:00:00-05:00,1302.5,1301.75,OR,OR,2011-02-04 03:00:00-05:00,25.0,,,2011-02-04 03:25:00-05:00,OR,0.29,0.71,0.5,0.5,0.5,0.5,0.5,0.1842,0.7895,0.8919,0.5,0.5,0.791,0.537,0.9910714285714286,0.9906542056074766,0.836,0.91,0.938,0.938,0.0,1.0,0.29,0.5,0.9910714285714286,1.0,1.0,1.0,32.0,27.0,52.0,68.0,74.0,117.0,0.75,6.0,dirty,-16.0,-43.0,True,no_breakout,0.75,4.666666666666667,4.666666666666667,True
2011-02-07,0:00,1306.75,ES,Confirmation,8:25,,No,,,1306.75,1305.75,1315.25,1311.5,2011-2016,2011-02-07,3:15,1305.75,1315.25,Long,Confirmation,Confirmation,0:00,No,2011-02-07 03:15:00-05:00,2011-02-07,,,,,,,,,,,,,,,,,,2011-02-07 03:15:00-05:00,OR,2011-02-07 03:00:00-05:00,1307.0,1306.25,OR,OR,2011-02-07 03:00:00-05:00,15.0,,,2011-02-07 03:15:00-05:00,OR,0.75,0.25,0.5,0.5,0.5,0.5,0.5,0.7419,0.2258,0.8065,0.5,0.5,0.64,0.833,0.9861111111111112,0.986842105263158,0.72,0.96,0.996,0.996,1.0,0.0,0.75,0.5,0.9861111111111112,1.0,0.0,1.0,84.0,48.0,171.0,141.0,213.0,164.0,4.75,3.0,dirty,30.0,49.0,True,no_breakout,1.0,8.5,4.75,True
2011-02-07,0:00,1311.25,ES,Confirmation,15:55,,No,,,1311.25,1309.5,1320.5,1315.75,2011-2016,2011-02-07,9:35,1309.5,1320.5,Long,Confirmation,Confirmation,0:00,No,2011-02-07 09:35:00-05:00,2011-02-07,,,,,,,,,,,,,,,,,,2011-02-07 09:35:00-05:00,RR,2011-02-07 09:30:00-05:00,1312.25,1311.0,RR,RR,2011-02-07 09:30:00-05:00,5.0,RR,2011-02-07 10:25:00-05:00,2011-02-07 09:35:00-05:00,RR,0.5,0.5,0.5,0.5,0.5,0.5,0.5,0.6667,0.3333,1.0,0.5375,0.44375,0.0,0.0,0.5,0.5,0.057,0.771,0.333,0.258,1.0,0.0,0.5,0.5375,0.5,0.0,0.0,0.0,6.0,4.0,18.0,11.0,18.0,11.0,3.75,1.0,clean,7.0,7.0,True,m7_first_two,1.75,5.285714285714286,2.5714285714285716,True
2011-02-08,0:00,1315.75,ES,Confirmation,5:30,,BE,,,1315.75,1315.0,1320.0,1315.75,2011-2016,2011-02-08,3:35,1315.0,1320.0,Long,Confirmation,Confirmation,0:00,BE,2011-02-08 03:35:00-05:00,2011-02-08,,,,,,,,,,,,,,,,,,2011-02-08 03:35:00-05:00,OR,2011-02-08 03:00:00-05:00,1316.5,1315.75,OR,OR,2011-02-08 03:00:00-05:00,35.0,,,2011-02-08 03:35:00-05:00,OR,0.6,0.4,0.5,0.5,0.5,0.5,0.5,0.8027,0.1701,0.8369,0.5,0.5,0.212,0.97,0.9850746268656716,0.9912280701754386,0.788,0.818,0.985,0.985,1.0,0.0,0.6,0.5,0.9850746268656716,0.0,1.0,1.0,19.0,13.0,115.0,72.0,134.0,115.0,2.0,4.0,dirty,43.0,19.0,True,no_breakout,0.75,5.666666666666667,0.0,False
2011-02-08,0:00,1316.5,ES,Confirmation,9:50,,BE,,,1316.5,1317.5,1310.0,1316.5,2011-2016,2011-02-08,8:50,1317.5,1310.0,Short,Confirmation,Confirmation,0:00,BE,2011-02-08 08:50:00-05:00,2011-02-08,,,,,,,,,,,,,,,,,,2011-02-08 08:50:00-05:00,TR,2011-02-08 08:30:00-05:00,1316.25,1315.5,TR,TR,2011-02-08 08:30:00-05:00,20.0,,,2011-02-08 08:50:00-05:00,TR,0.5,0.5,0.5,0.5,0.5,0.5,0.5,0.4675,0.4812,0.7469,0.5208333333333334,0.4583333333333333,0.212,0.97,0.5,0.5,0.53,0.727,0.985,0.985,0.0,0.0,0.5,0.4583333333333333,0.5,1.0,0.0,1.0,26.0,19.0,94.0,98.0,139.0,162.0,1.25,6.0,dirty,-4.0,-23.0,True,no_breakout,1.0,6.5,-0.0,False
2011-02-08,0:00,1317.75,ES,Confirmation,15:55,,No,,,1317.75,1316.75,1323.5,1321.75,2011-2016,2011-02-08,13:40,1316.75,1323.5,Long,Confirmation,Confirmation,0:00,No,2011-02-08 13:40:00-05:00,2011-02-08,,,,,,,,,,,,,,,,,,2011-02-08 13:40:00-05:00,RS,2011-02-08 10:30:00-05:00,1318.0,1317.75,RS,RS,2011-02-08 10:30:00-05:00,190.0,RS,2011-02-08 11:50:00-05:00,2011-02-08 13:40:00-05:00,RS,0.78,0.22,0.21,0.33,0.78,0.22,0.89,0.2872,0.7128,0.734,0.4910714285714285,0.5267857142857143,0.5,0.977,0.5,0.5,0.591,0.5,0.828,0.97,1.0,0.0,0.78,0.4910714285714285,0.5,1.0,0.0,1.0,9.0,4.0,29.0,26.0,47.0,89.0,1.5,6.0,dirty,3.0,-42.0,True,post_breakout,1.0,5.75,4.0,True
2011-02-09,0:00,1316.5,ES,Confirmation,10:45,,No,,,1316.5,1315.75,1321.75,1321.75,2011-2016,2011-02-09,8:30,1315.75,1321.75,Long,Confirmation,Confirmation,0:00,No,2011-02-09 08:30:00-05:00,2011-02-09,,,,,,,,,,,,,,,,,,2011-02-09 08:30:00-05:00,TR,2011-02-09 08:30:00-05:00,1316.75,1316.25,TR,TR,2011-02-09 08:30:00-05:00,0.0,,,2011-02-09 08:30:00-05:00,TR,0.5,0.5,0.5,0.5,0.5,0.5,0.5,0.4675,0.4812,0.7469,0.4655,0.3965,0.062,0.719,0.5,0.5,1.0,0.906,0.968,0.968,0.0,0.0,0.5,0.4655,0.5,1.0,0.0,0.0,27.0,22.0,64.0,73.0,139.0,112.0,1.5,6.0,dirty,-9.0,27.0,True,m7_first_two,0.75,7.0,7.0,True
2011-02-09,0:00,1321.75,ES,Confirmation,14:35,,No,,,1321.75,1322.5,1313.0,1313.0,2011-2016,2011-02-09,10:50,1322.5,1313.0,Short,Confirmation,Confirmation,0:00,No,2011-02-09 10:50:00-05:00,2011-02-09,,,,,,,,,,,,,,,,,,2011-02-09 10:50:00-05:00,RS,2011-02-09 10:30:00-05:00,1322.0,1320.75,RS,RS,2011-02-09 10:30:00-05:00,20.0,RS,2011-02-09 10:45:00-05:00,2011-02-09 10:50:00-05:00,RS,0.81,0.19,0.21,0.78,0.0,0.33,1.0,0.6277,0.3511,0.5745,0.4553571428571428,0.5089285714285714,0.062,0.719,0.5,0.5,0.781,0.906,0.641,0.583,1.0,0.0,0.19,0.5089285714285714,0.5,0.0,1.0,0.0,19.0,8.0,10.0,11.0,13.0,18.0,6.75,2.0,mixed,-1.0,-5.0,True,post_breakout,0.75,11.666666666666666,11.666666666666666,True
2011-02-09,0:00,1319.75,ES,Confirmation,22:20,,Yes,,,1319.75,1319.0,1323.75,1319.75,2011-2016,2011-02-09,20:50,1319.0,1323.75,Long,Confirmation,Confirmation,0:00,Yes,2011-02-09 20:50:00-05:00,2011-02-09,,,,,,,,,,,,,,,,,,2011-02-09 20:50:00-05:00,AS,2011-02-09 20:30:00-05:00,1319.0,1318.5,AS,AS,2011-02-08 20:30:00-05:00,1460.0,AS,2011-02-09 00:00:00-05:00,2011-02-09 20:50:00-05:00,AS,0.72,0.28,0.29,0.5,0.0,0.0,0.5,0.1304,0.8261,0.8261,0.5,0.5,,,0.99009900990099,0.9973474801061007,0.87,1.0,0.965,0.895,1.0,0.0,0.72,0.5,0.99009900990099,1.0,0.0,1.0,14.0,12.0,7.0,12.0,118.0,240.0,0.0,6.0,dirty,-5.0,-122.0,True,post_breakout,0.75,5.333333333333333,0.0,False
2011-02-10,0:00,1318.75,ES,Confirmation,4:25,,No,,,1318.75,1319.75,1311.75,1311.75,2011-2016,2011-02-10,0:40,1319.75,1311.75,Short,Confirmation,Confirmation,0:00,No,2011-02-10 00:40:00-05:00,2011-02-10,,,,,,,,,,,,,,,,,,2011-02-10 00:40:00-05:00,AS,2011-02-09 20:30:00-05:00,1319.0,1318.25,AS,AS,2011-02-09 20:30:00-05:00,250.0,AS,2011-02-10 00:00:00-05:00,2011-02-10 00:40:00-05:00,AS,0.72,0.28,0.29,0.09,1.0,0.19,0.41,0.1304,0.8261,0.8261,0.5,0.5,,,0.7893518518518519,0.9866666666666668,0.804,1.0,0.995,0.995,1.0,0.0,0.28,0.5,0.9866666666666668,1.0,0.0,1.0,50.0,25.0,108.0,78.0,240.0,300.0,2.0,5.0,dirty,30.0,-60.0,True,post_breakout,1.0,7.0,7.0,True
2011-02-10,0:00,1315.75,ES,Confirmation,4:25,,No,,,1315.75,1316.75,1311.75,1311.75,2011-2016,2011-02-10,3:05,1316.75,1311.75,Short,Confirmation,Confirmation,0:00,No,2011-02-10 03:05:00-05:00,2011-02-10,,,,,,,,,,,,,,,,,,2011-02-10 03:05:00-05:00,OR,2011-02-10 03:00:00-05:00,1316.25,1315.25,OR,OR,2011-02-10 03:00:00-05:00,5.0,,,2011-02-10 03:05:00-05:00,OR,0.27,0.73,0.5,0.5,0.5,0.5,0.5,0.3283,0.6111,0.7917,0.5,0.5,0.326,1.0,0.9861111111111112,0.9908256880733946,0.804,1.0,0.995,0.995,0.0,1.0,0.73,0.5,0.9908256880733946,0.0,0.0,1.0,0.0,0.0,12.0,9.0,109.0,96.0,3.0,4.0,dirty,3.0,13.0,False,m7_first_two,1.0,4.0,4.0,True
2011-02-11,0:00,1315.0,ES,Confirmation,10:40,,No,,,1315.0,1313.5,1321.0,1321.0,2011-2016,2011-02-11,9:50,1313.5,1321.0,Long,Confirmation,Confirmation,0:00,No,2011-02-11 09:50:00-05:00,2011-02-11,,,,,,,,,,,,,,,,,,2011-02-11 09:50:00-05:00,RR,2011-02-11 09:30:00-05:00,1316.75,1315.0,RR,RR,2011-02-11 09:30:00-05:00,20.0,RR,2011-02-11 10:25:00-05:00,2011-02-11 09:50:00-05:00,RR,1.0,0.0,0.5,0.5,0.5,0.5,0.5,0.7838,0.1892,0.7838,0.4166666666666666,0.4791666666666667,0.662,0.221,0.5,0.5,0.676,0.471,0.36,0.482,1.0,0.0,1.0,0.4166666666666666,0.5,1.0,0.0,1.0,70.0,22.0,133.0,145.0,269.0,331.0,3.5,1.0,clean,-12.0,-62.0,True,frontrun,1.5,4.0,4.0,True
2011-02-13,0:00,1326.0,ES,Confirmation,1:45,,No,,,1326.0,1324.75,1330.0,1330.0,2011-2016,2011-02-13,21:05,1324.75,1330.0,Long,Confirmation,Confirmation,0:00,No,2011-02-13 21:05:00-05:00,2011-02-13,,,,,,,,,,,,,,,,,,2011-02-13 21:05:00-05:00,AS,2011-02-13 20:30:00-05:00,1326.25,1326.0,AS,AS,2011-02-13 20:30:00-05:00,35.0,AS,2011-02-13 20:50:00-05:00,2011-02-13 21:05:00-05:00,AS,0.31,0.69,0.32,0.83,0.62,0.76,0.93,0.2548,0.6497,0.7755,0.5,0.5,,,0.9888888888888888,0.9915254237288136,0.988,0.912,0.85,0.99,0.0,1.0,0.31,0.5,0.9888888888888888,1.0,0.0,0.0,21.0,14.0,9.0,17.0,9.0,17.0,1.0,6.0,dirty,-8.0,-8.0,True,post_breakout,1.25,3.2,3.2,True
2011-02-14,0:00,1325.75,ES,Confirmation,10:45,,Yes,,,1325.75,1324.5,1329.75,1324.5,2011-2016,2011-02-14,6:05,1324.5,1329.75,Long,Confirmation,Confirmation,0:00,Yes,2011-02-14 06:05:00-05:00,2011-02-14,,,,,,,,,,,,,,,,,,2011-02-14 06:05:00-05:00,OS,2011-02-14 04:00:00-05:00,1326.0,1325.5,OS,OS,2011-02-14 04:00:00-05:00,125.0,OS,2011-02-14 04:35:00-05:00,2011-02-14 06:05:00-05:00,OS,0.33,0.67,0.2,0.58,0.0,0.17,0.75,0.6486,0.2703,0.7432,0.4189814814814814,0.3032407407407407,0.118,0.941,0.9263157894736842,0.7645,0.725,0.784,0.986,0.986,0.0,1.0,0.33,0.4189814814814814,0.9263157894736842,1.0,0.0,0.0,16.0,12.0,28.0,29.0,43.0,44.0,0.5,6.0,dirty,-1.0,-1.0,True,post_breakout,1.25,3.2,-1.0,False
2011-02-15,0:00,1328.75,ES,Confirmation,15:55,,No,,,1328.75,1330.0,1320.75,1326.0,2011-2016,2011-02-15,3:50,1330.0,1320.75,Short,Confirmation,Confirmation,0:00,No,2011-02-15 03:50:00-05:00,2011-02-15,,,,,,,,,,,,,,,,,,2011-02-15 03:50:00-05:00,OR,2011-02-15 03:00:00-05:00,1328.75,1328.0,OR,OR,2011-02-15 03:00:00-05:00,50.0,,,2011-02-15 03:50:00-05:00,OR,1.0,0.0,0.5,0.5,0.5,0.5,0.5,0.6486,0.2703,0.7432,0.5,0.5,0.343,0.629,0.8640151515151515,0.6163461538461539,0.686,0.914,0.929,0.929,1.0,0.0,0.0,0.5,0.6163461538461539,1.0,0.0,0.0,30.0,22.0,43.0,77.0,80.0,156.0,1.5,6.0,dirty,-34.0,-76.0,True,no_breakout,1.25,6.4,2.2,True
2011-02-15,0:00,1326.75,ES,Confirmation,22:10,,Yes,,,1326.75,1328.0,1320.75,1328.0,2011-2016,2011-02-15,20:35,1328.0,1320.75,Short,Confirmation,Confirmation,0:00,Yes,2011-02-15 20:35:00-05:00,2011-02-15,,,,,,,,,,,,,,,,,,2011-02-15 20:35:00-05:00,AS,2011-02-15 20:30:00-05:00,1327.75,1327.25,AS,AS,2011-02-14 20:30:00-05:00,1445.0,AS,2011-02-15 00:00:00-05:00,2011-02-15 20:35:00-05:00,AS,0.67,0.33,0.3,0.5,0.0,0.0,0.5,0.2222,0.7037,0.6667,0.5,0.5,,,0.9973474801061007,0.9973474801061007,0.964,1.0,0.928,0.94,1.0,0.0,0.33,0.5,0.9973474801061007,1.0,0.0,1.0,28.0,20.0,27.0,44.0,597.0,816.0,-0.5,2.0,dirty,-17.0,-219.0,True,post_breakout,1.25,4.8,-1.0,False
2011-02-16,0:00,1335.5,ES,Confirmation,12:05,,No,,,1335.5,1336.5,1327.75,1327.75,2011-2016,2011-02-16,11:00,1336.5,1327.75,Short,Confirmation,Confirmation,0:00,No,2011-02-16 11:00:00-05:00,2011-02-16,,,,,,,,,,,,,,,,,,2011-02-16 11:00:00-05:00,RS,2011-02-16 10:30:00-05:00,1336.0,1334.5,RS,RS,2011-02-16 10:30:00-05:00,30.0,RS,2011-02-16 10:35:00-05:00,2011-02-16 11:00:00-05:00,RS,0.63,0.37,0.38,0.78,0.46,0.22,0.91,0.7879,0.2121,0.7879,0.4833333333333333,0.5,0.019,0.34,0.5,0.5,0.245,0.981,0.36,0.83,1.0,0.0,0.37,0.5,0.5,0.0,1.0,0.0,0.0,0.0,0.0,0.0,0.0,0.0,4.0,4.0,dirty,0.0,0.0,False,post_breakout,1.0,7.75,7.75,True
2011-02-16,0:00,1326.75,ES,Confirmation,22:10,,No,,,1326.75,1325.75,1331.25,1331.25,2011-2016,2011-02-16,20:15,1325.75,1331.25,Long,Confirmation,Confirmation,0:00,No,2011-02-16 20:15:00-05:00,2011-02-16,,,,,,,,,,,,,,,,,,2011-02-16 20:15:00-05:00,AR,2011-02-16 19:30:00-05:00,1332.0,1331.75,AR,AR,2011-02-16 19:30:00-05:00,45.0,AR,2011-02-16 20:25:00-05:00,2011-02-16 20:15:00-05:00,AR,0.11,0.89,0.5,0.5,0.5,0.5,0.5,0.2911,0.6076,0.7564,0.5,0.5,0.019,0.34,0.5,0.5,0.245,0.981,0.83,0.98,0.0,1.0,0.11,0.5,0.5,1.0,0.0,1.0,0.0,0.0,0.0,0.0,50.0,13.0,5.75,0.0,clean,0.0,37.0,False,frontrun,1.0,4.5,4.5,True
2011-02-17,0:00,1332.75,ES,Confirmation,13:05,,No,,,1332.75,1331.75,1337.75,1337.75,2011-2016,2011-02-17,10:50,1331.75,1337.75,Long,Confirmation,Confirmation,0:00,No,2011-02-17 10:50:00-05:00,2011-02-17,,,,,,,,,,,,,,,,,,2011-02-17 10:50:00-05:00,RS,2011-02-17 10:30:00-05:00,1333.75,1332.5,RS,RS,2011-02-17 10:30:00-05:00,20.0,RS,2011-02-17 11:10:00-05:00,2011-02-17 10:50:00-05:00,RS,0.89,0.11,0.21,0.5,0.14,0.0,0.5,0.6316,0.3474,0.5789,0.5041666666666667,0.4958333333333333,0.87,0.304,0.5,0.5,0.905,0.695,0.516,0.774,1.0,0.0,0.89,0.5041666666666667,0.5,0.0,0.0,0.0,68.0,28.0,121.0,171.0,315.0,533.0,3.5,4.0,dirty,-50.0,-218.0,True,frontrun,1.0,5.0,5.0,True
2011-02-17,0:00,1337.25,ES,Confirmation,4:45,,Yes,,,1337.25,1336.5,1341.0,1336.5,2011-2016,2011-02-17,21:20,1336.5,1341.0,Long,Confirmation,Confirmation,0:00,Yes,2011-02-17 21:20:00-05:00,2011-02-17,,,,,,,,,,,,,,,,,,2011-02-17 21:20:00-05:00,AS,2011-02-17 20:30:00-05:00,1337.5,1337.0,AS,AS,2011-02-16 20:30:00-05:00,1490.0,AS,2011-02-17 00:25:00-05:00,2011-02-17 21:20:00-05:00,AS,0.67,0.33,0.24,0.5,0.39,0.0,0.5,0.5781,0.3203,0.686,0.5,0.5,,,0.9888888888888888,0.9838709677419356,1.0,0.984,0.667,0.933,1.0,0.0,0.67,0.5,0.9888888888888888,0.0,0.0,0.0,23.0,23.0,26.0,9.0,29.0,9.0,1.25,6.0,dirty,17.0,20.0,True,post_breakout,0.75,5.0,-1.0,False
2011-02-18,0:00,1335.5,ES,Confirmation,11:20,,No,,,1335.5,1334.75,1341.0,1341.0,2011-2016,2011-02-18,5:20,1334.75,1341.0,Long,Confirmation,Confirmation,0:00,No,2011-02-18 05:20:00-05:00,2011-02-18,,,,,,,,,,,,,,,,,,2011-02-18 05:20:00-05:00,OS,2011-02-18 04:00:00-05:00,1335.75,1335.25,OS,OS,2011-02-18 04:00:00-05:00,80.0,OS,2011-02-18 04:25:00-05:00,2011-02-18 05:20:00-05:00,OS,0.18,0.82,0.22,0.53,0.0,0.65,0.82,0.4242,0.5455,0.625,0.3032407407407407,0.349537037037037,0.739,0.609,0.8515625,0.6041666666666666,0.937,0.879,0.923,0.923,0.0,1.0,0.18,0.3032407407407407,0.8515625,0.0,1.0,0.0,7.0,6.0,4.0,4.0,6.0,5.0,0.75,6.0,dirty,0.0,1.0,True,post_breakout,0.75,7.333333333333333,7.333333333333333,True
2011-02-22,0:00,1324.25,ES,Confirmation,10:00,,No,,,1324.25,1323.0,1331.75,1331.75,2011-2016,2011-02-22,6:50,1323.0,1331.75,Long,Confirmation,Confirmation,0:00,No,2011-02-22 06:50:00-05:00,2011-02-22,,,,,,,,,,,,,,,,,,2011-02-22 06:50:00-05:00,OS,2011-02-22 04:00:00-05:00,1324.5,1323.75,OS,OS,2011-02-22 04:00:00-05:00,170.0,OS,2011-02-22 04:05:00-05:00,2011-02-22 06:50:00-05:00,OS,0.33,0.68,0.33,0.0,0.0,0.0,0.28,0.1293,0.819,0.8673,0.3345588235294118,0.4227941176470588,0.333,0.833,0.7769230769230769,0.9777777777777776,0.611,1.0,0.933,0.933,0.0,1.0,0.33,0.3345588235294118,0.7769230769230769,1.0,1.0,1.0,2.0,2.0,4.0,9.0,4.0,9.0,1.25,6.0,dirty,-5.0,-5.0,True,post_breakout,1.25,6.0,6.0,True
2011-02-22,0:00,1325.5,ES,Confirmation,12:50,,No,,,1325.5,1327.5,1316.0,1316.0,2011-2016,2011-02-22,11:40,1327.5,1316.0,Short,Confirmation,Confirmation,0:00,No,2011-02-22 11:40:00-05:00,2011-02-22,,,,,,,,,,,,,,,,,,2011-02-22 11:40:00-05:00,RS,2011-02-22 10:30:00-05:00,1326.5,1325.25,RS,RS,2011-02-22 10:30:00-05:00,70.0,RS,2011-02-22 12:05:00-05:00,2011-02-22 11:40:00-05:00,RS,0.67,0.33,0.21,0.5,0.54,0.0,0.5,0.8347,0.1653,0.8347,0.3359375,0.7578125,0.514,0.743,0.5,0.5,0.857,0.914,0.733,0.59,1.0,0.0,0.33,0.7578125,0.5,1.0,0.0,1.0,20.0,4.0,56.0,25.0,90.0,36.0,4.25,3.0,dirty,31.0,54.0,True,frontrun,2.0,4.75,4.75,True
2011-02-23,0:00,1317.75,ES,Confirmation,12:05,,No,,,1317.75,1319.0,1310.25,1310.25,2011-2016,2011-02-23,8:25,1319.0,1310.25,Short,Confirmation,Confirmation,0:00,No,2011-02-23 08:25:00-05:00,2011-02-23,,,,,,,,,,,,,,,,,,2011-02-23 08:25:00-05:00,OS,2011-02-23 04:00:00-05:00,1318.0,1316.75,OS,OS,2011-02-23 04:00:00-05:00,265.0,OS,2011-02-23 06:30:00-05:00,2011-02-23 08:25:00-05:00,OS,0.67,0.33,0.21,0.0,0.0,0.67,0.0,0.8054,0.1678,0.8392,0.5208333333333334,0.4583333333333333,0.919,0.757,1.0,1.0,1.0,0.919,0.975,0.975,1.0,0.0,0.33,0.4583333333333333,1.0,0.0,0.0,0.0,27.0,8.0,63.0,41.0,123.0,115.0,2.0,5.0,dirty,22.0,8.0,True,post_breakout,1.25,6.0,6.0,True
2011-02-23,0:00,1313.0,ES,Confirmation,10:00,,No,,,1313.0,1314.75,1302.5,1302.5,2011-2016,2011-02-23,11:10,1314.75,1302.5,Short,Confirmation,Confirmation,0:00,No,2011-02-23 11:10:00-05:00,2011-02-23,,,,,,,,,,,,,,,,,,2011-02-23 11:10:00-05:00,RS,2011-02-23 10:30:00-05:00,1313.25,1311.0,RS,RS,2011-02-23 10:30:00-05:00,40.0,RS,2011-02-23 11:35:00-05:00,2011-02-23 11:10:00-05:00,RS,0.2,0.8,0.25,0.5,0.32,0.0,0.5,0.4043,0.5532,0.5106,0.6987903225806451,0.3713709677419354,0.789,0.895,0.5,0.5,0.789,0.605,0.568,0.744,0.0,1.0,0.8,0.3713709677419354,0.5,0.0,0.0,0.0,5.0,3.0,6.0,14.0,18.0,18.0,6.5,2.0,mixed,-8.0,0.0,True,frontrun,1.75,6.0,6.0,True
2011-02-24,0:00,1294.75,ES,Confirmation,9:40,,No,,,1294.75,1293.25,1307.75,1307.75,2011-2016,2011-02-24,4:15,1293.25,1307.75,Long,Confirmation,Confirmation,0:00,No,2011-02-24 04:15:00-05:00,2011-02-24,,,,,,,,,,,,,,,,,,2011-02-24 04:15:00-05:00,OS,2011-02-24 04:00:00-05:00,1295.5,1294.5,OS,OS,2011-02-24 04:00:00-05:00,15.0,OS,2011-02-24 05:00:00-05:00,2011-02-24 04:15:00-05:00,OS,0.83,0.17,0.18,0.5,0.0,0.0,0.5,0.6071,0.3214,0.6914,0.1538461538461538,0.1153846153846154,1.0,0.023,0.9263157894736842,0.8515625,0.14,0.535,0.981,0.981,1.0,0.0,0.83,0.1538461538461538,0.9263157894736842,1.0,0.0,1.0,3.0,1.0,5.0,0.0,5.0,0.0,4.0,3.0,dirty,5.0,5.0,True,frontrun,1.5,8.666666666666666,8.666666666666666,True
2011-02-24,0:00,1297.75,ES,Confirmation,9:40,,No,,,1297.75,1296.5,1307.75,1307.75,2011-2016,2011-02-24,7:55,1296.5,1307.75,Long,Confirmation,Confirmation,0:00,No,2011-02-24 07:55:00-05:00,2011-02-24,,,,,,,,,,,,,,,,,,2011-02-24 07:55:00-05:00,OS,2011-02-24 04:00:00-05:00,1297.75,1296.75,OS,OS,2011-02-24 04:00:00-05:00,235.0,OS,2011-02-24 05:00:00-05:00,2011-02-24 07:55:00-05:00,OS,0.86,0.14,0.18,0.21,0.0,0.21,0.5,0.6071,0.3214,0.6914,0.3021551724137931,0.4185344827586206,1.0,0.023,0.979591836734694,0.9138513513513514,0.14,0.535,0.981,0.981,1.0,0.0,0.86,0.3021551724137931,0.979591836734694,1.0,0.0,0.0,16.0,9.0,53.0,40.0,56.0,40.0,3.5,2.0,mixed,13.0,16.0,True,post_breakout,1.25,8.0,8.0,True
2011-02-24,0:00,1305.5,ES,Confirmation,13:55,,No,,,1305.5,1307.25,1294.5,1294.5,2011-2016,2011-02-24,11:35,1307.25,1294.5,Short,Confirmation,Confirmation,0:00,No,2011-02-24 11:35:00-05:00,2011-02-24,,,,,,,,,,,,,,,,,,2011-02-24 11:35:00-05:00,RS,2011-02-24 10:30:00-05:00,1305.5,1303.5,RS,RS,2011-02-24 10:30:00-05:00,65.0,RS,2011-02-24 11:45:00-05:00,2011-02-24 11:35:00-05:00,RS,0.83,0.17,0.19,0.5,0.45,0.0,0.5,0.8347,0.1653,0.8347,0.4894230769230769,0.5951923076923077,1.0,0.023,0.5,0.5,0.886,0.045,0.733,0.59,1.0,0.0,0.17,0.5951923076923077,0.5,0.0,1.0,0.0,8.0,2.0,22.0,39.0,70.0,70.0,7.5,1.0,clean,-17.0,0.0,True,frontrun,1.75,6.285714285714286,6.285714285714286,True
2011-02-25,0:00,1307.5,ES,Confirmation,7:10,,No,,,1307.5,1306.5,1312.75,1307.5,2011-2016,2011-02-25,3:45,1306.5,1312.75,Long,Confirmation,Confirmation,0:00,No,2011-02-25 03:45:00-05:00,2011-02-25,,,,,,,,,,,,,,,,,,2011-02-25 03:45:00-05:00,OR,2011-02-25 03:00:00-05:00,1308.25,1307.5,OR,OR,2011-02-25 03:00:00-05:00,45.0,,,2011-02-25 03:45:00-05:00,OR,0.83,0.17,0.5,0.5,0.5,0.5,0.5,0.6533,0.2667,0.7467,0.5,0.5,0.0,1.0,0.9830508474576272,0.9855072463768116,0.806,0.917,0.95,0.95,1.0,0.0,0.83,0.5,0.9830508474576272,0.0,1.0,0.0,45.0,22.0,74.0,120.0,120.0,272.0,2.5,5.0,dirty,-46.0,-152.0,True,no_breakout,1.0,5.25,0.0,False
2011-02-25,0:00,1312.25,ES,Confirmation,15:55,,No,,,1312.25,1310.25,1321.25,1318.75,2011-2016,2011-02-25,9:45,1310.25,1321.25,Long,Confirmation,Confirmation,0:00,No,2011-02-25 09:45:00-05:00,2011-02-25,,,,,,,,,,,,,,,,,,2011-02-25 09:45:00-05:00,RR,2011-02-25 09:30:00-05:00,1313.25,1311.5,RR,RR,2011-02-25 09:30:00-05:00,15.0,RR,2011-02-25 10:25:00-05:00,2011-02-25 09:45:00-05:00,RR,0.5,0.5,0.5,0.5,0.5,0.5,0.5,0.8361,0.1639,0.8361,0.4024999999999999,0.5325,0.2,0.867,0.5,0.5,0.724,0.621,0.347,0.473,1.0,0.0,0.5,0.4024999999999999,0.5,0.0,0.0,0.0,6.0,2.0,1.0,12.0,1.0,12.0,5.25,2.0,mixed,-11.0,-11.0,True,frontrun,2.0,4.5,3.25,True
2011-02-27,0:00,1313.25,ES,Confirmation,7:15,,No,,,1313.25,1312.0,1320.0,1320.0,2011-2016,2011-02-27,20:50,1312.0,1320.0,Long,Confirmation,Confirmation,0:00,No,2011-02-27 20:50:00-05:00,2011-02-27,,,,,,,,,,,,,,,,,,2011-02-27 20:50:00-05:00,AS,2011-02-27 20:30:00-05:00,1313.75,1313.25,AS,AS,2011-02-27 20:30:00-05:00,20.0,AS,2011-02-27 20:40:00-05:00,2011-02-27 20:50:00-05:00,AS,0.21,0.79,0.16,0.53,0.47,0.05,0.84,0.2805,0.6098,0.7654,0.5,0.5,,,0.9973474801061007,0.9947368421052633,1.0,0.983,0.939,0.921,0.0,1.0,0.21,0.5,0.9973474801061007,1.0,0.0,0.0,28.0,20.0,6.0,22.0,6.0,22.0,1.25,6.0,dirty,-16.0,-16.0,True,post_breakout,1.25,5.4,5.4,True
2011-02-28,0:00,1315.0,ES,Confirmation,7:15,,No,,,1315.0,1314.0,1320.5,1320.5,2011-2016,2011-02-28,5:00,1314.0,1320.5,Long,Confirmation,Confirmation,0:00,No,2011-02-28 05:00:00-05:00,2011-02-28,,,,,,,,,,,,,,,,,,2011-02-28 05:00:00-05:00,OS,2011-02-28 04:00:00-05:00,1316.0,1314.5,OS,OS,2011-02-28 04:00:00-05:00,60.0,OS,2011-02-28 04:10:00-05:00,2011-02-28 05:00:00-05:00,OS,0.81,0.19,0.21,0.1,0.0,0.26,0.42,0.2857,0.7143,0.65,0.3928571428571428,0.4142857142857143,0.366,0.756,0.9824561403508772,0.653125,0.659,0.854,0.977,0.977,0.0,1.0,0.81,0.3928571428571428,0.9824561403508772,1.0,0.0,1.0,30.0,15.0,91.0,42.0,134.0,141.0,2.75,1.0,mixed,49.0,-7.0,True,post_breakout,1.0,5.5,5.5,True
2011-02-28,0:00,1328.0,ES,Confirmation,3:30,,No,,,1328.0,1327.25,1334.5,1334.5,2011-2016,2011-02-28,21:00,1327.25,1334.5,Long,Confirmation,Confirmation,0:00,No,2011-02-28 21:00:00-05:00,2011-02-28,,,,,,,,,,,,,,,,,,2011-02-28 21:00:00-05:00,AS,2011-02-28 20:30:00-05:00,1328.25,1327.75,AS,AS,2011-02-27 20:30:00-05:00,1470.0,AS,2011-02-28 00:00:00-05:00,2011-02-28 21:00:00-05:00,AS,0.21,0.79,0.23,0.92,0.38,0.5,1.0,0.2532,0.6519,0.777,0.5,0.5,,,0.9888888888888888,0.9915254237288136,0.994,0.474,0.692,0.923,1.0,0.0,0.21,0.5,0.9888888888888888,0.0,1.0,1.0,42.0,27.0,23.0,32.0,58.0,99.0,1.0,6.0,dirty,-9.0,-41.0,True,post_breakout,0.75,8.666666666666666,8.666666666666666,True
2011-03-01,0:00,1332.0,ES,Confirmation,10:05,,No,,,1332.0,1333.0,1324.0,1324.0,2011-2016,2011-03-01,6:55,1333.0,1324.0,Short,Confirmation,Confirmation,0:00,No,2011-03-01 06:55:00-05:00,2011-03-01,,,,,,,,,,,,,,,,,,2011-03-01 06:55:00-05:00,OS,2011-03-01 04:00:00-05:00,1332.25,1331.5,OS,OS,2011-03-01 04:00:00-05:00,175.0,OS,2011-03-01 06:35:00-05:00,2011-03-01 06:55:00-05:00,OS,0.5,0.5,0.23,0.5,0.0,0.0,1.0,0.8067,0.1667,0.8333,0.3230769230769231,0.1692307692307692,0.043,0.064,0.9803921568627452,0.8640151515151515,0.447,0.191,0.923,0.923,1.0,0.0,0.5,0.1692307692307692,0.8640151515151515,1.0,0.0,1.0,7.0,4.0,16.0,9.0,16.0,9.0,4.0,3.0,dirty,7.0,7.0,True,post_breakout,1.0,8.0,8.0,True
2011-03-01,0:00,1323.25,ES,Confirmation,14:25,,No,,,1323.25,1325.25,1307.5,1307.5,2011-2016,2011-03-01,11:15,1325.25,1307.5,Short,Confirmation,Confirmation,0:00,No,2011-03-01 11:15:00-05:00,2011-03-01,,,,,,,,,,,,,,,,,,2011-03-01 11:15:00-05:00,RS,2011-03-01 10:30:00-05:00,1323.75,1322.5,RS,RS,2011-03-01 10:30:00-05:00,45.0,RS,2011-03-01 11:45:00-05:00,2011-03-01 11:15:00-05:00,RS,0.0,1.0,0.21,0.5,0.39,0.0,0.5,0.1441,0.8288,0.8829,0.6453947368421052,0.3769736842105263,0.02,0.041,0.5,0.5,0.061,0.061,0.568,0.752,0.0,1.0,1.0,0.3769736842105263,0.5,0.0,0.0,0.0,23.0,7.0,19.0,17.0,45.0,44.0,5.5,2.0,mixed,2.0,1.0,True,frontrun,2.0,7.875,7.875,True
2011-03-01,0:00,1301.25,ES,Confirmation,12:50,,Yes,,,1301.25,1302.25,1293.5,1302.25,2011-2016,2011-03-01,20:50,1302.25,1293.5,Short,Confirmation,Confirmation,0:00,Yes,2011-03-01 20:50:00-05:00,2011-03-01,,,,,,,,,,,,,,,,,,2011-03-01 20:50:00-05:00,AS,2011-03-01 20:30:00-05:00,1301.25,1300.0,AS,AS,2011-02-28 20:30:00-05:00,1460.0,AS,2011-03-01 00:00:00-05:00,2011-03-01 20:50:00-05:00,AS,0.5,0.5,0.3,0.5,0.17,0.0,0.5,0.336,0.6,0.6975,0.5,0.5,,,0.99009900990099,0.9973474801061007,1.0,1.0,0.952,0.984,0.0,1.0,0.5,0.5,0.9973474801061007,1.0,1.0,1.0,17.0,9.0,3.0,14.0,3.0,14.0,5.0,1.0,clean,-11.0,-11.0,True,post_breakout,1.0,7.75,-1.0,False
2011-03-02,0:00,1298.75,ES,Confirmation,8:25,,Yes,,,1298.75,1297.75,1306.5,1297.75,2011-2016,2011-03-02,4:25,1297.75,1306.5,Long,Confirmation,Confirmation,0:00,Yes,2011-03-02 04:25:00-05:00,2011-03-02,,,,,,,,,,,,,,,,,,2011-03-02 04:25:00-05:00,OS,2011-03-02 04:00:00-05:00,1300.0,1298.75,OS,OS,2011-03-02 04:00:00-05:00,25.0,OS,2011-03-02 05:15:00-05:00,2011-03-02 04:25:00-05:00,OS,0.71,0.29,0.24,0.5,0.0,0.0,0.5,0.2667,0.7,0.7333,0.125,0.15625,0.387,0.355,0.9827586206896552,0.981132075471698,0.71,1.0,0.981,0.981,0.0,1.0,0.71,0.125,0.9827586206896552,1.0,0.0,1.0,7.0,1.0,33.0,38.0,43.0,51.0,2.0,6.0,dirty,-5.0,-8.0,True,frontrun,1.0,7.75,-1.0,False
2011-03-02,0:00,1298.75,ES,Confirmation,10:05,,No,,,1298.75,1297.25,1309.5,1309.5,2011-2016,2011-03-02,8:30,1297.25,1309.5,Long,Confirmation,Confirmation,0:00,No,2011-03-02 08:30:00-05:00,2011-03-02,,,,,,,,,,,,,,,,,,2011-03-02 08:30:00-05:00,TR,2011-03-02 08:30:00-05:00,1299.5,1298.0,TR,TR,2011-03-02 08:30:00-05:00,0.0,,,2011-03-02 08:30:00-05:00,TR,0.5,0.5,0.5,0.5,0.5,0.5,0.5,0.4699,0.4789,0.7458,0.2983974358974359,0.3221153846153846,0.387,0.355,0.5,0.5,0.419,1.0,0.981,0.981,0.0,0.0,0.5,0.2983974358974359,0.5,1.0,0.0,0.0,13.0,3.0,34.0,20.0,62.0,61.0,4.5,3.0,dirty,14.0,1.0,True,m7_first_two,1.5,7.166666666666667,7.166666666666667,True
2011-03-02,0:00,1308.25,ES,Confirmation,0:50,,No,,,1308.25,1307.5,1313.75,1313.75,2011-2016,2011-03-02,20:35,1307.5,1313.75,Long,Confirmation,Confirmation,0:00,No,2011-03-02 20:35:00-05:00,2011-03-02,,,,,,,,,,,,,,,,,,2011-03-02 20:35:00-05:00,AS,2011-03-02 20:30:00-05:00,1308.75,1308.25,AS,AS,2011-03-01 20:30:00-05:00,1445.0,AS,2011-03-02 00:00:00-05:00,2011-03-02 20:35:00-05:00,AS,0.78,0.22,0.23,0.5,0.0,0.0,0.5,0.2771,0.6145,0.7561,0.5,0.5,,,0.9973474801061007,0.9973474801061007,1.0,1.0,0.929,0.786,1.0,0.0,0.78,0.5,0.9973474801061007,0.0,1.0,0.0,9.0,8.0,5.0,4.0,5.0,4.0,1.25,6.0,dirty,1.0,1.0,True,post_breakout,0.75,7.333333333333333,7.333333333333333,True
2011-03-03,0:00,1311.0,ES,Confirmation,6:30,,No,,,1311.0,1310.0,1316.25,1316.25,2011-2016,2011-03-03,4:35,1310.0,1316.25,Long,Confirmation,Confirmation,0:00,No,2011-03-03 04:35:00-05:00,2011-03-03,,,,,,,,,,,,,,,,,,2011-03-03 04:35:00-05:00,OS,2011-03-03 04:00:00-05:00,1311.75,1311.0,OS,OS,2011-03-03 04:00:00-05:00,35.0,OS,2011-03-03 05:10:00-05:00,2011-03-03 04:35:00-05:00,OS,0.0,1.0,0.18,0.5,0.0,0.0,0.5,0.2821,0.641,0.7746,0.1612903225806451,0.1290322580645161,0.27,0.378,0.9927536231884058,0.9927536231884058,0.838,0.811,0.938,0.938,0.0,1.0,0.0,0.1612903225806451,0.9927536231884058,0.0,1.0,0.0,6.0,6.0,10.0,10.0,15.0,20.0,2.0,4.0,dirty,0.0,-5.0,True,frontrun,1.0,5.25,5.25,True
2011-03-03,0:00,1321.75,ES,Confirmation,12:50,,No,,,1321.75,1320.5,1328.0,1328.0,2011-2016,2011-03-03,10:35,1320.5,1328.0,Long,Confirmation,Confirmation,0:00,No,2011-03-03 10:35:00-05:00,2011-03-03,,,,,,,,,,,,,,,,,,2011-03-03 10:35:00-05:00,RS,2011-03-03 10:30:00-05:00,1322.75,1321.25,RS,RS,2011-03-03 10:30:00-05:00,5.0,RS,2011-03-03 11:00:00-05:00,2011-03-03 10:35:00-05:00,RS,0.8,0.2,0.19,0.5,0.0,0.0,0.5,0.84,0.16,0.84,0.5102272727272728,0.5306818181818181,0.27,0.378,0.5,0.5,0.459,0.811,0.363,0.794,1.0,0.0,0.8,0.5102272727272728,0.5,1.0,0.0,1.0,17.0,4.0,13.0,13.0,13.0,13.0,4.75,1.0,clean,0.0,0.0,True,m7_first_two,1.25,5.0,5.0,True
2011-03-04,0:00,1330.75,ES,Confirmation,12:20,,No,,,1330.75,1333.0,1313.75,1313.75,2011-2016,2011-03-04,9:20,1333.0,1313.75,Short,Confirmation,Confirmation,0:00,No,2011-03-04 09:20:00-05:00,2011-03-04,,,,,,,,,,,,,,,,,,2011-03-04 09:20:00-05:00,TR,2011-03-04 08:30:00-05:00,1331.0,1329.75,TR,TR,2011-03-04 08:30:00-05:00,50.0,,,2011-03-04 09:20:00-05:00,TR,0.5,0.5,0.5,0.5,0.5,0.5,0.5,0.47,0.479,0.7462,0.2851190476190476,0.3077380952380952,0.056,0.694,0.5,0.5,0.583,0.611,0.968,0.968,0.0,0.0,0.5,0.3077380952380952,0.5,1.0,0.0,1.0,27.0,12.0,137.0,112.0,398.0,364.0,4.5,3.0,dirty,25.0,34.0,True,no_breakout,2.25,7.555555555555555,7.555555555555555,True
2011-03-07,0:00,1323.25,ES,Confirmation,11:30,,No,,,1323.25,1324.75,1311.25,1323.25,2011-2016,2011-03-07,10:30,1324.75,1311.25,Short,Confirmation,Confirmation,0:00,No,2011-03-07 10:30:00-05:00,2011-03-07,,,,,,,,,,,,,,,,,,2011-03-07 10:30:00-05:00,RS,2011-03-07 10:30:00-05:00,1323.75,1321.0,RS,RS,2011-03-07 10:30:00-05:00,0.0,RS,2011-03-07 10:35:00-05:00,2011-03-07 10:30:00-05:00,RS,0.75,0.25,0.15,0.5,0.0,0.0,0.5,0.8425,0.1575,0.8425,0.6163461538461539,0.7692307692307693,0.657,0.823,0.5,0.5,0.977,0.8,0.353,0.706,0.0,1.0,0.25,0.7692307692307693,0.5,0.0,0.0,1.0,17.0,5.0,32.0,48.0,38.0,52.0,9.5,1.0,clean,-16.0,-14.0,True,m7_first_two,1.5,8.0,-0.0,False
2011-03-07,0:00,1320.75,ES,Confirmation,1:55,,No,,,1320.75,1322.0,1311.25,1315.0,2011-2016,2011-03-07,19:45,1322.0,1311.25,Short,Confirmation,Confirmation,0:00,No,2011-03-07 19:45:00-05:00,2011-03-07,,,,,,,,,,,,,,,,,,2011-03-07 19:45:00-05:00,AR,2011-03-07 19:30:00-05:00,1311.25,1310.75,AR,AR,2011-03-07 19:30:00-05:00,15.0,AR,2011-03-07 20:25:00-05:00,2011-03-07 19:45:00-05:00,AR,0.54,0.46,0.5,0.5,0.5,0.5,0.5,0.3333,0.6032,0.6975,0.5,0.5,0.657,0.823,0.5,0.5,0.977,0.497,0.765,0.824,0.0,1.0,0.46,0.5,0.5,1.0,0.0,1.0,0.0,0.0,0.0,0.0,129.0,106.0,10.5,0.0,clean,0.0,23.0,False,frontrun,1.25,7.6,4.6,True
2011-03-08,0:00,1315.25,ES,Confirmation,7:30,,No,,,1315.25,1316.25,1310.0,1310.0,2011-2016,2011-03-08,6:15,1316.25,1310.0,Short,Confirmation,Confirmation,0:00,No,2011-03-08 06:15:00-05:00,2011-03-08,,,,,,,,,,,,,,,,,,2011-03-08 06:15:00-05:00,OS,2011-03-08 04:00:00-05:00,1315.75,1315.25,OS,OS,2011-03-08 04:00:00-05:00,135.0,OS,2011-03-08 05:35:00-05:00,2011-03-08 06:15:00-05:00,OS,0.0,1.0,0.23,0.0,0.0,0.0,0.2,0.2785,0.6456,0.7778,0.4185344827586206,0.255603448275862,0.316,0.579,0.9803921568627452,0.979591836734694,0.974,0.737,0.941,0.941,0.0,1.0,1.0,0.255603448275862,0.979591836734694,1.0,0.0,1.0,17.0,10.0,85.0,75.0,111.0,97.0,2.25,5.0,dirty,10.0,14.0,True,post_breakout,1.0,5.25,5.25,True
2011-03-08,0:00,1308.75,ES,Confirmation,15:55,,No,,,1308.75,1306.0,1327.25,1321.75,2011-2016,2011-03-08,9:55,1306.0,1327.25,Long,Confirmation,Confirmation,0:00,No,2011-03-08 09:55:00-05:00,2011-03-08,,,,,,,,,,,,,,,,,,2011-03-08 09:55:00-05:00,RR,2011-03-08 09:30:00-05:00,1311.75,1308.75,RR,RR,2011-03-08 09:30:00-05:00,25.0,RR,2011-03-08 10:25:00-05:00,2011-03-08 09:55:00-05:00,RR,0.6,0.4,0.5,0.5,0.5,0.5,0.5,0.1429,0.8304,0.8839,0.5782894736842106,0.3098684210526315,0.316,0.579,0.5,0.5,0.974,0.132,0.352,0.455,0.0,1.0,0.6,0.5782894736842106,0.5,1.0,0.0,1.0,4.0,1.0,8.0,3.0,8.0,3.0,10.25,0.0,clean,5.0,5.0,True,frontrun,2.75,6.7272727272727275,4.7272727272727275,True
2011-03-09,0:00,1318.25,ES,Confirmation,9:05,,Be,,,1318.25,1317.0,1325.5,1318.25,2011-2016,2011-03-09,3:40,1317.0,1325.5,Long,Confirmation,Confirmation,0:00,Be,2011-03-09 03:40:00-05:00,2011-03-09,,,,,,,,,,,,,,,,,,2011-03-09 03:40:00-05:00,OR,2011-03-09 03:00:00-05:00,1318.75,1317.75,OR,OR,2011-03-09 03:00:00-05:00,40.0,,,2011-03-09 03:40:00-05:00,OR,0.0,1.0,0.5,0.5,0.5,0.5,0.5,0.25,0.75,0.7,0.5,0.5,1.0,0.4,0.9830508474576272,0.9855072463768116,1.0,0.644,0.968,0.968,0.0,1.0,0.0,0.5,0.9830508474576272,1.0,1.0,1.0,85.0,36.0,238.0,177.0,246.0,212.0,0.75,6.0,dirty,61.0,34.0,True,no_breakout,1.25,5.8,0.0,False
2011-03-10,0:00,1298.0,ES,Confirmation,1:20,,No,,,1298.0,1299.25,1289.25,1289.25,2011-2016,2011-03-10,20:20,1299.25,1289.25,Short,Confirmation,Confirmation,0:00,No,2011-03-10 20:20:00-05:00,2011-03-10,,,,,,,,,,,,,,,,,,2011-03-10 20:20:00-05:00,AR,2011-03-10 19:30:00-05:00,1298.25,1297.5,AR,AR,2011-03-10 19:30:00-05:00,50.0,AR,2011-03-10 20:25:00-05:00,2011-03-10 20:20:00-05:00,AR,0.33,0.67,0.5,0.5,0.5,0.5,0.5,0.2857,0.6071,0.747,0.5,0.5,0.611,0.778,0.5,0.5,0.972,0.889,0.948,0.856,0.0,1.0,0.67,0.5,0.5,0.0,0.0,0.0,0.0,0.0,6.0,6.0,25.0,16.0,2.0,6.0,dirty,0.0,9.0,False,frontrun,1.25,7.0,7.0,True
2011-03-11,0:00,1294.0,ES,Confirmation,15:00,,No,,,1294.0,1292.0,1305.75,1305.75,2011-2016,2011-03-11,10:45,1292.0,1305.75,Long,Confirmation,Confirmation,0:00,No,2011-03-11 10:45:00-05:00,2011-03-11,,,,,,,,,,,,,,,,,,2011-03-11 10:45:00-05:00,RS,2011-03-11 10:30:00-05:00,1296.0,1293.25,RS,RS,2011-03-11 10:30:00-05:00,15.0,RS,2011-03-11 11:35:00-05:00,2011-03-11 10:45:00-05:00,RS,0.67,0.33,0.18,0.5,0.1,0.0,0.5,0.7895,0.1842,0.7895,0.4791666666666667,0.5416666666666666,0.733,0.133,0.5,0.5,0.985,0.134,0.642,0.585,1.0,0.0,0.67,0.4791666666666667,0.5,0.0,1.0,0.0,13.0,4.0,18.0,21.0,31.0,35.0,2.75,6.0,dirty,-3.0,-4.0,True,frontrun,2.0,5.875,5.875,True
2011-03-14,0:00,1286.5,ES,Confirmation,22:10,,No,,,1286.5,1287.75,1275.0,1275.0,2011-2016,2011-03-14,20:40,1287.75,1275.0,Short,Confirmation,Confirmation,0:00,No,2011-03-14 20:40:00-04:00,2011-03-14,,,,,,,,,,,,,,,,,,2011-03-14 20:40:00-04:00,AS,2011-03-14 20:30:00-04:00,1287.0,1283.75,AS,AS,2011-03-13 21:30:00-04:00,1390.0,AS,2011-03-14 00:00:00-04:00,2011-03-14 20:40:00-04:00,AS,0.25,0.75,0.29,0.5,0.06,0.0,0.5,0.2667,0.6593,0.6667,0.5,0.5,,,0.99009900990099,0.9947368421052633,0.97,0.932,0.944,0.778,0.0,1.0,0.75,0.5,0.9947368421052633,0.0,0.0,0.0,20.0,7.0,12.0,43.0,61.0,65.0,5.5,1.0,clean,-31.0,-4.0,True,post_breakout,1.25,9.2,9.2,True
2011-03-15,0:00,1256.0,ES,Confirmation,15:20,,No,,,1256.0,1250.75,1281.0,1281.0,2011-2016,2011-03-15,9:25,1250.75,1281.0,Long,Confirmation,Confirmation,0:00,No,2011-03-15 09:25:00-04:00,2011-03-15,,,,,,,,,,,,,,,,,,2011-03-15 09:25:00-04:00,TR,2011-03-15 08:30:00-04:00,1256.75,1255.25,TR,TR,2011-03-15 08:30:00-04:00,55.0,,,2011-03-15 09:25:00-04:00,TR,0.5,0.5,0.5,0.5,0.5,0.5,0.5,0.4699,0.4796,0.745,0.3473484848484848,0.3943181818181818,0.982,0.083,0.5,0.5,0.97,0.284,0.976,0.976,0.0,0.0,0.5,0.3473484848484848,0.5,1.0,0.0,0.0,15.0,9.0,50.0,52.0,60.0,53.0,9.25,2.0,mixed,-2.0,7.0,True,no_breakout,5.25,4.761904761904762,4.761904761904762,True
2011-03-15,0:00,1274.75,ES,Confirmation,22:55,,Be,,,1274.75,1272.5,1286.75,1272.5,2011-2016,2011-03-15,20:15,1272.5,1286.75,Long,Confirmation,Confirmation,0:00,Be,2011-03-15 20:15:00-04:00,2011-03-15,,,,,,,,,,,,,,,,,,2011-03-15 20:15:00-04:00,AR,2011-03-15 19:30:00-04:00,1275.75,1274.75,AR,AR,2011-03-15 19:30:00-04:00,45.0,AR,2011-03-15 20:25:00-04:00,2011-03-15 20:15:00-04:00,AR,0.38,0.62,0.5,0.5,0.5,0.5,0.5,0.2671,0.6398,0.7733,0.5,0.5,0.939,0.242,0.5,0.5,0.97,0.576,0.954,0.907,1.0,0.0,0.38,0.5,0.5,0.0,0.0,0.0,0.0,0.0,5.0,2.0,7.0,12.0,8.0,1.0,clean,3.0,-5.0,False,frontrun,2.25,5.333333333333333,-1.0,False
2011-03-16,0:00,1273.75,ES,Confirmation,5:35,,Be,,,1273.75,1271.5,1286.75,1271.5,2011-2016,2011-03-16,0:30,1271.5,1286.75,Long,Confirmation,Confirmation,0:00,Be,2011-03-16 00:30:00-04:00,2011-03-16,,,,,,,,,,,,,,,,,,2011-03-16 00:30:00-04:00,AS,2011-03-15 20:30:00-04:00,1274.25,1273.5,AS,AS,2011-03-15 20:30:00-04:00,240.0,AS,2011-03-16 00:00:00-04:00,2011-03-16 00:30:00-04:00,AS,0.76,0.24,0.25,0.12,1.0,0.12,0.35,0.2671,0.6398,0.7733,0.5,0.5,,,0.981132075471698,0.8266666666666667,0.851,1.0,0.982,0.982,1.0,0.0,0.76,0.5,0.981132075471698,0.0,0.0,0.0,11.0,7.0,23.0,12.0,38.0,45.0,1.25,6.0,dirty,11.0,-7.0,True,post_breakout,2.25,5.777777777777778,-1.0,False
2011-03-16,0:00,1275.5,ES,Confirmation,13:40,,No,,,1275.5,1277.5,1255.25,1255.25,2011-2016,2011-03-16,10:50,1277.5,1255.25,Short,Confirmation,Confirmation,0:00,No,2011-03-16 10:50:00-04:00,2011-03-16,,,,,,,,,,,,,,,,,,2011-03-16 10:50:00-04:00,RS,2011-03-16 10:30:00-04:00,1275.75,1273.5,RS,RS,2011-03-16 10:30:00-04:00,20.0,RS,2011-03-16 10:35:00-04:00,2011-03-16 10:50:00-04:00,RS,0.63,0.37,0.38,0.7,0.41,0.22,0.89,0.1416,0.8319,0.885,0.7272727272727273,0.2937062937062937,0.602,0.981,0.5,0.5,0.77,0.994,0.5,0.667,1.0,0.0,0.37,0.2937062937062937,0.5,0.0,1.0,0.0,6.0,2.0,8.0,18.0,25.0,47.0,20.0,0.0,clean,-10.0,-22.0,True,post_breakout,2.0,10.125,10.125,True
2011-03-18,0:00,1283.25,ES,Confirmation,14:15,,No,,,1283.25,1285.25,1273.5,1273.5,2011-2016,2011-03-18,9:35,1285.25,1273.5,Short,Confirmation,Confirmation,0:00,No,2011-03-18 09:35:00-04:00,2011-03-18,,,,,,,,,,,,,,,,,,2011-03-18 09:35:00-04:00,RR,2011-03-18 09:30:00-04:00,1284.25,1282.5,RR,RR,2011-03-18 09:30:00-04:00,5.0,RR,2011-03-18 10:25:00-04:00,2011-03-18 09:35:00-04:00,RR,0.5,0.5,0.5,0.5,0.5,0.5,0.5,0.7102,0.2784,0.767,0.4448529411764706,0.4448529411764706,1.0,0.974,0.5,0.5,1.0,0.816,0.282,0.312,0.0,1.0,0.5,0.4448529411764706,0.5,0.0,0.0,0.0,8.0,2.0,13.0,2.0,13.0,2.0,4.0,5.0,dirty,11.0,11.0,True,m7_first_two,2.0,4.875,4.875,True
2011-03-20,0:00,1279.75,ES,Confirmation,21:55,,No,,,1279.75,1278.5,1285.0,1285.0,2011-2016,2011-03-20,21:30,1278.5,1285.0,Long,Confirmation,Confirmation,0:00,No,2011-03-20 21:30:00-04:00,2011-03-20,,,,,,,,,,,,,,,,,,2011-03-20 21:30:00-04:00,AS,2011-03-20 20:30:00-04:00,1280.75,1279.75,AS,AS,2011-03-20 20:30:00-04:00,60.0,AS,2011-03-20 22:05:00-04:00,2011-03-20 21:30:00-04:00,AS,0.8,0.2,0.16,0.5,0.5,0.0,0.5,0.6625,0.2375,0.7368,0.5,0.5,,,0.979591836734694,0.9888888888888888,0.976,0.855,0.934,0.928,1.0,0.0,0.8,0.5,0.979591836734694,1.0,0.0,1.0,32.0,19.0,13.0,43.0,13.0,43.0,2.0,5.0,dirty,-30.0,-30.0,True,frontrun,1.25,4.2,4.2,True
2011-03-21,0:00,1283.5,ES,Confirmation,10:30,,No,,,1283.5,1282.5,1295.25,1295.25,2011-2016,2011-03-21,2:45,1282.5,1295.25,Long,Confirmation,Confirmation,0:00,No,2011-03-21 02:45:00-04:00,2011-03-21,,,,,,,,,,,,,,,,,,2011-03-21 02:45:00-04:00,TO,2011-03-21 02:00:00-04:00,1283.75,1283.25,TO,TO,2011-03-21 02:00:00-04:00,45.0,,,2011-03-21 02:45:00-04:00,TO,0.5,0.5,0.5,0.5,0.5,0.5,0.5,0.4719,0.4779,0.7448,0.5,0.5,,,0.9263157894736842,0.8764705882352941,0.847,0.75,0.994,0.994,0.0,0.0,0.5,0.5,0.9263157894736842,0.0,0.0,1.0,17.0,15.0,35.0,41.0,35.0,41.0,2.5,4.0,dirty,-6.0,-6.0,True,no_breakout,1.0,11.75,11.75,True
01/03/2018,,2698.25,,,,,,,,,,,2710.5,2018,2018-01-03,9:35,2697.25,2710.5,Long,M7 Candle,No Conf,,W,2018-01-03 09:35:00-05:00,2018-01-03,,9:35,ES,No Conf,Long,RDR,M7 Candle,W,2698.25,2697.25,2710.5,2710.5,RDR,,,,,2018-01-03 09:35:00-05:00,RR,2018-01-03 09:30:00-05:00,2701.5,2697.75,RR,RR,2018-01-03 09:30:00-05:00,5.0,RR,2018-01-03 10:25:00-05:00,2018-01-03 09:35:00-05:00,RR,0.86,0.14,0.5,0.5,0.5,0.5,0.5,0.8795,0.1133,0.8973,0.6163461538461539,0.6138613861386139,0.974,0.872,0.5,0.5,1.0,0.513,0.219,0.345,1.0,0.0,0.86,0.6163461538461539,0.5,0.0,0.0,0.0,14.0,2.0,63.0,46.0,68.0,56.0,7.75,0.0,clean,17.0,12.0,True,m7_first_two,1.0,12.25,12.25,True
01/03/2018,,2706.0,,,,,,,,,,,2712.5,2018_set2,2018-01-03,11:05,2704.75,2714.75,Long,Mode,Confirmed,10:30,W,2018-01-03 11:05:00-05:00,2018-01-03,10:30,11:05,ES,Confirmed,Long,RDR,Mode,W,,,,,RDR,2706.0,2704.75,2714.75,2712.5,2018-01-03 11:05:00-05:00,RS,2018-01-03 10:30:00-05:00,2706.5,2705.5,RR,RR,2018-01-03 09:30:00-05:00,95.0,RR,2018-01-03 10:25:00-05:00,2018-01-03 11:05:00-05:00,RS,0.69,0.31,0.31,0.45,0.63,0.08,0.83,0.8795,0.1133,0.8973,0.238095238095238,0.8809523809523809,0.974,0.872,0.5,0.5,0.769,0.513,0.309,0.841,1.0,0.0,0.69,0.238095238095238,0.5,0.0,0.0,0.0,0.0,0.0,0.0,0.0,0.0,0.0,1.75,6.0,dirty,0.0,0.0,False,post_breakout,1.25,7.0,5.2,True
01/04/2018,,2721.0,,,,,,,,,,,2724.0,2018,2018-01-04,9:35,2719.0,2730.0,Long,Mode,No Conf,,W,2018-01-04 09:35:00-05:00,2018-01-04,,9:35,ES,No Conf,Long,RDR,Mode,W,2721.0,2719.0,2730.0,2724.0,RDR,,,,,2018-01-04 09:35:00-05:00,RR,2018-01-04 09:30:00-05:00,2722.5,2720.75,RR,RR,2018-01-04 09:30:00-05:00,5.0,RR,2018-01-04 10:25:00-05:00,2018-01-04 09:35:00-05:00,RR,0.5,0.5,0.5,0.5,0.5,0.5,0.5,0.8795,0.1133,0.8973,0.6163461538461539,0.6138613861386139,0.769,0.282,0.5,0.5,0.795,0.59,0.219,0.345,1.0,0.0,0.5,0.6163461538461539,0.5,1.0,0.0,1.0,0.0,0.0,0.0,0.0,0.0,0.0,5.0,3.0,dirty,0.0,0.0,False,m7_first_two,2.0,4.5,1.5,True
01/04/2018,,2723.75,,,,,,,,,,,2721.75,2018_set2,2018-01-04,11:15,2721.75,2733.25,Long,Mode,Confirmed,10:30,EX,2018-01-04 11:15:00-05:00,2018-01-04,10:30,11:15,ES,Confirmed,Long,RDR,Mode,EX,,,,,RDR,2723.75,2721.75,2733.25,2721.75,2018-01-04 11:15:00-05:00,RS,2018-01-04 10:30:00-05:00,2726.25,2722.75,RR,RR,2018-01-04 09:30:00-05:00,105.0,RR,2018-01-04 10:25:00-05:00,2018-01-04 11:15:00-05:00,RS,0.77,0.23,0.24,0.12,0.73,0.05,0.5,0.8795,0.1133,0.8973,0.238095238095238,0.8809523809523809,0.769,0.282,0.5,0.5,0.436,0.59,0.309,0.85,1.0,0.0,0.77,0.238095238095238,0.5,0.0,0.0,1.0,0.0,0.0,0.0,0.0,0.0,0.0,0.75,6.0,dirty,0.0,0.0,False,post_breakout,2.0,4.75,-1.0,False
01/05/2018,,2732.0,,,,,,,,,,,2738.75,2018_set2,2018-01-05,13:00,2730.75,2738.75,Long,Mode,Confirmed,11:15,W,2018-01-05 13:00:00-05:00,2018-01-05,11:15,13:00,ES,Confirmed,Long,RDR,Mode,W,,,,,RDR,2732.0,2730.75,2738.75,2738.75,2018-01-05 13:00:00-05:00,RS,2018-01-05 10:30:00-05:00,2732.75,2732.0,RR,RR,2018-01-05 09:30:00-05:00,210.0,RR,2018-01-05 10:25:00-05:00,2018-01-05 13:00:00-05:00,RS,0.73,0.27,0.17,0.27,0.91,0.27,0.64,0.2581,0.7312,0.7455,0.545,0.545,0.607,0.429,0.5,0.5,0.286,0.607,0.699,0.865,0.0,1.0,0.73,0.545,0.5,0.0,0.0,0.0,5.0,5.0,18.0,14.0,18.0,19.0,2.0,5.0,dirty,4.0,-1.0,True,post_breakout,1.25,5.4,5.4,True
01/08/2018,,2739.5,,,,,,,,,,,2747.25,2018_set2,2018-01-08,10:45,2738.0,2747.25,Long,Mode,Wick,10:30,W,2018-01-08 10:45:00-05:00,2018-01-08,10:30,10:45,ES,Wick,Long,RDR,Mode,W,,,,,RDR,2739.5,2738.0,2747.25,2747.25,2018-01-08 10:45:00-05:00,RS,2018-01-08 10:30:00-05:00,2741.75,2739.5,RR,RR,2018-01-08 09:30:00-05:00,75.0,RR,2018-01-08 10:25:00-05:00,2018-01-08 10:45:00-05:00,RS,0.57,0.43,0.18,0.5,0.08,0.0,0.5,0.157,0.8292,0.884,0.6145833333333334,0.3625,0.08,0.88,0.5,0.5,0.8,0.92,0.698,0.508,1.0,0.0,0.57,0.6145833333333334,0.5,0.0,1.0,0.0,4.0,1.0,7.0,11.0,7.0,11.0,2.75,3.0,dirty,-4.0,-4.0,True,post_breakout,1.5,5.166666666666667,5.166666666666667,True
01/08/2018,,2741.75,,,,,,,,,,,2748.0,2018,2018-01-08,11:25,2740.75,2748.0,Long,Mode,Confirmed,11:10,W,2018-01-08 11:25:00-05:00,2018-01-08,11:10,11:25,ES,Confirmed,Long,RDR,Mode,W,2741.75,2740.75,2748.0,2748.0,RDR,,,,,2018-01-08 11:25:00-05:00,RS,2018-01-08 10:30:00-05:00,2743.0,2741.75,RR,RR,2018-01-08 09:30:00-05:00,115.0,RR,2018-01-08 10:25:00-05:00,2018-01-08 11:25:00-05:00,RS,0.82,0.18,0.15,0.18,0.73,0.09,0.55,0.157,0.8292,0.884,0.6145833333333334,0.43125,0.08,0.88,0.5,0.5,0.8,0.92,0.783,0.525,1.0,0.0,0.82,0.6145833333333334,0.5,0.0,0.0,0.0,1.0,0.0,4.0,8.0,14.0,20.0,1.5,6.0,dirty,-4.0,-6.0,False,post_breakout,1.0,6.25,6.25,True
01/09/2018,,2749.5,,,,,,,,,,,2758.25,2018_set2,2018-01-09,10:55,2748.0,2758.25,Long,Retired,Wick,10:30,W,2018-01-09 10:55:00-05:00,2018-01-09,10:30,10:55,ES,Wick,Long,RDR,Retired,W,,,,,RDR,2749.5,2748.0,2758.25,2758.25,2018-01-09 10:55:00-05:00,RS,2018-01-09 10:30:00-05:00,2751.25,2749.5,RR,RR,2018-01-09 09:30:00-05:00,85.0,RR,2018-01-09 10:25:00-05:00,2018-01-09 10:55:00-05:00,RS,0.67,0.33,0.21,0.5,0.19,0.0,0.5,0.425,0.55,0.6051,0.4319444444444444,0.5291666666666667,0.812,0.812,0.5,0.5,0.912,0.118,0.567,0.687,1.0,0.0,0.67,0.4319444444444444,0.5,1.0,0.0,1.0,3.0,1.0,8.0,1.0,8.0,1.0,9.0,0.0,clean,7.0,7.0,True,post_breakout,1.5,5.833333333333333,5.833333333333333,True
01/09/2018,,2749.5,,,,,,,,,,,2758.5,2018,2018-01-09,10:55,2748.25,2758.5,Long,Mode,No Conf,,W,2018-01-09 10:55:00-05:00,2018-01-09,,10:55,ES,No Conf,Long,RDR,Mode,W,2749.5,2748.25,2758.5,2758.5,RDR,,,,,2018-01-09 10:55:00-05:00,RS,2018-01-09 10:30:00-05:00,2751.25,2749.5,RR,RR,2018-01-09 09:30:00-05:00,85.0,RR,2018-01-09 10:25:00-05:00,2018-01-09 10:55:00-05:00,RS,0.67,0.33,0.21,0.5,0.19,0.0,0.5,0.425,0.55,0.6051,0.4319444444444444,0.5291666666666667,0.812,0.812,0.5,0.5,0.912,0.118,0.567,0.687,1.0,0.0,0.67,0.4319444444444444,0.5,1.0,0.0,1.0,3.0,1.0,8.0,1.0,8.0,1.0,9.0,0.0,clean,7.0,7.0,True,post_breakout,1.25,7.2,7.2,True
01/10/2018,,2743.75,,,,,,,,,,,2748.75,2018_set2,2018-01-10,10:55,2741.75,2752.75,Long,Mode,Wick,10:40,W,2018-01-10 10:55:00-05:00,2018-01-10,10:40,10:55,ES,Wick,Long,RDR,Mode,W,,,,,RDR,2743.75,2741.75,2752.75,2748.75,2018-01-10 10:55:00-05:00,RS,2018-01-10 10:30:00-05:00,2745.25,2743.5,RR,RR,2018-01-10 09:30:00-05:00,85.0,RR,2018-01-10 10:25:00-05:00,2018-01-10 10:55:00-05:00,RS,0.57,0.43,0.3,0.5,0.22,0.0,0.5,0.184,0.8037,0.8491,0.4259615384615384,0.5528846153846154,0.208,0.755,0.5,0.5,0.358,0.792,0.751,0.44,0.0,0.0,0.57,0.4259615384615384,0.5,0.0,1.0,0.0,0.0,0.0,0.0,0.0,0.0,0.0,4.75,0.0,clean,0.0,0.0,False,post_breakout,2.0,4.5,2.5,True
01/11/2018,,2754.0,,,,,,,,,,,2764.0,2018_set2,2018-01-11,10:35,2752.5,2764.0,Long,Frontrun,No Conf,,W,2018-01-11 10:35:00-05:00,2018-01-11,,10:35,ES,No Conf,Long,RDR,Frontrun,W,,,,,RDR,2754.0,2752.5,2764.0,2764.0,2018-01-11 10:35:00-05:00,RS,2018-01-11 10:30:00-05:00,2754.5,2753.25,RR,RR,2018-01-11 09:30:00-05:00,65.0,RR,2018-01-11 10:25:00-05:00,2018-01-11 10:35:00-05:00,RS,0.52,0.48,0.21,0.5,0.0,0.0,0.5,0.6489,0.3321,0.6322,0.5,0.4599999999999999,1.0,0.773,0.5,0.5,0.85,0.775,0.511,0.748,1.0,0.0,0.52,0.5,0.5,1.0,0.0,1.0,8.0,3.0,64.0,44.0,122.0,141.0,6.0,1.0,clean,20.0,-19.0,True,post_breakout,1.5,6.666666666666667,6.666666666666667,True
01/11/2018,,2754.5,,,,,,,,,,,2766.75,2018,2018-01-11,10:40,2753.25,2766.75,Long,Frontrun,No Conf,,W,2018-01-11 10:40:00-05:00,2018-01-11,,10:40,ES,No Conf,Long,RDR,Frontrun,W,2754.5,2753.25,2766.75,2766.75,RDR,,,,,2018-01-11 10:40:00-05:00,RS,2018-01-11 10:30:00-05:00,2756.0,2754.25,RR,RR,2018-01-11 09:30:00-05:00,70.0,RR,2018-01-11 10:25:00-05:00,2018-01-11 10:40:00-05:00,RS,0.52,0.48,0.21,0.5,0.05,0.0,0.5,0.6489,0.3321,0.6322,0.5,0.4599999999999999,1.0,0.773,0.5,0.5,0.85,0.775,0.519,0.779,1.0,0.0,0.52,0.5,0.5,1.0,0.0,1.0,9.0,3.0,49.0,26.0,85.0,89.0,5.5,1.0,clean,23.0,-4.0,True,post_breakout,1.25,9.8,9.8,True
01/12/2018,,2778.75,,,,,,,,,,,2784.75,2018,2018-01-12,10:30,2777.5,2784.75,Long,Advanced,No Conf,,W,2018-01-12 10:30:00-05:00,2018-01-12,,10:30,ES,No Conf,Long,RDR,Advanced,W,2778.75,2777.5,2784.75,2784.75,RDR,,,,,2018-01-12 10:30:00-05:00,RS,2018-01-12 10:30:00-05:00,2780.0,2778.5,RR,RR,2018-01-12 09:30:00-05:00,60.0,RR,2018-01-12 10:25:00-05:00,2018-01-12 10:30:00-05:00,RS,0.6,0.4,0.17,0.5,0.0,0.0,0.5,0.8081,0.1818,0.7835,0.4319444444444444,0.5291666666666667,0.2,0.467,0.5,0.5,0.467,0.3,0.303,0.784,1.0,0.0,0.6,0.4319444444444444,0.5,0.0,0.0,0.0,4.0,4.0,0.0,4.0,0.0,4.0,7.0,1.0,clean,-4.0,-4.0,True,post_breakout,1.25,4.8,4.8,True
01/12/2018,,2779.25,,,,,,,,,,,2787.75,2018,2018-01-12,11:15,2778.0,2787.75,Long,Mode,Confirmed,10:35,W,2018-01-12 11:15:00-05:00,2018-01-12,10:35,11:15,ES,Confirmed,Long,RDR,Mode,W,2779.25,2778.0,2787.75,2787.75,RDR,,,,,2018-01-12 11:15:00-05:00,RS,2018-01-12 10:30:00-05:00,2780.0,2779.0,RR,RR,2018-01-12 09:30:00-05:00,105.0,RR,2018-01-12 10:25:00-05:00,2018-01-12 11:15:00-05:00,RS,0.8,0.2,0.22,0.57,0.63,0.51,0.71,0.8081,0.1818,0.7835,0.4319444444444444,0.5486111111111112,0.2,0.467,0.5,0.5,0.267,0.3,0.306,0.851,1.0,0.0,0.8,0.4319444444444444,0.5,0.0,0.0,0.0,0.0,0.0,1.0,4.0,1.0,4.0,4.0,2.0,mixed,-3.0,-3.0,False,post_breakout,1.25,6.8,6.8,True
01/12/2018,,2779.25,,,,,,,,,,,2787.75,2018_set2,2018-01-12,11:20,2777.5,2787.75,Long,Mode,Confirmed,10:35,W,2018-01-12 11:20:00-05:00,2018-01-12,10:35,11:20,ES,Confirmed,Long,RDR,Mode,W,,,,,RDR,2779.25,2777.5,2787.75,2787.75,2018-01-12 11:20:00-05:00,RS,2018-01-12 10:30:00-05:00,2780.5,2779.0,RR,RR,2018-01-12 09:30:00-05:00,110.0,RR,2018-01-12 10:25:00-05:00,2018-01-12 11:20:00-05:00,RS,0.8,0.2,0.22,0.57,0.66,0.51,0.71,0.8081,0.1818,0.7835,0.4319444444444444,0.5486111111111112,0.2,0.467,0.5,0.5,0.267,0.3,0.306,0.857,1.0,0.0,0.8,0.4319444444444444,0.5,0.0,0.0,0.0,0.0,0.0,1.0,4.0,1.0,4.0,4.25,1.0,clean,-3.0,-3.0,False,post_breakout,1.75,4.857142857142857,4.857142857142857,True
01/17/2018,,2783.0,,,,,,,,,,,2780.75,2018,2018-01-17,9:45,2780.75,2794.25,Long,Advanced,No Conf,,EX,2018-01-17 09:45:00-05:00,2018-01-17,,9:45,ES,No Conf,Long,RDR,Advanced,EX,2783.0,2780.75,2794.25,2780.75,RDR,,,,,2018-01-17 09:45:00-05:00,RR,2018-01-17 09:30:00-05:00,2784.75,2780.5,RR,RR,2018-01-17 09:30:00-05:00,15.0,RR,2018-01-17 10:25:00-05:00,2018-01-17 09:45:00-05:00,RR,0.5,0.5,0.5,0.5,0.5,0.5,0.5,0.1829,0.7988,0.85,0.3275862068965517,0.6041666666666666,0.966,0.931,0.5,0.5,1.0,0.207,0.271,0.454,0.0,1.0,0.5,0.3275862068965517,0.5,0.0,1.0,0.0,6.0,3.0,6.0,0.0,63.0,38.0,5.5,4.0,dirty,6.0,25.0,True,frontrun,2.25,5.0,-1.0,False
01/17/2018,,2783.75,,,,,,,,,,,2781.75,2018,2018-01-17,9:45,2781.75,2794.25,Long,Advanced,No Conf,,EX,2018-01-17 09:45:00-05:00,2018-01-17,,9:45,ES,No Conf,Long,RDR,Advanced,EX,2783.75,2781.75,2794.25,2781.75,RDR,,,,,2018-01-17 09:45:00-05:00,RR,2018-01-17 09:30:00-05:00,2784.75,2780.5,RR,RR,2018-01-17 09:30:00-05:00,15.0,RR,2018-01-17 10:25:00-05:00,2018-01-17 09:45:00-05:00,RR,0.5,0.5,0.5,0.5,0.5,0.5,0.5,0.1829,0.7988,0.85,0.3275862068965517,0.6041666666666666,0.966,0.931,0.5,0.5,1.0,0.207,0.271,0.454,0.0,1.0,0.5,0.3275862068965517,0.5,0.0,1.0,0.0,6.0,3.0,6.0,0.0,61.0,31.0,4.75,4.0,dirty,6.0,30.0,True,frontrun,2.0,5.25,-1.0,False
01/17/2018,,2784.75,,,,,,,,,,,2800.75,2018_set2,2018-01-17,10:30,2782.75,2800.75,Long,Frontrun,No Conf,,W,2018-01-17 10:30:00-05:00,2018-01-17,,10:30,ES,No Conf,Long,RDR,Frontrun,W,,,,,RDR,2784.75,2782.75,2800.75,2800.75,2018-01-17 10:30:00-05:00,RS,2018-01-17 10:30:00-05:00,2787.5,2784.25,RR,RR,2018-01-17 09:30:00-05:00,60.0,RR,2018-01-17 10:25:00-05:00,2018-01-17 10:30:00-05:00,RS,0.27,0.73,0.25,0.5,0.0,0.0,0.5,0.252,0.7317,0.7459,0.4925,0.5225,1.0,1.0,0.5,0.5,0.977,0.841,0.45,0.705,0.0,1.0,0.27,0.4925,0.5,0.0,1.0,0.0,15.0,4.0,15.0,12.0,45.0,43.0,3.75,3.0,dirty,3.0,2.0,True,post_breakout,2.0,8.0,8.0,True
01/18/2018,,2801.75,,,,,,,,,,,2803.25,2018,2018-01-18,8:05,2803.25,2793.75,Short,Advanced,No Conf,,EX,2018-01-18 08:05:00-05:00,2018-01-18,,8:05,ES,No Conf,Short,ODR,Advanced,EX,2801.75,2803.25,2793.75,2803.25,ODR,,,,,2018-01-18 08:05:00-05:00,OS,2018-01-18 04:00:00-05:00,2802.75,2800.5,OR,OR,2018-01-18 03:00:00-05:00,305.0,,,2018-01-18 08:05:00-05:00,OS,0.35,0.65,0.36,0.0,0.0,0.0,0.26,0.1133,0.8499,0.8882,0.1789634146341464,0.4167682926829268,0.054,0.892,1.0,1.0,0.595,1.0,0.983,0.983,0.0,1.0,0.65,0.4167682926829268,1.0,1.0,1.0,1.0,9.0,4.0,20.0,22.0,44.0,43.0,0.25,4.0,dirty,-2.0,1.0,True,no_breakout,1.5,5.333333333333333,-1.0,False
01/18/2018,,2799.75,,,,,,,,,,,2801.0,2018,2018-01-18,10:30,2801.0,2791.5,Short,Frontrun,No Conf,,EX,2018-01-18 10:30:00-05:00,2018-01-18,,10:30,ES,No Conf,Short,RDR,Frontrun,EX,2799.75,2801.0,2791.5,2801.0,RDR,,,,,2018-01-18 10:30:00-05:00,RS,2018-01-18 10:30:00-05:00,2801.25,2798.75,RR,RR,2018-01-18 09:30:00-05:00,60.0,RR,2018-01-18 10:25:00-05:00,2018-01-18 10:30:00-05:00,RS,0.43,0.57,0.21,0.5,0.0,0.0,0.5,0.6502,0.3308,0.6336,0.51875,0.48125,0.067,0.867,0.5,0.5,0.667,0.967,0.715,0.377,0.0,1.0,0.57,0.48125,0.5,1.0,0.0,1.0,9.0,0.0,15.0,7.0,33.0,30.0,1.75,6.0,dirty,8.0,3.0,False,post_breakout,1.25,6.6,-1.0,False
01/19/2018,,2807.0,,,,,,,,,,,2807.0,2018,2018-01-19,9:45,2809.0,2791.75,Short,Mode,No Conf,,BE,2018-01-19 09:45:00-05:00,2018-01-19,,9:45,ES,No Conf,Short,RDR,Mode,BE,2807.0,2809.0,2791.75,2807.0,RDR,,,,,2018-01-19 09:45:00-05:00,RR,2018-01-19 09:30:00-05:00,2808.25,2807.0,RR,RR,2018-01-19 09:30:00-05:00,15.0,RR,2018-01-19 10:25:00-05:00,2018-01-19 09:45:00-05:00,RR,0.65,0.35,0.5,0.5,0.5,0.5,0.5,0.5134,0.4545,0.7297,0.4708333333333333,0.4513888888888889,0.76,0.36,0.5,0.5,0.28,0.84,0.363,0.459,1.0,0.0,0.35,0.4513888888888889,0.5,1.0,0.0,1.0,11.0,2.0,3.0,8.0,3.0,20.0,6.5,3.0,dirty,-5.0,-17.0,True,frontrun,2.0,7.625,-0.0,False
01/19/2018,,2805.5,,,,,,,,,,,2803.5,2018_set2,2018-01-19,10:35,2803.5,2814.5,Long,Frontrun,No Conf,,EX,2018-01-19 10:35:00-05:00,2018-01-19,,10:35,ES,No Conf,Long,RDR,Frontrun,EX,,,,,RDR,2805.5,2803.5,2814.5,2803.5,2018-01-19 10:35:00-05:00,RS,2018-01-19 10:30:00-05:00,2807.0,2804.5,RR,RR,2018-01-19 09:30:00-05:00,65.0,RR,2018-01-19 10:25:00-05:00,2018-01-19 10:35:00-05:00,RS,0.57,0.43,0.17,0.5,0.0,0.0,0.5,0.4286,0.5466,0.6076,0.5041666666666667,0.4958333333333333,0.75,0.55,0.5,0.5,0.879,0.303,0.616,0.644,1.0,0.0,0.57,0.5041666666666667,0.5,1.0,0.0,1.0,11.0,1.0,30.0,52.0,43.0,104.0,2.25,3.0,dirty,-22.0,-61.0,True,post_breakout,2.0,4.5,-1.0,False
01/19/2018,,2803.25,,,,,,,,,,,2803.25,2018,2018-01-19,11:00,2804.75,2791.75,Short,Mode,No Conf,,BE,2018-01-19 11:00:00-05:00,2018-01-19,,11:00,ES,No Conf,Short,RDR,Mode,BE,2803.25,2804.75,2791.75,2803.25,RDR,,,,,2018-01-19 11:00:00-05:00,RS,2018-01-19 10:30:00-05:00,2803.25,2800.75,RR,RR,2018-01-19 09:30:00-05:00,90.0,RR,2018-01-19 10:25:00-05:00,2018-01-19 11:00:00-05:00,RS,0.57,0.43,0.17,0.5,0.2,0.0,0.5,0.4286,0.5466,0.6076,0.5041666666666667,0.4958333333333333,0.75,0.55,0.5,0.5,0.879,0.303,0.644,0.658,1.0,0.0,0.43,0.4958333333333333,0.5,1.0,0.0,1.0,13.0,2.0,36.0,35.0,57.0,55.0,3.75,5.0,dirty,1.0,2.0,True,post_breakout,1.5,7.666666666666667,-0.0,False
01/19/2018,,2802.25,,,,,,,,,,,2804.0,2018,2018-01-19,11:55,2804.0,2791.75,Short,Mode,Wick,11:05,EX,2018-01-19 11:55:00-05:00,2018-01-19,11:05,11:55,ES,Wick,Short,RDR,Mode,EX,2802.25,2804.0,2791.75,2804.0,RDR,,,,,2018-01-19 11:55:00-05:00,RS,2018-01-19 10:30:00-05:00,2803.5,2801.5,RR,RR,2018-01-19 09:30:00-05:00,145.0,RR,2018-01-19 10:25:00-05:00,2018-01-19 11:55:00-05:00,RS,0.57,0.43,0.17,0.5,0.52,0.0,0.5,0.4286,0.5466,0.6076,0.5041666666666667,0.4958333333333333,0.75,0.55,0.5,0.5,0.879,0.303,0.685,0.699,1.0,0.0,0.43,0.4958333333333333,0.5,1.0,0.0,1.0,13.0,4.0,32.0,29.0,48.0,40.0,0.25,5.0,dirty,3.0,8.0,True,post_breakout,1.75,6.0,-1.0,False
01/22/2018,,2809.5,,,,,,,,,,,2827.5,2018,2018-01-22,9:30,2808.25,2827.5,Long,Missed,No Conf,,W,2018-01-22 09:30:00-05:00,2018-01-22,,9:30,ES,No Conf,Long,RDR,Missed,W,2809.5,2808.25,2827.5,2827.5,RDR,,,,,2018-01-22 09:30:00-05:00,RR,2018-01-22 09:30:00-05:00,2811.75,2809.25,RR,RR,2018-01-22 09:30:00-05:00,0.0,RR,2018-01-22 10:25:00-05:00,2018-01-22 09:30:00-05:00,RR,0.52,0.48,0.5,0.5,0.5,0.5,0.5,0.7556,0.2324,0.8182,0.4533333333333333,0.36,0.905,0.286,0.5,0.5,0.797,0.841,0.161,0.21,1.0,0.0,0.52,0.4533333333333333,0.5,1.0,0.0,1.0,15.0,8.0,42.0,42.0,59.0,66.0,6.25,2.0,mixed,0.0,-7.0,True,m7_first_two,1.25,14.4,14.4,True
01/22/2018,,2821.0,,,,,,,,,,,2819.0,2018,2018-01-22,10:35,2819.0,2833.25,Long,Frontrun,No Conf,,EX,2018-01-22 10:35:00-05:00,2018-01-22,,10:35,ES,No Conf,Long,RDR,Frontrun,EX,2821.0,2819.0,2833.25,2819.0,RDR,,,,,2018-01-22 10:35:00-05:00,RS,2018-01-22 10:30:00-05:00,2822.25,2819.75,RR,RR,2018-01-22 09:30:00-05:00,65.0,RR,2018-01-22 10:25:00-05:00,2018-01-22 10:35:00-05:00,RS,0.71,0.29,0.18,0.5,0.0,0.0,0.5,0.8807,0.1122,0.8983,0.4583333333333333,0.5208333333333334,0.812,0.375,0.5,0.5,0.429,0.629,0.536,0.696,1.0,0.0,0.71,0.4583333333333333,0.5,0.0,0.0,0.0,0.0,0.0,0.0,0.0,0.0,0.0,1.0,5.0,dirty,0.0,0.0,False,post_breakout,2.0,6.125,-1.0,False
01/22/2018,,2818.75,,,,,,,,,,,2834.25,2018,2018-01-22,11:00,2815.75,2834.25,Long,Frontrun,No Conf,,W,2018-01-22 11:00:00-05:00,2018-01-22,,11:00,ES,No Conf,Long,RDR,Frontrun,W,2818.75,2815.75,2834.25,2834.25,RDR,,,,,2018-01-22 11:00:00-05:00,RS,2018-01-22 10:30:00-05:00,2819.75,2817.75,RR,RR,2018-01-22 09:30:00-05:00,90.0,RR,2018-01-22 10:25:00-05:00,2018-01-22 11:00:00-05:00,RS,0.71,0.29,0.18,0.5,0.25,0.0,0.5,0.8807,0.1122,0.8983,0.5208333333333334,0.5208333333333334,0.812,0.375,0.5,0.5,0.429,0.629,0.565,0.696,1.0,0.0,0.71,0.5208333333333334,0.5,0.0,0.0,0.0,0.0,0.0,0.0,0.0,0.0,0.0,2.0,6.0,dirty,0.0,0.0,False,post_breakout,3.0,5.166666666666667,5.166666666666667,True
01/23/2018,,2837.25,,,,,,,,,,,2835.25,2018,2018-01-23,10:15,2835.25,2848.0,Long,Frontrun,No Conf,,EX,2018-01-23 10:15:00-05:00,2018-01-23,,10:15,ES,No Conf,Long,RDR,Frontrun,EX,2837.25,2835.25,2848.0,2835.25,RDR,,,,,2018-01-23 10:15:00-05:00,RR,2018-01-23 09:30:00-05:00,2839.0,2837.25,RR,RR,2018-01-23 09:30:00-05:00,45.0,RR,2018-01-23 10:25:00-05:00,2018-01-23 10:15:00-05:00,RR,0.6,0.4,0.5,0.5,0.5,0.5,0.5,0.6477,0.3333,0.6312,0.4625,0.5375,0.951,0.561,0.5,0.5,1.0,0.024,0.341,0.621,1.0,0.0,0.6,0.4625,0.5,1.0,0.0,1.0,5.0,1.0,6.0,13.0,27.0,54.0,3.25,5.0,dirty,-7.0,-27.0,True,frontrun,2.0,5.375,-1.0,False
01/23/2018,,2838.5,,,,,,,,,,,2838.5,2018,2018-01-23,10:30,2836.75,2848.0,Long,Frontrun,No Conf,,BE,2018-01-23 10:30:00-05:00,2018-01-23,,10:30,ES,No Conf,Long,RDR,Frontrun,BE,2838.5,2836.75,2848.0,2838.5,RDR,,,,,2018-01-23 10:30:00-05:00,RS,2018-01-23 10:30:00-05:00,2839.25,2836.75,RR,RR,2018-01-23 09:30:00-05:00,60.0,RR,2018-01-23 10:25:00-05:00,2018-01-23 10:30:00-05:00,RS,0.7,0.3,0.21,0.5,0.0,0.0,0.5,0.6477,0.3333,0.6312,0.4626865671641791,0.373134328358209,0.9,0.5,0.5,0.5,0.975,0.375,0.303,0.783,1.0,0.0,0.7,0.4626865671641791,0.5,1.0,0.0,0.0,1.0,1.0,9.0,5.0,22.0,15.0,6.25,4.0,dirty,4.0,7.0,True,post_breakout,1.75,5.428571428571429,0.0,False
01/23/2018,,2838.0,,,,,,,,,,,2838.0,2018_set2,2018-01-23,10:30,2835.25,2848.5,Long,Frontrun,No Conf,,BE,2018-01-23 10:30:00-05:00,2018-01-23,,10:30,ES,No Conf,Long,RDR,Frontrun,BE,,,,,RDR,2838.0,2835.25,2848.5,2838.0,2018-01-23 10:30:00-05:00,RS,2018-01-23 10:30:00-05:00,2839.25,2836.75,RR,RR,2018-01-23 09:30:00-05:00,60.0,RR,2018-01-23 10:25:00-05:00,2018-01-23 10:30:00-05:00,RS,0.7,0.3,0.21,0.5,0.0,0.0,0.5,0.6477,0.3333,0.6312,0.4626865671641791,0.373134328358209,0.9,0.5,0.5,0.5,0.975,0.375,0.303,0.783,1.0,0.0,0.7,0.4626865671641791,0.5,1.0,0.0,1.0,9.0,1.0,13.0,14.0,34.0,55.0,6.75,3.0,dirty,-1.0,-21.0,True,post_breakout,2.75,3.8181818181818183,0.0,False
01/24/2018,,2854.0,,,,,,,,,,,2852.25,2018,2018-01-24,10:10,2852.25,2862.0,Long,Frontrun,No Conf,,EX,2018-01-24 10:10:00-05:00,2018-01-24,,10:10,ES,No Conf,Long,RDR,Frontrun,EX,2854.0,2852.25,2862.0,2852.25,RDR,,,,,2018-01-24 10:10:00-05:00,RR,2018-01-24 09:30:00-05:00,2854.25,2852.25,RR,RR,2018-01-24 09:30:00-05:00,40.0,RR,2018-01-24 10:25:00-05:00,2018-01-24 10:10:00-05:00,RR,0.88,0.12,0.5,0.5,0.5,0.5,0.5,0.4321,0.5432,0.6101,0.6285714285714286,0.6442307692307693,0.448,0.621,0.5,0.5,0.345,0.621,0.328,0.592,1.0,0.0,0.88,0.6285714285714286,0.5,0.0,0.0,0.0,0.0,0.0,0.0,0.0,0.0,0.0,1.25,4.0,dirty,0.0,0.0,False,frontrun,1.75,4.571428571428571,-1.0,False
01/24/2018,,2852.0,,,,,,,,,,,2850.75,2018_set2,2018-01-24,10:30,2850.75,2857.25,Long,Frontrun,No Conf,,EX,2018-01-24 10:30:00-05:00,2018-01-24,,10:30,ES,No Conf,Long,RDR,Frontrun,EX,,,,,RDR,2852.0,2850.75,2857.25,2850.75,2018-01-24 10:30:00-05:00,RS,2018-01-24 10:30:00-05:00,2853.75,2851.75,RR,RR,2018-01-24 09:30:00-05:00,60.0,RR,2018-01-24 10:25:00-05:00,2018-01-24 10:30:00-05:00,RS,0.71,0.29,0.25,0.5,0.0,0.0,0.5,0.4321,0.5432,0.6101,0.396551724137931,0.8103448275862069,0.812,0.688,0.5,0.5,0.73,0.297,0.303,0.783,1.0,0.0,0.71,0.396551724137931,0.5,0.0,0.0,0.0,4.0,2.0,3.0,2.0,3.0,2.0,3.25,6.0,dirty,1.0,1.0,True,post_breakout,1.25,4.2,-1.0,False
01/24/2018,,2852.25,,,,,,,,,,,2850.5,2018,2018-01-24,10:50,2850.5,2862.0,Long,Frontrun,No Conf,,EX,2018-01-24 10:50:00-05:00,2018-01-24,,10:50,ES,No Conf,Long,RDR,Frontrun,EX,2852.25,2850.5,2862.0,2850.5,RDR,,,,,2018-01-24 10:50:00-05:00,RS,2018-01-24 10:30:00-05:00,2853.0,2851.75,RR,RR,2018-01-24 09:30:00-05:00,80.0,RR,2018-01-24 10:25:00-05:00,2018-01-24 10:50:00-05:00,RS,0.71,0.29,0.25,0.5,0.16,0.0,0.5,0.4321,0.5432,0.6101,0.2045454545454545,0.8863636363636364,0.812,0.688,0.5,0.5,0.703,0.297,0.306,0.803,1.0,0.0,0.71,0.2045454545454545,0.5,0.0,0.0,0.0,2.0,1.0,3.0,2.0,3.0,2.0,0.0,3.0,dirty,1.0,1.0,True,post_breakout,1.75,5.571428571428571,-1.0,False
01/25/2018,,2842.5,,,,,,,,,,,2842.5,2018_set2,2018-01-25,10:35,2845.0,2828.75,Short,Frontrun,No Conf,,BE,2018-01-25 10:35:00-05:00,2018-01-25,,10:35,ES,No Conf,Short,RDR,Frontrun,BE,,,,,RDR,2842.5,2845.0,2828.75,2842.5,2018-01-25 10:35:00-05:00,RS,2018-01-25 10:30:00-05:00,2843.25,2839.75,RR,RR,2018-01-25 09:30:00-05:00,65.0,RR,2018-01-25 10:25:00-05:00,2018-01-25 10:35:00-05:00,RS,0.13,0.87,0.19,0.5,0.0,0.0,0.5,0.2571,0.7321,0.7464,0.5097222222222222,0.4902777777777777,0.882,0.794,0.5,0.5,0.779,1.0,0.67,0.571,0.0,1.0,0.87,0.4902777777777777,0.5,1.0,0.0,0.0,11.0,2.0,11.0,19.0,45.0,108.0,6.5,2.0,mixed,-8.0,-63.0,True,post_breakout,2.5,5.5,-0.0,False
01/26/2018,,2849.75,,,,,,,,,,,2857.75,2018_set2,2018-01-26,10:30,2848.25,2857.75,Long,Frontrun,No Conf,,W,2018-01-26 10:30:00-05:00,2018-01-26,,10:30,ES,No Conf,Long,RDR,Frontrun,W,,,,,RDR,2849.75,2848.25,2857.75,2857.75,2018-01-26 10:30:00-05:00,RS,2018-01-26 10:30:00-05:00,2851.75,2849.75,RR,RR,2018-01-26 09:30:00-05:00,60.0,RR,2018-01-26 10:25:00-05:00,2018-01-26 10:30:00-05:00,RS,0.59,0.41,0.17,0.5,0.0,0.0,0.5,0.881,0.1119,0.8986,0.3396226415094339,0.7169811320754716,0.973,0.378,0.5,0.5,1.0,0.946,0.509,0.669,0.0,0.0,0.59,0.3396226415094339,0.5,0.0,0.0,0.0,5.0,1.0,23.0,28.0,23.0,28.0,6.75,0.0,clean,-5.0,-5.0,True,post_breakout,1.5,5.333333333333333,5.333333333333333,True
01/26/2018,,2852.75,,,,,,,,,,,2862.75,2018,2018-01-26,11:05,2851.5,2862.75,Long,Mode,Confirmed,10:35,W,2018-01-26 11:05:00-05:00,2018-01-26,10:35,11:05,ES,Confirmed,Long,RDR,Mode,W,2852.75,2851.5,2862.75,2862.75,RDR,,,,,2018-01-26 11:05:00-05:00,RS,2018-01-26 10:30:00-05:00,2855.0,2852.25,RR,RR,2018-01-26 09:30:00-05:00,95.0,RR,2018-01-26 10:25:00-05:00,2018-01-26 11:05:00-05:00,RS,0.8,0.2,0.22,0.43,0.51,0.29,0.57,0.881,0.1119,0.8986,0.1560897435897436,0.8439102564102564,0.973,0.378,0.5,0.5,0.919,0.946,0.522,0.741,0.0,0.0,0.8,0.1560897435897436,0.5,0.0,0.0,0.0,2.0,0.0,2.0,0.0,2.0,0.0,3.5,2.0,mixed,2.0,2.0,False,post_breakout,1.25,8.0,8.0,True
01/29/2018,,2869.5,,,,,,,,,,,2867.75,2018,2018-01-29,9:40,2867.75,2878.75,Long,Advanced,No Conf,,EX,2018-01-29 09:40:00-05:00,2018-01-29,,9:40,ES,No Conf,Long,RDR,Advanced,EX,2869.5,2867.75,2878.75,2867.75,RDR,,,,,2018-01-29 09:40:00-05:00,RR,2018-01-29 09:30:00-05:00,2871.25,2868.75,RR,RR,2018-01-29 09:30:00-05:00,10.0,RR,2018-01-29 10:25:00-05:00,2018-01-29 09:40:00-05:00,RR,0.75,0.25,0.5,0.5,0.5,0.5,0.5,0.6703,0.3077,0.6966,0.4266666666666667,0.6408333333333334,0.705,0.308,0.5,0.5,0.731,0.5,0.325,0.32,1.0,0.0,0.75,0.4266666666666667,0.5,0.0,1.0,0.0,0.0,0.0,0.0,0.0,0.0,0.0,1.5,4.0,dirty,0.0,0.0,False,frontrun,1.75,5.285714285714286,-1.0,False
01/29/2018,,2865.75,,,,,,,,,,,2855.25,2018_set2,2018-01-29,10:30,2868.25,2855.25,Short,Frontrun,No Conf,,W,2018-01-29 10:30:00-05:00,2018-01-29,,10:30,ES,No Conf,Short,RDR,Frontrun,W,,,,,RDR,2865.75,2868.25,2855.25,2855.25,2018-01-29 10:30:00-05:00,RS,2018-01-29 10:30:00-05:00,2866.0,2863.5,RR,RR,2018-01-29 09:30:00-05:00,60.0,RR,2018-01-29 10:25:00-05:00,2018-01-29 10:30:00-05:00,RS,0.67,0.33,0.18,0.5,0.0,0.0,0.5,0.6703,0.3077,0.6966,0.51875,0.4625,0.73,0.351,0.5,0.5,0.649,0.541,0.716,0.379,0.0,1.0,0.33,0.4625,0.5,0.0,0.0,0.0,0.0,0.0,0.0,0.0,0.0,0.0,10.0,0.0,clean,0.0,0.0,False,post_breakout,2.5,4.2,4.2,True
01/30/2018,,2832.25,,,,,,,,,,,2829.25,2018,2018-01-30,9:45,2829.25,2856.75,Long,Advanced,No Conf,,EX,2018-01-30 09:45:00-05:00,2018-01-30,,9:45,ES,No Conf,Long,RDR,Advanced,EX,2832.25,2829.25,2856.75,2829.25,RDR,,,,,2018-01-30 09:45:00-05:00,RR,2018-01-30 09:30:00-05:00,2832.5,2827.5,RR,RR,2018-01-30 09:30:00-05:00,15.0,RR,2018-01-30 10:25:00-05:00,2018-01-30 09:45:00-05:00,RR,0.4,0.6,0.5,0.5,0.5,0.5,0.5,0.1593,0.8269,0.8843,0.510576923076923,0.4471153846153846,0.658,0.737,0.5,0.5,0.763,0.868,0.373,0.347,0.0,1.0,0.4,0.510576923076923,0.5,1.0,0.0,1.0,5.0,2.0,4.0,1.0,5.0,1.0,-1.5,0.0,dirty,3.0,4.0,True,frontrun,3.0,8.166666666666666,-1.0,False
02/01/2018,,2821.5,,,,,,,,,,,2818.0,2018,2018-02-01,9:55,2818.0,2839.5,Long,Advanced,No Conf,,EX,2018-02-01 09:55:00-05:00,2018-02-01,,9:55,ES,No Conf,Long,RDR,Advanced,EX,2821.5,2818.0,2839.5,2818.0,RDR,,,,,2018-02-01 09:55:00-05:00,RR,2018-02-01 09:30:00-05:00,2825.25,2821.25,RR,RR,2018-02-01 09:30:00-05:00,25.0,RR,2018-02-01 10:25:00-05:00,2018-02-01 09:55:00-05:00,RR,0.83,0.17,0.5,0.5,0.5,0.5,0.5,0.5192,0.4295,0.6118,0.4429347826086957,0.3744565217391304,0.967,0.733,0.5,0.5,1.0,0.3,0.343,0.497,1.0,0.0,0.83,0.4429347826086957,0.5,1.0,1.0,1.0,5.0,0.0,2.0,8.0,8.0,12.0,4.5,6.0,dirty,-6.0,-4.0,False,frontrun,3.5,5.142857142857143,-1.0,False
02/01/2018,,2819.75,,,,,,,,,,,2834.25,2018_set2,2018-02-01,10:35,2817.0,2834.25,Long,Frontrun,No Conf,,W,2018-02-01 10:35:00-05:00,2018-02-01,,10:35,ES,No Conf,Long,RDR,Frontrun,W,,,,,RDR,2819.75,2817.0,2834.25,2834.25,2018-02-01 10:35:00-05:00,RS,2018-02-01 10:30:00-05:00,2823.0,2819.0,RR,RR,2018-02-01 09:30:00-05:00,65.0,RR,2018-02-01 10:25:00-05:00,2018-02-01 10:35:00-05:00,RS,0.82,0.18,0.21,0.5,0.0,0.0,0.5,0.5192,0.4295,0.6118,0.5416666666666666,0.4583333333333333,1.0,0.778,0.5,0.5,1.0,0.556,0.536,0.696,1.0,0.0,0.82,0.5416666666666666,0.5,0.0,0.0,1.0,0.0,0.0,0.0,0.0,2.0,1.0,5.75,4.0,dirty,0.0,1.0,False,post_breakout,2.75,5.2727272727272725,5.2727272727272725,True
02/01/2018,,2826.25,,,,,,,,,,,2831.5,2018,2018-02-01,11:30,2824.0,2839.5,Long,Mode,Confirmed,11:25,W,2018-02-01 11:30:00-05:00,2018-02-01,11:25,11:30,ES,Confirmed,Long,RDR,Mode,W,2826.25,2824.0,2839.5,2831.5,RDR,,,,,2018-02-01 11:30:00-05:00,RS,2018-02-01 10:30:00-05:00,2827.75,2822.5,RR,RR,2018-02-01 09:30:00-05:00,120.0,RR,2018-02-01 10:25:00-05:00,2018-02-01 11:30:00-05:00,RS,0.94,0.06,0.19,0.5,0.0,0.0,0.5,0.5192,0.4295,0.6118,0.5416666666666666,0.4791666666666667,1.0,0.778,0.5,0.5,1.0,0.556,0.58,0.739,1.0,0.0,0.94,0.5416666666666666,0.5,1.0,1.0,1.0,0.0,0.0,0.0,0.0,32.0,18.0,9.25,1.0,clean,0.0,14.0,False,post_breakout,2.25,5.888888888888889,2.3333333333333335,True
02/02/2018,,2798.5,,,,,,,,,,,2801.25,2018_set2,2018-02-02,10:30,2801.25,2777.75,Short,Frontrun,No Conf,,EX,2018-02-02 10:30:00-05:00,2018-02-02,,10:30,ES,No Conf,Short,RDR,Frontrun,EX,,,,,RDR,2798.5,2801.25,2777.75,2801.25,2018-02-02 10:30:00-05:00,RS,2018-02-02 10:30:00-05:00,2798.5,2795.0,RR,RR,2018-02-02 09:30:00-05:00,60.0,RR,2018-02-02 10:25:00-05:00,2018-02-02 10:30:00-05:00,RS,0.18,0.82,0.18,0.5,0.0,0.0,0.5,0.1589,0.8274,0.8846,0.6056818181818182,0.4647727272727273,0.167,0.882,0.5,0.5,0.922,0.971,0.717,0.378,0.0,1.0,0.82,0.4647727272727273,0.5,0.0,0.0,0.0,0.0,0.0,0.0,0.0,0.0,0.0,3.0,6.0,dirty,0.0,0.0,False,post_breakout,2.75,7.545454545454546,-1.0,False
