Date,conf,entry,instrument,conf type,exit time,Unnamed: 6,stopped out,Unnamed: 8,Unnamed: 9,entry.1,stop ,take profit,exit,source,date,entry_time,stop,target,direction,entry_method,conf_type,conf_time,status,entry_ts,entry_date,Conf Time,Entry Time,Instrument,Conf Type,Direction,Session,Entry Method,Status,Entry,Stop,Target,Exit,session_label,Entry Price,Stop Price,Target Price,Exit Price,ts,bar_session,session_start,range_session,session_x,range_session_start,mins_from_range_start,session_y,confirm_ts,pre_breakout,timing_class,risk_pts,target_r,target_r_multiple,realized_r_multiple,is_win
2011-01-02,0:00,1256.25,ES,Confirmation,22:30,,No,,,1256.25,1255.5,1261.0,1261.0,2011-2016,2011-01-02,19:35,1255.5,1261.0,Long,Confirmation,Confirmation,0:00,No,2011-01-02 19:35:00-05:00,2011-01-02,,,,,,,,,,,,,,,,,,2011-01-02 19:35:00-05:00,AR,2011-01-02 19:30:00-05:00,AR,AR,2011-01-02 19:30:00-05:00,5.0,AR,2011-01-02 20:25:00-05:00,True,m7,0.75,4.75,6.333333333333333,6.333333333333333,True
2011-01-03,0:00,1260.0,ES,Confirmation,11:35,,No,,,1260.0,1258.75,1271.5,1271.5,2011-2016,2011-01-03,7:15,1258.75,1271.5,Long,Confirmation,Confirmation,0:00,No,2011-01-03 07:15:00-05:00,2011-01-03,,,,,,,,,,,,,,,,,,2011-01-03 07:15:00-05:00,OS,2011-01-03 04:00:00-05:00,OS,OS,2011-01-03 04:00:00-05:00,195.0,OS,2011-01-03 07:30:00-05:00,True,other,1.25,11.5,9.2,9.2,True
2011-01-03,0:00,1266.75,ES,Confirmation,4:35,,Yes,,,1266.75,1267.75,1261.0,1267.75,2011-2016,2011-01-03,21:50,1267.75,1261.0,Short,Confirmation,Confirmation,0:00,Yes,2011-01-03 21:50:00-05:00,2011-01-03,,,,,,,,,,,,,,,,,,2011-01-03 21:50:00-05:00,AS,2011-01-03 20:30:00-05:00,AS,AS,2011-01-02 20:30:00-05:00,1520.0,AS,2011-01-03 00:00:00-05:00,False,after_confirm,1.0,5.75,5.75,-1.0,False
2011-01-04,0:00,1268.25,ES,Confirmation,12:25,,No,,,1268.25,1270.25,1260.0,1260.0,2011-2016,2011-01-04,9:35,1270.25,1260.0,Short,Confirmation,Confirmation,0:00,No,2011-01-04 09:35:00-05:00,2011-01-04,,,,,,,,,,,,,,,,,,2011-01-04 09:35:00-05:00,RR,2011-01-04 09:30:00-05:00,RR,RR,2011-01-04 09:30:00-05:00,5.0,RR,2011-01-04 10:25:00-05:00,True,m7,2.0,8.25,4.125,4.125,True
2011-01-04,0:00,1264.75,ES,Confirmation,3:40,,No,,,1264.75,1265.25,1258.25,1258.25,2011-2016,2011-01-04,19:45,1265.25,1258.25,Short,Confirmation,Confirmation,0:00,No,2011-01-04 19:45:00-05:00,2011-01-04,,,,,,,,,,,,,,,,,,2011-01-04 19:45:00-05:00,AR,2011-01-04 19:30:00-05:00,AR,AR,2011-01-04 19:30:00-05:00,15.0,AR,2011-01-04 20:25:00-05:00,True,other,0.5,6.5,13.0,13.0,True
2011-01-05,0:00,1264.25,ES,Confirmation,11:25,,No,,,1264.25,1263.25,1270.0,1270.0,2011-2016,2011-01-05,10:35,1263.25,1270.0,Long,Confirmation,Confirmation,0:00,No,2011-01-05 10:35:00-05:00,2011-01-05,,,,,,,,,,,,,,,,,,2011-01-05 10:35:00-05:00,RS,2011-01-05 10:30:00-05:00,RS,RS,2011-01-05 10:30:00-05:00,5.0,RS,2011-01-05 10:50:00-05:00,True,m7,1.0,5.75,5.75,5.75,True
2011-01-06,0:00,1271.25,ES,Confirmation,7:30,,No,,,1271.25,1270.25,1276.75,1271.25,2011-2016,2011-01-06,3:00,1270.25,1276.75,Long,Confirmation,Confirmation,0:00,No,2011-01-06 03:00:00-05:00,2011-01-06,,,,,,,,,,,,,,,,,,2011-01-06 03:00:00-05:00,OR,2011-01-06 03:00:00-05:00,OR,OR,2011-01-06 03:00:00-05:00,0.0,,,False,m7,1.0,5.5,5.5,0.0,False
2011-01-06,0:00,1274.25,ES,Confirmation,11:05,,No,,,1274.25,1275.25,1267.75,1274.25,2011-2016,2011-01-06,10:40,1275.25,1267.75,Short,Confirmation,Confirmation,0:00,No,2011-01-06 10:40:00-05:00,2011-01-06,,,,,,,,,,,,,,,,,,2011-01-06 10:40:00-05:00,RS,2011-01-06 10:30:00-05:00,RS,RS,2011-01-06 10:30:00-05:00,10.0,RS,2011-01-06 10:35:00-05:00,False,m7,1.0,6.5,6.5,-0.0,False
2011-01-07,0:00,1270.25,ES,Confirmation,6:50,,BE,,,1270.25,1271.5,1264.25,1270.25,2011-2016,2011-01-07,3:05,1271.5,1264.25,Short,Confirmation,Confirmation,0:00,BE,2011-01-07 03:05:00-05:00,2011-01-07,,,,,,,,,,,,,,,,,,2011-01-07 03:05:00-05:00,OR,2011-01-07 03:00:00-05:00,OR,OR,2011-01-07 03:00:00-05:00,5.0,,,False,m7,1.25,6.0,4.8,-0.0,False
2011-01-07,0:00,1272.25,ES,Confirmation,11:20,,No,,,1272.25,1273.5,1264.5,1272.25,2011-2016,2011-01-07,10:35,1273.5,1264.5,Short,Confirmation,Confirmation,0:00,No,2011-01-07 10:35:00-05:00,2011-01-07,,,,,,,,,,,,,,,,,,2011-01-07 10:35:00-05:00,RS,2011-01-07 10:30:00-05:00,RS,RS,2011-01-07 10:30:00-05:00,5.0,RS,2011-01-07 10:50:00-05:00,True,m7,1.25,7.75,6.2,-0.0,False
2011-01-10,0:00,1263.5,ES,Confirmation,8:25,,No,,,1263.5,1264.75,1257.75,1262.25,2011-2016,2011-01-10,3:15,1264.75,1257.75,Short,Confirmation,Confirmation,0:00,No,2011-01-10 03:15:00-05:00,2011-01-10,,,,,,,,,,,,,,,,,,2011-01-10 03:15:00-05:00,OR,2011-01-10 03:00:00-05:00,OR,OR,2011-01-10 03:00:00-05:00,15.0,,,False,other,1.25,5.75,4.6,1.0,True
2011-01-10,0:00,1260.75,ES,Confirmation,9:55,,Yes,,,1260.75,1258.75,1274.0,1258.75,2011-2016,2011-01-10,9:30,1258.75,1274.0,Long,Confirmation,Confirmation,0:00,Yes,2011-01-10 09:30:00-05:00,2011-01-10,,,,,,,,,,,,,,,,,,2011-01-10 09:30:00-05:00,RR,2011-01-10 09:30:00-05:00,RR,RR,2011-01-10 09:30:00-05:00,0.0,RR,2011-01-10 10:25:00-05:00,True,m7,2.0,13.25,6.625,-1.0,False
2011-01-10,0:00,1264.25,ES,Confirmation,7:05,,No,,,1264.25,1263.25,1272.0,1272.0,2011-2016,2011-01-10,20:40,1263.25,1272.0,Long,Confirmation,Confirmation,0:00,No,2011-01-10 20:40:00-05:00,2011-01-10,,,,,,,,,,,,,,,,,,2011-01-10 20:40:00-05:00,AS,2011-01-10 20:30:00-05:00,AS,AS,2011-01-09 20:30:00-05:00,1450.0,AS,2011-01-10 00:00:00-05:00,False,after_confirm,1.0,7.75,7.75,7.75,True
2011-01-11,0:00,1266.0,ES,Confirmation,7:05,,No,,,1266.0,1265.0,1272.0,1272.0,2011-2016,2011-01-11,5:05,1265.0,1272.0,Long,Confirmation,Confirmation,0:00,No,2011-01-11 05:05:00-05:00,2011-01-11,,,,,,,,,,,,,,,,,,2011-01-11 05:05:00-05:00,OS,2011-01-11 04:00:00-05:00,OS,OS,2011-01-11 04:00:00-05:00,65.0,OS,2011-01-11 04:30:00-05:00,False,after_confirm,1.0,6.0,6.0,6.0,True
2011-01-12,0:00,1279.0,ES,Confirmation,11:15,,No,,,1279.0,1278.0,1282.75,1282.75,2011-2016,2011-01-12,10:40,1278.0,1282.75,Long,Confirmation,Confirmation,0:00,No,2011-01-12 10:40:00-05:00,2011-01-12,,,,,,,,,,,,,,,,,,2011-01-12 10:40:00-05:00,RS,2011-01-12 10:30:00-05:00,RS,RS,2011-01-12 10:30:00-05:00,10.0,RS,2011-01-12 10:55:00-05:00,True,m7,1.0,3.75,3.75,3.75,True
2011-01-12,0:00,1282.0,ES,Confirmation,21:55,,Yes,,,1282.0,1281.25,1286.5,1281.25,2011-2016,2011-01-12,21:25,1281.25,1286.5,Long,Confirmation,Confirmation,0:00,Yes,2011-01-12 21:25:00-05:00,2011-01-12,,,,,,,,,,,,,,,,,,2011-01-12 21:25:00-05:00,AS,2011-01-12 20:30:00-05:00,AS,AS,2011-01-11 20:30:00-05:00,1495.0,AS,2011-01-12 00:00:00-05:00,False,after_confirm,0.75,4.5,6.0,-1.0,False
2011-01-13,0:00,1280.5,ES,Confirmation,4:15,,BE,,,1280.5,1279.5,1286.25,1280.5,2011-2016,2011-01-13,1:40,1279.5,1286.25,Long,Confirmation,Confirmation,0:00,BE,2011-01-13 01:40:00-05:00,2011-01-13,,,,,,,,,,,,,,,,,,2011-01-13 01:40:00-05:00,AS,2011-01-12 20:30:00-05:00,AS,AS,2011-01-12 20:30:00-05:00,310.0,AS,2011-01-13 00:00:00-05:00,False,after_confirm,1.0,5.75,5.75,0.0,False
2011-01-13,0:00,1281.75,ES,Confirmation,5:20,,Yes,,,1281.75,1281.0,1286.5,1281.0,2011-2016,2011-01-13,4:15,1281.0,1286.5,Long,Confirmation,Confirmation,0:00,Yes,2011-01-13 04:15:00-05:00,2011-01-13,,,,,,,,,,,,,,,,,,2011-01-13 04:15:00-05:00,OS,2011-01-13 04:00:00-05:00,OS,OS,2011-01-13 04:00:00-05:00,15.0,OS,2011-01-13 07:35:00-05:00,True,other,0.75,4.75,6.333333333333333,-1.0,False
2011-01-13,0:00,1280.75,ES,Confirmation,10:00,,Yes,,,1280.75,1279.5,1287.25,1279.5,2011-2016,2011-01-13,9:50,1279.5,1287.25,Long,Confirmation,Confirmation,0:00,Yes,2011-01-13 09:50:00-05:00,2011-01-13,,,,,,,,,,,,,,,,,,2011-01-13 09:50:00-05:00,RR,2011-01-13 09:30:00-05:00,RR,RR,2011-01-13 09:30:00-05:00,20.0,RR,2011-01-13 10:25:00-05:00,True,other,1.25,6.5,5.2,-1.0,False
2011-01-13,0:00,1282.75,ES,Confirmation,14:50,,No,,,1282.75,1283.75,1277.25,1282.75,2011-2016,2011-01-13,11:35,1283.75,1277.25,Short,Confirmation,Confirmation,0:00,No,2011-01-13 11:35:00-05:00,2011-01-13,,,,,,,,,,,,,,,,,,2011-01-13 11:35:00-05:00,RS,2011-01-13 10:30:00-05:00,RS,RS,2011-01-13 10:30:00-05:00,65.0,RS,2011-01-13 15:30:00-05:00,True,frontrun_window,1.0,5.5,5.5,-0.0,False
2011-01-14,0:00,1275.75,ES,Confirmation,14:05,,No,,,1275.75,1274.0,1288.5,1288.5,2011-2016,2011-01-14,8:35,1274.0,1288.5,Long,Confirmation,Confirmation,0:00,No,2011-01-14 08:35:00-05:00,2011-01-14,,,,,,,,,,,,,,,,,,2011-01-14 08:35:00-05:00,TR,2011-01-14 08:30:00-05:00,TR,TR,2011-01-14 08:30:00-05:00,5.0,,,False,m7,1.75,12.75,7.285714285714286,7.285714285714286,True
2011-01-14,0:00,1282.5,ES,Confirmation,14:05,,No,,,1282.5,1281.5,1288.5,1288.5,2011-2016,2011-01-14,11:00,1281.5,1288.5,Long,Confirmation,Confirmation,0:00,No,2011-01-14 11:00:00-05:00,2011-01-14,,,,,,,,,,,,,,,,,,2011-01-14 11:00:00-05:00,RS,2011-01-14 10:30:00-05:00,RS,RS,2011-01-14 10:30:00-05:00,30.0,RS,2011-01-14 10:40:00-05:00,False,after_confirm,1.0,6.0,6.0,6.0,True
2011-01-18,0:00,1285.75,ES,Confirmation,6:45,,No,,,1285.75,1284.5,1292.5,1292.5,2011-2016,2011-01-18,2:15,1284.5,1292.5,Long,Confirmation,Confirmation,0:00,No,2011-01-18 02:15:00-05:00,2011-01-18,,,,,,,,,,,,,,,,,,2011-01-18 02:15:00-05:00,TO,2011-01-18 02:00:00-05:00,TO,TO,2011-01-18 02:00:00-05:00,15.0,,,False,other,1.25,6.75,5.4,5.4,True
2011-01-18,0:00,1286.75,ES,Confirmation,15:55,,No,,,1286.75,1285.25,1293.0,1291.5,2011-2016,2011-01-18,9:55,1285.25,1293.0,Long,Confirmation,Confirmation,0:00,No,2011-01-18 09:55:00-05:00,2011-01-18,,,,,,,,,,,,,,,,,,2011-01-18 09:55:00-05:00,RR,2011-01-18 09:30:00-05:00,RR,RR,2011-01-18 09:30:00-05:00,25.0,RR,2011-01-18 10:25:00-05:00,True,other,1.5,6.25,4.166666666666667,3.1666666666666665,True
2011-01-19,0:00,1292.25,ES,Confirmation,8:00,,BE,,,1292.25,1291.25,1297.25,1292.25,2011-2016,2011-01-19,4:20,1291.25,1297.25,Long,Confirmation,Confirmation,0:00,BE,2011-01-19 04:20:00-05:00,2011-01-19,,,,,,,,,,,,,,,,,,2011-01-19 04:20:00-05:00,OS,2011-01-19 04:00:00-05:00,OS,OS,2011-01-19 04:00:00-05:00,20.0,OS,2011-01-19 04:00:00-05:00,False,after_confirm,1.0,5.0,5.0,0.0,False
2011-01-19,0:00,1290.25,ES,Confirmation,11:10,,No,,,1290.25,1291.5,1281.25,1281.25,2011-2016,2011-01-19,9:35,1291.5,1281.25,Short,Confirmation,Confirmation,0:00,No,2011-01-19 09:35:00-05:00,2011-01-19,,,,,,,,,,,,,,,,,,2011-01-19 09:35:00-05:00,RR,2011-01-19 09:30:00-05:00,RR,RR,2011-01-19 09:30:00-05:00,5.0,RR,2011-01-19 10:25:00-05:00,True,m7,1.25,9.0,7.2,7.2,True
2011-01-19,0:00,1283.5,ES,Confirmation,14:40,,No,,,1283.5,1284.5,1278.0,1278.0,2011-2016,2011-01-19,11:45,1284.5,1278.0,Short,Confirmation,Confirmation,0:00,No,2011-01-19 11:45:00-05:00,2011-01-19,,,,,,,,,,,,,,,,,,2011-01-19 11:45:00-05:00,RS,2011-01-19 10:30:00-05:00,RS,RS,2011-01-19 10:30:00-05:00,75.0,RS,2011-01-19 10:35:00-05:00,False,after_confirm,1.0,5.5,5.5,5.5,True
2011-01-19,0:00,1280.75,ES,Confirmation,7:20,,No,,,1280.75,1281.75,1275.0,1280.75,2011-2016,2011-01-19,21:10,1281.75,1275.0,Short,Confirmation,Confirmation,0:00,No,2011-01-19 21:10:00-05:00,2011-01-19,,,,,,,,,,,,,,,,,,2011-01-19 21:10:00-05:00,AS,2011-01-19 20:30:00-05:00,AS,AS,2011-01-18 20:30:00-05:00,1480.0,AS,2011-01-19 00:00:00-05:00,False,after_confirm,1.0,5.75,5.75,-0.0,False
2011-01-20,0:00,1278.5,ES,Confirmation,10:55,,No,,,1278.5,1280.25,1268.25,1278.5,2011-2016,2011-01-20,8:55,1280.25,1268.25,Short,Confirmation,Confirmation,0:00,No,2011-01-20 08:55:00-05:00,2011-01-20,,,,,,,,,,,,,,,,,,2011-01-20 08:55:00-05:00,TR,2011-01-20 08:30:00-05:00,TR,TR,2011-01-20 08:30:00-05:00,25.0,,,False,other,1.75,10.25,5.857142857142857,-0.0,False
2011-01-20,0:00,1269.0,ES,Confirmation,14:40,,No,,,1269.0,1267.0,1280.0,1269.0,2011-2016,2011-01-20,11:00,1267.0,1280.0,Long,Confirmation,Confirmation,0:00,No,2011-01-20 11:00:00-05:00,2011-01-20,,,,,,,,,,,,,,,,,,2011-01-20 11:00:00-05:00,RS,2011-01-20 10:30:00-05:00,RS,RS,2011-01-20 10:30:00-05:00,30.0,RS,2011-01-20 10:50:00-05:00,False,after_confirm,2.0,11.0,5.5,0.0,False
2011-01-20,0:00,1274.0,ES,Confirmation,0:40,,BE,,,1274.0,1273.0,1280.25,1274.0,2011-2016,2011-01-20,21:10,1273.0,1280.25,Long,Confirmation,Confirmation,0:00,BE,2011-01-20 21:10:00-05:00,2011-01-20,,,,,,,,,,,,,,,,,,2011-01-20 21:10:00-05:00,AS,2011-01-20 20:30:00-05:00,AS,AS,2011-01-19 20:30:00-05:00,1480.0,AS,2011-01-20 01:35:00-05:00,False,after_confirm,1.0,6.25,6.25,0.0,False
2011-01-21,0:00,1274.0,ES,Confirmation,7:40,,No,,,1274.0,1273.0,1283.25,1283.25,2011-2016,2011-01-21,3:25,1273.0,1283.25,Long,Confirmation,Confirmation,0:00,No,2011-01-21 03:25:00-05:00,2011-01-21,,,,,,,,,,,,,,,,,,2011-01-21 03:25:00-05:00,OR,2011-01-21 03:00:00-05:00,OR,OR,2011-01-21 03:00:00-05:00,25.0,,,False,other,1.0,9.25,9.25,9.25,True
2011-01-21,0:00,1286.25,ES,Confirmation,11:45,,No,,,1286.25,1287.5,1280.25,1280.25,2011-2016,2011-01-21,10:10,1287.5,1280.25,Short,Confirmation,Confirmation,0:00,No,2011-01-21 10:10:00-05:00,2011-01-21,,,,,,,,,,,,,,,,,,2011-01-21 10:10:00-05:00,RR,2011-01-21 09:30:00-05:00,RR,RR,2011-01-21 09:30:00-05:00,40.0,RR,2011-01-21 10:25:00-05:00,True,frontrun_window,1.25,6.0,4.8,4.8,True
2011-01-21,0:00,1283.75,ES,Confirmation,11:40,,No,,,1283.75,1284.75,1279.75,1279.75,2011-2016,2011-01-21,10:45,1284.75,1279.75,Short,Confirmation,Confirmation,0:00,No,2011-01-21 10:45:00-05:00,2011-01-21,,,,,,,,,,,,,,,,,,2011-01-21 10:45:00-05:00,RS,2011-01-21 10:30:00-05:00,RS,RS,2011-01-21 10:30:00-05:00,15.0,RS,2011-01-21 10:30:00-05:00,False,after_confirm,1.0,4.0,4.0,4.0,True
2011-01-24,0:00,1279.0,ES,Confirmation,14:15,,No,,,1279.0,1278.0,1288.0,1288.0,2011-2016,2011-01-24,9:30,1278.0,1288.0,Long,Confirmation,Confirmation,0:00,No,2011-01-24 09:30:00-05:00,2011-01-24,,,,,,,,,,,,,,,,,,2011-01-24 09:30:00-05:00,RR,2011-01-24 09:30:00-05:00,RR,RR,2011-01-24 09:30:00-05:00,0.0,RR,2011-01-24 10:25:00-05:00,True,m7,1.0,9.0,9.0,9.0,True
2011-01-25,0:00,1291.0,ES,Confirmation,4:35,,No,,,1291.0,1292.0,1285.25,1291.0,2011-2016,2011-01-25,2:40,1292.0,1285.25,Short,Confirmation,Confirmation,0:00,No,2011-01-25 02:40:00-05:00,2011-01-25,,,,,,,,,,,,,,,,,,2011-01-25 02:40:00-05:00,TO,2011-01-25 02:00:00-05:00,TO,TO,2011-01-25 02:00:00-05:00,40.0,,,False,frontrun_window,1.0,5.75,5.75,-0.0,False
2011-01-25,0:00,1286.0,ES,Confirmation,11:20,,No,,,1286.0,1287.0,1279.75,1286.0,2011-2016,2011-01-25,11:00,1287.0,1279.75,Short,Confirmation,Confirmation,0:00,No,2011-01-25 11:00:00-05:00,2011-01-25,,,,,,,,,,,,,,,,,,2011-01-25 11:00:00-05:00,RS,2011-01-25 10:30:00-05:00,RS,RS,2011-01-25 10:30:00-05:00,30.0,RS,2011-01-25 11:10:00-05:00,True,other,1.0,6.25,6.25,-0.0,False
2011-01-25,0:00,1288.75,ES,Confirmation,0:30,,No,,,1288.75,1288.0,1292.25,1292.25,2011-2016,2011-01-25,22:35,1288.0,1292.25,Long,Confirmation,Confirmation,0:00,No,2011-01-25 22:35:00-05:00,2011-01-25,,,,,,,,,,,,,,,,,,2011-01-25 22:35:00-05:00,AS,2011-01-25 20:30:00-05:00,AS,AS,2011-01-24 20:30:00-05:00,1565.0,AS,2011-01-25 00:00:00-05:00,False,after_confirm,0.75,3.5,4.666666666666667,4.666666666666667,True
2011-01-26,0:00,1289.0,ES,Confirmation,10:45,,No,,,1289.0,1287.75,1296.0,1296.0,2011-2016,2011-01-26,9:50,1287.75,1296.0,Long,Confirmation,Confirmation,0:00,No,2011-01-26 09:50:00-05:00,2011-01-26,,,,,,,,,,,,,,,,,,2011-01-26 09:50:00-05:00,RR,2011-01-26 09:30:00-05:00,RR,RR,2011-01-26 09:30:00-05:00,20.0,RR,2011-01-26 10:25:00-05:00,True,other,1.25,7.0,5.6,5.6,True
2011-01-27,0:00,1293.0,ES,Confirmation,11:05,,BE,,,1293.0,1291.5,1298.5,1293.0,2011-2016,2011-01-27,9:35,1291.5,1298.5,Long,Confirmation,Confirmation,0:00,BE,2011-01-27 09:35:00-05:00,2011-01-27,,,,,,,,,,,,,,,,,,2011-01-27 09:35:00-05:00,RR,2011-01-27 09:30:00-05:00,RR,RR,2011-01-27 09:30:00-05:00,5.0,RR,2011-01-27 10:25:00-05:00,True,m7,1.5,5.5,3.6666666666666665,0.0,False
2011-01-27,0:00,1291.0,ES,Confirmation,15:45,,No,,,1291.0,1289.75,1298.0,1298.0,2011-2016,2011-01-27,11:35,1289.75,1298.0,Long,Confirmation,Confirmation,0:00,No,2011-01-27 11:35:00-05:00,2011-01-27,,,,,,,,,,,,,,,,,,2011-01-27 11:35:00-05:00,RS,2011-01-27 10:30:00-05:00,RS,RS,2011-01-27 10:30:00-05:00,65.0,RS,2011-01-27 11:25:00-05:00,False,after_confirm,1.25,7.0,5.6,5.6,True
2011-01-28,0:00,1293.25,ES,Confirmation,10:15,,Yes,,,1293.25,1291.5,1301.5,1291.5,2011-2016,2011-01-28,10:05,1291.5,1301.5,Long,Confirmation,Confirmation,0:00,Yes,2011-01-28 10:05:00-05:00,2011-01-28,,,,,,,,,,,,,,,,,,2011-01-28 10:05:00-05:00,RR,2011-01-28 09:30:00-05:00,RR,RR,2011-01-28 09:30:00-05:00,35.0,RR,2011-01-28 10:25:00-05:00,True,other,1.75,8.25,4.714285714285714,-1.0,False
2011-01-28,0:00,1288.25,ES,Confirmation,11:40,,No,,,1288.25,1289.5,1279.75,1289.5,2011-2016,2011-01-28,10:45,1289.5,1279.75,Short,Confirmation,Confirmation,0:00,No,2011-01-28 10:45:00-05:00,2011-01-28,,,,,,,,,,,,,,,,,,2011-01-28 10:45:00-05:00,RS,2011-01-28 10:30:00-05:00,RS,RS,2011-01-28 10:30:00-05:00,15.0,RS,2011-01-28 10:30:00-05:00,False,after_confirm,1.25,8.5,6.8,-1.0,False
2011-01-28,0:00,1293.5,ES,Confirmation,0:35,,No,,,1293.5,1294.25,1289.25,1293.5,2011-2016,2011-01-28,21:00,1294.25,1289.25,Short,Confirmation,Confirmation,0:00,No,2011-01-28 21:00:00-05:00,2011-01-28,,,,,,,,,,,,,,,,,,,,,,,,,,,False,unknown,0.75,4.25,5.666666666666667,-0.0,False
2011-01-31,0:00,1274.0,ES,Confirmation,5:20,,BE,,,1274.0,1275.25,1262.25,1274.0,2011-2016,2011-01-31,3:05,1275.25,1262.25,Short,Confirmation,Confirmation,0:00,BE,2011-01-31 03:05:00-05:00,2011-01-31,,,,,,,,,,,,,,,,,,2011-01-31 03:05:00-05:00,OR,2011-01-31 03:00:00-05:00,OR,OR,2011-01-31 03:00:00-05:00,5.0,,,False,m7,1.25,11.75,9.4,-0.0,False
2011-01-31,0:00,1274.5,ES,Confirmation,12:10,,No,,,1274.5,1272.75,1282.0,1282.0,2011-2016,2011-01-31,9:50,1272.75,1282.0,Long,Confirmation,Confirmation,0:00,No,2011-01-31 09:50:00-05:00,2011-01-31,,,,,,,,,,,,,,,,,,2011-01-31 09:50:00-05:00,RR,2011-01-31 09:30:00-05:00,RR,RR,2011-01-31 09:30:00-05:00,20.0,RR,2011-01-31 10:25:00-05:00,True,other,1.75,7.5,4.285714285714286,4.285714285714286,True
2011-02-01,0:00,1284.75,ES,Confirmation,8:25,,No,,,1284.75,1284.0,1290.75,1290.75,2011-2016,2011-02-01,4:10,1284.0,1290.75,Long,Confirmation,Confirmation,0:00,No,2011-02-01 04:10:00-05:00,2011-02-01,,,,,,,,,,,,,,,,,,2011-02-01 04:10:00-05:00,OS,2011-02-01 04:00:00-05:00,OS,OS,2011-02-01 04:00:00-05:00,10.0,OS,2011-02-01 05:05:00-05:00,True,m7,0.75,6.0,8.0,8.0,True
2011-02-01,0:00,1292.25,ES,Confirmation,12:50,,No,,,1292.25,1290.5,1303.5,1303.5,2011-2016,2011-02-01,9:35,1290.5,1303.5,Long,Confirmation,Confirmation,0:00,No,2011-02-01 09:35:00-05:00,2011-02-01,,,,,,,,,,,,,,,,,,2011-02-01 09:35:00-05:00,RR,2011-02-01 09:30:00-05:00,RR,RR,2011-02-01 09:30:00-05:00,5.0,RR,2011-02-01 10:25:00-05:00,True,m7,1.75,11.25,6.428571428571429,6.428571428571429,True
2011-02-01,0:00,1295.75,ES,Confirmation,12:50,,No,,,1295.75,1294.25,1303.5,1303.5,2011-2016,2011-02-01,10:35,1294.25,1303.5,Long,Confirmation,Confirmation,0:00,No,2011-02-01 10:35:00-05:00,2011-02-01,,,,,,,,,,,,,,,,,,2011-02-01 10:35:00-05:00,RS,2011-02-01 10:30:00-05:00,RS,RS,2011-02-01 10:30:00-05:00,5.0,RS,2011-02-01 10:40:00-05:00,True,m7,1.5,7.75,5.166666666666667,5.166666666666667,True
2011-02-02,0:00,1302.5,ES,Confirmation,4:10,,BE,,,1302.5,1301.5,1309.0,1302.5,2011-2016,2011-02-02,3:05,1301.5,1309.0,Long,Confirmation,Confirmation,0:00,BE,2011-02-02 03:05:00-05:00,2011-02-02,,,,,,,,,,,,,,,,,,2011-02-02 03:05:00-05:00,OR,2011-02-02 03:00:00-05:00,OR,OR,2011-02-02 03:00:00-05:00,5.0,,,False,m7,1.0,6.5,6.5,0.0,False
2011-02-03,0:00,1300.75,ES,Confirmation,4:20,,BE,,,1300.75,1301.75,1295.25,1300.75,2011-2016,2011-02-03,3:15,1301.75,1295.25,Short,Confirmation,Confirmation,0:00,BE,2011-02-03 03:15:00-05:00,2011-02-03,,,,,,,,,,,,,,,,,,2011-02-03 03:15:00-05:00,OR,2011-02-03 03:00:00-05:00,OR,OR,2011-02-03 03:00:00-05:00,15.0,,,False,other,1.0,5.5,5.5,-0.0,False
2011-02-03,0:00,1293.75,ES,Confirmation,14:55,,No,,,1293.75,1292.0,1302.5,1302.5,2011-2016,2011-02-03,10:20,1292.0,1302.5,Long,Confirmation,Confirmation,0:00,No,2011-02-03 10:20:00-05:00,2011-02-03,,,,,,,,,,,,,,,,,,2011-02-03 10:20:00-05:00,RR,2011-02-03 09:30:00-05:00,RR,RR,2011-02-03 09:30:00-05:00,50.0,RR,2011-02-03 10:25:00-05:00,True,frontrun_window,1.75,8.75,5.0,5.0,True
2011-02-04,0:00,1302.25,ES,Confirmation,8:10,,No,,,1302.25,1301.5,1305.75,1305.75,2011-2016,2011-02-04,3:25,1301.5,1305.75,Long,Confirmation,Confirmation,0:00,No,2011-02-04 03:25:00-05:00,2011-02-04,,,,,,,,,,,,,,,,,,2011-02-04 03:25:00-05:00,OR,2011-02-04 03:00:00-05:00,OR,OR,2011-02-04 03:00:00-05:00,25.0,,,False,other,0.75,3.5,4.666666666666667,4.666666666666667,True
2011-02-07,0:00,1306.75,ES,Confirmation,8:25,,No,,,1306.75,1305.75,1315.25,1311.5,2011-2016,2011-02-07,3:15,1305.75,1315.25,Long,Confirmation,Confirmation,0:00,No,2011-02-07 03:15:00-05:00,2011-02-07,,,,,,,,,,,,,,,,,,2011-02-07 03:15:00-05:00,OR,2011-02-07 03:00:00-05:00,OR,OR,2011-02-07 03:00:00-05:00,15.0,,,False,other,1.0,8.5,8.5,4.75,True
2011-02-07,0:00,1311.25,ES,Confirmation,15:55,,No,,,1311.25,1309.5,1320.5,1315.75,2011-2016,2011-02-07,9:35,1309.5,1320.5,Long,Confirmation,Confirmation,0:00,No,2011-02-07 09:35:00-05:00,2011-02-07,,,,,,,,,,,,,,,,,,2011-02-07 09:35:00-05:00,RR,2011-02-07 09:30:00-05:00,RR,RR,2011-02-07 09:30:00-05:00,5.0,RR,2011-02-07 10:25:00-05:00,True,m7,1.75,9.25,5.285714285714286,2.5714285714285716,True
2011-02-08,0:00,1315.75,ES,Confirmation,5:30,,BE,,,1315.75,1315.0,1320.0,1315.75,2011-2016,2011-02-08,3:35,1315.0,1320.0,Long,Confirmation,Confirmation,0:00,BE,2011-02-08 03:35:00-05:00,2011-02-08,,,,,,,,,,,,,,,,,,2011-02-08 03:35:00-05:00,OR,2011-02-08 03:00:00-05:00,OR,OR,2011-02-08 03:00:00-05:00,35.0,,,False,other,0.75,4.25,5.666666666666667,0.0,False
2011-02-08,0:00,1316.5,ES,Confirmation,9:50,,BE,,,1316.5,1317.5,1310.0,1316.5,2011-2016,2011-02-08,8:50,1317.5,1310.0,Short,Confirmation,Confirmation,0:00,BE,2011-02-08 08:50:00-05:00,2011-02-08,,,,,,,,,,,,,,,,,,2011-02-08 08:50:00-05:00,TR,2011-02-08 08:30:00-05:00,TR,TR,2011-02-08 08:30:00-05:00,20.0,,,False,other,1.0,6.5,6.5,-0.0,False
2011-02-08,0:00,1317.75,ES,Confirmation,15:55,,No,,,1317.75,1316.75,1323.5,1321.75,2011-2016,2011-02-08,13:40,1316.75,1323.5,Long,Confirmation,Confirmation,0:00,No,2011-02-08 13:40:00-05:00,2011-02-08,,,,,,,,,,,,,,,,,,2011-02-08 13:40:00-05:00,RS,2011-02-08 10:30:00-05:00,RS,RS,2011-02-08 10:30:00-05:00,190.0,RS,2011-02-08 11:50:00-05:00,False,after_confirm,1.0,5.75,5.75,4.0,True
2011-02-09,0:00,1316.5,ES,Confirmation,10:45,,No,,,1316.5,1315.75,1321.75,1321.75,2011-2016,2011-02-09,8:30,1315.75,1321.75,Long,Confirmation,Confirmation,0:00,No,2011-02-09 08:30:00-05:00,2011-02-09,,,,,,,,,,,,,,,,,,2011-02-09 08:30:00-05:00,TR,2011-02-09 08:30:00-05:00,TR,TR,2011-02-09 08:30:00-05:00,0.0,,,False,m7,0.75,5.25,7.0,7.0,True
2011-02-09,0:00,1321.75,ES,Confirmation,14:35,,No,,,1321.75,1322.5,1313.0,1313.0,2011-2016,2011-02-09,10:50,1322.5,1313.0,Short,Confirmation,Confirmation,0:00,No,2011-02-09 10:50:00-05:00,2011-02-09,,,,,,,,,,,,,,,,,,2011-02-09 10:50:00-05:00,RS,2011-02-09 10:30:00-05:00,RS,RS,2011-02-09 10:30:00-05:00,20.0,RS,2011-02-09 10:45:00-05:00,False,after_confirm,0.75,8.75,11.666666666666666,11.666666666666666,True
2011-02-09,0:00,1319.75,ES,Confirmation,22:20,,Yes,,,1319.75,1319.0,1323.75,1319.75,2011-2016,2011-02-09,20:50,1319.0,1323.75,Long,Confirmation,Confirmation,0:00,Yes,2011-02-09 20:50:00-05:00,2011-02-09,,,,,,,,,,,,,,,,,,2011-02-09 20:50:00-05:00,AS,2011-02-09 20:30:00-05:00,AS,AS,2011-02-08 20:30:00-05:00,1460.0,AS,2011-02-09 00:00:00-05:00,False,after_confirm,0.75,4.0,5.333333333333333,0.0,False
2011-02-10,0:00,1318.75,ES,Confirmation,4:25,,No,,,1318.75,1319.75,1311.75,1311.75,2011-2016,2011-02-10,0:40,1319.75,1311.75,Short,Confirmation,Confirmation,0:00,No,2011-02-10 00:40:00-05:00,2011-02-10,,,,,,,,,,,,,,,,,,2011-02-10 00:40:00-05:00,AS,2011-02-09 20:30:00-05:00,AS,AS,2011-02-09 20:30:00-05:00,250.0,AS,2011-02-10 00:00:00-05:00,False,after_confirm,1.0,7.0,7.0,7.0,True
2011-02-10,0:00,1315.75,ES,Confirmation,4:25,,No,,,1315.75,1316.75,1311.75,1311.75,2011-2016,2011-02-10,3:05,1316.75,1311.75,Short,Confirmation,Confirmation,0:00,No,2011-02-10 03:05:00-05:00,2011-02-10,,,,,,,,,,,,,,,,,,2011-02-10 03:05:00-05:00,OR,2011-02-10 03:00:00-05:00,OR,OR,2011-02-10 03:00:00-05:00,5.0,,,False,m7,1.0,4.0,4.0,4.0,True
2011-02-11,0:00,1315.0,ES,Confirmation,10:40,,No,,,1315.0,1313.5,1321.0,1321.0,2011-2016,2011-02-11,9:50,1313.5,1321.0,Long,Confirmation,Confirmation,0:00,No,2011-02-11 09:50:00-05:00,2011-02-11,,,,,,,,,,,,,,,,,,2011-02-11 09:50:00-05:00,RR,2011-02-11 09:30:00-05:00,RR,RR,2011-02-11 09:30:00-05:00,20.0,RR,2011-02-11 10:25:00-05:00,True,other,1.5,6.0,4.0,4.0,True
2011-02-13,0:00,1326.0,ES,Confirmation,1:45,,No,,,1326.0,1324.75,1330.0,1330.0,2011-2016,2011-02-13,21:05,1324.75,1330.0,Long,Confirmation,Confirmation,0:00,No,2011-02-13 21:05:00-05:00,2011-02-13,,,,,,,,,,,,,,,,,,2011-02-13 21:05:00-05:00,AS,2011-02-13 20:30:00-05:00,AS,AS,2011-02-13 20:30:00-05:00,35.0,AS,2011-02-13 20:50:00-05:00,False,after_confirm,1.25,4.0,3.2,3.2,True
2011-02-14,0:00,1325.75,ES,Confirmation,10:45,,Yes,,,1325.75,1324.5,1329.75,1324.5,2011-2016,2011-02-14,6:05,1324.5,1329.75,Long,Confirmation,Confirmation,0:00,Yes,2011-02-14 06:05:00-05:00,2011-02-14,,,,,,,,,,,,,,,,,,2011-02-14 06:05:00-05:00,OS,2011-02-14 04:00:00-05:00,OS,OS,2011-02-14 04:00:00-05:00,125.0,OS,2011-02-14 04:35:00-05:00,False,after_confirm,1.25,4.0,3.2,-1.0,False
2011-02-15,0:00,1328.75,ES,Confirmation,15:55,,No,,,1328.75,1330.0,1320.75,1326.0,2011-2016,2011-02-15,3:50,1330.0,1320.75,Short,Confirmation,Confirmation,0:00,No,2011-02-15 03:50:00-05:00,2011-02-15,,,,,,,,,,,,,,,,,,2011-02-15 03:50:00-05:00,OR,2011-02-15 03:00:00-05:00,OR,OR,2011-02-15 03:00:00-05:00,50.0,,,False,frontrun_window,1.25,8.0,6.4,2.2,True
2011-02-15,0:00,1326.75,ES,Confirmation,22:10,,Yes,,,1326.75,1328.0,1320.75,1328.0,2011-2016,2011-02-15,20:35,1328.0,1320.75,Short,Confirmation,Confirmation,0:00,Yes,2011-02-15 20:35:00-05:00,2011-02-15,,,,,,,,,,,,,,,,,,2011-02-15 20:35:00-05:00,AS,2011-02-15 20:30:00-05:00,AS,AS,2011-02-14 20:30:00-05:00,1445.0,AS,2011-02-15 00:00:00-05:00,False,after_confirm,1.25,6.0,4.8,-1.0,False
2011-02-16,0:00,1335.5,ES,Confirmation,12:05,,No,,,1335.5,1336.5,1327.75,1327.75,2011-2016,2011-02-16,11:00,1336.5,1327.75,Short,Confirmation,Confirmation,0:00,No,2011-02-16 11:00:00-05:00,2011-02-16,,,,,,,,,,,,,,,,,,2011-02-16 11:00:00-05:00,RS,2011-02-16 10:30:00-05:00,RS,RS,2011-02-16 10:30:00-05:00,30.0,RS,2011-02-16 10:35:00-05:00,False,after_confirm,1.0,7.75,7.75,7.75,True
2011-02-16,0:00,1326.75,ES,Confirmation,22:10,,No,,,1326.75,1325.75,1331.25,1331.25,2011-2016,2011-02-16,20:15,1325.75,1331.25,Long,Confirmation,Confirmation,0:00,No,2011-02-16 20:15:00-05:00,2011-02-16,,,,,,,,,,,,,,,,,,2011-02-16 20:15:00-05:00,AR,2011-02-16 19:30:00-05:00,AR,AR,2011-02-16 19:30:00-05:00,45.0,AR,2011-02-16 20:25:00-05:00,True,frontrun_window,1.0,4.5,4.5,4.5,True
2011-02-17,0:00,1332.75,ES,Confirmation,13:05,,No,,,1332.75,1331.75,1337.75,1337.75,2011-2016,2011-02-17,10:50,1331.75,1337.75,Long,Confirmation,Confirmation,0:00,No,2011-02-17 10:50:00-05:00,2011-02-17,,,,,,,,,,,,,,,,,,2011-02-17 10:50:00-05:00,RS,2011-02-17 10:30:00-05:00,RS,RS,2011-02-17 10:30:00-05:00,20.0,RS,2011-02-17 11:10:00-05:00,True,other,1.0,5.0,5.0,5.0,True
2011-02-17,0:00,1337.25,ES,Confirmation,4:45,,Yes,,,1337.25,1336.5,1341.0,1336.5,2011-2016,2011-02-17,21:20,1336.5,1341.0,Long,Confirmation,Confirmation,0:00,Yes,2011-02-17 21:20:00-05:00,2011-02-17,,,,,,,,,,,,,,,,,,2011-02-17 21:20:00-05:00,AS,2011-02-17 20:30:00-05:00,AS,AS,2011-02-16 20:30:00-05:00,1490.0,AS,2011-02-17 00:25:00-05:00,False,after_confirm,0.75,3.75,5.0,-1.0,False
2011-02-18,0:00,1335.5,ES,Confirmation,11:20,,No,,,1335.5,1334.75,1341.0,1341.0,2011-2016,2011-02-18,5:20,1334.75,1341.0,Long,Confirmation,Confirmation,0:00,No,2011-02-18 05:20:00-05:00,2011-02-18,,,,,,,,,,,,,,,,,,2011-02-18 05:20:00-05:00,OS,2011-02-18 04:00:00-05:00,OS,OS,2011-02-18 04:00:00-05:00,80.0,OS,2011-02-18 04:25:00-05:00,False,after_confirm,0.75,5.5,7.333333333333333,7.333333333333333,True
2011-02-22,0:00,1324.25,ES,Confirmation,10:00,,No,,,1324.25,1323.0,1331.75,1331.75,2011-2016,2011-02-22,6:50,1323.0,1331.75,Long,Confirmation,Confirmation,0:00,No,2011-02-22 06:50:00-05:00,2011-02-22,,,,,,,,,,,,,,,,,,2011-02-22 06:50:00-05:00,OS,2011-02-22 04:00:00-05:00,OS,OS,2011-02-22 04:00:00-05:00,170.0,OS,2011-02-22 04:05:00-05:00,False,after_confirm,1.25,7.5,6.0,6.0,True
2011-02-22,0:00,1325.5,ES,Confirmation,12:50,,No,,,1325.5,1327.5,1316.0,1316.0,2011-2016,2011-02-22,11:40,1327.5,1316.0,Short,Confirmation,Confirmation,0:00,No,2011-02-22 11:40:00-05:00,2011-02-22,,,,,,,,,,,,,,,,,,2011-02-22 11:40:00-05:00,RS,2011-02-22 10:30:00-05:00,RS,RS,2011-02-22 10:30:00-05:00,70.0,RS,2011-02-22 12:05:00-05:00,True,frontrun_window,2.0,9.5,4.75,4.75,True
2011-02-23,0:00,1317.75,ES,Confirmation,12:05,,No,,,1317.75,1319.0,1310.25,1310.25,2011-2016,2011-02-23,8:25,1319.0,1310.25,Short,Confirmation,Confirmation,0:00,No,2011-02-23 08:25:00-05:00,2011-02-23,,,,,,,,,,,,,,,,,,2011-02-23 08:25:00-05:00,OS,2011-02-23 04:00:00-05:00,OS,OS,2011-02-23 04:00:00-05:00,265.0,OS,2011-02-23 06:30:00-05:00,False,after_confirm,1.25,7.5,6.0,6.0,True
2011-02-23,0:00,1313.0,ES,Confirmation,10:00,,No,,,1313.0,1314.75,1302.5,1302.5,2011-2016,2011-02-23,11:10,1314.75,1302.5,Short,Confirmation,Confirmation,0:00,No,2011-02-23 11:10:00-05:00,2011-02-23,,,,,,,,,,,,,,,,,,2011-02-23 11:10:00-05:00,RS,2011-02-23 10:30:00-05:00,RS,RS,2011-02-23 10:30:00-05:00,40.0,RS,2011-02-23 11:35:00-05:00,True,frontrun_window,1.75,10.5,6.0,6.0,True
2011-02-24,0:00,1294.75,ES,Confirmation,9:40,,No,,,1294.75,1293.25,1307.75,1307.75,2011-2016,2011-02-24,4:15,1293.25,1307.75,Long,Confirmation,Confirmation,0:00,No,2011-02-24 04:15:00-05:00,2011-02-24,,,,,,,,,,,,,,,,,,2011-02-24 04:15:00-05:00,OS,2011-02-24 04:00:00-05:00,OS,OS,2011-02-24 04:00:00-05:00,15.0,OS,2011-02-24 05:00:00-05:00,True,other,1.5,13.0,8.666666666666666,8.666666666666666,True
2011-02-24,0:00,1297.75,ES,Confirmation,9:40,,No,,,1297.75,1296.5,1307.75,1307.75,2011-2016,2011-02-24,7:55,1296.5,1307.75,Long,Confirmation,Confirmation,0:00,No,2011-02-24 07:55:00-05:00,2011-02-24,,,,,,,,,,,,,,,,,,2011-02-24 07:55:00-05:00,OS,2011-02-24 04:00:00-05:00,OS,OS,2011-02-24 04:00:00-05:00,235.0,OS,2011-02-24 05:00:00-05:00,False,after_confirm,1.25,10.0,8.0,8.0,True
2011-02-24,0:00,1305.5,ES,Confirmation,13:55,,No,,,1305.5,1307.25,1294.5,1294.5,2011-2016,2011-02-24,11:35,1307.25,1294.5,Short,Confirmation,Confirmation,0:00,No,2011-02-24 11:35:00-05:00,2011-02-24,,,,,,,,,,,,,,,,,,2011-02-24 11:35:00-05:00,RS,2011-02-24 10:30:00-05:00,RS,RS,2011-02-24 10:30:00-05:00,65.0,RS,2011-02-24 11:45:00-05:00,True,frontrun_window,1.75,11.0,6.285714285714286,6.285714285714286,True
2011-02-25,0:00,1307.5,ES,Confirmation,7:10,,No,,,1307.5,1306.5,1312.75,1307.5,2011-2016,2011-02-25,3:45,1306.5,1312.75,Long,Confirmation,Confirmation,0:00,No,2011-02-25 03:45:00-05:00,2011-02-25,,,,,,,,,,,,,,,,,,2011-02-25 03:45:00-05:00,OR,2011-02-25 03:00:00-05:00,OR,OR,2011-02-25 03:00:00-05:00,45.0,,,False,frontrun_window,1.0,5.25,5.25,0.0,False
2011-02-25,0:00,1312.25,ES,Confirmation,15:55,,No,,,1312.25,1310.25,1321.25,1318.75,2011-2016,2011-02-25,9:45,1310.25,1321.25,Long,Confirmation,Confirmation,0:00,No,2011-02-25 09:45:00-05:00,2011-02-25,,,,,,,,,,,,,,,,,,2011-02-25 09:45:00-05:00,RR,2011-02-25 09:30:00-05:00,RR,RR,2011-02-25 09:30:00-05:00,15.0,RR,2011-02-25 10:25:00-05:00,True,other,2.0,9.0,4.5,3.25,True
2011-02-27,0:00,1313.25,ES,Confirmation,7:15,,No,,,1313.25,1312.0,1320.0,1320.0,2011-2016,2011-02-27,20:50,1312.0,1320.0,Long,Confirmation,Confirmation,0:00,No,2011-02-27 20:50:00-05:00,2011-02-27,,,,,,,,,,,,,,,,,,2011-02-27 20:50:00-05:00,AS,2011-02-27 20:30:00-05:00,AS,AS,2011-02-27 20:30:00-05:00,20.0,AS,2011-02-27 20:40:00-05:00,False,after_confirm,1.25,6.75,5.4,5.4,True
2011-02-28,0:00,1315.0,ES,Confirmation,7:15,,No,,,1315.0,1314.0,1320.5,1320.5,2011-2016,2011-02-28,5:00,1314.0,1320.5,Long,Confirmation,Confirmation,0:00,No,2011-02-28 05:00:00-05:00,2011-02-28,,,,,,,,,,,,,,,,,,2011-02-28 05:00:00-05:00,OS,2011-02-28 04:00:00-05:00,OS,OS,2011-02-28 04:00:00-05:00,60.0,OS,2011-02-28 04:10:00-05:00,False,after_confirm,1.0,5.5,5.5,5.5,True
2011-02-28,0:00,1328.0,ES,Confirmation,3:30,,No,,,1328.0,1327.25,1334.5,1334.5,2011-2016,2011-02-28,21:00,1327.25,1334.5,Long,Confirmation,Confirmation,0:00,No,2011-02-28 21:00:00-05:00,2011-02-28,,,,,,,,,,,,,,,,,,2011-02-28 21:00:00-05:00,AS,2011-02-28 20:30:00-05:00,AS,AS,2011-02-27 20:30:00-05:00,1470.0,AS,2011-02-28 00:00:00-05:00,False,after_confirm,0.75,6.5,8.666666666666666,8.666666666666666,True
2011-03-01,0:00,1332.0,ES,Confirmation,10:05,,No,,,1332.0,1333.0,1324.0,1324.0,2011-2016,2011-03-01,6:55,1333.0,1324.0,Short,Confirmation,Confirmation,0:00,No,2011-03-01 06:55:00-05:00,2011-03-01,,,,,,,,,,,,,,,,,,2011-03-01 06:55:00-05:00,OS,2011-03-01 04:00:00-05:00,OS,OS,2011-03-01 04:00:00-05:00,175.0,OS,2011-03-01 06:35:00-05:00,False,after_confirm,1.0,8.0,8.0,8.0,True
2011-03-01,0:00,1323.25,ES,Confirmation,14:25,,No,,,1323.25,1325.25,1307.5,1307.5,2011-2016,2011-03-01,11:15,1325.25,1307.5,Short,Confirmation,Confirmation,0:00,No,2011-03-01 11:15:00-05:00,2011-03-01,,,,,,,,,,,,,,,,,,2011-03-01 11:15:00-05:00,RS,2011-03-01 10:30:00-05:00,RS,RS,2011-03-01 10:30:00-05:00,45.0,RS,2011-03-01 11:45:00-05:00,True,frontrun_window,2.0,15.75,7.875,7.875,True
2011-03-01,0:00,1301.25,ES,Confirmation,12:50,,Yes,,,1301.25,1302.25,1293.5,1302.25,2011-2016,2011-03-01,20:50,1302.25,1293.5,Short,Confirmation,Confirmation,0:00,Yes,2011-03-01 20:50:00-05:00,2011-03-01,,,,,,,,,,,,,,,,,,2011-03-01 20:50:00-05:00,AS,2011-03-01 20:30:00-05:00,AS,AS,2011-02-28 20:30:00-05:00,1460.0,AS,2011-03-01 00:00:00-05:00,False,after_confirm,1.0,7.75,7.75,-1.0,False
2011-03-02,0:00,1298.75,ES,Confirmation,8:25,,Yes,,,1298.75,1297.75,1306.5,1297.75,2011-2016,2011-03-02,4:25,1297.75,1306.5,Long,Confirmation,Confirmation,0:00,Yes,2011-03-02 04:25:00-05:00,2011-03-02,,,,,,,,,,,,,,,,,,2011-03-02 04:25:00-05:00,OS,2011-03-02 04:00:00-05:00,OS,OS,2011-03-02 04:00:00-05:00,25.0,OS,2011-03-02 05:15:00-05:00,True,other,1.0,7.75,7.75,-1.0,False
2011-03-02,0:00,1298.75,ES,Confirmation,10:05,,No,,,1298.75,1297.25,1309.5,1309.5,2011-2016,2011-03-02,8:30,1297.25,1309.5,Long,Confirmation,Confirmation,0:00,No,2011-03-02 08:30:00-05:00,2011-03-02,,,,,,,,,,,,,,,,,,2011-03-02 08:30:00-05:00,TR,2011-03-02 08:30:00-05:00,TR,TR,2011-03-02 08:30:00-05:00,0.0,,,False,m7,1.5,10.75,7.166666666666667,7.166666666666667,True
2011-03-02,0:00,1308.25,ES,Confirmation,0:50,,No,,,1308.25,1307.5,1313.75,1313.75,2011-2016,2011-03-02,20:35,1307.5,1313.75,Long,Confirmation,Confirmation,0:00,No,2011-03-02 20:35:00-05:00,2011-03-02,,,,,,,,,,,,,,,,,,2011-03-02 20:35:00-05:00,AS,2011-03-02 20:30:00-05:00,AS,AS,2011-03-01 20:30:00-05:00,1445.0,AS,2011-03-02 00:00:00-05:00,False,after_confirm,0.75,5.5,7.333333333333333,7.333333333333333,True
2011-03-03,0:00,1311.0,ES,Confirmation,6:30,,No,,,1311.0,1310.0,1316.25,1316.25,2011-2016,2011-03-03,4:35,1310.0,1316.25,Long,Confirmation,Confirmation,0:00,No,2011-03-03 04:35:00-05:00,2011-03-03,,,,,,,,,,,,,,,,,,2011-03-03 04:35:00-05:00,OS,2011-03-03 04:00:00-05:00,OS,OS,2011-03-03 04:00:00-05:00,35.0,OS,2011-03-03 05:10:00-05:00,True,other,1.0,5.25,5.25,5.25,True
2011-03-03,0:00,1321.75,ES,Confirmation,12:50,,No,,,1321.75,1320.5,1328.0,1328.0,2011-2016,2011-03-03,10:35,1320.5,1328.0,Long,Confirmation,Confirmation,0:00,No,2011-03-03 10:35:00-05:00,2011-03-03,,,,,,,,,,,,,,,,,,2011-03-03 10:35:00-05:00,RS,2011-03-03 10:30:00-05:00,RS,RS,2011-03-03 10:30:00-05:00,5.0,RS,2011-03-03 11:00:00-05:00,True,m7,1.25,6.25,5.0,5.0,True
2011-03-04,0:00,1330.75,ES,Confirmation,12:20,,No,,,1330.75,1333.0,1313.75,1313.75,2011-2016,2011-03-04,9:20,1333.0,1313.75,Short,Confirmation,Confirmation,0:00,No,2011-03-04 09:20:00-05:00,2011-03-04,,,,,,,,,,,,,,,,,,2011-03-04 09:20:00-05:00,TR,2011-03-04 08:30:00-05:00,TR,TR,2011-03-04 08:30:00-05:00,50.0,,,False,frontrun_window,2.25,17.0,7.555555555555555,7.555555555555555,True
2011-03-07,0:00,1323.25,ES,Confirmation,11:30,,No,,,1323.25,1324.75,1311.25,1323.25,2011-2016,2011-03-07,10:30,1324.75,1311.25,Short,Confirmation,Confirmation,0:00,No,2011-03-07 10:30:00-05:00,2011-03-07,,,,,,,,,,,,,,,,,,2011-03-07 10:30:00-05:00,RS,2011-03-07 10:30:00-05:00,RS,RS,2011-03-07 10:30:00-05:00,0.0,RS,2011-03-07 10:35:00-05:00,True,m7,1.5,12.0,8.0,-0.0,False
2011-03-07,0:00,1320.75,ES,Confirmation,1:55,,No,,,1320.75,1322.0,1311.25,1315.0,2011-2016,2011-03-07,19:45,1322.0,1311.25,Short,Confirmation,Confirmation,0:00,No,2011-03-07 19:45:00-05:00,2011-03-07,,,,,,,,,,,,,,,,,,2011-03-07 19:45:00-05:00,AR,2011-03-07 19:30:00-05:00,AR,AR,2011-03-07 19:30:00-05:00,15.0,AR,2011-03-07 20:25:00-05:00,True,other,1.25,9.5,7.6,4.6,True
2011-03-08,0:00,1315.25,ES,Confirmation,7:30,,No,,,1315.25,1316.25,1310.0,1310.0,2011-2016,2011-03-08,6:15,1316.25,1310.0,Short,Confirmation,Confirmation,0:00,No,2011-03-08 06:15:00-05:00,2011-03-08,,,,,,,,,,,,,,,,,,2011-03-08 06:15:00-05:00,OS,2011-03-08 04:00:00-05:00,OS,OS,2011-03-08 04:00:00-05:00,135.0,OS,2011-03-08 05:35:00-05:00,False,after_confirm,1.0,5.25,5.25,5.25,True
2011-03-08,0:00,1308.75,ES,Confirmation,15:55,,No,,,1308.75,1306.0,1327.25,1321.75,2011-2016,2011-03-08,9:55,1306.0,1327.25,Long,Confirmation,Confirmation,0:00,No,2011-03-08 09:55:00-05:00,2011-03-08,,,,,,,,,,,,,,,,,,2011-03-08 09:55:00-05:00,RR,2011-03-08 09:30:00-05:00,RR,RR,2011-03-08 09:30:00-05:00,25.0,RR,2011-03-08 10:25:00-05:00,True,other,2.75,18.5,6.7272727272727275,4.7272727272727275,True
2011-03-09,0:00,1318.25,ES,Confirmation,9:05,,Be,,,1318.25,1317.0,1325.5,1318.25,2011-2016,2011-03-09,3:40,1317.0,1325.5,Long,Confirmation,Confirmation,0:00,Be,2011-03-09 03:40:00-05:00,2011-03-09,,,,,,,,,,,,,,,,,,2011-03-09 03:40:00-05:00,OR,2011-03-09 03:00:00-05:00,OR,OR,2011-03-09 03:00:00-05:00,40.0,,,False,frontrun_window,1.25,7.25,5.8,0.0,False
2011-03-10,0:00,1298.0,ES,Confirmation,1:20,,No,,,1298.0,1299.25,1289.25,1289.25,2011-2016,2011-03-10,20:20,1299.25,1289.25,Short,Confirmation,Confirmation,0:00,No,2011-03-10 20:20:00-05:00,2011-03-10,,,,,,,,,,,,,,,,,,2011-03-10 20:20:00-05:00,AR,2011-03-10 19:30:00-05:00,AR,AR,2011-03-10 19:30:00-05:00,50.0,AR,2011-03-10 20:25:00-05:00,True,frontrun_window,1.25,8.75,7.0,7.0,True
2011-03-11,0:00,1294.0,ES,Confirmation,15:00,,No,,,1294.0,1292.0,1305.75,1305.75,2011-2016,2011-03-11,10:45,1292.0,1305.75,Long,Confirmation,Confirmation,0:00,No,2011-03-11 10:45:00-05:00,2011-03-11,,,,,,,,,,,,,,,,,,2011-03-11 10:45:00-05:00,RS,2011-03-11 10:30:00-05:00,RS,RS,2011-03-11 10:30:00-05:00,15.0,RS,2011-03-11 11:35:00-05:00,True,other,2.0,11.75,5.875,5.875,True
2011-03-14,0:00,1286.5,ES,Confirmation,22:10,,No,,,1286.5,1287.75,1275.0,1275.0,2011-2016,2011-03-14,20:40,1287.75,1275.0,Short,Confirmation,Confirmation,0:00,No,2011-03-14 20:40:00-04:00,2011-03-14,,,,,,,,,,,,,,,,,,2011-03-14 20:40:00-04:00,AS,2011-03-14 20:30:00-04:00,AS,AS,2011-03-13 21:30:00-04:00,1390.0,AS,2011-03-14 00:00:00-04:00,False,after_confirm,1.25,11.5,9.2,9.2,True
2011-03-15,0:00,1256.0,ES,Confirmation,15:20,,No,,,1256.0,1250.75,1281.0,1281.0,2011-2016,2011-03-15,9:25,1250.75,1281.0,Long,Confirmation,Confirmation,0:00,No,2011-03-15 09:25:00-04:00,2011-03-15,,,,,,,,,,,,,,,,,,2011-03-15 09:25:00-04:00,TR,2011-03-15 08:30:00-04:00,TR,TR,2011-03-15 08:30:00-04:00,55.0,,,False,frontrun_window,5.25,25.0,4.761904761904762,4.761904761904762,True
2011-03-15,0:00,1274.75,ES,Confirmation,22:55,,Be,,,1274.75,1272.5,1286.75,1272.5,2011-2016,2011-03-15,20:15,1272.5,1286.75,Long,Confirmation,Confirmation,0:00,Be,2011-03-15 20:15:00-04:00,2011-03-15,,,,,,,,,,,,,,,,,,2011-03-15 20:15:00-04:00,AR,2011-03-15 19:30:00-04:00,AR,AR,2011-03-15 19:30:00-04:00,45.0,AR,2011-03-15 20:25:00-04:00,True,frontrun_window,2.25,12.0,5.333333333333333,-1.0,False
2011-03-16,0:00,1273.75,ES,Confirmation,5:35,,Be,,,1273.75,1271.5,1286.75,1271.5,2011-2016,2011-03-16,0:30,1271.5,1286.75,Long,Confirmation,Confirmation,0:00,Be,2011-03-16 00:30:00-04:00,2011-03-16,,,,,,,,,,,,,,,,,,2011-03-16 00:30:00-04:00,AS,2011-03-15 20:30:00-04:00,AS,AS,2011-03-15 20:30:00-04:00,240.0,AS,2011-03-16 00:00:00-04:00,False,after_confirm,2.25,13.0,5.777777777777778,-1.0,False
2011-03-16,0:00,1275.5,ES,Confirmation,13:40,,No,,,1275.5,1277.5,1255.25,1255.25,2011-2016,2011-03-16,10:50,1277.5,1255.25,Short,Confirmation,Confirmation,0:00,No,2011-03-16 10:50:00-04:00,2011-03-16,,,,,,,,,,,,,,,,,,2011-03-16 10:50:00-04:00,RS,2011-03-16 10:30:00-04:00,RS,RS,2011-03-16 10:30:00-04:00,20.0,RS,2011-03-16 10:35:00-04:00,False,after_confirm,2.0,20.25,10.125,10.125,True
2011-03-18,0:00,1283.25,ES,Confirmation,14:15,,No,,,1283.25,1285.25,1273.5,1273.5,2011-2016,2011-03-18,9:35,1285.25,1273.5,Short,Confirmation,Confirmation,0:00,No,2011-03-18 09:35:00-04:00,2011-03-18,,,,,,,,,,,,,,,,,,2011-03-18 09:35:00-04:00,RR,2011-03-18 09:30:00-04:00,RR,RR,2011-03-18 09:30:00-04:00,5.0,RR,2011-03-18 10:25:00-04:00,True,m7,2.0,9.75,4.875,4.875,True
2011-03-20,0:00,1279.75,ES,Confirmation,21:55,,No,,,1279.75,1278.5,1285.0,1285.0,2011-2016,2011-03-20,21:30,1278.5,1285.0,Long,Confirmation,Confirmation,0:00,No,2011-03-20 21:30:00-04:00,2011-03-20,,,,,,,,,,,,,,,,,,2011-03-20 21:30:00-04:00,AS,2011-03-20 20:30:00-04:00,AS,AS,2011-03-20 20:30:00-04:00,60.0,AS,2011-03-20 22:05:00-04:00,True,frontrun_window,1.25,5.25,4.2,4.2,True
2011-03-21,0:00,1283.5,ES,Confirmation,10:30,,No,,,1283.5,1282.5,1295.25,1295.25,2011-2016,2011-03-21,2:45,1282.5,1295.25,Long,Confirmation,Confirmation,0:00,No,2011-03-21 02:45:00-04:00,2011-03-21,,,,,,,,,,,,,,,,,,2011-03-21 02:45:00-04:00,TO,2011-03-21 02:00:00-04:00,TO,TO,2011-03-21 02:00:00-04:00,45.0,,,False,frontrun_window,1.0,11.75,11.75,11.75,True
01/03/2018,,2698.25,,,,,,,,,,,2710.5,2018,2018-01-03,9:35,2697.25,2710.5,Long,M7 Candle,No Conf,,W,2018-01-03 09:35:00-05:00,2018-01-03,,9:35,ES,No Conf,Long,RDR,M7 Candle,W,2698.25,2697.25,2710.5,2710.5,RDR,,,,,2018-01-03 09:35:00-05:00,RR,2018-01-03 09:30:00-05:00,RR,RR,2018-01-03 09:30:00-05:00,5.0,RR,2018-01-03 10:25:00-05:00,True,m7,1.0,12.25,12.25,12.25,True
01/03/2018,,2706.0,,,,,,,,,,,2712.5,2018_set2,2018-01-03,11:05,2704.75,2714.75,Long,Mode,Confirmed,10:30,W,2018-01-03 11:05:00-05:00,2018-01-03,10:30,11:05,ES,Confirmed,Long,RDR,Mode,W,,,,,RDR,2706.0,2704.75,2714.75,2712.5,2018-01-03 11:05:00-05:00,RS,2018-01-03 10:30:00-05:00,RR,RR,2018-01-03 09:30:00-05:00,95.0,RR,2018-01-03 10:25:00-05:00,False,after_confirm,1.25,8.75,7.0,5.2,True
01/04/2018,,2721.0,,,,,,,,,,,2724.0,2018,2018-01-04,9:35,2719.0,2730.0,Long,Mode,No Conf,,W,2018-01-04 09:35:00-05:00,2018-01-04,,9:35,ES,No Conf,Long,RDR,Mode,W,2721.0,2719.0,2730.0,2724.0,RDR,,,,,2018-01-04 09:35:00-05:00,RR,2018-01-04 09:30:00-05:00,RR,RR,2018-01-04 09:30:00-05:00,5.0,RR,2018-01-04 10:25:00-05:00,True,m7,2.0,9.0,4.5,1.5,True
01/04/2018,,2723.75,,,,,,,,,,,2721.75,2018_set2,2018-01-04,11:15,2721.75,2733.25,Long,Mode,Confirmed,10:30,EX,2018-01-04 11:15:00-05:00,2018-01-04,10:30,11:15,ES,Confirmed,Long,RDR,Mode,EX,,,,,RDR,2723.75,2721.75,2733.25,2721.75,2018-01-04 11:15:00-05:00,RS,2018-01-04 10:30:00-05:00,RR,RR,2018-01-04 09:30:00-05:00,105.0,RR,2018-01-04 10:25:00-05:00,False,after_confirm,2.0,9.5,4.75,-1.0,False
01/05/2018,,2732.0,,,,,,,,,,,2738.75,2018_set2,2018-01-05,13:00,2730.75,2738.75,Long,Mode,Confirmed,11:15,W,2018-01-05 13:00:00-05:00,2018-01-05,11:15,13:00,ES,Confirmed,Long,RDR,Mode,W,,,,,RDR,2732.0,2730.75,2738.75,2738.75,2018-01-05 13:00:00-05:00,RS,2018-01-05 10:30:00-05:00,RR,RR,2018-01-05 09:30:00-05:00,210.0,RR,2018-01-05 10:25:00-05:00,False,after_confirm,1.25,6.75,5.4,5.4,True
01/08/2018,,2739.5,,,,,,,,,,,2747.25,2018_set2,2018-01-08,10:45,2738.0,2747.25,Long,Mode,Wick,10:30,W,2018-01-08 10:45:00-05:00,2018-01-08,10:30,10:45,ES,Wick,Long,RDR,Mode,W,,,,,RDR,2739.5,2738.0,2747.25,2747.25,2018-01-08 10:45:00-05:00,RS,2018-01-08 10:30:00-05:00,RR,RR,2018-01-08 09:30:00-05:00,75.0,RR,2018-01-08 10:25:00-05:00,False,after_confirm,1.5,7.75,5.166666666666667,5.166666666666667,True
01/08/2018,,2741.75,,,,,,,,,,,2748.0,2018,2018-01-08,11:25,2740.75,2748.0,Long,Mode,Confirmed,11:10,W,2018-01-08 11:25:00-05:00,2018-01-08,11:10,11:25,ES,Confirmed,Long,RDR,Mode,W,2741.75,2740.75,2748.0,2748.0,RDR,,,,,2018-01-08 11:25:00-05:00,RS,2018-01-08 10:30:00-05:00,RR,RR,2018-01-08 09:30:00-05:00,115.0,RR,2018-01-08 10:25:00-05:00,False,after_confirm,1.0,6.25,6.25,6.25,True
01/09/2018,,2749.5,,,,,,,,,,,2758.25,2018_set2,2018-01-09,10:55,2748.0,2758.25,Long,Retired,Wick,10:30,W,2018-01-09 10:55:00-05:00,2018-01-09,10:30,10:55,ES,Wick,Long,RDR,Retired,W,,,,,RDR,2749.5,2748.0,2758.25,2758.25,2018-01-09 10:55:00-05:00,RS,2018-01-09 10:30:00-05:00,RR,RR,2018-01-09 09:30:00-05:00,85.0,RR,2018-01-09 10:25:00-05:00,False,after_confirm,1.5,8.75,5.833333333333333,5.833333333333333,True
01/09/2018,,2749.5,,,,,,,,,,,2758.5,2018,2018-01-09,10:55,2748.25,2758.5,Long,Mode,No Conf,,W,2018-01-09 10:55:00-05:00,2018-01-09,,10:55,ES,No Conf,Long,RDR,Mode,W,2749.5,2748.25,2758.5,2758.5,RDR,,,,,2018-01-09 10:55:00-05:00,RS,2018-01-09 10:30:00-05:00,RR,RR,2018-01-09 09:30:00-05:00,85.0,RR,2018-01-09 10:25:00-05:00,False,after_confirm,1.25,9.0,7.2,7.2,True
01/10/2018,,2743.75,,,,,,,,,,,2748.75,2018_set2,2018-01-10,10:55,2741.75,2752.75,Long,Mode,Wick,10:40,W,2018-01-10 10:55:00-05:00,2018-01-10,10:40,10:55,ES,Wick,Long,RDR,Mode,W,,,,,RDR,2743.75,2741.75,2752.75,2748.75,2018-01-10 10:55:00-05:00,RS,2018-01-10 10:30:00-05:00,RR,RR,2018-01-10 09:30:00-05:00,85.0,RR,2018-01-10 10:25:00-05:00,False,after_confirm,2.0,9.0,4.5,2.5,True
01/11/2018,,2754.0,,,,,,,,,,,2764.0,2018_set2,2018-01-11,10:35,2752.5,2764.0,Long,Frontrun,No Conf,,W,2018-01-11 10:35:00-05:00,2018-01-11,,10:35,ES,No Conf,Long,RDR,Frontrun,W,,,,,RDR,2754.0,2752.5,2764.0,2764.0,2018-01-11 10:35:00-05:00,RS,2018-01-11 10:30:00-05:00,RR,RR,2018-01-11 09:30:00-05:00,65.0,RR,2018-01-11 10:25:00-05:00,False,after_confirm,1.5,10.0,6.666666666666667,6.666666666666667,True
01/11/2018,,2754.5,,,,,,,,,,,2766.75,2018,2018-01-11,10:40,2753.25,2766.75,Long,Frontrun,No Conf,,W,2018-01-11 10:40:00-05:00,2018-01-11,,10:40,ES,No Conf,Long,RDR,Frontrun,W,2754.5,2753.25,2766.75,2766.75,RDR,,,,,2018-01-11 10:40:00-05:00,RS,2018-01-11 10:30:00-05:00,RR,RR,2018-01-11 09:30:00-05:00,70.0,RR,2018-01-11 10:25:00-05:00,False,after_confirm,1.25,12.25,9.8,9.8,True
01/12/2018,,2778.75,,,,,,,,,,,2784.75,2018,2018-01-12,10:30,2777.5,2784.75,Long,Advanced,No Conf,,W,2018-01-12 10:30:00-05:00,2018-01-12,,10:30,ES,No Conf,Long,RDR,Advanced,W,2778.75,2777.5,2784.75,2784.75,RDR,,,,,2018-01-12 10:30:00-05:00,RS,2018-01-12 10:30:00-05:00,RR,RR,2018-01-12 09:30:00-05:00,60.0,RR,2018-01-12 10:25:00-05:00,False,after_confirm,1.25,6.0,4.8,4.8,True
01/12/2018,,2779.25,,,,,,,,,,,2787.75,2018,2018-01-12,11:15,2778.0,2787.75,Long,Mode,Confirmed,10:35,W,2018-01-12 11:15:00-05:00,2018-01-12,10:35,11:15,ES,Confirmed,Long,RDR,Mode,W,2779.25,2778.0,2787.75,2787.75,RDR,,,,,2018-01-12 11:15:00-05:00,RS,2018-01-12 10:30:00-05:00,RR,RR,2018-01-12 09:30:00-05:00,105.0,RR,2018-01-12 10:25:00-05:00,False,after_confirm,1.25,8.5,6.8,6.8,True
01/12/2018,,2779.25,,,,,,,,,,,2787.75,2018_set2,2018-01-12,11:20,2777.5,2787.75,Long,Mode,Confirmed,10:35,W,2018-01-12 11:20:00-05:00,2018-01-12,10:35,11:20,ES,Confirmed,Long,RDR,Mode,W,,,,,RDR,2779.25,2777.5,2787.75,2787.75,2018-01-12 11:20:00-05:00,RS,2018-01-12 10:30:00-05:00,RR,RR,2018-01-12 09:30:00-05:00,110.0,RR,2018-01-12 10:25:00-05:00,False,after_confirm,1.75,8.5,4.857142857142857,4.857142857142857,True
01/17/2018,,2783.0,,,,,,,,,,,2780.75,2018,2018-01-17,9:45,2780.75,2794.25,Long,Advanced,No Conf,,EX,2018-01-17 09:45:00-05:00,2018-01-17,,9:45,ES,No Conf,Long,RDR,Advanced,EX,2783.0,2780.75,2794.25,2780.75,RDR,,,,,2018-01-17 09:45:00-05:00,RR,2018-01-17 09:30:00-05:00,RR,RR,2018-01-17 09:30:00-05:00,15.0,RR,2018-01-17 10:25:00-05:00,True,other,2.25,11.25,5.0,-1.0,False
01/17/2018,,2783.75,,,,,,,,,,,2781.75,2018,2018-01-17,9:45,2781.75,2794.25,Long,Advanced,No Conf,,EX,2018-01-17 09:45:00-05:00,2018-01-17,,9:45,ES,No Conf,Long,RDR,Advanced,EX,2783.75,2781.75,2794.25,2781.75,RDR,,,,,2018-01-17 09:45:00-05:00,RR,2018-01-17 09:30:00-05:00,RR,RR,2018-01-17 09:30:00-05:00,15.0,RR,2018-01-17 10:25:00-05:00,True,other,2.0,10.5,5.25,-1.0,False
01/17/2018,,2784.75,,,,,,,,,,,2800.75,2018_set2,2018-01-17,10:30,2782.75,2800.75,Long,Frontrun,No Conf,,W,2018-01-17 10:30:00-05:00,2018-01-17,,10:30,ES,No Conf,Long,RDR,Frontrun,W,,,,,RDR,2784.75,2782.75,2800.75,2800.75,2018-01-17 10:30:00-05:00,RS,2018-01-17 10:30:00-05:00,RR,RR,2018-01-17 09:30:00-05:00,60.0,RR,2018-01-17 10:25:00-05:00,False,after_confirm,2.0,16.0,8.0,8.0,True
01/18/2018,,2801.75,,,,,,,,,,,2803.25,2018,2018-01-18,8:05,2803.25,2793.75,Short,Advanced,No Conf,,EX,2018-01-18 08:05:00-05:00,2018-01-18,,8:05,ES,No Conf,Short,ODR,Advanced,EX,2801.75,2803.25,2793.75,2803.25,ODR,,,,,2018-01-18 08:05:00-05:00,OS,2018-01-18 04:00:00-05:00,OR,OR,2018-01-18 03:00:00-05:00,305.0,,,False,other,1.5,8.0,5.333333333333333,-1.0,False
01/18/2018,,2799.75,,,,,,,,,,,2801.0,2018,2018-01-18,10:30,2801.0,2791.5,Short,Frontrun,No Conf,,EX,2018-01-18 10:30:00-05:00,2018-01-18,,10:30,ES,No Conf,Short,RDR,Frontrun,EX,2799.75,2801.0,2791.5,2801.0,RDR,,,,,2018-01-18 10:30:00-05:00,RS,2018-01-18 10:30:00-05:00,RR,RR,2018-01-18 09:30:00-05:00,60.0,RR,2018-01-18 10:25:00-05:00,False,after_confirm,1.25,8.25,6.6,-1.0,False
01/19/2018,,2807.0,,,,,,,,,,,2807.0,2018,2018-01-19,9:45,2809.0,2791.75,Short,Mode,No Conf,,BE,2018-01-19 09:45:00-05:00,2018-01-19,,9:45,ES,No Conf,Short,RDR,Mode,BE,2807.0,2809.0,2791.75,2807.0,RDR,,,,,2018-01-19 09:45:00-05:00,RR,2018-01-19 09:30:00-05:00,RR,RR,2018-01-19 09:30:00-05:00,15.0,RR,2018-01-19 10:25:00-05:00,True,other,2.0,15.25,7.625,-0.0,False
01/19/2018,,2805.5,,,,,,,,,,,2803.5,2018_set2,2018-01-19,10:35,2803.5,2814.5,Long,Frontrun,No Conf,,EX,2018-01-19 10:35:00-05:00,2018-01-19,,10:35,ES,No Conf,Long,RDR,Frontrun,EX,,,,,RDR,2805.5,2803.5,2814.5,2803.5,2018-01-19 10:35:00-05:00,RS,2018-01-19 10:30:00-05:00,RR,RR,2018-01-19 09:30:00-05:00,65.0,RR,2018-01-19 10:25:00-05:00,False,after_confirm,2.0,9.0,4.5,-1.0,False
01/19/2018,,2803.25,,,,,,,,,,,2803.25,2018,2018-01-19,11:00,2804.75,2791.75,Short,Mode,No Conf,,BE,2018-01-19 11:00:00-05:00,2018-01-19,,11:00,ES,No Conf,Short,RDR,Mode,BE,2803.25,2804.75,2791.75,2803.25,RDR,,,,,2018-01-19 11:00:00-05:00,RS,2018-01-19 10:30:00-05:00,RR,RR,2018-01-19 09:30:00-05:00,90.0,RR,2018-01-19 10:25:00-05:00,False,after_confirm,1.5,11.5,7.666666666666667,-0.0,False
01/19/2018,,2802.25,,,,,,,,,,,2804.0,2018,2018-01-19,11:55,2804.0,2791.75,Short,Mode,Wick,11:05,EX,2018-01-19 11:55:00-05:00,2018-01-19,11:05,11:55,ES,Wick,Short,RDR,Mode,EX,2802.25,2804.0,2791.75,2804.0,RDR,,,,,2018-01-19 11:55:00-05:00,RS,2018-01-19 10:30:00-05:00,RR,RR,2018-01-19 09:30:00-05:00,145.0,RR,2018-01-19 10:25:00-05:00,False,after_confirm,1.75,10.5,6.0,-1.0,False
01/22/2018,,2809.5,,,,,,,,,,,2827.5,2018,2018-01-22,9:30,2808.25,2827.5,Long,Missed,No Conf,,W,2018-01-22 09:30:00-05:00,2018-01-22,,9:30,ES,No Conf,Long,RDR,Missed,W,2809.5,2808.25,2827.5,2827.5,RDR,,,,,2018-01-22 09:30:00-05:00,RR,2018-01-22 09:30:00-05:00,RR,RR,2018-01-22 09:30:00-05:00,0.0,RR,2018-01-22 10:25:00-05:00,True,m7,1.25,18.0,14.4,14.4,True
01/22/2018,,2821.0,,,,,,,,,,,2819.0,2018,2018-01-22,10:35,2819.0,2833.25,Long,Frontrun,No Conf,,EX,2018-01-22 10:35:00-05:00,2018-01-22,,10:35,ES,No Conf,Long,RDR,Frontrun,EX,2821.0,2819.0,2833.25,2819.0,RDR,,,,,2018-01-22 10:35:00-05:00,RS,2018-01-22 10:30:00-05:00,RR,RR,2018-01-22 09:30:00-05:00,65.0,RR,2018-01-22 10:25:00-05:00,False,after_confirm,2.0,12.25,6.125,-1.0,False
01/22/2018,,2818.75,,,,,,,,,,,2834.25,2018,2018-01-22,11:00,2815.75,2834.25,Long,Frontrun,No Conf,,W,2018-01-22 11:00:00-05:00,2018-01-22,,11:00,ES,No Conf,Long,RDR,Frontrun,W,2818.75,2815.75,2834.25,2834.25,RDR,,,,,2018-01-22 11:00:00-05:00,RS,2018-01-22 10:30:00-05:00,RR,RR,2018-01-22 09:30:00-05:00,90.0,RR,2018-01-22 10:25:00-05:00,False,after_confirm,3.0,15.5,5.166666666666667,5.166666666666667,True
01/23/2018,,2837.25,,,,,,,,,,,2835.25,2018,2018-01-23,10:15,2835.25,2848.0,Long,Frontrun,No Conf,,EX,2018-01-23 10:15:00-05:00,2018-01-23,,10:15,ES,No Conf,Long,RDR,Frontrun,EX,2837.25,2835.25,2848.0,2835.25,RDR,,,,,2018-01-23 10:15:00-05:00,RR,2018-01-23 09:30:00-05:00,RR,RR,2018-01-23 09:30:00-05:00,45.0,RR,2018-01-23 10:25:00-05:00,True,frontrun_window,2.0,10.75,5.375,-1.0,False
01/23/2018,,2838.0,,,,,,,,,,,2838.0,2018_set2,2018-01-23,10:30,2835.25,2848.5,Long,Frontrun,No Conf,,BE,2018-01-23 10:30:00-05:00,2018-01-23,,10:30,ES,No Conf,Long,RDR,Frontrun,BE,,,,,RDR,2838.0,2835.25,2848.5,2838.0,2018-01-23 10:30:00-05:00,RS,2018-01-23 10:30:00-05:00,RR,RR,2018-01-23 09:30:00-05:00,60.0,RR,2018-01-23 10:25:00-05:00,False,after_confirm,2.75,10.5,3.8181818181818183,0.0,False
01/23/2018,,2838.5,,,,,,,,,,,2838.5,2018,2018-01-23,10:30,2836.75,2848.0,Long,Frontrun,No Conf,,BE,2018-01-23 10:30:00-05:00,2018-01-23,,10:30,ES,No Conf,Long,RDR,Frontrun,BE,2838.5,2836.75,2848.0,2838.5,RDR,,,,,2018-01-23 10:30:00-05:00,RS,2018-01-23 10:30:00-05:00,RR,RR,2018-01-23 09:30:00-05:00,60.0,RR,2018-01-23 10:25:00-05:00,False,after_confirm,1.75,9.5,5.428571428571429,0.0,False
01/24/2018,,2854.0,,,,,,,,,,,2852.25,2018,2018-01-24,10:10,2852.25,2862.0,Long,Frontrun,No Conf,,EX,2018-01-24 10:10:00-05:00,2018-01-24,,10:10,ES,No Conf,Long,RDR,Frontrun,EX,2854.0,2852.25,2862.0,2852.25,RDR,,,,,2018-01-24 10:10:00-05:00,RR,2018-01-24 09:30:00-05:00,RR,RR,2018-01-24 09:30:00-05:00,40.0,RR,2018-01-24 10:25:00-05:00,True,frontrun_window,1.75,8.0,4.571428571428571,-1.0,False
01/24/2018,,2852.0,,,,,,,,,,,2850.75,2018_set2,2018-01-24,10:30,2850.75,2857.25,Long,Frontrun,No Conf,,EX,2018-01-24 10:30:00-05:00,2018-01-24,,10:30,ES,No Conf,Long,RDR,Frontrun,EX,,,,,RDR,2852.0,2850.75,2857.25,2850.75,2018-01-24 10:30:00-05:00,RS,2018-01-24 10:30:00-05:00,RR,RR,2018-01-24 09:30:00-05:00,60.0,RR,2018-01-24 10:25:00-05:00,False,after_confirm,1.25,5.25,4.2,-1.0,False
01/24/2018,,2852.25,,,,,,,,,,,2850.5,2018,2018-01-24,10:50,2850.5,2862.0,Long,Frontrun,No Conf,,EX,2018-01-24 10:50:00-05:00,2018-01-24,,10:50,ES,No Conf,Long,RDR,Frontrun,EX,2852.25,2850.5,2862.0,2850.5,RDR,,,,,2018-01-24 10:50:00-05:00,RS,2018-01-24 10:30:00-05:00,RR,RR,2018-01-24 09:30:00-05:00,80.0,RR,2018-01-24 10:25:00-05:00,False,after_confirm,1.75,9.75,5.571428571428571,-1.0,False
01/25/2018,,2842.5,,,,,,,,,,,2842.5,2018_set2,2018-01-25,10:35,2845.0,2828.75,Short,Frontrun,No Conf,,BE,2018-01-25 10:35:00-05:00,2018-01-25,,10:35,ES,No Conf,Short,RDR,Frontrun,BE,,,,,RDR,2842.5,2845.0,2828.75,2842.5,2018-01-25 10:35:00-05:00,RS,2018-01-25 10:30:00-05:00,RR,RR,2018-01-25 09:30:00-05:00,65.0,RR,2018-01-25 10:25:00-05:00,False,after_confirm,2.5,13.75,5.5,-0.0,False
01/26/2018,,2849.75,,,,,,,,,,,2857.75,2018_set2,2018-01-26,10:30,2848.25,2857.75,Long,Frontrun,No Conf,,W,2018-01-26 10:30:00-05:00,2018-01-26,,10:30,ES,No Conf,Long,RDR,Frontrun,W,,,,,RDR,2849.75,2848.25,2857.75,2857.75,2018-01-26 10:30:00-05:00,RS,2018-01-26 10:30:00-05:00,RR,RR,2018-01-26 09:30:00-05:00,60.0,RR,2018-01-26 10:25:00-05:00,False,after_confirm,1.5,8.0,5.333333333333333,5.333333333333333,True
01/26/2018,,2852.75,,,,,,,,,,,2862.75,2018,2018-01-26,11:05,2851.5,2862.75,Long,Mode,Confirmed,10:35,W,2018-01-26 11:05:00-05:00,2018-01-26,10:35,11:05,ES,Confirmed,Long,RDR,Mode,W,2852.75,2851.5,2862.75,2862.75,RDR,,,,,2018-01-26 11:05:00-05:00,RS,2018-01-26 10:30:00-05:00,RR,RR,2018-01-26 09:30:00-05:00,95.0,RR,2018-01-26 10:25:00-05:00,False,after_confirm,1.25,10.0,8.0,8.0,True
01/29/2018,,2869.5,,,,,,,,,,,2867.75,2018,2018-01-29,9:40,2867.75,2878.75,Long,Advanced,No Conf,,EX,2018-01-29 09:40:00-05:00,2018-01-29,,9:40,ES,No Conf,Long,RDR,Advanced,EX,2869.5,2867.75,2878.75,2867.75,RDR,,,,,2018-01-29 09:40:00-05:00,RR,2018-01-29 09:30:00-05:00,RR,RR,2018-01-29 09:30:00-05:00,10.0,RR,2018-01-29 10:25:00-05:00,True,m7,1.75,9.25,5.285714285714286,-1.0,False
01/29/2018,,2865.75,,,,,,,,,,,2855.25,2018_set2,2018-01-29,10:30,2868.25,2855.25,Short,Frontrun,No Conf,,W,2018-01-29 10:30:00-05:00,2018-01-29,,10:30,ES,No Conf,Short,RDR,Frontrun,W,,,,,RDR,2865.75,2868.25,2855.25,2855.25,2018-01-29 10:30:00-05:00,RS,2018-01-29 10:30:00-05:00,RR,RR,2018-01-29 09:30:00-05:00,60.0,RR,2018-01-29 10:25:00-05:00,False,after_confirm,2.5,10.5,4.2,4.2,True
01/30/2018,,2832.25,,,,,,,,,,,2829.25,2018,2018-01-30,9:45,2829.25,2856.75,Long,Advanced,No Conf,,EX,2018-01-30 09:45:00-05:00,2018-01-30,,9:45,ES,No Conf,Long,RDR,Advanced,EX,2832.25,2829.25,2856.75,2829.25,RDR,,,,,2018-01-30 09:45:00-05:00,RR,2018-01-30 09:30:00-05:00,RR,RR,2018-01-30 09:30:00-05:00,15.0,RR,2018-01-30 10:25:00-05:00,True,other,3.0,24.5,8.166666666666666,-1.0,False
02/01/2018,,2821.5,,,,,,,,,,,2818.0,2018,2018-02-01,9:55,2818.0,2839.5,Long,Advanced,No Conf,,EX,2018-02-01 09:55:00-05:00,2018-02-01,,9:55,ES,No Conf,Long,RDR,Advanced,EX,2821.5,2818.0,2839.5,2818.0,RDR,,,,,2018-02-01 09:55:00-05:00,RR,2018-02-01 09:30:00-05:00,RR,RR,2018-02-01 09:30:00-05:00,25.0,RR,2018-02-01 10:25:00-05:00,True,other,3.5,18.0,5.142857142857143,-1.0,False
02/01/2018,,2819.75,,,,,,,,,,,2834.25,2018_set2,2018-02-01,10:35,2817.0,2834.25,Long,Frontrun,No Conf,,W,2018-02-01 10:35:00-05:00,2018-02-01,,10:35,ES,No Conf,Long,RDR,Frontrun,W,,,,,RDR,2819.75,2817.0,2834.25,2834.25,2018-02-01 10:35:00-05:00,RS,2018-02-01 10:30:00-05:00,RR,RR,2018-02-01 09:30:00-05:00,65.0,RR,2018-02-01 10:25:00-05:00,False,after_confirm,2.75,14.5,5.2727272727272725,5.2727272727272725,True
02/01/2018,,2826.25,,,,,,,,,,,2831.5,2018,2018-02-01,11:30,2824.0,2839.5,Long,Mode,Confirmed,11:25,W,2018-02-01 11:30:00-05:00,2018-02-01,11:25,11:30,ES,Confirmed,Long,RDR,Mode,W,2826.25,2824.0,2839.5,2831.5,RDR,,,,,2018-02-01 11:30:00-05:00,RS,2018-02-01 10:30:00-05:00,RR,RR,2018-02-01 09:30:00-05:00,120.0,RR,2018-02-01 10:25:00-05:00,False,after_confirm,2.25,13.25,5.888888888888889,2.3333333333333335,True
02/02/2018,,2798.5,,,,,,,,,,,2801.25,2018_set2,2018-02-02,10:30,2801.25,2777.75,Short,Frontrun,No Conf,,EX,2018-02-02 10:30:00-05:00,2018-02-02,,10:30,ES,No Conf,Short,RDR,Frontrun,EX,,,,,RDR,2798.5,2801.25,2777.75,2801.25,2018-02-02 10:30:00-05:00,RS,2018-02-02 10:30:00-05:00,RR,RR,2018-02-02 09:30:00-05:00,60.0,RR,2018-02-02 10:25:00-05:00,False,after_confirm,2.75,20.75,7.545454545454546,-1.0,False
02/02/2018,,2790.75,,,,,,,,,,,2794.25,2018_set2,2018-02-02,12:10,2794.25,2768.5,Short,Mode,Confirmed,11:55,EX,2018-02-02 12:10:00-05:00,2018-02-02,11:55,12:10,ES,Confirmed,Short,RDR,Mode,EX,,,,,RDR,2790.75,2794.25,2768.5,2794.25,2018-02-02 12:10:00-05:00,RS,2018-02-02 10:30:00-05:00,RR,RR,2018-02-02 09:30:00-05:00,160.0,RR,2018-02-02 10:25:00-05:00,False,after_confirm,3.5,22.25,6.357142857142857,-1.0,False
02/05/2018,,2753.5,,,,,,,,,,,2753.5,2018,2018-02-05,10:35,2749.75,2780.5,Long,Frontrun,No Conf,,BE,2018-02-05 10:35:00-05:00,2018-02-05,,10:35,ES,No Conf,Long,RDR,Frontrun,BE,2753.5,2749.75,2780.5,2753.5,RDR,,,,,2018-02-05 10:35:00-05:00,RS,2018-02-05 10:30:00-05:00,RR,RR,2018-02-05 09:30:00-05:00,65.0,RR,2018-02-05 10:25:00-05:00,False,after_confirm,3.75,27.0,7.2,0.0,False
02/05/2018,,2749.25,,,,,,,,,,,2712.75,2018,2018-02-05,12:00,2754.0,2712.75,Short,Advanced,No Conf,,W,2018-02-05 12:00:00-05:00,2018-02-05,,12:00,ES,No Conf,Short,RDR,Advanced,W,2749.25,2754.0,2712.75,2712.75,RDR,,,,,2018-02-05 12:00:00-05:00,RS,2018-02-05 10:30:00-05:00,RR,RR,2018-02-05 09:30:00-05:00,150.0,RR,2018-02-05 10:25:00-05:00,False,after_confirm,4.75,36.5,7.684210526315789,7.684210526315789,True
02/06/2018,,2635.75,,,,,,,,,,,2620.0,2018_set2,2018-02-06,10:30,2620.0,2705.5,Long,Frontrun,No Conf,,EX,2018-02-06 10:30:00-05:00,2018-02-06,,10:30,ES,No Conf,Long,RDR,Frontrun,EX,,,,,RDR,2635.75,2620.0,2705.5,2620.0,2018-02-06 10:30:00-05:00,RS,2018-02-06 10:30:00-05:00,RR,RR,2018-02-06 09:30:00-05:00,60.0,RR,2018-02-06 10:25:00-05:00,False,after_confirm,15.75,69.75,4.428571428571429,-1.0,False
02/07/2018,,2689.75,,,,,,,,,,,2725.25,2018,2018-02-07,9:35,2685.0,2725.25,Long,M7 Candle,No Conf,,W,2018-02-07 09:35:00-05:00,2018-02-07,,9:35,ES,No Conf,Long,RDR,M7 Candle,W,2689.75,2685.0,2725.25,2725.25,RDR,,,,,2018-02-07 09:35:00-05:00,RR,2018-02-07 09:30:00-05:00,RR,RR,2018-02-07 09:30:00-05:00,5.0,RR,2018-02-07 10:25:00-05:00,True,m7,4.75,35.5,7.473684210526316,7.473684210526316,True
02/07/2018,,2704.0,,,,,,,,,,,2704.0,2018_set2,2018-02-07,10:30,2698.25,2737.25,Long,Frontrun,No Conf,,BE,2018-02-07 10:30:00-05:00,2018-02-07,,10:30,ES,No Conf,Long,RDR,Frontrun,BE,,,,,RDR,2704.0,2698.25,2737.25,2704.0,2018-02-07 10:30:00-05:00,RS,2018-02-07 10:30:00-05:00,RR,RR,2018-02-07 09:30:00-05:00,60.0,RR,2018-02-07 10:25:00-05:00,False,after_confirm,5.75,33.25,5.782608695652174,0.0,False
02/08/2018,,2683.0,,,,,,,,,,,2679.25,2018,2018-02-08,8:55,2679.25,2727.0,Long,Advanced,No Conf,,EX,2018-02-08 08:55:00-05:00,2018-02-08,,8:55,ES,No Conf,Long,In Between,Advanced,EX,2683.0,2679.25,2727.0,2679.25,In Between,,,,,2018-02-08 08:55:00-05:00,TR,2018-02-08 08:30:00-05:00,TR,TR,2018-02-08 08:30:00-05:00,25.0,,,False,other,3.75,44.0,11.733333333333333,-1.0,False
02/08/2018,,2665.5,,,,,,,,,,,2641.25,2018_set2,2018-02-08,10:30,2670.0,2641.25,Short,Frontrun,No Conf,,W,2018-02-08 10:30:00-05:00,2018-02-08,,10:30,ES,No Conf,Short,RDR,Frontrun,W,,,,,RDR,2665.5,2670.0,2641.25,2641.25,2018-02-08 10:30:00-05:00,RS,2018-02-08 10:30:00-05:00,RR,RR,2018-02-08 09:30:00-05:00,60.0,RR,2018-02-08 10:25:00-05:00,False,after_confirm,4.5,24.25,5.388888888888889,5.388888888888889,True
02/09/2018,,2602.0,,,,,,,,,,,2578.25,2018_set2,2018-02-09,10:35,2606.75,2578.25,Short,Frontrun,No Conf,,W,2018-02-09 10:35:00-05:00,2018-02-09,,10:35,ES,No Conf,Short,RDR,Frontrun,W,,,,,RDR,2602.0,2606.75,2578.25,2578.25,2018-02-09 10:35:00-05:00,RS,2018-02-09 10:30:00-05:00,RR,RR,2018-02-09 09:30:00-05:00,65.0,RR,2018-02-09 10:25:00-05:00,False,after_confirm,4.75,23.75,5.0,5.0,True
02/12/2018,,2648.0,,,,,,,,,,,2643.25,2018,2018-02-12,9:35,2643.25,2680.75,Long,Advanced,No Conf,,EX,2018-02-12 09:35:00-05:00,2018-02-12,,9:35,ES,No Conf,Long,RDR,Advanced,EX,2648.0,2643.25,2680.75,2643.25,RDR,,,,,2018-02-12 09:35:00-05:00,RR,2018-02-12 09:30:00-05:00,RR,RR,2018-02-12 09:30:00-05:00,5.0,RR,2018-02-12 10:25:00-05:00,True,m7,4.75,32.75,6.894736842105263,-1.0,False
02/12/2018,,2631.0,,,,,,,,,,,2662.5,2018,2018-02-12,10:35,2626.0,2680.75,Long,Advanced,No Conf,,W,2018-02-12 10:35:00-05:00,2018-02-12,,10:35,ES,No Conf,Long,RDR,Advanced,W,2631.0,2626.0,2680.75,2662.5,RDR,,,,,2018-02-12 10:35:00-05:00,RS,2018-02-12 10:30:00-05:00,RR,RR,2018-02-12 09:30:00-05:00,65.0,RR,2018-02-12 10:25:00-05:00,False,after_confirm,5.0,49.75,9.95,6.3,True
02/13/2018,,2640.25,,,,,,,,,,,2661.25,2018_set2,2018-02-13,10:35,2637.75,2661.25,Long,Frontrun,No Conf,,W,2018-02-13 10:35:00-05:00,2018-02-13,,10:35,ES,No Conf,Long,RDR,Frontrun,W,,,,,RDR,2640.25,2637.75,2661.25,2661.25,2018-02-13 10:35:00-05:00,RS,2018-02-13 10:30:00-05:00,RR,RR,2018-02-13 09:30:00-05:00,65.0,RR,2018-02-13 10:25:00-05:00,False,after_confirm,2.5,21.0,8.4,8.4,True
02/13/2018,,2649.75,,,,,,,,,,,2647.0,2018_set2,2018-02-13,10:55,2647.0,2661.25,Long,Mode,Confirmed,10:45,EX,2018-02-13 10:55:00-05:00,2018-02-13,10:45,10:55,ES,Confirmed,Long,RDR,Mode,EX,,,,,RDR,2649.75,2647.0,2661.25,2647.0,2018-02-13 10:55:00-05:00,RS,2018-02-13 10:30:00-05:00,RR,RR,2018-02-13 09:30:00-05:00,85.0,RR,2018-02-13 10:25:00-05:00,False,after_confirm,2.75,11.5,4.181818181818182,-1.0,False
02/15/2018,,2710.25,,,,,,,,,,,2693.25,2018,2018-02-15,10:10,2713.0,2693.25,Short,Frontrun,Confirmed,,W,2018-02-15 10:10:00-05:00,2018-02-15,,10:10,ES,Confirmed,Short,RDR,Frontrun,W,2710.25,2713.0,2693.25,2693.25,RDR,,,,,2018-02-15 10:10:00-05:00,RR,2018-02-15 09:30:00-05:00,RR,RR,2018-02-15 09:30:00-05:00,40.0,RR,2018-02-15 10:25:00-05:00,True,frontrun_window,2.75,17.0,6.181818181818182,6.181818181818182,True
02/15/2018,,2710.5,,,,,,,,,,,2693.75,2018_set2,2018-02-15,10:30,2712.75,2693.75,Short,Frontrun,No Conf,,W,2018-02-15 10:30:00-05:00,2018-02-15,,10:30,ES,No Conf,Short,RDR,Frontrun,W,,,,,RDR,2710.5,2712.75,2693.75,2693.75,2018-02-15 10:30:00-05:00,RS,2018-02-15 10:30:00-05:00,RR,RR,2018-02-15 09:30:00-05:00,60.0,RR,2018-02-15 10:25:00-05:00,False,after_confirm,2.25,16.75,7.444444444444445,7.444444444444445,True
02/15/2018,,2711.5,,,,,,,,,,,2714.5,2018_set2,2018-02-15,12:45,2714.5,2688.25,Short,Mode,Confirmed,10:40,EX,2018-02-15 12:45:00-05:00,2018-02-15,10:40,12:45,ES,Confirmed,Short,RDR,Mode,EX,,,,,RDR,2711.5,2714.5,2688.25,2714.5,2018-02-15 12:45:00-05:00,RS,2018-02-15 10:30:00-05:00,RR,RR,2018-02-15 09:30:00-05:00,195.0,RR,2018-02-15 10:25:00-05:00,False,after_confirm,3.0,23.25,7.75,-1.0,False
02/16/2018,,2728.25,,,,,,,,,,,2728.25,2018,2018-02-16,9:35,2726.0,2746.75,Long,M7 Candle,No Conf,,BE,2018-02-16 09:35:00-05:00,2018-02-16,,9:35,ES,No Conf,Long,RDR,M7 Candle,BE,2728.25,2726.0,2746.75,2728.25,RDR,,,,,2018-02-16 09:35:00-05:00,RR,2018-02-16 09:30:00-05:00,RR,RR,2018-02-16 09:30:00-05:00,5.0,RR,2018-02-16 10:25:00-05:00,True,m7,2.25,18.5,8.222222222222221,0.0,False
02/16/2018,,2736.25,,,,,,,,,,,2751.0,2018,2018-02-16,10:25,2733.75,2751.0,Long,Frontrun,No Conf,,W,2018-02-16 10:25:00-05:00,2018-02-16,,10:25,ES,No Conf,Long,RDR,Frontrun,W,2736.25,2733.75,2751.0,2751.0,RDR,,,,,2018-02-16 10:25:00-05:00,RR,2018-02-16 09:30:00-05:00,RR,RR,2018-02-16 09:30:00-05:00,55.0,RR,2018-02-16 10:25:00-05:00,False,after_confirm,2.5,14.75,5.9,5.9,True
02/16/2018,,2736.0,,,,,,,,,,,2750.75,2018_set2,2018-02-16,10:55,2733.5,2750.75,Long,Mode,Confirmed,10:30,W,2018-02-16 10:55:00-05:00,2018-02-16,10:30,10:55,ES,Confirmed,Long,RDR,Mode,W,,,,,RDR,2736.0,2733.5,2750.75,2750.75,2018-02-16 10:55:00-05:00,RS,2018-02-16 10:30:00-05:00,RR,RR,2018-02-16 09:30:00-05:00,85.0,RR,2018-02-16 10:25:00-05:00,False,after_confirm,2.5,14.75,5.9,5.9,True
02/20/2018,,2724.75,,,,,,,,,,,2727.75,2018,2018-02-20,10:10,2727.75,2709.0,Short,Advanced,No Conf,,EX,2018-02-20 10:10:00-05:00,2018-02-20,,10:10,ES,No Conf,Short,RDR,Advanced,EX,2724.75,2727.75,2709.0,2727.75,RDR,,,,,2018-02-20 10:10:00-05:00,RR,2018-02-20 09:30:00-05:00,RR,RR,2018-02-20 09:30:00-05:00,40.0,RR,2018-02-20 10:25:00-05:00,True,frontrun_window,3.0,15.75,5.25,-1.0,False
02/21/2018,,2728.5,,,,,,,,,,,2728.5,2018_set2,2018-02-21,10:30,2726.75,2738.75,Long,Frontrun,No Conf,,BE,2018-02-21 10:30:00-05:00,2018-02-21,,10:30,ES,No Conf,Long,RDR,Frontrun,BE,,,,,RDR,2728.5,2726.75,2738.75,2728.5,2018-02-21 10:30:00-05:00,RS,2018-02-21 10:30:00-05:00,RR,RR,2018-02-21 09:30:00-05:00,60.0,RR,2018-02-21 10:25:00-05:00,False,after_confirm,1.75,10.25,5.857142857142857,0.0,False
02/22/2018,,2717.75,,,,,,,,,,,2717.75,2018,2018-02-22,9:45,2721.75,2682.25,Short,Advanced,No Conf,,BE,2018-02-22 09:45:00-05:00,2018-02-22,,9:45,ES,No Conf,Short,RDR,Advanced,BE,2717.75,2721.75,2682.25,2717.75,RDR,,,,,2018-02-22 09:45:00-05:00,RR,2018-02-22 09:30:00-05:00,RR,RR,2018-02-22 09:30:00-05:00,15.0,RR,2018-02-22 10:25:00-05:00,True,other,4.0,35.5,8.875,-0.0,False
02/22/2018,,2716.75,,,,,,,,,,,2716.75,2018_set2,2018-02-22,10:30,2714.0,2733.0,Long,Frontrun,No Conf,,BE,2018-02-22 10:30:00-05:00,2018-02-22,,10:30,ES,No Conf,Long,RDR,Frontrun,BE,,,,,RDR,2716.75,2714.0,2733.0,2716.75,2018-02-22 10:30:00-05:00,RS,2018-02-22 10:30:00-05:00,RR,RR,2018-02-22 09:30:00-05:00,60.0,RR,2018-02-22 10:25:00-05:00,False,after_confirm,2.75,16.25,5.909090909090909,0.0,False
02/23/2018,,2718.0,,,,,,,,,,,2721.0,2018_set2,2018-02-23,10:40,2721.0,2703.25,Short,Mode,Wick,10:30,EX,2018-02-23 10:40:00-05:00,2018-02-23,10:30,10:40,ES,Wick,Short,RDR,Mode,EX,,,,,RDR,2718.0,2721.0,2703.25,2721.0,2018-02-23 10:40:00-05:00,RS,2018-02-23 10:30:00-05:00,RR,RR,2018-02-23 09:30:00-05:00,70.0,RR,2018-02-23 10:25:00-05:00,False,after_confirm,3.0,14.75,4.916666666666667,-1.0,False
02/23/2018,,2719.75,,,,,,,,,,,2743.5,2018,2018-02-23,11:15,2717.75,2743.5,Long,Missed,Confirmed,11:00,W,2018-02-23 11:15:00-05:00,2018-02-23,11:00,11:15,ES,Confirmed,Long,RDR,Missed,W,2719.75,2717.75,2743.5,2743.5,RDR,,,,,2018-02-23 11:15:00-05:00,RS,2018-02-23 10:30:00-05:00,RR,RR,2018-02-23 09:30:00-05:00,105.0,RR,2018-02-23 10:25:00-05:00,False,after_confirm,2.0,23.75,11.875,11.875,True
02/23/2018,,2719.75,,,,,,,,,,,2732.25,2018_set2,2018-02-23,11:20,2717.75,2732.25,Long,Mode,Confirmed,11:00,W,2018-02-23 11:20:00-05:00,2018-02-23,11:00,11:20,ES,Confirmed,Long,RDR,Mode,W,,,,,RDR,2719.75,2717.75,2732.25,2732.25,2018-02-23 11:20:00-05:00,RS,2018-02-23 10:30:00-05:00,RR,RR,2018-02-23 09:30:00-05:00,110.0,RR,2018-02-23 10:25:00-05:00,False,after_confirm,2.0,12.5,6.25,6.25,True
02/26/2018,,2760.0,,,,,,,,,,,2760.0,2018,2018-02-26,9:35,2758.25,2774.25,Long,M7 Candle,No Conf,,BE,2018-02-26 09:35:00-05:00,2018-02-26,,9:35,ES,No Conf,Long,RDR,M7 Candle,BE,2760.0,2758.25,2774.25,2760.0,RDR,,,,,2018-02-26 09:35:00-05:00,RR,2018-02-26 09:30:00-05:00,RR,RR,2018-02-26 09:30:00-05:00,5.0,RR,2018-02-26 10:25:00-05:00,True,m7,1.75,14.25,8.142857142857142,0.0,False
02/26/2018,,2759.5,,,,,,,,,,,2759.5,2018_set2,2018-02-26,10:40,2761.75,2742.5,Short,Mode,Confirmed,10:30,BE,2018-02-26 10:40:00-05:00,2018-02-26,10:30,10:40,ES,Confirmed,Short,RDR,Mode,BE,,,,,RDR,2759.5,2761.75,2742.5,2759.5,2018-02-26 10:40:00-05:00,RS,2018-02-26 10:30:00-05:00,RR,RR,2018-02-26 09:30:00-05:00,70.0,RR,2018-02-26 10:25:00-05:00,False,after_confirm,2.25,17.0,7.555555555555555,-0.0,False
02/27/2018,,2775.25,,,,,,,,,,,2760.0,2018_set2,2018-02-27,11:15,2780.0,2760.0,Short,Mode,Confirmed,10:45,W,2018-02-27 11:15:00-05:00,2018-02-27,10:45,11:15,ES,Confirmed,Short,RDR,Mode,W,,,,,RDR,2775.25,2780.0,2760.0,2760.0,2018-02-27 11:15:00-05:00,RS,2018-02-27 10:30:00-05:00,RR,RR,2018-02-27 09:30:00-05:00,105.0,RR,2018-02-27 10:25:00-05:00,False,after_confirm,4.75,15.25,3.210526315789474,3.210526315789474,True
02/27/2018,,2776.25,,,,,,,,,,,2747.75,2018,2018-02-27,11:15,2779.25,2747.75,Short,Missed,Confirmed,10:45,W,2018-02-27 11:15:00-05:00,2018-02-27,10:45,11:15,ES,Confirmed,Short,RDR,Missed,W,2776.25,2779.25,2747.75,2747.75,RDR,,,,,2018-02-27 11:15:00-05:00,RS,2018-02-27 10:30:00-05:00,RR,RR,2018-02-27 09:30:00-05:00,105.0,RR,2018-02-27 10:25:00-05:00,False,after_confirm,3.0,28.5,9.5,9.5,True
02/28/2018,,2759.25,,,,,,,,,,,2756.75,2018_set2,2018-02-28,10:30,2756.75,2773.75,Long,Frontrun,No Conf,,EX,2018-02-28 10:30:00-05:00,2018-02-28,,10:30,ES,No Conf,Long,RDR,Frontrun,EX,,,,,RDR,2759.25,2756.75,2773.75,2756.75,2018-02-28 10:30:00-05:00,RS,2018-02-28 10:30:00-05:00,RR,RR,2018-02-28 09:30:00-05:00,60.0,RR,2018-02-28 10:25:00-05:00,False,after_confirm,2.5,14.5,5.8,-1.0,False
02/28/2018,,2755.25,,,,,,,,,,,2738.5,2018,2018-02-28,10:40,2757.75,2738.5,Short,Frontrun,No Conf,,W,2018-02-28 10:40:00-05:00,2018-02-28,,10:40,ES,No Conf,Short,RDR,Frontrun,W,2755.25,2757.75,2738.5,2738.5,RDR,,,,,2018-02-28 10:40:00-05:00,RS,2018-02-28 10:30:00-05:00,RR,RR,2018-02-28 09:30:00-05:00,70.0,RR,2018-02-28 10:25:00-05:00,False,after_confirm,2.5,16.75,6.7,6.7,True
03/01/2018,,2718.25,,,,,,,,,,,2718.25,2018,2018-03-01,10:30,2715.25,2737.75,Long,Frontrun,No Conf,,BE,2018-03-01 10:30:00-05:00,2018-03-01,,10:30,ES,No Conf,Long,RDR,Frontrun,BE,2718.25,2715.25,2737.75,2718.25,RDR,,,,,2018-03-01 10:30:00-05:00,RS,2018-03-01 10:30:00-05:00,RR,RR,2018-03-01 09:30:00-05:00,60.0,RR,2018-03-01 10:25:00-05:00,False,after_confirm,3.0,19.5,6.5,0.0,False
03/01/2018,,2718.25,,,,,,,,,,,2713.0,2018_set2,2018-03-01,10:50,2713.0,2743.0,Long,Mode,Confirmed,10:30,EX,2018-03-01 10:50:00-05:00,2018-03-01,10:30,10:50,ES,Confirmed,Long,RDR,Mode,EX,,,,,RDR,2718.25,2713.0,2743.0,2713.0,2018-03-01 10:50:00-05:00,RS,2018-03-01 10:30:00-05:00,RR,RR,2018-03-01 09:30:00-05:00,80.0,RR,2018-03-01 10:25:00-05:00,False,after_confirm,5.25,24.75,4.714285714285714,-1.0,False
03/01/2018,,2709.5,,,,,,,,,,,2682.25,2018_set2,2018-03-01,12:10,2714.0,2682.25,Short,Advanced,Confirmed,10:30,W,2018-03-01 12:10:00-05:00,2018-03-01,10:30,12:10,ES,Confirmed,Short,RDR,Advanced,W,,,,,RDR,2709.5,2714.0,2682.25,2682.25,2018-03-01 12:10:00-05:00,RS,2018-03-01 10:30:00-05:00,RR,RR,2018-03-01 09:30:00-05:00,160.0,RR,2018-03-01 10:25:00-05:00,False,after_confirm,4.5,27.25,6.055555555555555,6.055555555555555,True
03/02/2018,,2654.25,,,,,,,,,,,2684.5,2018_set2,2018-03-02,11:20,2650.5,2684.5,Long,Retired,Confirmed,10:40,W,2018-03-02 11:20:00-05:00,2018-03-02,10:40,11:20,ES,Confirmed,Long,RDR,Retired,W,,,,,RDR,2654.25,2650.5,2684.5,2684.5,2018-03-02 11:20:00-05:00,RS,2018-03-02 10:30:00-05:00,RR,RR,2018-03-02 09:30:00-05:00,110.0,RR,2018-03-02 10:25:00-05:00,False,after_confirm,3.75,30.25,8.066666666666666,8.066666666666666,True
03/02/2018,,2654.0,,,,,,,,,,,2684.5,2018,2018-03-02,11:20,2650.5,2684.5,Long,Mode,Confirmed,10:40,W,2018-03-02 11:20:00-05:00,2018-03-02,10:40,11:20,ES,Confirmed,Long,RDR,Mode,W,2654.0,2650.5,2684.5,2684.5,RDR,,,,,2018-03-02 11:20:00-05:00,RS,2018-03-02 10:30:00-05:00,RR,RR,2018-03-02 09:30:00-05:00,110.0,RR,2018-03-02 10:25:00-05:00,False,after_confirm,3.5,30.5,8.714285714285714,8.714285714285714,True
03/05/2018,,2681.5,,,,,,,,,,,2693.75,2018_set2,2018-03-05,10:35,2679.0,2693.75,Long,Frontrun,No Conf,,W,2018-03-05 10:35:00-05:00,2018-03-05,,10:35,ES,No Conf,Long,RDR,Frontrun,W,,,,,RDR,2681.5,2679.0,2693.75,2693.75,2018-03-05 10:35:00-05:00,RS,2018-03-05 10:30:00-05:00,RR,RR,2018-03-05 09:30:00-05:00,65.0,RR,2018-03-05 10:25:00-05:00,False,after_confirm,2.5,12.25,4.9,4.9,True
03/06/2018,,2726.5,,,,,,,,,,,2722.0,2018,2018-03-06,10:25,2729.75,2707.75,Short,Mode,No Conf,,W,2018-03-06 10:25:00-05:00,2018-03-06,,10:25,ES,No Conf,Short,RDR,Mode,W,2726.5,2729.75,2707.75,2722.0,RDR,,,,,2018-03-06 10:25:00-05:00,RR,2018-03-06 09:30:00-05:00,RR,RR,2018-03-06 09:30:00-05:00,55.0,RR,2018-03-06 10:25:00-05:00,False,after_confirm,3.25,18.75,5.769230769230769,1.3846153846153846,True
03/06/2018,,2726.5,,,,,,,,,,,2726.5,2018_set2,2018-03-06,10:35,2729.75,2710.0,Short,Frontrun,No Conf,,BE,2018-03-06 10:35:00-05:00,2018-03-06,,10:35,ES,No Conf,Short,RDR,Frontrun,BE,,,,,RDR,2726.5,2729.75,2710.0,2726.5,2018-03-06 10:35:00-05:00,RS,2018-03-06 10:30:00-05:00,RR,RR,2018-03-06 09:30:00-05:00,65.0,RR,2018-03-06 10:25:00-05:00,False,after_confirm,3.25,16.5,5.076923076923077,-0.0,False
03/07/2018,,2717.0,,,,,,,,,,,2714.25,2018_set2,2018-03-07,11:10,2714.25,2732.75,Long,Mode,Confirmed,10:30,EX,2018-03-07 11:10:00-05:00,2018-03-07,10:30,11:10,ES,Confirmed,Long,RDR,Mode,EX,,,,,RDR,2717.0,2714.25,2732.75,2714.25,2018-03-07 11:10:00-05:00,RS,2018-03-07 10:30:00-05:00,RR,RR,2018-03-07 09:30:00-05:00,100.0,RR,2018-03-07 10:25:00-05:00,False,after_confirm,2.75,15.75,5.7272727272727275,-1.0,False
03/07/2018,,2705.75,,,,,,,,,,,2727.5,2018,2018-03-07,13:20,2702.25,2727.5,Long,Missed,Confirmed,10:30,W,2018-03-07 13:20:00-05:00,2018-03-07,10:30,13:20,ES,Confirmed,Long,RDR,Missed,W,2705.75,2702.25,2727.5,2727.5,RDR,,,,,2018-03-07 13:20:00-05:00,RS,2018-03-07 10:30:00-05:00,RR,RR,2018-03-07 09:30:00-05:00,230.0,RR,2018-03-07 10:25:00-05:00,False,after_confirm,3.5,21.75,6.214285714285714,6.214285714285714,True
03/08/2018,,2730.25,,,,,,,,,,,2732.5,2018_set2,2018-03-08,10:55,2732.5,2720.0,Short,Mode,Confirmed,10:35,EX,2018-03-08 10:55:00-05:00,2018-03-08,10:35,10:55,ES,Confirmed,Short,RDR,Mode,EX,,,,,RDR,2730.25,2732.5,2720.0,2732.5,2018-03-08 10:55:00-05:00,RS,2018-03-08 10:30:00-05:00,RR,RR,2018-03-08 09:30:00-05:00,85.0,RR,2018-03-08 10:25:00-05:00,False,after_confirm,2.25,10.25,4.555555555555555,-1.0,False
03/14/2018,,2767.0,,,,,,,,,,,2752.25,2018,2018-03-14,10:30,2769.25,2752.25,Short,Frontrun,No Conf,,W,2018-03-14 10:30:00-04:00,2018-03-14,,10:30,ES,No Conf,Short,RDR,Frontrun,W,2767.0,2769.25,2752.25,2752.25,RDR,,,,,2018-03-14 10:30:00-04:00,RS,2018-03-14 10:30:00-04:00,RR,RR,2018-03-14 09:30:00-04:00,60.0,RR,2018-03-14 10:25:00-04:00,False,after_confirm,2.25,14.75,6.555555555555555,6.555555555555555,True
03/14/2018,,2766.5,,,,,,,,,,,2752.25,2018_set2,2018-03-14,10:35,2769.0,2752.25,Short,Frontrun,No Conf,,W,2018-03-14 10:35:00-04:00,2018-03-14,,10:35,ES,No Conf,Short,RDR,Frontrun,W,,,,,RDR,2766.5,2769.0,2752.25,2752.25,2018-03-14 10:35:00-04:00,RS,2018-03-14 10:30:00-04:00,RR,RR,2018-03-14 09:30:00-04:00,65.0,RR,2018-03-14 10:25:00-04:00,False,after_confirm,2.5,14.25,5.7,5.7,True
03/15/2018,,2756.75,,,,,,,,,,,2759.75,2018,2018-03-15,9:35,2759.75,2743.75,Short,M7 Candle,No Conf,,EX,2018-03-15 09:35:00-04:00,2018-03-15,,9:35,ES,No Conf,Short,RDR,M7 Candle,EX,2756.75,2759.75,2743.75,2759.75,RDR,,,,,2018-03-15 09:35:00-04:00,RR,2018-03-15 09:30:00-04:00,RR,RR,2018-03-15 09:30:00-04:00,5.0,RR,2018-03-15 10:25:00-04:00,True,m7,3.0,13.0,4.333333333333333,-1.0,False
03/15/2018,,2758.0,,,,,,,,,,,2755.75,2018,2018-03-15,12:20,2755.75,2768.75,Long,Mode,Confirmed,11:00,EX,2018-03-15 12:20:00-04:00,2018-03-15,11:00,12:20,ES,Confirmed,Long,RDR,Mode,EX,2758.0,2755.75,2768.75,2755.75,RDR,,,,,2018-03-15 12:20:00-04:00,RS,2018-03-15 10:30:00-04:00,RR,RR,2018-03-15 09:30:00-04:00,170.0,RR,2018-03-15 10:25:00-04:00,False,after_confirm,2.25,10.75,4.777777777777778,-1.0,False
03/16/2018,,2757.75,,,,,,,,,,,2760.25,2018,2018-03-16,9:35,2756.0,2771.0,Long,M7 Candle,No Conf,,W,2018-03-16 09:35:00-04:00,2018-03-16,,9:35,ES,No Conf,Long,RDR,M7 Candle,W,2757.75,2756.0,2771.0,2760.25,RDR,,,,,2018-03-16 09:35:00-04:00,RR,2018-03-16 09:30:00-04:00,RR,RR,2018-03-16 09:30:00-04:00,5.0,RR,2018-03-16 10:25:00-04:00,True,m7,1.75,13.25,7.571428571428571,1.4285714285714286,True
03/19/2018,,2737.25,,,,,,,,,,,2723.5,2018_set2,2018-03-19,10:30,2739.5,2723.5,Short,Mode,Confirmed,,W,2018-03-19 10:30:00-04:00,2018-03-19,,10:30,ES,Confirmed,Short,RDR,Mode,W,,,,,RDR,2737.25,2739.5,2723.5,2723.5,2018-03-19 10:30:00-04:00,RS,2018-03-19 10:30:00-04:00,RR,RR,2018-03-19 09:30:00-04:00,60.0,RR,2018-03-19 10:25:00-04:00,False,after_confirm,2.25,13.75,6.111111111111111,6.111111111111111,True
03/23/2018,,2647.5,,,,,,,,,,,2647.5,2018_set2,2018-03-23,11:15,2651.5,2617.0,Short,Frontrun,No Conf,,BE,2018-03-23 11:15:00-04:00,2018-03-23,,11:15,ES,No Conf,Short,RDR,Frontrun,BE,,,,,RDR,2647.5,2651.5,2617.0,2647.5,2018-03-23 11:15:00-04:00,RS,2018-03-23 10:30:00-04:00,RR,RR,2018-03-23 09:30:00-04:00,105.0,RR,2018-03-23 10:25:00-04:00,False,after_confirm,4.0,30.5,7.625,-0.0,False
03/26/2018,,2624.25,,,,,,,,,,,2602.75,2018_set2,2018-03-26,10:40,2629.0,2602.75,Short,Mode,Wick,10:30,W,2018-03-26 10:40:00-04:00,2018-03-26,10:30,10:40,ES,Wick,Short,RDR,Mode,W,,,,,RDR,2624.25,2629.0,2602.75,2602.75,2018-03-26 10:40:00-04:00,RS,2018-03-26 10:30:00-04:00,RR,RR,2018-03-26 09:30:00-04:00,70.0,RR,2018-03-26 10:25:00-04:00,False,after_confirm,4.75,21.5,4.526315789473684,4.526315789473684,True
03/29/2018,,2620.0,,,,,,,,,,,2636.75,2018_set2,2018-03-29,10:35,2617.25,2636.75,Long,Frontrun,No Conf,,W,2018-03-29 10:35:00-04:00,2018-03-29,,10:35,ES,No Conf,Long,RDR,Frontrun,W,,,,,RDR,2620.0,2617.25,2636.75,2636.75,2018-03-29 10:35:00-04:00,RS,2018-03-29 10:30:00-04:00,RR,RR,2018-03-29 09:30:00-04:00,65.0,RR,2018-03-29 10:25:00-04:00,False,after_confirm,2.75,16.75,6.090909090909091,6.090909090909091,True
04/04/2018,,2584.5,,,,,,,,,,,2614.0,2018_set2,2018-04-04,10:35,2581.75,2614.0,Long,Frontrun,No Conf,,W,2018-04-04 10:35:00-04:00,2018-04-04,,10:35,ES,No Conf,Long,RDR,Frontrun,W,,,,,RDR,2584.5,2581.75,2614.0,2614.0,2018-04-04 10:35:00-04:00,RS,2018-04-04 10:30:00-04:00,RR,RR,2018-04-04 09:30:00-04:00,65.0,RR,2018-04-04 10:25:00-04:00,False,after_confirm,2.75,29.5,10.727272727272727,10.727272727272727,True
04/09/2018,,2627.75,,,,,,,,,,,2648.25,2018_set2,2018-04-09,10:30,2624.5,2648.25,Long,Frontrun,No Conf,,W,2018-04-09 10:30:00-04:00,2018-04-09,,10:30,ES,No Conf,Long,RDR,Frontrun,W,,,,,RDR,2627.75,2624.5,2648.25,2648.25,2018-04-09 10:30:00-04:00,RS,2018-04-09 10:30:00-04:00,RR,RR,2018-04-09 09:30:00-04:00,60.0,RR,2018-04-09 10:25:00-04:00,False,after_confirm,3.25,20.5,6.3076923076923075,6.3076923076923075,True
04/10/2018,,2652.25,,,,,,,,,,,2652.25,2018_set2,2018-04-10,10:30,2649.5,2664.25,Long,Frontrun,No Conf,,BE,2018-04-10 10:30:00-04:00,2018-04-10,,10:30,ES,No Conf,Long,RDR,Frontrun,BE,,,,,RDR,2652.25,2649.5,2664.25,2652.25,2018-04-10 10:30:00-04:00,RS,2018-04-10 10:30:00-04:00,RR,RR,2018-04-10 09:30:00-04:00,60.0,RR,2018-04-10 10:25:00-04:00,False,after_confirm,2.75,12.0,4.363636363636363,0.0,False
04/11/2018,,2642.25,,,,,,,,,,,2658.25,2018_set2,2018-04-11,11:05,2639.25,2658.25,Long,Retired,Confirmed,10:30,W,2018-04-11 11:05:00-04:00,2018-04-11,10:30,11:05,ES,Confirmed,Long,RDR,Retired,W,,,,,RDR,2642.25,2639.25,2658.25,2658.25,2018-04-11 11:05:00-04:00,RS,2018-04-11 10:30:00-04:00,RR,RR,2018-04-11 09:30:00-04:00,95.0,RR,2018-04-11 10:25:00-04:00,False,after_confirm,3.0,16.0,5.333333333333333,5.333333333333333,True
04/12/2018,,2666.75,,,,,,,,,,,2663.5,2018_set2,2018-04-12,10:40,2663.5,2684.0,Long,Frontrun,No Conf,,EX,2018-04-12 10:40:00-04:00,2018-04-12,,10:40,ES,No Conf,Long,RDR,Frontrun,EX,,,,,RDR,2666.75,2663.5,2684.0,2663.5,2018-04-12 10:40:00-04:00,RS,2018-04-12 10:30:00-04:00,RR,RR,2018-04-12 09:30:00-04:00,70.0,RR,2018-04-12 10:25:00-04:00,False,after_confirm,3.25,17.25,5.3076923076923075,-1.0,False
04/13/2018,,2664.25,,,,,,,,,,,2656.0,2018_set2,2018-04-13,12:00,2668.5,2642.5,Short,Mode,Confirmed,10:55,W,2018-04-13 12:00:00-04:00,2018-04-13,10:55,12:00,ES,Confirmed,Short,RDR,Mode,W,,,,,RDR,2664.25,2668.5,2642.5,2656.0,2018-04-13 12:00:00-04:00,RS,2018-04-13 10:30:00-04:00,RR,RR,2018-04-13 09:30:00-04:00,150.0,RR,2018-04-13 10:25:00-04:00,False,after_confirm,4.25,21.75,5.117647058823529,1.9411764705882353,True
04/16/2018,,2675.0,,,,,,,,,,,2673.0,2018_set2,2018-04-16,10:40,2673.0,2683.75,Long,Mode,Wick,10:30,EX,2018-04-16 10:40:00-04:00,2018-04-16,10:30,10:40,ES,Wick,Long,RDR,Mode,EX,,,,,RDR,2675.0,2673.0,2683.75,2673.0,2018-04-16 10:40:00-04:00,RS,2018-04-16 10:30:00-04:00,RR,RR,2018-04-16 09:30:00-04:00,70.0,RR,2018-04-16 10:25:00-04:00,False,after_confirm,2.0,8.75,4.375,-1.0,False
04/16/2018,,2676.25,,,,,,,,,,,2684.0,2018_set2,2018-04-16,12:40,2674.5,2684.0,Long,Goldfish,Confirmed,12:00,W,2018-04-16 12:40:00-04:00,2018-04-16,12:00,12:40,ES,Confirmed,Long,RDR,Goldfish,W,,,,,RDR,2676.25,2674.5,2684.0,2684.0,2018-04-16 12:40:00-04:00,RS,2018-04-16 10:30:00-04:00,RR,RR,2018-04-16 09:30:00-04:00,190.0,RR,2018-04-16 10:25:00-04:00,False,after_confirm,1.75,7.75,4.428571428571429,4.428571428571429,True
04/17/2018,,2699.0,,,,,,,,,,,2705.25,2018_set2,2018-04-17,10:30,2697.75,2705.25,Long,Frontrun,No Conf,,W,2018-04-17 10:30:00-04:00,2018-04-17,,10:30,ES,No Conf,Long,RDR,Frontrun,W,,,,,RDR,2699.0,2697.75,2705.25,2705.25,2018-04-17 10:30:00-04:00,RS,2018-04-17 10:30:00-04:00,RR,RR,2018-04-17 09:30:00-04:00,60.0,RR,2018-04-17 10:25:00-04:00,False,after_confirm,1.25,6.25,5.0,5.0,True
04/19/2018,,2697.75,,,,,,,,,,,2685.5,2018_set2,2018-04-19,10:45,2700.0,2685.5,Short,Frontrun,No Conf,,W,2018-04-19 10:45:00-04:00,2018-04-19,,10:45,ES,No Conf,Short,RDR,Frontrun,W,,,,,RDR,2697.75,2700.0,2685.5,2685.5,2018-04-19 10:45:00-04:00,RS,2018-04-19 10:30:00-04:00,RR,RR,2018-04-19 09:30:00-04:00,75.0,RR,2018-04-19 10:25:00-04:00,False,after_confirm,2.25,12.25,5.444444444444445,5.444444444444445,True
04/20/2018,,2687.5,,,,,,,,,,,2676.25,2018_set2,2018-04-20,10:30,2689.25,2676.25,Short,Frontrun,No Conf,,W,2018-04-20 10:30:00-04:00,2018-04-20,,10:30,ES,No Conf,Short,RDR,Frontrun,W,,,,,RDR,2687.5,2689.25,2676.25,2676.25,2018-04-20 10:30:00-04:00,RS,2018-04-20 10:30:00-04:00,RR,RR,2018-04-20 09:30:00-04:00,60.0,RR,2018-04-20 10:25:00-04:00,False,after_confirm,1.75,11.25,6.428571428571429,6.428571428571429,True
04/23/2018,,2673.25,,,,,,,,,,,2673.25,2018_set2,2018-04-23,10:35,2675.25,2664.0,Short,Frontrun,No Conf,,BE,2018-04-23 10:35:00-04:00,2018-04-23,,10:35,ES,No Conf,Short,RDR,Frontrun,BE,,,,,RDR,2673.25,2675.25,2664.0,2673.25,2018-04-23 10:35:00-04:00,RS,2018-04-23 10:30:00-04:00,RR,RR,2018-04-23 09:30:00-04:00,65.0,RR,2018-04-23 10:25:00-04:00,False,after_confirm,2.0,9.25,4.625,-0.0,False
04/24/2018,,2672.25,,,,,,,,,,,2672.25,2018_set2,2018-04-24,10:55,2674.75,2656.25,Short,Mode,Wick,10:30,BE,2018-04-24 10:55:00-04:00,2018-04-24,10:30,10:55,ES,Wick,Short,RDR,Mode,BE,,,,,RDR,2672.25,2674.75,2656.25,2672.25,2018-04-24 10:55:00-04:00,RS,2018-04-24 10:30:00-04:00,RR,RR,2018-04-24 09:30:00-04:00,85.0,RR,2018-04-24 10:25:00-04:00,False,after_confirm,2.5,16.0,6.4,-0.0,False
04/26/2018,,2655.75,,,,,,,,,,,2655.75,2018_set2,2018-04-26,10:45,2652.5,2667.0,Long,Mode,Confirmed,10:35,BE,2018-04-26 10:45:00-04:00,2018-04-26,10:35,10:45,ES,Confirmed,Long,RDR,Mode,BE,,,,,RDR,2655.75,2652.5,2667.0,2655.75,2018-04-26 10:45:00-04:00,RS,2018-04-26 10:30:00-04:00,RR,RR,2018-04-26 09:30:00-04:00,75.0,RR,2018-04-26 10:25:00-04:00,False,after_confirm,3.25,11.25,3.4615384615384617,0.0,False
04/26/2018,,2656.25,,,,,,,,,,,2656.25,2018_set2,2018-04-26,12:00,2652.5,2670.5,Long,Mode,Confirmed,10:35,BE,2018-04-26 12:00:00-04:00,2018-04-26,10:35,12:00,ES,Confirmed,Long,RDR,Mode,BE,,,,,RDR,2656.25,2652.5,2670.5,2656.25,2018-04-26 12:00:00-04:00,RS,2018-04-26 10:30:00-04:00,RR,RR,2018-04-26 09:30:00-04:00,150.0,RR,2018-04-26 10:25:00-04:00,False,after_confirm,3.75,14.25,3.8,0.0,False
05/01/2018,,2637.75,,,,,,,,,,,2629.25,2018_set2,2018-05-01,10:35,2639.5,2629.25,Short,Frontrun,No Conf,,W,2018-05-01 10:35:00-04:00,2018-05-01,,10:35,ES,No Conf,Short,RDR,Frontrun,W,,,,,RDR,2637.75,2639.5,2629.25,2629.25,2018-05-01 10:35:00-04:00,RS,2018-05-01 10:30:00-04:00,RR,RR,2018-05-01 09:30:00-04:00,65.0,RR,2018-05-01 10:25:00-04:00,False,after_confirm,1.75,8.5,4.857142857142857,4.857142857142857,True
05/02/2018,,2647.25,,,,,,,,,,,2645.25,2018_set2,2018-05-02,11:35,2645.25,2658.5,Long,Mode,Early I,11:10,EX,2018-05-02 11:35:00-04:00,2018-05-02,11:10,11:35,ES,Early I,Long,RDR,Mode,EX,,,,,RDR,2647.25,2645.25,2658.5,2645.25,2018-05-02 11:35:00-04:00,RS,2018-05-02 10:30:00-04:00,RR,RR,2018-05-02 09:30:00-04:00,125.0,RR,2018-05-02 10:25:00-04:00,False,after_confirm,2.0,11.25,5.625,-1.0,False
05/03/2018,,2613.75,,,,,,,,,,,2613.75,2018_set2,2018-05-03,9:45,2610.75,2636.25,Long,Advanced,No Conf,,BE,2018-05-03 09:45:00-04:00,2018-05-03,,9:45,ES,No Conf,Long,RDR,Advanced,BE,,,,,RDR,2613.75,2610.75,2636.25,2613.75,2018-05-03 09:45:00-04:00,RR,2018-05-03 09:30:00-04:00,RR,RR,2018-05-03 09:30:00-04:00,15.0,RR,2018-05-03 10:25:00-04:00,True,other,3.0,22.5,7.5,0.0,False
05/03/2018,,2596.25,,,,,,,,,,,2631.25,2018_set2,2018-05-03,11:00,2591.0,2631.25,Long,Advanced,Confirmed,10:30,W,2018-05-03 11:00:00-04:00,2018-05-03,10:30,11:00,ES,Confirmed,Long,RDR,Advanced,W,,,,,RDR,2596.25,2591.0,2631.25,2631.25,2018-05-03 11:00:00-04:00,RS,2018-05-03 10:30:00-04:00,RR,RR,2018-05-03 09:30:00-04:00,90.0,RR,2018-05-03 10:25:00-04:00,False,after_confirm,5.25,35.0,6.666666666666667,6.666666666666667,True
05/04/2018,,2615.25,,,,,,,,,,,2661.0,2018_set2,2018-05-04,9:35,2611.0,2661.0,Long,Advanced,No Conf,,W,2018-05-04 09:35:00-04:00,2018-05-04,,9:35,ES,No Conf,Long,RDR,Advanced,W,,,,,RDR,2615.25,2611.0,2661.0,2661.0,2018-05-04 09:35:00-04:00,RR,2018-05-04 09:30:00-04:00,RR,RR,2018-05-04 09:30:00-04:00,5.0,RR,2018-05-04 10:25:00-04:00,True,m7,4.25,45.75,10.764705882352942,10.764705882352942,True
05/07/2018,,2675.25,,,,,,,,,,,2673.5,2018_set2,2018-05-07,10:35,2673.5,2682.0,Long,Frontrun,No Conf,,EX,2018-05-07 10:35:00-04:00,2018-05-07,,10:35,ES,No Conf,Long,RDR,Frontrun,EX,,,,,RDR,2675.25,2673.5,2682.0,2673.5,2018-05-07 10:35:00-04:00,RS,2018-05-07 10:30:00-04:00,RR,RR,2018-05-07 09:30:00-04:00,65.0,RR,2018-05-07 10:25:00-04:00,False,after_confirm,1.75,6.75,3.857142857142857,-1.0,False
05/08/2018,,2865.5,,,,,,,,,,,2663.75,2018_set2,2018-05-08,11:00,2663.75,2675.75,Long,Mode,Confirmed,10:50,EX,2018-05-08 11:00:00-04:00,2018-05-08,10:50,11:00,ES,Confirmed,Long,RDR,Mode,EX,,,,,RDR,2865.5,2663.75,2675.75,2663.75,2018-05-08 11:00:00-04:00,RS,2018-05-08 10:30:00-04:00,RR,RR,2018-05-08 09:30:00-04:00,90.0,RR,2018-05-08 10:25:00-04:00,False,after_confirm,201.75,189.75,0.9405204460966543,-1.0,False
05/09/2018,,2677.25,,,,,,,,,,,2675.25,2018_set2,2018-05-09,10:35,2675.25,2688.0,Long,Frontrun,No Conf,,EX,2018-05-09 10:35:00-04:00,2018-05-09,,10:35,ES,No Conf,Long,RDR,Frontrun,EX,,,,,RDR,2677.25,2675.25,2688.0,2675.25,2018-05-09 10:35:00-04:00,RS,2018-05-09 10:30:00-04:00,RR,RR,2018-05-09 09:30:00-04:00,65.0,RR,2018-05-09 10:25:00-04:00,False,after_confirm,2.0,10.75,5.375,-1.0,False
05/10/2018,,2709.5,,,,,,,,,,,2722.0,2018_set2,2018-05-10,10:45,2708.5,2722.0,Long,Mode,Confirmed,,W,2018-05-10 10:45:00-04:00,2018-05-10,,10:45,ES,Confirmed,Long,RDR,Mode,W,,,,,RDR,2709.5,2708.5,2722.0,2722.0,2018-05-10 10:45:00-04:00,RS,2018-05-10 10:30:00-04:00,RR,RR,2018-05-10 09:30:00-04:00,75.0,RR,2018-05-10 10:25:00-04:00,False,after_confirm,1.0,12.5,12.5,12.5,True
05/11/2018,,2728.25,,,,,,,,,,,2728.25,2018_set2,2018-05-11,10:35,2726.5,2735.25,Long,Frontrun,No Conf,,BE,2018-05-11 10:35:00-04:00,2018-05-11,,10:35,ES,No Conf,Long,RDR,Frontrun,BE,,,,,RDR,2728.25,2726.5,2735.25,2728.25,2018-05-11 10:35:00-04:00,RS,2018-05-11 10:30:00-04:00,RR,RR,2018-05-11 09:30:00-04:00,65.0,RR,2018-05-11 10:25:00-04:00,False,after_confirm,1.75,7.0,4.0,0.0,False
05/14/2018,,2739.75,,,,,,,,,,,2738.75,2018_set2,2018-05-14,10:45,2738.75,2746.75,Long,Mode,Confirmed,,EX,2018-05-14 10:45:00-04:00,2018-05-14,,10:45,ES,Confirmed,Long,RDR,Mode,EX,,,,,RDR,2739.75,2738.75,2746.75,2738.75,2018-05-14 10:45:00-04:00,RS,2018-05-14 10:30:00-04:00,RR,RR,2018-05-14 09:30:00-04:00,75.0,RR,2018-05-14 10:25:00-04:00,False,after_confirm,1.0,7.0,7.0,-1.0,False
05/15/2018,,2708.5,,,,,,,,,,,2711.5,2018_set2,2018-05-15,10:30,2711.5,2696.25,Short,Frontrun,No Conf,,EX,2018-05-15 10:30:00-04:00,2018-05-15,,10:30,ES,No Conf,Short,RDR,Frontrun,EX,,,,,RDR,2708.5,2711.5,2696.25,2711.5,2018-05-15 10:30:00-04:00,RS,2018-05-15 10:30:00-04:00,RR,RR,2018-05-15 09:30:00-04:00,60.0,RR,2018-05-15 10:25:00-04:00,False,after_confirm,3.0,12.25,4.083333333333333,-1.0,False
05/17/2018,,2718.5,,,,,,,,,,,2718.5,2018_set2,2018-05-17,9:55,2716.75,2729.75,Long,Advanced,No Conf,,BE,2018-05-17 09:55:00-04:00,2018-05-17,,9:55,ES,No Conf,Long,RDR,Advanced,BE,,,,,RDR,2718.5,2716.75,2729.75,2718.5,2018-05-17 09:55:00-04:00,RR,2018-05-17 09:30:00-04:00,RR,RR,2018-05-17 09:30:00-04:00,25.0,RR,2018-05-17 10:25:00-04:00,True,other,1.75,11.25,6.428571428571429,0.0,False
05/21/2018,,2735.0,,,,,,,,,,,2735.0,2018_set2,2018-05-21,10:30,2734.0,2741.75,Long,Frontrun,No Conf,,BE,2018-05-21 10:30:00-04:00,2018-05-21,,10:30,ES,No Conf,Long,RDR,Frontrun,BE,,,,,RDR,2735.0,2734.0,2741.75,2735.0,2018-05-21 10:30:00-04:00,RS,2018-05-21 10:30:00-04:00,RR,RR,2018-05-21 09:30:00-04:00,60.0,RR,2018-05-21 10:25:00-04:00,False,after_confirm,1.0,6.75,6.75,0.0,False
05/25/2018,,2723.5,,,,,,,,,,,2721.25,2018_set2,2018-05-25,10:45,2721.25,2737.5,Long,Mode,Wick,10:30,EX,2018-05-25 10:45:00-04:00,2018-05-25,10:30,10:45,ES,Wick,Long,RDR,Mode,EX,,,,,RDR,2723.5,2721.25,2737.5,2721.25,2018-05-25 10:45:00-04:00,RS,2018-05-25 10:30:00-04:00,RR,RR,2018-05-25 09:30:00-04:00,75.0,RR,2018-05-25 10:25:00-04:00,False,after_confirm,2.25,14.0,6.222222222222222,-1.0,False
05/29/2018,,2702.5,,,,,,,,,,,2700.25,2018_set2,2018-05-29,10:35,2700.25,2718.25,Long,Frontrun,No Conf,,EX,2018-05-29 10:35:00-04:00,2018-05-29,,10:35,ES,No Conf,Long,RDR,Frontrun,EX,,,,,RDR,2702.5,2700.25,2718.25,2700.25,2018-05-29 10:35:00-04:00,RS,2018-05-29 10:30:00-04:00,RR,RR,2018-05-29 09:30:00-04:00,65.0,RR,2018-05-29 10:25:00-04:00,False,after_confirm,2.25,15.75,7.0,-1.0,False
05/30/2018,,2706.25,,,,,,,,,,,2723.25,2018_set2,2018-05-30,10:30,2704.5,2723.25,Long,Frontrun,No Conf,,W,2018-05-30 10:30:00-04:00,2018-05-30,,10:30,ES,No Conf,Long,RDR,Frontrun,W,,,,,RDR,2706.25,2704.5,2723.25,2723.25,2018-05-30 10:30:00-04:00,RS,2018-05-30 10:30:00-04:00,RR,RR,2018-05-30 09:30:00-04:00,60.0,RR,2018-05-30 10:25:00-04:00,False,after_confirm,1.75,17.0,9.714285714285714,9.714285714285714,True
05/31/2018,,2714.75,,,,,,,,,,,2714.75,2018_set2,2018-05-31,10:35,2716.25,2706.75,Short,Frontrun,No Conf,,BE,2018-05-31 10:35:00-04:00,2018-05-31,,10:35,ES,No Conf,Short,RDR,Frontrun,BE,,,,,RDR,2714.75,2716.25,2706.75,2714.75,2018-05-31 10:35:00-04:00,RS,2018-05-31 10:30:00-04:00,RR,RR,2018-05-31 09:30:00-04:00,65.0,RR,2018-05-31 10:25:00-04:00,False,after_confirm,1.5,8.0,5.333333333333333,-0.0,False
05/31/2018,,2717.5,,,,,,,,,,,2715.5,2018_set2,2018-05-31,11:45,2715.5,2728.25,Long,Advanced,Confirmed,10:45,EX,2018-05-31 11:45:00-04:00,2018-05-31,10:45,11:45,ES,Confirmed,Long,RDR,Advanced,EX,,,,,RDR,2717.5,2715.5,2728.25,2715.5,2018-05-31 11:45:00-04:00,RS,2018-05-31 10:30:00-04:00,RR,RR,2018-05-31 09:30:00-04:00,135.0,RR,2018-05-31 10:25:00-04:00,False,after_confirm,2.0,10.75,5.375,-1.0,False
06/01/2018,,2727.75,,,,,,,,,,,2725.5,2018_set2,2018-06-01,10:30,2725.5,2738.75,Long,Frontrun,No Conf,,EX,2018-06-01 10:30:00-04:00,2018-06-01,,10:30,ES,No Conf,Long,RDR,Frontrun,EX,,,,,RDR,2727.75,2725.5,2738.75,2725.5,2018-06-01 10:30:00-04:00,RS,2018-06-01 10:30:00-04:00,RR,RR,2018-06-01 09:30:00-04:00,60.0,RR,2018-06-01 10:25:00-04:00,False,after_confirm,2.25,11.0,4.888888888888889,-1.0,False
06/04/2018,,2741.5,,,,,,,,,,,2746.75,2018_set2,2018-06-04,10:35,2739.5,2754.75,Long,Frontrun,No Conf,,W,2018-06-04 10:35:00-04:00,2018-06-04,,10:35,ES,No Conf,Long,RDR,Frontrun,W,,,,,RDR,2741.5,2739.5,2754.75,2746.75,2018-06-04 10:35:00-04:00,RS,2018-06-04 10:30:00-04:00,RR,RR,2018-06-04 09:30:00-04:00,65.0,RR,2018-06-04 10:25:00-04:00,False,after_confirm,2.0,13.25,6.625,2.625,True
06/05/2018,,2749.5,,,,,,,,,,,2742.0,2018_set2,2018-06-05,10:35,2751.5,2742.0,Short,Frontrun,No Conf,,W,2018-06-05 10:35:00-04:00,2018-06-05,,10:35,ES,No Conf,Short,RDR,Frontrun,W,,,,,RDR,2749.5,2751.5,2742.0,2742.0,2018-06-05 10:35:00-04:00,RS,2018-06-05 10:30:00-04:00,RR,RR,2018-06-05 09:30:00-04:00,65.0,RR,2018-06-05 10:25:00-04:00,False,after_confirm,2.0,7.5,3.75,3.75,True
06/05/2018,,2746.5,,,,,,,,,,,2740.75,2018_set2,2018-06-05,11:20,2748.0,2740.75,Short,Mode,Confirmed,11:05,W,2018-06-05 11:20:00-04:00,2018-06-05,11:05,11:20,ES,Confirmed,Short,RDR,Mode,W,,,,,RDR,2746.5,2748.0,2740.75,2740.75,2018-06-05 11:20:00-04:00,RS,2018-06-05 10:30:00-04:00,RR,RR,2018-06-05 09:30:00-04:00,110.0,RR,2018-06-05 10:25:00-04:00,False,after_confirm,1.5,5.75,3.8333333333333335,3.8333333333333335,True
06/06/2018,,2753.25,,,,,,,,,,,2767.25,2018_set2,2018-06-06,11:00,2751.5,2767.25,Long,Advanced,No Conf,,W,2018-06-06 11:00:00-04:00,2018-06-06,,11:00,ES,No Conf,Long,RDR,Advanced,W,,,,,RDR,2753.25,2751.5,2767.25,2767.25,2018-06-06 11:00:00-04:00,RS,2018-06-06 10:30:00-04:00,RR,RR,2018-06-06 09:30:00-04:00,90.0,RR,2018-06-06 10:25:00-04:00,False,after_confirm,1.75,14.0,8.0,8.0,True
06/07/2018,,2771.75,,,,,,,,,,,2774.0,2018_set2,2018-06-07,11:00,2774.0,2761.75,Short,Mode,Confirmed,10:30,EX,2018-06-07 11:00:00-04:00,2018-06-07,10:30,11:00,ES,Confirmed,Short,RDR,Mode,EX,,,,,RDR,2771.75,2774.0,2761.75,2774.0,2018-06-07 11:00:00-04:00,RS,2018-06-07 10:30:00-04:00,RR,RR,2018-06-07 09:30:00-04:00,90.0,RR,2018-06-07 10:25:00-04:00,False,after_confirm,2.25,10.0,4.444444444444445,-1.0,False
06/07/2018,,2774.5,,,,,,,,,,,2761.75,2018_set2,2018-06-07,11:15,2776.5,2761.75,Short,Mode,Confirmed,10:30,W,2018-06-07 11:15:00-04:00,2018-06-07,10:30,11:15,ES,Confirmed,Short,RDR,Mode,W,,,,,RDR,2774.5,2776.5,2761.75,2761.75,2018-06-07 11:15:00-04:00,RS,2018-06-07 10:30:00-04:00,RR,RR,2018-06-07 09:30:00-04:00,105.0,RR,2018-06-07 10:25:00-04:00,False,after_confirm,2.0,12.75,6.375,6.375,True
06/08/2018,,2766.5,,,,,,,,,,,2777.25,2018_set2,2018-06-08,11:35,2764.75,2777.25,Long,Retired,Confirmed,11:10,W,2018-06-08 11:35:00-04:00,2018-06-08,11:10,11:35,ES,Confirmed,Long,RDR,Retired,W,,,,,RDR,2766.5,2764.75,2777.25,2777.25,2018-06-08 11:35:00-04:00,RS,2018-06-08 10:30:00-04:00,RR,RR,2018-06-08 09:30:00-04:00,125.0,RR,2018-06-08 10:25:00-04:00,False,after_confirm,1.75,10.75,6.142857142857143,6.142857142857143,True
06/11/2018,,2783.0,,,,,,,,,,,2781.75,2018_set2,2018-06-11,10:35,2781.75,2789.25,Long,Frontrun,No Conf,,EX,2018-06-11 10:35:00-04:00,2018-06-11,,10:35,ES,No Conf,Long,RDR,Frontrun,EX,,,,,RDR,2783.0,2781.75,2789.25,2781.75,2018-06-11 10:35:00-04:00,RS,2018-06-11 10:30:00-04:00,RR,RR,2018-06-11 09:30:00-04:00,65.0,RR,2018-06-11 10:25:00-04:00,False,after_confirm,1.25,6.25,5.0,-1.0,False
06/12/2018,,2783.25,,,,,,,,,,,2783.25,2018_set2,2018-06-12,11:20,2782.0,2790.0,Long,Frontrun,No Conf,,BE,2018-06-12 11:20:00-04:00,2018-06-12,,11:20,ES,No Conf,Long,RDR,Frontrun,BE,,,,,RDR,2783.25,2782.0,2790.0,2783.25,2018-06-12 11:20:00-04:00,RS,2018-06-12 10:30:00-04:00,RR,RR,2018-06-12 09:30:00-04:00,110.0,RR,2018-06-12 10:25:00-04:00,False,after_confirm,1.25,6.75,5.4,0.0,False
06/18/2018,,2767.25,,,,,,,,,,,2778.5,2018_set2,2018-06-18,10:30,2765.25,2778.5,Long,Frontrun,No Conf,,W,2018-06-18 10:30:00-04:00,2018-06-18,,10:30,ES,No Conf,Long,RDR,Frontrun,W,,,,,RDR,2767.25,2765.25,2778.5,2778.5,2018-06-18 10:30:00-04:00,RS,2018-06-18 10:30:00-04:00,RR,RR,2018-06-18 09:30:00-04:00,60.0,RR,2018-06-18 10:25:00-04:00,False,after_confirm,2.0,11.25,5.625,5.625,True
06/26/2018,,2725.0,,,,,,,,,,,2727.75,2018_set2,2018-06-26,11:45,2727.75,2711.5,Short,Retired,Wick,,EX,2018-06-26 11:45:00-04:00,2018-06-26,,11:45,ES,Wick,Short,RDR,Retired,EX,,,,,RDR,2725.0,2727.75,2711.5,2727.75,2018-06-26 11:45:00-04:00,RS,2018-06-26 10:30:00-04:00,RR,RR,2018-06-26 09:30:00-04:00,135.0,RR,2018-06-26 10:25:00-04:00,False,after_confirm,2.75,13.5,4.909090909090909,-1.0,False
06/27/2018,,2740.75,,,,,,,,,,,2705.5,2018_set2,2018-06-27,12:20,2744.25,2705.5,Short,Advanced,Confirmed,10:35,W,2018-06-27 12:20:00-04:00,2018-06-27,10:35,12:20,ES,Confirmed,Short,RDR,Advanced,W,,,,,RDR,2740.75,2744.25,2705.5,2705.5,2018-06-27 12:20:00-04:00,RS,2018-06-27 10:30:00-04:00,RR,RR,2018-06-27 09:30:00-04:00,170.0,RR,2018-06-27 10:25:00-04:00,False,after_confirm,3.5,35.25,10.071428571428571,10.071428571428571,True
06/28/2018,,2707.25,,,,,,,,,,,2694.75,2018_set2,2018-06-28,8:00,2710.0,2694.75,Short,Advanced,Confirmed,4:00,W,2018-06-28 08:00:00-04:00,2018-06-28,4:00,8:00,ES,Confirmed,Short,ODR,Advanced,W,,,,,ODR,2707.25,2710.0,2694.75,2694.75,2018-06-28 08:00:00-04:00,OS,2018-06-28 04:00:00-04:00,OR,OR,2018-06-28 03:00:00-04:00,300.0,,,False,other,2.75,12.5,4.545454545454546,4.545454545454546,True
06/28/2018,,2702.5,,,,,,,,,,,2717.25,2018_set2,2018-06-28,12:25,2700.0,2717.25,Long,Median,Confirmed,10:55,W,2018-06-28 12:25:00-04:00,2018-06-28,10:55,12:25,ES,Confirmed,Long,RDR,Median,W,,,,,RDR,2702.5,2700.0,2717.25,2717.25,2018-06-28 12:25:00-04:00,RS,2018-06-28 10:30:00-04:00,RR,RR,2018-06-28 09:30:00-04:00,175.0,RR,2018-06-28 10:25:00-04:00,False,after_confirm,2.5,14.75,5.9,5.9,True
06/29/2018,,2736.25,,,,,,,,,,,2745.0,2018_set2,2018-06-29,10:30,2734.5,2745.0,Long,Frontrun,No Conf,,W,2018-06-29 10:30:00-04:00,2018-06-29,,10:30,ES,No Conf,Long,RDR,Frontrun,W,,,,,RDR,2736.25,2734.5,2745.0,2745.0,2018-06-29 10:30:00-04:00,RS,2018-06-29 10:30:00-04:00,RR,RR,2018-06-29 09:30:00-04:00,60.0,RR,2018-06-29 10:25:00-04:00,False,after_confirm,1.75,8.75,5.0,5.0,True
07/02/2018,,2707.5,,,,,,,,,,,2705.25,2018_set2,2018-07-02,12:10,2705.25,2721.75,Long,Median,Confirmed,10:30,EX,2018-07-02 12:10:00-04:00,2018-07-02,10:30,12:10,ES,Confirmed,Long,RDR,Median,EX,,,,,RDR,2707.5,2705.25,2721.75,2705.25,2018-07-02 12:10:00-04:00,RS,2018-07-02 10:30:00-04:00,RR,RR,2018-07-02 09:30:00-04:00,160.0,RR,2018-07-02 10:25:00-04:00,False,after_confirm,2.25,14.25,6.333333333333333,-1.0,False
07/05/2018,,2724.5,,,,,,,,,,,2724.5,2018_set2,2018-07-05,10:45,2726.25,2713.25,Short,Mode,Confirmed,10:35,BE,2018-07-05 10:45:00-04:00,2018-07-05,10:35,10:45,ES,Confirmed,Short,RDR,Mode,BE,,,,,RDR,2724.5,2726.25,2713.25,2724.5,2018-07-05 10:45:00-04:00,RS,2018-07-05 10:30:00-04:00,RR,RR,2018-07-05 09:30:00-04:00,75.0,RR,2018-07-05 10:25:00-04:00,False,after_confirm,1.75,11.25,6.428571428571429,-0.0,False
07/06/2018,,2745.75,,,,,,,,,,,2762.0,2018_set2,2018-07-06,10:35,2743.75,2762.0,Long,Frontrun,No Conf,,W,2018-07-06 10:35:00-04:00,2018-07-06,,10:35,ES,No Conf,Long,RDR,Frontrun,W,,,,,RDR,2745.75,2743.75,2762.0,2762.0,2018-07-06 10:35:00-04:00,RS,2018-07-06 10:30:00-04:00,RR,RR,2018-07-06 09:30:00-04:00,65.0,RR,2018-07-06 10:25:00-04:00,False,after_confirm,2.0,16.25,8.125,8.125,True
